,Unnamed: 0,created_utc,body,subreddit,subreddit_id,permalink
0,0,1641845629,"very sorry for you bro, hope you will get to see your mom !.  if you are vaccinated no need for negative PCR just fly in with your vaccine certificate and even if you get tested positive upon arrival they will call you within 24 h of arrival you will have few hours to see your mom  https://www.iatatravelcentre.com/world.php",lebanon,t5_2qzpg,/r/lebanon/comments/s08bns/cant_travel_to_lebanon_to_see_my_dying_mother_due/hs3xcbx/
1,0,1638520301,Yes you need the PASS even if fully vaccinated. You are only exempted from PCR test.  I just applied and uploaded my vaccine certificate and I got the PASS immediately on the spot.,lebanon,t5_2qzpg,/r/lebanon/comments/r6oavj/covid_new_rules_for_all_incoming_passengers_to/hn1o3o1/
2,0,1636807586,"You don't need a PCR prior to landing in Beirut. Like people mentioned here, you will do a PCR at the airport once you land in Beirut. HOWEVER, this is conditional on your vaccination status and proof of vaccination. i.e. TWO doses of the approved vaccines ( or 1 dose of johnson and johnson?), with a minimum of 2 weeks from the date of your second dose and a QR code/vaccine certificate.  As always double-check, I just got back from Turkey so this is based on my experience being a Lebanese national.",lebanon,t5_2qzpg,/r/lebanon/comments/qszlvh/pcr_from_turkey_to_beirut/hkg9qjc/
3,0,1635127073,"If you have completed vaccine double dose at least 2 weeks before arriving then you are exempt from PCR test at country of departure.   You will need a certificate to prove you have had vaccine.  You still need to do test at beiruit airport on arrival which is included in the cost of your airfare.  ===  Read the exemptions at the end  ===  Last updated: 4 October 2021  Travel to Lebanon  If you are travelling to Lebanon, you must take a COVID‑19 PCR test before departure. COVID‑19 testing requirements All passengers travelling to Lebanon must take a COVID‑19 PCR test in a laboratory certified by the country’s local authority no later than 96 hours between the release of the negative test result and their date of arrival in Lebanon. The negative COVID‑19 PCR test result must contain a QR code and passengers have to present the certificate at check in to be accepted on the flight. COVID‑19 PCR test results issued in the USA, Canada, Australia, New Zealand, South Korea, Japan and all European countries will be accepted without QR codes. All arriving passengers must take another COVID‑19 PCR test on arrival. The cost of the COVID‑19 PCR test and other medical diagnostic measures is USD 50 (except for children under 12 years age and UNIFIL) and it is collected at the time of booking. The test will be conducted in laboratories authorised by the Lebanese Ministry of Public Health at the airport.   Exemptions:  are fully vaccinated against COVID‑19 and have received all required doses, at least 2 weeks before their departure to Lebanon, or  who were infected and recovered from COVID‑19 within 90 days before their departure date and are holding an official proof of recovery.  travelled out of Lebanon and returning within one week.  are below 12 years old   Cabin crew arriving to Lebanon for a period of no more than 48 hours are exempted from doing COVID‑19 PCR test upon arrival at the airport, and they shall remain quarantined in their places of residence throughout their stay in Lebanon.  Travel from Lebanon  If you are travelling from Lebanon, you must take a COVID‑19 PCR test before departure. Please check the requirements of your specific destination before you travel.",lebanon,t5_2qzpg,/r/lebanon/comments/qf36km/is_pcr_required_for_the_vaccinated/hhxr35y/
4,0,1634313217,iranian vaccine certificate...,lebanon,t5_2qzpg,/r/lebanon/comments/q8pe5a/amalhezb_tribes_checkpoint_near_baalbak_a_few/hgr2qoj/
5,0,1633628633,"Nowhere does it say the vaccine must be taken on the EU territory.  Vaccine certificates only  If you use a vaccine certificate as proof, it must be issued by a national or state-level public health authority, be in English, French or Spanish, and include as a minimum:  your forename and surname(s)  your date of birth  vaccine brand and manufacturer  date of vaccination for every dose  country or territory of vaccination and/or certificate issuer",lebanon,t5_2qzpg,/r/lebanon/comments/q2hrct/already_got_sputnik_back_in_june_is_there_a_way/hfr5oo0/
6,0,1626950388,"Heading there too.  It looks like the vaccine exempts you from quarantine and pre-arrival test, but not post-arrival test.  Also, may not accept Turkish certificate of vaccine: https://www.mea.com.lb/english/covid19-and-travel/announcements/lebanon-entry-requirements",lebanon,t5_2qzpg,/r/lebanon/comments/opb5sk/pcr_at_beirut_airport/h641rtj/
7,0,1626834766,"The CDC card is enough. Have the certificate with you and if your state has a digital covid vaccine card have it with you too, you never know what will be on their minds in Lebanon.",lebanon,t5_2qzpg,/r/lebanon/comments/oofpro/proof_of_vaccination_for_travel_to_lebanon_pcr/h5ycvw8/
8,0,1626022288,"If you are coming from Abu Dhabi, you need a PCR test. From Dubai, vaccine certificate is enough.",lebanon,t5_2qzpg,/r/lebanon/comments/oi5f4d/can_i_come_to_beirut_without_a_pcr/h4to9ml/
9,0,1620747582,"I think officially Canada only requires rabies vaccine for cats, but airlines might want a health certificate too",lebanon,t5_2qzpg,/r/lebanon/comments/n9dgap/bringing_cat_to_lebanon/gxqnyuk/
