,Unnamed: 0,created_utc,body,subreddit,subreddit_id,permalink
98,6,1629597972,"I agree. Vax passport is only good up to the point that everyone is able to freely receive a Vax, to allow Cafes etc. to fully open without causing a spread.         After everyone who wants a Vax, gets a Vax, protecting the Antivaxxers is only delaying eradication. We need to let nature take it's course and let it rip. Some antivaxxers will survive, some will not. Either way, they will be bringing it upon themselves if there are three different Vax available and they still choose not to get it.         We should also place a cap on how much treatment is available to Antivaxxers seeking COVID treatment as not to overwhelm the system. At this point, if you present with COVID and you chose not to receive a Vax despite easily being able to get one, your treatment should be limited to getting a tank of Oxygen in a tent, and not an unlimited amount of nurses. The health system has far more important things to be doing, like getting onto that backlog of elective surgeries.         Why should the rest of us have our privacy invaded indefinitely to save these pricks.",australia,t5_2qh8e,/r/australia/comments/p91bly/vaccine_passports_to_combine_jab_records_with_qr/h9v0b1z/
99,7,1629605309,"But you have to, you must....how dare you suggest we return to normal after everyone gets a chance to be vaccinated   The irony is many, not all, of the people promoting the passport want those rights now before everyone has had a chance to be vaccinated. It really is a special privilege they think they deserve   Just let everyone vaxxed and let the disease do what it's meant to do  Dogs will have more freedom and they're already proven to catch and carry COVID.",australia,t5_2qh8e,/r/australia/comments/p95jt2/to_those_out_there_complaining_about_vaccine/h9veh1h/
100,8,1629606344,Please show us your covid passport please? Whoops. You have not got one because you're an antivaxxer.   https://www.afr.com/politics/border-force-to-patrol-and-check-visas-in-melbournes-cbd-20150828-gj9spi,australia,t5_2qh8e,/r/australia/comments/p91bly/vaccine_passports_to_combine_jab_records_with_qr/h9vgbfs/
101,9,1629606934,"&gt;its not weird or a little sus.   It is, and your account is a perfect example of it. In the last week, nearly 100% of your posts have been anti-vax, anti-lockdown, or some other COVID-related thing on subreddits including r/Australia, r/Sydney, r/Kansas, r/Missouri, r/KansasCity, and r/nyc. You're literally brigading to push dangerous anti-vax, anti-vax passport, anti-lockdown content all over Reddit.",australia,t5_2qh8e,/r/australia/comments/p91bly/vaccine_passports_to_combine_jab_records_with_qr/h9vhbnf/
102,10,1629607613,"What would be the difference between a printable PDF proving your covid vaccination history, and a vaccine passport? Sounds like we're just disagreeing about the name tbh.",australia,t5_2qh8e,/r/australia/comments/p8zotr/morrison_backs_nsw_in_war_of_words_over_lockdown/h9vifuh/
103,11,1629612204,"People who are going on about being pro-vaccine and anti-passport are relying completely on the trust of the Australian public and haven't really been following what's been happening over the past couple weeks.  Almost every single excuse is useless:  1. The government is bad at securing data - The government has your passport information, birth/death/marriage/divorce records, driving license, earnings, police records, court records, the list goes on and on. 2. They can trace you - If you do a COVID check, they can trace you. If you have a mobile phone, they can trace you. If you appear on surveilance, use a train station, taxi, uber they can trace you. 3. Businesses will see your personal info - I hope you never go to a bar/club/venue where you have to show ID, or they check the ticket against a form of ID, or use your credit card at a venue.",australia,t5_2qh8e,/r/australia/comments/p91bly/vaccine_passports_to_combine_jab_records_with_qr/h9vpaor/
104,0,1629496313,"Right. Delta is so contagious even if numbers are low whenever we reopen it's going to go up quickly anyway. It's mostly the unvaccinated that are ending up in hospital. Once everyone that wants to be jabbed has the chance to we need to open up. Honestly, these people that want to stay home forever because PEOPLE WILL DIE are fucking mental. They can stay home, good luck to them. If we open and people choose to go out and they get it, well, that's on them. I'm vaccinated and I'd rather risk covid than endless lockdowns. If people are worried about getting it, they can stay home. Why do the rest of us have to? Most of this lockdown obsessives have NO exit plan.  That said I have no probs with a vaccine passport and vaccination status being taken into account when triaging patients and deciding who gets an ICU bed",australia,t5_2qh8e,/r/australia/comments/p8dfl6/vaccination_rate_of_70_wont_end_lockdowns_if/h9psame/
105,1,1629498471,"To do it reasonably safely ?  First of all, the kids get vaxxed at the same rate as adults. It's a joke that children are being left unvaccinated (nb Victoria is currently running at more than 100 kids with covid. Think about how good kids are at spreading everything else).  Second, we get full vaccine passports implemented. No vaccine passport, no public life.  Third, we get vaccine numbers to 90%. This will require 'No jab, no job' (and theres a good legal argument that unvaxed staff are an OHS issue btw).  Finally, we get the numbers to 100% among medical staff.  Covid running wild in a  pool of about 8 million people (30% of adults, plus all kids adds to about that) is going to cripple the hospital system as ICU beds get filled up. That means you don't just get Covid deaths, you get everything else deaths as the beds are full of Covid patients.",australia,t5_2qh8e,/r/australia/comments/p8dfl6/vaccination_rate_of_70_wont_end_lockdowns_if/h9px4uj/
106,2,1629507612,"Ive gotten my pfizer jabs, Ill get my yearly or biannually covid vaccine, whatever is best advice, I'll wear a mask while the vaccine roll-out is in shambles, but once everyone who's eligible has had both jabs they can be done with mask wearing after we go back to ""normal"".  Happy to make the vaccine passport a thing for people to contribute to society but I am dead set sick of wearing a mask.  If antivaxxers wanna get covid and die, then that's on them.",australia,t5_2qh8e,/r/australia/comments/p8dfl6/vaccination_rate_of_70_wont_end_lockdowns_if/h9qgldu/
107,0,1629281897,"You are practising the very trait of ""fuck you, I got mine"" that you are complaining about. You want your preferred shot so you can get your exemption and go hiking while others can't.  In Italy they are doing what they are doing because they respect peoples personal choices and don't want anyone to need a covid passport. They want people both vaxxed and unvaxxed to have the same rights and not put any restrictions on  people based on the vax status. That is whole reason I made my comment.  Let's not be a ""Fuck you, I got mine"" value system. How about we respect personal choice like the Italians?",australia,t5_2qh8e,/r/australia/comments/p6fv32/qantas_makes_covid19_vaccinations_mandatory_for/h9e6osn/
108,1,1629290065,"My statement of ""a law is only a law if enforced"" is to refer to what it means in practice to have mandated vaccination by the government. For any law, unless there is a police officer willing to enforce it its just a suggestion. If mandated, its not simply the government asking you nicely. If you go against it, state action will be taken. If you ignore fines or whatever the penalty, police will come, if you resist the police, it will be enforced with violence. When you say that you're in favor of mandating vaccination. You are in effect saying you're willing for violence to come to people who do not consent to medical decisions forced onto them.   &amp;#x200B;  You say you're against forced vaccinations and im glad that you are. But these comments iv been making arguing against mandating it were not directed at you but instead just the general authoritarianism people have on reddit. I do want to know when you say you're against forcing people, how far do you take that principle? Would you say coercion is force? If you ban unvaccinated people from participating in society via some vaccine passport system is force?    &amp;#x200B;  As to the absurdity of my concerns. I feel as if people are not thinking through the consequences of giving this much power to government. Even if you're one of these people who fully buy into the fear mongering around covid and really do thing its a plague, are you really willing to give the government authority over your body for the next issue they find? These pharmaceutical companies now have a vested interest in you using their products. If now the principle is that government can force you to take medical intervention against your will, why do you think there wont be any bribes going between the decision makers in government and the companies that stand to profit from it? Whats stopping them from mandating regular flu vaccines, or mandating intervention for literally anything they can? Look how much cronyism takes place in other aspects of the economy. Do you want that cooperate favoritism to now impede on your body? Then theres the issue of what i practically takes to enforce this, to have establishments check for vaccination to pass. It effectively takes a authoritarian ""papers please"" system installed. And why do you think that would never be used for other means? If that becomes normalized, can you really ensure that no one will seek to put other requirements on that system? Governments shouldn't control your body.",australia,t5_2qh8e,/r/australia/comments/p6ksmu/antivaxxers_complaining_about_their_freedoms/h9ehut1/
109,2,1629290359,"You’ve entirely ignored the fact that “no jab, no pay” and “no jab, no play” are in full effect. And to answer your question, this is 100% fine with me. Yes, coercion via these means is fine.  What I’m against is putting people in a cattle crush and forcibly restraining them. Anything short of this - especially things like a COVID passport - absolutely great.  So are you against ‘no jab no play’, and ‘no jab no pay’?",australia,t5_2qh8e,/r/australia/comments/p6ksmu/antivaxxers_complaining_about_their_freedoms/h9eic5g/
110,0,1629198260,"Hey mate, going through the exact same process at the moment!  My understanding with a joint account is that you both sign the paperwork, at the bank. Obviously not exactly possible at the moment due to COVID ;-)  Now the ID part of opening a bank account as in international citizen requires a passport etc, once again, presented in person at the bank. The online banks, ING, Ubank, etc are only available to Australian Citizens due to tax law.   My fiancee's sister works at a bank in Aus, and will check tomorrow for us to see what to go is with current lockdown situation, to see if there is a loophole we can take advantage of. The goal is to see if my Fiancee and I can open a Joint account, with her being in the Philippines, with a Philippine passport, and me in Aus, with an Aussie Passport.   Shoot me a message and I'll let you know how we go.",australia,t5_2qh8e,/r/australia/comments/p5zfp2/is_it_possible_to_create_a_joint_bank_account/h99xdql/
111,0,1628671906,"The old guy hasn't been well behaved either:   &gt;  Byron Bay’s patient zero is a Sydney businessman with convictions for drugs, burglary and forgery who immigration authorities once claimed had arrived in Australia on a false passport. Zoran Radovanovic, 52, successfully fought a government bid to cancel his visa and send him home to Yugoslavia with the Administrative Appeals Tribunal finding he had a capacity to make a contribution to Australia. NSW Police on Wednesday charged him with breaching public health orders after he allegedly travelled from Sydney to the Byron Bay area without a reasonable excuse in contravention of public health orders. He is in Lismore Base Hospital being treated for Covid having travelled to the Byron Bay area with his two children, who have also tested positive to the virus. He has been served with a Future Court Attendance Notice to appear at Lismore Local Court on Septemebr 13. His criminal history was revealed in the AAT in 2000 when he was given the benefit of the doubt and the “finely balanced exercise of discretion” to remain in Australia with his wife Tiana MacDowell, against whom he has recently been accused of breaching a restraining order taken out by police to protect her. He has made regular appearances before the courts in relation to a series of domestic violence charges. In 2018 he pleaded guilty to two separate counts of common assault and two separate counts of contravening a restraining order and was placed on a good behaviour bond for 12 months, ordered to complete 100 hours of community service and fined $500. Most recently he was charged with destroying or damaging property and breaching a restraining order taken out by police to protect Ms MacDowell. He will face a hearing over the destroying or damaging property charged in Downing Centre Local Court on October 28. The family recently moved from their home in Woodside Grove, Frenchs Forest on the Northern Beaches which they sold for $2.25 million and moved to Rose Bay. In February 1992, he was convicted in Melbourne’s Prahran Magistrates’ Court of two counts of burglary, theft and theft of a car. He was sentenced to six months’ jail on each charge to be served concurrently. The sentences were suspended for 12 months. He told the AAT that he was not guilty but took the advice of his then-lawyer that “it would be quicker and cheaper to plead guilty”. Immigration documents show he left Australia on March 1, 1992 with Tiana MacDowell, who had changed her name from Tijana Simic. They cleared customs at the same barrier and were cleared by the same custom’s officer but Radovanovic denied having left the country and returning on a false passport as alleged by immigration authorities. “Movement records do not show that the applicant re-entered Australia after March 1 1992 by the name Zoran Radovanovic,” the AAT said in a judgment handed down in Melbourne in 2000. In April 1998, immigration officers and police, acting on information he was in Australia unlawfully, raided the St Kilda flat where he lived with Tiana and as they searched for his passport, they found about 40 young marijuana plants. He was convicted at Prahran Magistrates Court of possessing cannabis, growing cannabis, using cannabis and forging a birth certificate. Radovanovic claimed he had last seen his passport two years earlier and he was not sure whether it was lost or stolen, the AAT said. He was refused a bridging visa in May 1998 but was later granted a visa on various conditions including that he leave in June 1998. He married Tiana in July 1998 and he applied for a permanent residency on spouse grounds. Again this was refused which is when he appealed to the AAT. In his time in Australia, Radovanovic has lived in Lightning Ridge under the name Zoran Cuk, according to the AAT decision. In overturning the decision to cancel his visa, the then-AAT deputy president B M Forrest said he believed witnesses who said Radovanovic lived in Lightening Ridge during the period immigration authorities said he had left the country. He said he was prepared to “accept as a probability” that he did not leave Australia and return on a false passport while not rejected evidence of immigration records or accepting Radovanovic’s evidence “unequivocally” “I have considerable reservations about his evidence,” the AAT said. “Only he (and probably those closest to him) know the truth of events and I am not convinced that he was being candid in his evidence about matters which he perceived may have been to his disadvantage to disclose. Such an approach does little to instil confidence that a person has the inherent qualities of good character. “I regard the applicant’s evidence of his passport being either lost or stolen as unconvincing.” Mr Forrest said despite finding he did not “pass the character test”, there was evidence of his good character. “Having considered all of the evidence and submissions and the matters required ... to be taken into account, the competing considerations for the exercise of discretion are finely balanced,” the tribunal said. “I have come to the conclusion that the balance falls ever so slightly on the side of an exercise of discretion in favour of the grant of a visa. “",australia,t5_2qh8e,/r/australia/comments/p24lae/police_to_charge_sydney_man_who_sparked_covid19/h8ii4o1/
112,0,1628500450,"That allowing a government to force a medical procedure against someones will is no different from what the Nazi's did to their Jewish prisoners.  Restrictions imposed on non covid passport holders (if that became a thing) is no different than the ""Papers"" that the Jews had to carry in Nazi Germany.     I'm not Anti Vax, but freedom against governments enforcing lack of freedom, freedom to choose.         We need to see the 50 year future of how this situation could be abused and not give sweeping short term powers (that may never get removed) to 'fix'  today.",australia,t5_2qh8e,/r/australia/comments/p0s7mt/an_assault_on_civil_liberties_liberal_mps_seek_to/h89mj6w/
113,0,1628400318,"It's an unpopular position and I'm absolutely  going to be downvoted to hell but here I go:  If you break it down by population they're absolutely not having more deaths than Australia is right now - search by case fatality rate, because Australia's largely unvaccinated population the US has a CFR of 1.7 while Australia's is 2.6.  With a population multiple times larger they're absolutely going to have a higher number, but the rate of death matters too for your argument.  While it's undeniable Australia's overall death rate has been very low compared to other developed nation of a similar size, and here's where I get downvoted, Australia paid for it's low numbers with government responses that would not be tolerated by many populations in the developed world - from restricting freedom of movement, to creating a temporary prison locking in migrants ([https://www.abc.net.au/news/2020-08-25/coronavirus-melbourne-public-housing-tower-shutdown-inquiry/12589372](https://www.abc.net.au/news/2020-08-25/coronavirus-melbourne-public-housing-tower-shutdown-inquiry/12589372https://www.abc.net.au/news/2020-08-25/coronavirus-melbourne-public-housing-tower-shutdown-inquiry/12589372)), to implementing outbound travel bans even for foreign citizens and foreign residents becoming the only country other than North Korea to do it ([https://www.abc.net.au/news/2021-08-06/covid-rules-australians-overseas-visit-home-change-exemption/100356366](https://www.abc.net.au/news/2021-08-06/covid-rules-australians-overseas-visit-home-change-exemption/100356366)), to being investigated by the Human Rights Commission for not allowing passport holders home ([https://www.theguardian.com/australia-news/2021/apr/16/un-urges-australia-to-act-quickly-to-bring-stranded-australians-home](https://www.theguardian.com/australia-news/2021/apr/16/un-urges-australia-to-act-quickly-to-bring-stranded-australians-home)), to outright declaring the use of an Australian passport a criminal offense ([https://time.com/6047130/australia-india-covid-travel-ban/](https://time.com/6047130/australia-india-covid-travel-ban/)), to using the military on the streets when public health measures failed and actually thinking using the military is best placed to handle healthcare ([https://thenewdaily.com.au/news/2021/07/07/military-covid-australia/](https://thenewdaily.com.au/news/2021/07/07/military-covid-australia/)).  &amp;#x200B;  Any one of these measures would have caused rioting where I am in Europe and in other free nations as the governments were reluctant, for better or more likely worse, to allow a public health issue erode fundamental things like human rights and freedom. They leaned towards the human rights side and paid a heavy, heavy toll in human lives and were then forced to rush in to the highly vaccinated state they're in now.   I don't know what's better and it's up for hearty debate but I'm not sure history will provide Australia with quite the clean report card you're implying.",australia,t5_2qh8e,/r/australia/comments/otk5g8/coronavirus_megathread_b117_counts_leaks/h850vpg/
114,0,1628228941,"https://www.abc.net.au/news/2021-08-06/covid-rules-australians-overseas-visit-home-change-exemption/100356366  Can someone please explain why, as someone with an Australian passport who is living abroad, I'd need to ask the government for permission to go home if I ever come to Australia to visit family and friends?   I'm vaccinated and have no plans of coming home any time soon, but why on earth are they threatening to keep you locked in to Australia, like the fellow in the case study in the article?  This seems crazy - if people have come in responsibly, done their time in hotel quarantine, done whatever they planned to do and want to leave to go home - why do they need to ask Mr Dutton if they can go back home? What if he and his goons say no? Will that person be arrested/fined for trying?",australia,t5_2qh8e,/r/australia/comments/otk5g8/coronavirus_megathread_b117_counts_leaks/h7wjvxt/
115,0,1628110944,"Wihtout being labelled as anti vax (which I'm not), we should consider the fact that the total global number of deaths hasn't spiked exponentially and in fact around the same number of people died in 2020 as the previous years before covid. Stop buying in to all the media FUD and do some actual research beyond social media or what you hear from the controlled mainstream. I'll get the vaccine when it's available to me, but this vaccine passport nonsense and the way things are being handled, especially when a lot of people don't even have a say or are snubbed out for their opposing views. We are slowly leading more towards authoritarian dictatorship and this is only the beginning. Privacy? Freedom? Please.",australia,t5_2qh8e,/r/australia/comments/oxmq6t/the_back_of_the_back_of_the_queue_young_people/h7q3uju/
116,0,1627948419,The passport is not the way as vaccines aren't stopping the virus mutations anyway.   Israel about to lockdown and have over 80% vaccinated and about to start giving people their 3rd shots. Gibraltar over 99% vaccinated and massive outbreak and lockdown.  Cape Cod outbreak where over 80% of those hospitalized from covid are fully vaccinated.  Getting needles in arms doesn't appear to be enough and if the vaccines aren't doing the job why would a vaccine passport be necessary?,australia,t5_2qh8e,/r/australia/comments/ow1foh/operation_khaki_creep_why_public_policy/h7hp58w/
117,1,1627965307,"There are already hundreds of peer-reviewed journal articles and trials of pfizer and AZ vaccines... more than hundreds.  You're already being pushed, coerced or forced to comply with a multitude of mandates and laws. I only mentioned a few above but there are thousands of aspects of society which are already forced upon you by law or legislation. Why is this any different? I see people talk about their fears of a covid passport,  but we already have that in place for all other vaccines. If you don't have your vaccine passport stamped as a child you can't attend school or childcare. I recently travelled to Brazil, if I didn't have my yellow fever vaccine stamped in my passport I wasn't allowed back into the country. If you don't have a flu shot you can't work in aged care. I needed a flu shot just to visit my Mum when she was respite care a few months ago. If you want to work in a birthing ward or around newborns you must have the whooping cough vaccine.  I can't see how this is different to any of the other requirements already in place.",australia,t5_2qh8e,/r/australia/comments/owt2p0/australia_covid_vaccine_passports_are_coming_so/h7im784/
118,2,1627980933,"Good, I support all the measures you mentioned in your first paragraph and we'll get them here whether I agree with them or not.   In terms of 95% being scheduled for vaccinations and you asking why the other 5% don't need a passport, etc. The 5% represents those who can't take vaccines due to medical issues. However, a 95% vaccination rate in the rest of the population is enough to suppress any outbreaks in those diseases and virus'. This is what people are talking about in regards to hitting 80% (or whatever) covid vacc rates. As it stands Australia is sitting at 15.something% for both doses of covid vaccine. Maybe when we get to 95% we can talk about not needing a domestic covid vaccine passport.   And we already have what is effectively a vaccine passport, it's called an Immunisation History Statement. Everyone has one. You have one somewhere unless your parents lost it or threw it out. I guess these days it's a digital file with the Dep't of Health. The difference is that everyone gets multiple doses of these vaccines before they're 20. For example, by the time you're 16 you've likely had 5 or 6 doses of the diphtheria vaccine.  These multiple doses provide a lifelong protection against these illnesses. The point of a new vaccine passport, statement, record... call it whatever you want, is that nobody received multiple courses of a covid vaccine throughout their childhood and have no protection. Now as adults we're going to have to go through the same process we did as kids but now as adults instead.",australia,t5_2qh8e,/r/australia/comments/owt2p0/australia_covid_vaccine_passports_are_coming_so/h7j6cej/
