,Unnamed: 0,Unnamed: 0.1,created_utc,body,subreddit,subreddit_id,permalink
375,134,4,1630280047,"For me the main issue with the vaccine passport in terms of visiting restaurants etc is it has your full name and DOB on there.   They need to make two available in the app, one that shows full details if you need to show police, medical staff etc and one that just confirms your are vaccinated to show at cafes with no details showing.",australia,t5_2qh8e,/r/australia/comments/pdnk4t/federal_opposition_signals_support_for_proof_of/hav59ev/
376,135,5,1630283363,"Dangling the carrot of possible ""freedom"" from travel and other restrictions in front those members of the electorate who have been fully vaccinated (as you mention: currently disproportionately older and soon to be the majority of the voting public) makes sense as a cynical vote-winning ploy. Unfortunately (for them as well as us proles) it looks like the federal coalition government are already in the process of fucking this up since they're already starting to pander to the ""anti-vaccine passport"" troglodytes.  It looks like they will have enough internal resistance to *selective* easing of restrictions based on vaccine status that they'll either just throw the whole idea out the window and let rip for everyone, or offer some compromised smoke-and-mirrors bullshit that sounds like ""freedom for vaccinated people"" on face value but is in reality such an individually onerous, incompetently managed and corrupt process that no ordinary person can realistically take advantage of it (but they'll still swallow it hook, line and sinker come election day).",australia,t5_2qh8e,/r/australia/comments/pe6jy1/newspoll_5446_to_labor/havbz65/
377,136,6,1630293474,Yes but scary vaccine passport boogeyman,australia,t5_2qh8e,/r/australia/comments/pe9cdn/surveillance_legislation_amendment_identify_and/havwcya/
378,137,0,1630135160,"&gt;And vaccine passport? Well thats fine. You dont have a right to travel overseas.  Yup. And as OP mentioned, in terms of international travel the burden of enforcement will lie with immigration officers backed up by heavy police/security presence. Vs a minimum wage waiter who's just stoked to be back at work, and now will have to spend half the day dealing with the combative muh freedums crowd. It's very upsetting that some of the hardest-working hospitality industry workers will have to shoulder this burden",australia,t5_2qh8e,/r/australia/comments/pcxbkg/nsw_covid_bars_eateries_out_of_bounds_for/hano0ln/
379,138,1,1630136367,"The point I’m trying to make is I’m response to op, which is “how does a vaccine passport help ME”. It doesn’t, it helps SOCIETY.   I can go get avocado on toast without a vaccine passport, but the reason I’m going to need one, is because a world where everybody just stumps up and gets vaccinated because it’s the right thing to do, doesn’t exist.  Most people are fine, Around 20% are selfish assholes. If we can’t convince the selfish assholes to get vaccinated, the rest of us are fucked.",australia,t5_2qh8e,/r/australia/comments/pcxbkg/nsw_covid_bars_eateries_out_of_bounds_for/hanpf6f/
380,139,2,1630142785,"Seems majority are in favour of the vaccine, but not the vaccine passport.",australia,t5_2qh8e,/r/australia/comments/pcxbkg/nsw_covid_bars_eateries_out_of_bounds_for/hanwmuz/
381,140,3,1630200144,"I got this from a relative that is a pastor at one of the fundamentalist churches in Sydney. It is legit. I have a real concern that mystical beliefs may influence our politicians at a time where we really need level heads. Scroll to the end and look at how long the list of supporting churches is. I really do not want to go the way of the Southern US states where beliefs have infiltrated politics and has lead to a really dire health situation.  Yet, here we are. The churches are putting out a subtle biblical antivax, anti-lockdown message to try and influence politics.  https://caldronpool.com/ezekieldeclaration/?fbclid=IwAR103zqXjPjpj2Qz26nW81Tq2jlj65845nz6X9M5XP4tjXGFYSG6BSm6qvg  Just to be perfectly clear, I am not anti-religion, but religion and politics should be kept separate. We need politics to be backed by science and done in the best interests of the people. Australia, and NSW in particular, wouldn't be in this situation if our leaders cared more about science. This applies to climate change too.  A vaccine passport would mean that while I may carry the virus, and I may infect others, I will not be a statistic that has an unbearable weight on our health system. Average cost of hospital care for COVID-19 in the US ranges from $51,000 to $78,000 USD, based on age.  https://www.healthcarefinancenews.com/news/average-cost-hospital-care-covid-19-ranges-51000-78000-based-age#:~:text=More%20on%20Operations-,Average%20cost%20of%20hospital%20care%20for%20COVID%2D19%20ranges%20from,to%20%2478%2C000%2C%20based%20on%20age  We don't have that problem in Aus, because we have a social safety net. If we let the unvaxinated overwhelm our hospitals our public health system could break. Once it is gone, I doubt we will get it back easily.  Florida is a great example of what is going on in the Southern States. Florida's Governor Ron DeSantis has been a critic of Covid restrictions, to the point where he has said the state can withhold salaries from school leaders who enact mask mandates. It is so bad in Florida that they have ordered portable morgues. https://www.wftv.com/news/local/orange-county/more-than-dozen-portable-morgues-coming-central-florida-after-hospital-units-reach-capacity/XRXZLVJQPRGR5FRHVEQC4J2SJU/  If churches want to influence public policy then we should have the right to fight back. Honestly, it is not that I care that the religious are shooting themselves in the foot, what I care about is the collateral damage it will do to us all.",australia,t5_2qh8e,/r/australia/comments/p8fvab/coronavirus_megathread_b1526_counts_lockdowns/har2sb7/
382,141,4,1630201227,We got 84% in BC and then they introduced vaccine passport mandates.,australia,t5_2qh8e,/r/australia/comments/pdlrm6/nsw_records_1218_new_covid_cases/har4vuo/
383,142,5,1630204378,"Hahahhaha.  You think people actually use that Covid check in?  My dad went to the hospital every day for 8 weeks for his cancer treatments. This is a hospital, not a shop. He never once checked in, he doesn't know how to, and **no one ever checked**.  I am not complaining, I hope compliance with any form of vaccine passport would be very low.",australia,t5_2qh8e,/r/australia/comments/pdlrm6/nsw_records_1218_new_covid_cases/haravfm/
384,143,6,1630211228,"I don't get the fear of a vaccine passport from people who are willing to get vaccinated. Anti-vaxers, sure, they've been brainwashed into being scared of the vaccine, but if you're vaxed you've got a card or whatever that proves you're vaxed big whoop.",australia,t5_2qh8e,/r/australia/comments/pdnk4t/federal_opposition_signals_support_for_proof_of/harms2s/
385,144,0,1630105263,"I’m 5000% vaccine positive, literally got booked in the first day I was able to and have been trying to be the most reasonable, supportive person nudging people into getting their appointments. But these “incentives” are bullshit.   The ones announced this week are impossible to administer, no one is checking if your outside exercise/regulation is 30min or 90min and how many parks are really being cleared for too many parents loitering near each other? But that’s nothing compared to the time paradox these people must live in who think it’s an “incentive” to people who are waiting for their December appointment. Even if they were AZ hesitant and decide to get AZ they’re nearly 2 months away from this “incentive”.   Now the cafe “incentive” has just as much baggage. Firstly, It will be used by antivaxers as big brother, vaccine passport, the gubinment is taking your freedoms tracking your brain patterns 5G billgates etc etc  It seems to me the vast majority of the people want to get on board, but the more ammunition you give antivaxxers leads to more bleed over into the general population.   More practically it puts an unreasonable burden on vendors/retailers to question the medical history of their customers. I have a brother who has been vaccinated, but due to his medical history may never have immunity, a friend who has had actual genetic testing that has told her she shouldn’t get AZ and still can’t get a Pfizer appointment. Should a 18yo restaurant host question that and should turn them away?    We have already had hairdressers express these concerns when it was raised as an option to get salons reopened.   And lastly, waitstaff do not get paid enough to deal with the type of assholes, who are taking to the streets over this stuff, who are definitely first in line for a greasy parmi when cafes reopen.",australia,t5_2qh8e,/r/australia/comments/pcxbkg/nsw_covid_bars_eateries_out_of_bounds_for/ham8fhn/
386,145,1,1630110282,This is just a politicised rubbish move. How can it be a good idea to further divide society? I’m pro vax and I’m vaccinated but I wouldn’t take a vaccine passport if I were offered one.,australia,t5_2qh8e,/r/australia/comments/pcxbkg/nsw_covid_bars_eateries_out_of_bounds_for/hamird4/
387,146,2,1630110965,"Yeah, this is definitely something that needs to be integrated into any planning for a vaccine passport. While it's not many people who can't get vaccinated they shouldn't be punished for not being able to be vaccinated.",australia,t5_2qh8e,/r/australia/comments/pcxbkg/nsw_covid_bars_eateries_out_of_bounds_for/hamk5rf/
388,147,3,1630112042,"100%, great post.  Id also add as a rational pro vaccine person, I dont support mandatory vaccination, and going to pubs and retaurants is kind of a basic part of life.  This is genuinely veering into authoritarianism.  I dont want to be on the side of the conspiracy weilding nutjobs….I really dont.  I fucking hate those people.  And vaccine passport?  Well thats fine.  You dont have a right to travel overseas.  I understand the reasoning, I just think this is dumb, ineffectual policy and an unreasonable curb on long term sovereignty to make medical decisions over your own body.",australia,t5_2qh8e,/r/australia/comments/pcxbkg/nsw_covid_bars_eateries_out_of_bounds_for/hammbpp/
389,148,4,1630115375,"If we had an effective ""vaccine passport"" the gov would simply be able to put fines for business in effect if they serve unvaxxed customers, just like how they do with under-age drinking. I agree though going for payments would also be quite effective, no reason they can't do both.",australia,t5_2qh8e,/r/australia/comments/pcxbkg/nsw_covid_bars_eateries_out_of_bounds_for/hamt07s/
390,149,5,1630116984,How does a vaccine passport or proof of vaccination afford any extra protection to you if you're already vaccinated?,australia,t5_2qh8e,/r/australia/comments/pcxbkg/nsw_covid_bars_eateries_out_of_bounds_for/hamw4ok/
391,150,6,1630126158,"I mentioned Service NSW because there has been discussion about integrating the vaccine passport into that, but it doesn't have to be that app whatever they decide to use for the passport.   A doctor would determine that. No details would need to be provided on the entrance on why they can't be vaccinated. A bouncer doesn't need to know why you can't be vaccinated, they just need to know that you can't.  The vaccine passport just needs to be available in one spot that is easy to read and easy to understand for anybody to be able to determine if somebody can be let in quickly and easily. They wouldn't detail why you can't be vaccinated, it's irrelevant.  Why would insurance companies need to know? Do you understand the logic behind the vaccine passport? It is just for in-person physical events. All of this can be made explicit in the drafting of the legislation. I think it should be very narrow and very specific.  It's only a slippery slope if you throw your hands up and declare it's too hard before you even bother to try.",australia,t5_2qh8e,/r/australia/comments/pcxbkg/nsw_covid_bars_eateries_out_of_bounds_for/hanc1qs/
392,151,0,1629943522,"Not everyone has a smart phone, so if it’s required for travel etc, are ppl really going to be showing up at airports with a black and white printed PDF of this vaccine passport and it’s accepted? Like.. even if they ‘update it’ to include a QR code, surely not every 75 year old is going to go back to their online Medicare account and re-download/print it.. what if they’ve already left the country? This is a circus 🎪",australia,t5_2qh8e,/r/australia/comments/p9lkki/richard_managed_to_forge_a_covid_vaccine/hadg8z6/
393,152,1,1630017196,"Some people just don't have a choice but to 'just live with it'.  It's great to see millions of jabs in NSW and headlines shouting availability to 12+ children now.  The reality is in regional Queensland as a 42 yr old on disability pension I can't get a vaccine anywhere.  I can't make a booking anywhere, I ring Qld Health and they tell me if you're not in 1a or 1b too bad.  I'm starting to stress about them bringing in a ""vaccine passport"" before the vaccine arrives here.",australia,t5_2qh8e,/r/australia/comments/p8fvab/coronavirus_megathread_b1526_counts_lockdowns/hahf0kl/
394,153,0,1629865305,"Equity as well, everyone has to have the opportunity to access the vaccine before we implement passport systems and have exemptions for vaccinated people from restrictions.",australia,t5_2qh8e,/r/australia/comments/pawpei/scott_morrisons_caveman_comments_alienate_western/ha95per/
395,154,1,1629878249,"Probably not for long, Gerry will have a hotline to to Scotty from marketing. Living freely for vaccinated people will probably include permission to shop at Hardly Normal with a vaccine passport.",australia,t5_2qh8e,/r/australia/comments/pb60o9/harvey_norman_and_jb_hifi_should_go_out_of/ha9natl/
396,155,2,1629891854,You don't need any of them to enter a restaurant though? Or go to the gym? The problem with a vaccine passport is they're going to use it to enforce restrictions on what the unvaccinated can do.,australia,t5_2qh8e,/r/australia/comments/owt2p0/australia_covid_vaccine_passports_are_coming_so/haa4djh/
397,156,3,1629895897,Why do we need the vaccine passport then?,australia,t5_2qh8e,/r/australia/comments/pb632i/trick_or_treat_with_nsw_hospitals_under/haabl8x/
398,157,0,1629794495,"https://www.reuters.com/business/healthcare-pharmaceuticals/canadas-british-columbia-plans-vaccine-passport-restaurants-sports-events-2021-08-23/  https://www.bbc.com/news/world-europe-56522408  https://www.timeout.com/newyork/news/everything-you-need-to-know-about-new-yorks-vaccine-passport-080921  Canada, UK, New York vaccine passports from everything from travel to restaurants.  So you agree with me.",australia,t5_2qh8e,/r/australia/comments/pafcay/freedoms_for_vaccinated_nsw_residents_to_be/ha51aks/
399,158,1,1629810124,"This is fair. As someone who is fairly left and will vote greens, I don’t really support a vaccination mandate/passport either. I strongly believe in abortion rights “my body, my choice” and although I think people should get the vaccine if they can, in no way do I think they should be forced. I’ve had mine, as it was my choice, and I think vaccines should be encouraged, but mandated is against what I stand for.",australia,t5_2qh8e,/r/australia/comments/paakc2/why_do_these_people_keep_winning_elections/ha5nilo/
400,159,0,1629708358,"You're giving concessions to them having more power which you cannot revoke once it is given. I think you are under an illusion as to the reality of the privacy you *could* have but are willingly giving it up.  It's not the vaccine status I am concerned with. I will get vaccinated when possible however I will not carry a vaccine passport especially on my phone.  As I've said in another comment the only middle ground I see is some sort of physical ""card"" to show vaccination status that would be shown **only** to authorities **when necessary.** I would much prefer nothing at all, people just get vaccinated like any other vaccine and it actually be represented on our real passport for traveling overseas only.  My issue isn't how to end the lockdown, its with a vaccine passport, privacy and government overreach.  These are dangerous comments that push us in the wrong direction quickly.   &gt;privacy is pretty much a myth.   &gt;   &gt;does it really matter?   &gt;   &gt;My life is way too boring for anyone in the government to care   &gt;   &gt;All it does it affects my targeted advertising.   &gt;   &gt;All this to say I really don’t give a shit what information the government wants to collect at this point    &gt;   &gt;privacy is an illusion   &gt;   &gt;I’m not giving up anything that I haven’t already shared",australia,t5_2qh8e,/r/australia/comments/p91bly/vaccine_passports_to_combine_jab_records_with_qr/ha0eoyy/
401,160,1,1629712611,"First, I want to say thank you for engaging in a thoughtful conversation and following up with ideas for alternative vaccine passport methods. That doesn’t always happen on Reddit.   I suspect we’d actually agree on more issues than you think - I’d prefer if everyone would just get vaccinated and it could be something we just generally assume, like the MMR or DTAP. Unfortunately we have too many people that are perpetuating fear combined with a bungled vaccine roll out and we’re in a frustrating situation with limited solutions.  Perhaps I have gotten a bit old and complacent. On the other hand, I have always been compulsively open about my life. I’ll talk to anyone about my teenage drug use, porn preferences, multiple miscarriages or experiences with date rape, without any shame. I do understand that my level of openness is not comfortable for everyone. Thank you for reminding me of that, but please also understand that my way of thinking isn’t dangerous, it’s just different.",australia,t5_2qh8e,/r/australia/comments/p91bly/vaccine_passports_to_combine_jab_records_with_qr/ha0ji6v/
402,161,2,1629760469,"&gt;are they gonna introduce a vax passport before they solve the vaccine supply problems?  We are talking about the Liberal party here. ""What supply problems?""",australia,t5_2qh8e,/r/australia/comments/p9lkki/richard_managed_to_forge_a_covid_vaccine/ha3en66/
403,162,3,1629774590,"I think a lot of people are overestimating how much support the liberals are gonna get in the next federal election. Im seeing countless people talk about how their not voting for the libs at all because of things revolving around covid such as the lockdowns, restrictions or mandates.  I support the vaccines and plan on getting novavax if my doctor approves of it (i have an auto immune disease) but i am heavily against mandates such as the vaccine passport. I get having it for international travel and even massive crowd events like the footy but its just fucked that you would need it for just going to the shops or a cafe. I voted for Morrison in 2019. Let me tell you im not going to vote for him again. The moment he began to support the idea of a vaccine passport for a domestic use he lost my support. And no, im not voting for labour either, they support the vax passport as well.",australia,t5_2qh8e,/r/australia/comments/paakc2/why_do_these_people_keep_winning_elections/ha495p1/
404,163,4,1629775881,"Well this is a terrible quandary for the smug freedom-mocker mobs!  Turns out it *is* about freedom.   *This will be the first real trial of version one of Australia’s vaccine passport.*  Government, ironically, doesn’t trust people to be honest so there will need to be a way to show your papers.   It begins.",australia,t5_2qh8e,/r/australia/comments/pafcay/freedoms_for_vaccinated_nsw_residents_to_be/ha4bmf3/
405,164,0,1629622195,"The probability, haha, is much higher that you are bailing on the conversation now that your bullshit has been exposed, rather than me ""not seeing it"".  First line of the fucking article.  &gt; Millions of vaccinated Australians will be able to use their mobile phones to gain exemptions to lockdown rules at cafes, restaurants and public events under a national cabinet plan to use digital records to verify vaccine status.  Your fixation on me pointing out that the vaccine making people only half effective at transmission (A point I only made to be honest about the effective immunity of the current vaccines, while explaining that none of them have a sterilising immunity) is irrelevant. The passport will allow someone with the virus to spread it, that isn't risk management reduction in any way. It is as Frydenberg alluded.  &gt; Mr Frydenberg said it was a “fallacy” to expect to eliminate COVID-19 and said the states and territories had to offer people a path toward easing restrictions.  &gt; “We have to give people the clear sense that there is light at the end of the tunnel,” he said.  Risk management isn't driving any of this, it is economic pressure.",australia,t5_2qh8e,/r/australia/comments/p91bly/vaccine_passports_to_combine_jab_records_with_qr/h9w1o1z/
406,165,1,1629625790,That's an exaggeration. I had to take a Tuberculosis test to qualify for an Australian visa. We have been doing these things for ages. Most of the first world countries have vaccination requirements for immigrants.  [https://www.dw.com/en/are-vaccine-passports-really-that-new/a-57144620](https://www.dw.com/en/are-vaccine-passports-really-that-new/a-57144620)  [https://time.com/5952532/vaccine-passport-history/](https://time.com/5952532/vaccine-passport-history/)  [https://www.npr.org/sections/goatsandsoda/2021/04/08/985032748/the-vaccine-passport-debate-actually-began-in-1897-over-a-plague-vaccine](https://www.npr.org/sections/goatsandsoda/2021/04/08/985032748/the-vaccine-passport-debate-actually-began-in-1897-over-a-plague-vaccine),australia,t5_2qh8e,/r/australia/comments/p91bly/vaccine_passports_to_combine_jab_records_with_qr/h9w5nvr/
407,166,2,1629628898,"Nup.  Turns out I was thinking of a couple of different things. 1) some childcare payments are witheld from unvaccinated children and 2) Unvaccinated children are banned from preschools and childcares (the childcare centres themselves can be fined if they admit unvaccinated kids).  https://en.m.wikipedia.org/wiki/No_Jab,_No_Pay  I'm guessing most of the anti-vaccine-passport people in this thread don't have kids, because I thought this was common knowledge but apparently not.",australia,t5_2qh8e,/r/australia/comments/p91bly/vaccine_passports_to_combine_jab_records_with_qr/h9w97dr/
408,167,3,1629629584,The vaccine passport will allow easing of restrictions for vaccinated people is my understanding. Side benefit of that is promoting vaccination,australia,t5_2qh8e,/r/australia/comments/p91bly/vaccine_passports_to_combine_jab_records_with_qr/h9wa17v/
409,168,4,1629632521,This is a great point. Especially with a potential vaccine passport in the works.,australia,t5_2qh8e,/r/australia/comments/p8zotr/morrison_backs_nsw_in_war_of_words_over_lockdown/h9wdqsd/
410,169,5,1629636636,"But by doing HIV tests what does it achieve? If a person tested positive then what, he’s not allowed to go inside the club?  Vaccine passport is different. People can get covid just by entering premises.",australia,t5_2qh8e,/r/australia/comments/p91bly/vaccine_passports_to_combine_jab_records_with_qr/h9wjup2/
411,170,6,1629644952,"This is completely different to what you said in the first post. You were literally talking about stopping it spreading and eradication.  And what you have said since, while more accurate, has zero relevance to the point of a vaccine passport. There is literally no need for it, if the vaccine roll outs are achieved. But if they aren't then the concept, as presented in the article, of allowing people with these passports to have exemptions around covid suppression measures, it actually makes things worse.  So it is either pointless or dangerous. The passport idea is purely from economic pressure, it has nothing to do with health.",australia,t5_2qh8e,/r/australia/comments/p91bly/vaccine_passports_to_combine_jab_records_with_qr/h9x0hzc/
412,171,7,1629700143,"my worry is the divide between people who want the vaccine but can't fucking get it, and those who queue-jumped because they went to the right school  even if it's for a few months - those months are when kids are graduating high school and trying to get their first jobs  are they gonna introduce a vax passport before they solve the vaccine supply problems?",australia,t5_2qh8e,/r/australia/comments/p9lkki/richard_managed_to_forge_a_covid_vaccine/ha0557l/
413,172,8,1629701642,"You can. In fact, making it mandatory for a few things like a passport, centrelink, interstate travel, licence renewal, nursing/health and other government services goes a long way. Couple that with a one-off tax incentive, a vaccination bonus and an increased centrelink payment and your vaccine rate goes up.",australia,t5_2qh8e,/r/australia/comments/p9pdty/we_have_to_move_forward_prime_minister_fights/ha06zvw/
414,173,9,1629704314,"Sure pre covid you could be traced indirectly with your gps,  with vaccine passports you are legally being tracked and god forbid anything happened it could be used against you in a court of law unlike now.   Whats next? They still wont be happy if anyone can cheese the system with loopholes in the tracking , might aswel get microchipped like a dog, I mean your already got a vaccine passport so whats the diffrence right?  When you keep giving them a piece of cake eventually they will try to take the whole thing. The only argument for wholeheartedly trusting the authorities at this point is ignorance.  I rather die a man than live like a coward.",australia,t5_2qh8e,/r/australia/comments/p91bly/vaccine_passports_to_combine_jab_records_with_qr/ha0a4we/
