,Unnamed: 0,Unnamed: 0.1,created_utc,body,subreddit,subreddit_id,permalink
245,4,0,1642401041,"Hazzard said “ *It’s time to give a damn about someone other than yourself. Give a damn about your community, your family and most particularly the health staff across New South Wales*”.   It is utter hypocrisy for Hazzard and the government to point the fingers at the anti-vaxxers and the vaccine-hesitants. The government should have done more. That is the job you are paid to do.      Despite the warnings from healthcare workers that the health system was under pressure, the NSW government’s message to the community in December 2021 was: “**Go out there and spend, head to the pub and get back to normal**”.   If the NSW government actually “give a damn”,  they could have:      \-  Deliver an effective education campaign on vaccination – instead you stood by while many LNP politicians such as George Christensen vocally support the anti-vaxxers.       \-  Implement a vaccine passport – Instead Perrottet removed all restrictions on the unvaccinated on 15 Dec 2021.",australia,t5_2qh8e,/r/australia/comments/s5qaop/hazzard_urges_people_to_give_a_damn_about_someone/ht0bvrp/
246,5,0,1642318411,"For a lot of us living overseas it wasn’t as simple as „should have just hopped on the plane at the start of the pandemic“. You have your job overseas, your non Australian partner, maybe family. I couldn’t have taken my partner or my job. Not knowing if you go that you’d able to return and being then separated from your life on the other side was a huge risk.   For other people, they had booked flights but they kept getting cancelled and pushed back. The costs honestly got ridiculous. At one point for me it would have cost a total of $12,000 to come back. At that point your passport and citizenship means absolutely nothing to you unless you are rich.  Let’s just say after 2 years of not being allowed to see my family in person as a citizen whose entry now is pretty much vaccine conditional, I would have been really damn pissed off if Djokovic had been found exempt.",australia,t5_2qh8e,/r/australia/comments/s5603s/djokovic_has_appeal_dismissed/hsvjohl/
247,6,0,1641974831,"Just wait until you find out where this vaccine passport/MyGovID stuff is heading, ho boy you’re in for some fun.",australia,t5_2qh8e,/r/australia/comments/s1pvs3/customs_confiscated_and_scanned_our_mobile_phones/hsbozgb/
248,7,1,1641998815,"Well let me tell you how the government want you to use an app to sign in to every location you go and also provide a vaccine passport to enter certain locations, nice to see some people waking up to the slow degradation towards a chinese style control the government is taking",australia,t5_2qh8e,/r/australia/comments/s1pvs3/customs_confiscated_and_scanned_our_mobile_phones/hscq5aa/
249,8,0,1641533542,Do you also remember when the idea of a vaccine passport and vaccine mandates were called a conspiracy theory and that it’ll never happen? Well here we are bois,australia,t5_2qh8e,/r/australia/comments/rxn5b7/nsw_hospitals_bracing_for_tripling_of_covid/hrlmhq7/
250,9,0,1641381924,"Personally never bothered with enforcement of it my self tbh unless it physically wouldnt let us scan anymore. It's the same with the vaccine passport where I am now, minimum wage retail workers don't get paid enough to play security guard and its a shit enough job with out having to worry about even more abusive idiots.",australia,t5_2qh8e,/r/australia/comments/rwhvpz/coles_reintroduces_product_limits_to_curb_panic/hrcaxfn/
251,10,1,1641418256,"&gt;But Djokovic is unable to proceed through passport control after a member of his support team made a critical mistake in requesting a sub-class of visa that does not apply to those who have received medical exemptions from a Covid-19 vaccine. The error had been discovered by the Australian border force while Djokovic was already travelling on a 14-hour commercial flight from Dubai to Melbourne.        Djokovic’s father, Srdjan, confirmed to the Serbian  &amp;#x200B;  So most likely this will just be a temporary issue. And his new visa application will be assessed first thing in the morning. Also fuck this dickheads father for saying he will have people in the streets, when his own incompetence is landing him in this spot. And even if it hadnt been his fault. Fuck that dickhead for using an inciteful language.  Too bad we're bending over backwards for these assclowns.",australia,t5_2qh8e,/r/australia/comments/rwwpx2/novak_djokovic_denied_entry_to_australia_after/hreoeoe/
252,11,2,1641425175,"Can't blame anyone but himself and his support crew lol  ""But Djokovic is unable to proceed through passport control after a member of his support team made a critical mistake in requesting a sub-class of visa that does not apply to those who have received medical exemptions from a Covid-19 vaccine""",australia,t5_2qh8e,/r/australia/comments/rwwpx2/novak_djokovic_denied_entry_to_australia_after/hrf6cpw/
253,12,0,1640354784,"[Nope, he's safe](https://www.theguardian.com/business/2021/dec/02/tesco-ad-featuring-santa-with-covid-vaccine-passport-cleared-by-watchdog-christmas).",australia,t5_2qh8e,/r/australia/comments/rnlnal/fears_of_super_spreader_event_after_single_man/hpt4st5/
254,13,0,1639533544,"So the virus spread despite a vaccine passport system, again another reminder there is zero scientific evidence or example that such a program has any effect on virus cases",australia,t5_2qh8e,/r/australia/comments/rgjc75/nsw_covid19_cases_hit_threemonth_high_1360_new/hola9l0/
255,14,0,1639200188,"Do you have any sort of certification that you are vaxxed, either digital or paper? Are you sure you need the International Covid Vaccine certificate specifically? From memory you need a document stating the vaccine you got and when,your name, and either your Dob or passport number. Sounds like you don't have that, but just in case...",australia,t5_2qh8e,/r/australia/comments/r4e3az/coronavirus_megathread_b11529_counts_lockdowns/ho34jqf/
256,15,1,1639273744,Easy fixed. Take bottleshops off the essential services list so everyone purchasing booze must show their vaccination passport. And if that doesn’t work extend the vaccine mandate to Centrelink payments. No jab no benefits.,australia,t5_2qh8e,/r/australia/comments/redt2o/thousands_of_protesters_expected_to_hit_melbourne/ho709tw/
257,16,0,1639083651,"I'm a overseas travelling and am unable to return to Australia because I am unable to apply for the medicare International Covid Vaccine Certificate.  I am traveling on an NZ passport and Medicare messed up my name and they can't find my vaccine records when looking me up through my passport number.I called them up to try sort it manually and the operator said verbatim:  &gt;You have done everything right, I can see your passport and that you're vaccinated here in Australia - but the system doesn't seem to allow me to link them. I don't know what I can do about this.  The obvious question is ""why didn't you sort this before you left?"" and I am asking myself that as well. There are so many hoops to jump through when travelling it's an easy thing to miss.   I suppose I didn't expect the country I live and got my vaccines in to drop a ""new phone who dis"" on me.  So as of right now, I am chilling alone in a foreign country with no idea of how or when I'll get back home.  Sick.",australia,t5_2qh8e,/r/australia/comments/r4e3az/coronavirus_megathread_b11529_counts_lockdowns/hnwevmm/
258,17,0,1639002461,That's what the vaccine passport does,australia,t5_2qh8e,/r/australia/comments/rc1nqo/barnaby_joyce_tests_positive_for_covid/hnrzcox/
259,18,1,1639018262,And which industries are those? You didn't mention also being barred from society once the vaccine passport kicks in.,australia,t5_2qh8e,/r/australia/comments/rbiacg/antivaxxers_lose_court_appeal_against_mandatory/hnszacz/
260,19,0,1638329865,"I'm a little bit confused by the reaction.   [Firstly, we know multiple-voting happens](https://www.smh.com.au/politics/federal/more-than-18000-people-asked-to-explain-why-they-voted-twice-at-election-20161019-gs5cal.html).      But secondly, my understanding is that the forms of ID accepted are pretty wide-ranging. If you don't have a drivers license, you can provide a medicare card, or even a bill eg gas, telephone bill, etc. Failing that, if you're with another person, you can ask them to verify your identity. And failing even that, you can cast a declaration vote, where you simply provide your D.O.B. and a signature.   Just a side question though. Are those angry with these laws OK with vaccine passports? If the burden of bringing as gas bill to a voting booth is too high, surely producing a vaccine passport is at least equally so? Are we worried about marginalising vulnerable groups in both cases, or just one?",australia,t5_2qh8e,/r/australia/comments/r61t2y/morrison_govt_is_attempting_to_introduce/hmr3mw1/
261,20,1,1638334737,"&gt; Firstly, we know multiple-voting happens.  Weird you'd bring that up, since voter ID will do nothing about it. You can presumably still show your ID at multiple poling stations, and the fact we're catching people who vote twice anyway argues against the need for change.  &gt; Just a side question though. Are those angry with these laws OK with vaccine passports? If the burden of bringing as gas bill to a voting booth is too high, surely producing a vaccine passport is at least equally so? Are we worried about marginalising vulnerable groups in both cases, or just one?  This is a really stupid comment, because the things being restricted by vaccine certificates are not essential to democracy. If you don't have your vaccine certificate, then maybe you miss out on watching a movie or you need to switch to takeaway at your local cafe. If you don't have a valid ID your fundamental right to participate in democracy has been violated. Not remotely comparable.   Also there is absolutely no indication that a vaccine certificate will be required to vote, just as it's not required to access numerous essential services like supermarkets or hospitals.",australia,t5_2qh8e,/r/australia/comments/r61t2y/morrison_govt_is_attempting_to_introduce/hmrdfev/
262,21,2,1638339781,"So far we know the symptoms all go away, but down the line they could resurface, perhaps. No way to know this until time has passed.  Simple, the vaccine is not necessary. The numbers don't support it, the reaction does not support it. This entire situation is the pandemic equivalent of burning down your kitchen to kill a spider. The death rate is minimal, the people who are at risk are given the option to get the treatments or shots so they choose. So why is any of this going on? Why the mandates? Why the demands? You literally cannot eradicate covid, nor is it worth eradicating. It's such a non-factor when compared to almost any disease, especially ones that aren't just influenza. Smallpox had a death rate of over 30%, I dont know of anything like what we're seeing right now.  So why would I take a shot for a disease that isn't going anywhere, that won't stop transmission, or infection, and might screw with my body in ways that we either don't know about, or aren't being told about. Because like I said Pfizer doesn't want to release its data. I'd much rather just get the disease, be sick for a week, and get over it. It's why I don't bother with the flu shot, it's not worth getting.  And to add on to that, I dont believe the government has any right whatsoever to tell me I have to take medicine or shots, or even have a friggin passport and papers on me to live my life day to day. So by my own moral compass and principles I have to decline. If it kills me? So be it, but it was my choice, and freedom carries the price that you might make the wrong choices. But thats fine. Too many people are just fine with the nanny state babying them.",australia,t5_2qh8e,/r/australia/comments/r5adgx/new_omicron_case_found_in_nsw_has_been_active_in/hmrm1za/
263,22,0,1637555475,"The difference is that vaccine passports are a **necessary** evil that solve a *real* problem. People *are* dying from Covid. Or getting sick and even after recovery have long-term health issues e.g. lung damage.  Meanwhile voter fraud is a crime the libs love to hype up but in reality we barely charge anyone with it each election, let alone find them guilty. It's usually just old people who accidentally vote twice, and we notice because there are systems in place to check during vote count / after the election.   The rare times voter fraud *has* made a difference, comparisons between the electoral roll and the census have picked it up, voter fraud is a non-issue and ID-laws will just make it hard for *not-liberal-demographics* like poor people with no drivers license or passport to vote.",australia,t5_2qh8e,/r/australia/comments/qymkr3/voter_id_laws_will_diminish_rights_of_all/hlloijw/
264,23,0,1637340618,"&gt;I'd love us to adopt wearing face masks if you've got a cold or the flu.  Why not?  It's not going to happen, though. 2 years time and things will be back to as they were in 2019.  I doubt it, COVID isn't going away any time soon and hence the restrictions will remain.  As an example, the Netherlands has slightly higher vaccination rates than Australia, has had ""vaccine passport"" type restrictions on the unvaccinated for several months (Similar to Australia), and yet has reached new highs in new COVID cases per day in the past week. https://www.worldometers.info/coronavirus/country/netherlands/",australia,t5_2qh8e,/r/australia/comments/qxb5qv/scott_morrison_wants_to_pretend_nothing_has/hl9v27e/
265,24,0,1636707583,So why do I have a vaccine passport?,australia,t5_2qh8e,/r/australia/comments/qrwciu/scott_morrison_says_he_doesnt_believe_hes_told_a/hkb9v3e/
266,25,0,1636587352,"I sincerely doubt you're asking in good faith but other people might be questioning it, so I will reply.  Australia already has an independent electoral commission to keep both the voting public and political groups in check. Voting is mandatory in Australia, unlike in the US, so the infrastructure is there to make sure everyone who must vote has. Think about the fact people who don't vote get fined - the AEC already knows who is and isn't voting. Australia also doesn't have an undocumented underclass to use as a boogeyman. Who do people think are trying to vote fraudulently? It isn't an issue in America and it isn't an issue here.   [According to the AEC](https://www.aec.gov.au/enrolling_to_vote/enrolment_stats/) there are 17.685,585 eligible voters in Australia. Of these, 16,905,290 are enrolled. [In the 2016 election](https://www.smh.com.au/politics/federal/more-than-18000-people-asked-to-explain-why-they-voted-twice-at-election-20161019-gs5cal.html) , there were 18,000 votes caught as being fraudulent. That is 0.1% of the possible votes. There were also 87 instances of electoral campaign fraud including dodgy how to vote cards handed out by political groups.  As far as ID is concerned, when I lived in Australia I had ID but it rarely matched my home address. I didn't drive and having a correct address wasn't important for buying alcohol. In fact, I lived in Canberra for three years without ever switching my drivers license from my NSW learners. I could change my voting enrolment details online and without a fee. Because I moved so often (landlords constantly increasing rents) there would be quite a cost involved in making my ID match my address. One time I didn't quite make my enrolment changes in time and they accommodated me by making me do an out of area form.  Personally I'm against a vaccine passport for everyday life because it seems like a hassle. I'm in NZ now and had to apply for my NZ passport because otherwise I might not be able to prove I'm vaccinated. A difficult to forge vaccine certificate or having it linked to my medicare/nhs number would be fine imo.",australia,t5_2qh8e,/r/australia/comments/qr2xaa/its_unclear_why_new_laws_to_enforce_voter/hk4v64m/
267,26,1,1636591292,"&gt; Btw the vaxx passport is an avenue into a ""health passport"" moreso than voter ID is an avenue into tracing people voting against the establishment.  There is not a single reasonable person who thinks this is going to happen.  &gt; the one certain people can have   There is an absolutely minuscule percentage of the population who ""can't have"" the vaccine and those people I absolutely guarantee wish they could get it. They are the ones put at risk by ""vaccine hesitant"" people who have bought into the conspiracy.  Voting already requires you to identify yourself. You approach the desk, mark off your name on the electoral roll and vote.  The alternative to the vaccine passport is to literally let deathly ill people prance around society infecting others at a huge rate which will very quickly infect those who can't be vaccinated (like my infant son).  I am 100% for any measure that protects those who CAN'T be vaccinated against those who WONT be vaccinated.",australia,t5_2qh8e,/r/australia/comments/qr2xaa/its_unclear_why_new_laws_to_enforce_voter/hk541xk/
268,27,0,1635301549,"So a vaccine passport protects against the potential of someone spreading a disease (they are supposedly vaccinated for?) and using the same logic, a voter ID protects against the potential of someone committing voter fraud.",australia,t5_2qh8e,/r/australia/comments/qg0jgz/voters_will_be_asked_to_show_identification_to/hi758gd/
269,28,1,1635335936,"So requiring ID to vote is racist and segregating, but requiring a vaccine passport to go shopping is totally fine.  Haha yes",australia,t5_2qh8e,/r/australia/comments/qgtbsw/utter_disgrace_labor_senator_likens_voter_id_bill/hi8jamm/
270,29,0,1635251497,Vaccine passport ok but ID bad? Am I right?,australia,t5_2qh8e,/r/australia/comments/qg0jgz/voters_will_be_asked_to_show_identification_to/hi3ukcd/
271,30,1,1635263713,"Can’t believe Australians say that this is voter suppression, but applaud having to have a vaccine passport to leave their own house. What kind of ridiculous thought pattern is that?",australia,t5_2qh8e,/r/australia/comments/qg0jgz/voters_will_be_asked_to_show_identification_to/hi4m7j2/
272,31,2,1635267576,Apparently here in the states it's racist to require identification for voting but NOT racist for vaccine passport,australia,t5_2qh8e,/r/australia/comments/qg0jgz/voters_will_be_asked_to_show_identification_to/hi4w0cw/
273,32,3,1635280931,"You need a medicare card for the vaccine passport, and that is acceptable ID here.",australia,t5_2qh8e,/r/australia/comments/qg0jgz/voters_will_be_asked_to_show_identification_to/hi5uavb/
274,33,0,1635026845,"** It's now illegal in Victoria for unvaccinated people to play chess, practice archery or coach junior football - has the state finally gone too far? Where will it go next?**  For reference the [Open Premises Directions](https://www.dhhs.vic.gov.au/victorias-restriction-levels-covid-19) from the Victorian Acting Chief Health Officer (CHO) mandates that clubs, special interest meeting groups and sports facilities specifically exclude and prohibit unvaccinated people on behalf of the state.  Unfortunately, as many of us suspected, the Vaccine Passport did get implemented and is actively being used in Victoria to prevent unvaccinated people from participating in social activities.  The Vaccine Passport is a now a dangerous tool that only requires the Victorian CHO to add another premises or activity to the list in order to forcibly conscript an organisation into the service of the state.  In my opinion this has already gone too far. A second subclass tier of ""citizen"" has now been created and can be further excluded from society with a simple stroke of the pen.  Where it will go next is even more worrying. The Victorian AMA has *already* gone on record as saying [""Covid-deniers and anti-vaxxers should opt out of public health system and ‘let nature run its course’""](https://www.theguardian.com/australia-news/2021/oct/21/victoria-ama-says-covid-deniers-and-anti-vaxxers-should-opt-out-of-public-health-system-and-let-nature-take-its-course). These are the ""experts"" we are being socially engineered to trust unquestioningly and they proposing that people with a different opinion should be thrown onto the medical scrap heap.  Where it is very likely to go next, in my opinion, will be the large businesses and corporations that were ""permitted"" to stay open by the government and friendly politicians. Expect the supermarket chains and large stores like Bunnings to be enforcing vaccination status soon.  History shows when The State forces organisations to act on their behalf and creates a sub group of people to be singled out for hate that it never goes well.  **What do you think - has the state finally gone too far? Where will it go next?**",australia,t5_2qh8e,/r/australia/comments/q47jcq/coronavirus_megathread_r1_counts_lockdowns/hhsg65w/
275,34,0,1634764269,"From the coronavirus Vic website  What to bring with you to your vaccine appointment Bring these things, if you have them:  a face mask any emails about your vaccination appointment (on your phone or printed) photo identification, if you have one, such as a passport or driver’s licence a Medicare card or Individual Healthcare Identifier number, if you have one. If you don't, that's ok.  https://www.coronavirus.vic.gov.au/checklist-your-covid-19-vaccination",australia,t5_2qh8e,/r/australia/comments/qbykdj/how_do_i_get_vaccinated_as_a_16_year_old_without/hheu2uz/
276,35,0,1634243221,Really hoping the high rate means we can skip any stupid vaccine passport system. Looking forward to being able to just walk in to stores again rather than having to search my pockets for my phone and mask.,australia,t5_2qh8e,/r/australia/comments/q785eb/antivaxxers_refuse_to_believe_the_statistics_they/hgnl6ch/
277,36,0,1634031780,"SeviceVic app works surprisingly well. No problem sharing from Medicare app to Service Victoria app.  If you can't share to check-in app, you can copy your vaccine passport to your google pay or apple pay",australia,t5_2qh8e,/r/australia/comments/q6e248/explainer_how_do_i_get_a_covid_digital/hgc3vmx/
278,37,0,1633834304,"Seriously? Like pretty much all health workers require a range of vaccines. Just to do a student placement in a hospital I was required to have six proof of vacs. I also worked in an old folks home and everyone was required to show proof of flu vac every year. There are even countries that require you show proof of vac for visa and entry requirements, we quite literally already have a vaccine passport in Australia for this purpose.",australia,t5_2qh8e,/r/australia/comments/q4exgs/victoria_police_sergeant_quits_over_enforcing/hg24u6x/
279,38,0,1633550770,"He's going to do all he can to dump the vaccine passport as soon as possible.   It will be labelled as providing businesses with access to as many customers as possible, but in reality he'll be doing it so his fellow religious nutjobs who claim their right to not be vaccinated is based on religion won't be excluded.",australia,t5_2qh8e,/r/australia/comments/q2hbwr/nsw_crisis_cabinet_overhaul_as_new_premier/hfn851r/
280,39,1,1633569642,"I don't get the vaccine passport thing. I don't really care firstly because I'm fully vaxxed, but secondly, if people want to take their chances unvaxxed, let them get sick.",australia,t5_2qh8e,/r/australia/comments/q2y3so/reported_vaccination_percentages_something_thats/hfod4wd/
281,40,2,1633572410,"actually, the point of a Covid passport (as successfully used in the Scandinavian countries) is as a method to keep the infected in lockdown, and open up society for the uninfected. or, reduce the spread/""flatten the curve"", while keeping society open.  the actual vaccine portion of the passport, is really just used as an incentive to get people vaccinated.  the coronapas used by Denmark tracked people negative tests, prior infections (which counted as vaccination) and, Vax status.  The negative tests/prior infection portion, ensured that the people that checked in to busy places (restaurants etc) weren't infected, and wouldn't infect others. you couldn't get in to the restaurant if you recently tested positive for example.  the way we're using it seems... useless. we've all been in lockdown to reduce the spread.",australia,t5_2qh8e,/r/australia/comments/q2y3so/reported_vaccination_percentages_something_thats/hfoj2ha/
282,41,0,1633403976,"They would have to get vaccine passport.. oh wait.. passports passports to come here, so I'd hope they consider that too much of an imposition on their liberty to need a passport to travel internationally.",australia,t5_2qh8e,/r/australia/comments/q1ld07/save_australia_protest_erupts_in_new_york/hffscgk/
283,42,0,1632826838,Everyone who diligently got vaccinated is now thinking why can't I travel?  What happened to this vaccine passport?  Are we only going to open things up once people are actually rioting?,australia,t5_2qh8e,/r/australia/comments/pwfv6r/cnn_australias_scott_morrison_may_dodge_the_cop26/hekxh4q/
284,43,0,1632755865,"Seriously? How ARE they going to enforce It? Ok. So if they want to go into a premises? They can ask for evidence. How do you present that evidence? Do I have open my link to MyGov? And show them? Or ??? And unvaccinated people...are they going to stop people on the street and demand they show them some sort of evidence?  How EXACTLY is this ""vaccine passport"" thing supposed to work???",australia,t5_2qh8e,/r/australia/comments/pwbomr/victoria_covid_update_unvaccinated_residents_will/hehb327/
