,Unnamed: 0,Unnamed: 0.1,created_utc,body,subreddit,subreddit_id,permalink
119,119,3,1627987351,"You do understand that ~3000 people die each year in Australia from the flu right? That is every single year, year in, year out.  There is even a flu vaccine every year you can go and get, has been for quite a while now.  If there has been something, which is very similar to Covid (effects the lungs, spreads easily, incubation period while infectious), around for many years, has been killing thousands of people every year, and we have **never had any response about it at all** from the government, why are we starting now?  This is a perfect comparison. Similar disease, similar symptoms, similar infection vectors.   Why has there never been a flu vaccine passport? Why has there never even been the **idea** of a flu vaccine passport?  Here is a link to show I am not making up the number of flu deaths. https://www.abs.gov.au/statistics/health/causes-death/causes-death-australia/2019  COVID IS NOT THE FLU. Better add that in too.",australia,t5_2qh8e,/r/australia/comments/owt2p0/australia_covid_vaccine_passports_are_coming_so/h7jduay/
120,120,0,1627816781,its no accident that the same label is being used both for nutjobs who dont vaccinate their children against polio and anybody remotely opposed to mandatory covid vaccination or a vaccine passport  the purpose is to silence opposition,australia,t5_2qh8e,/r/australia/comments/ovlkhv/youtube_suspends_sky_news_australia_account/h7awjxh/
121,121,0,1627558068,"&gt;The simple fact is that even now, right this very moment, for Australia as a whole, were we to roll out AZ nationwide to all age groups, the chances are very high that more people would die from AZ than would have died from covid  Which is exactly what the poster said.  Look, we get that you have some kind of AZ phobia, but the facts are that the only wait out of this shitfest is for people to get vaccinated and if that means getting the unfashionable one, so be it.  The longer you wait, the bigger the risk gets. Don't be whining because you missed your chance, got sick and missed out on your vaccine passport.  I thought Aussies had more about them, but clearly not.  Bring on the downvotes because facts touch your precious egos.",australia,t5_2qh8e,/r/australia/comments/otoe18/scott_morrison_expecting_everyone_who_wants_a/h6xzu5t/
122,122,1,1627608409,"I have a feeling they will tie income support to Pfizer participation when the supply reaches enough to do the last 25% of not at risk groups, say 12 months from now. Covid passport etc, which does seem a bit like eugenics to be frank",australia,t5_2qh8e,/r/australia/comments/ou8a3o/astrazeneca_vaccine_creator_says_australian_lives/h713j2z/
123,123,2,1627614676,"One: the Morrison govt will never do that. Their reasons won't be listed here, but you can bet for political reasons that will never, ever happen (again).  Two: Lockdowns cost. They have a cost in terms of money, and in terms of lives. It may not be as immediate as COVID deaths are, but they are just as real. You don't inflict that cost on whole areas of the country that don't need to bear it.  Three: When everybody is responsible, nobody is. Or to put it another way, NSW should not be allowed to dodge making the hard decisions by getting the federal government to make the call for them.   Four: Policing a national lockdown is even harder than a targeted or state level lockdown. You think the people in Darwin are going to be interested in your idea? You think anyone there is interested in enforcing it?  Five: We can't stop people coming in. The very fact that we have limited and made it hard for Australians to come home is a breach of our obligations and is just morally reprehensible. An Australian passport should mean that you always have a place to call home here, regardless of all other circumstances.   Your issue is with the substandard quarantine options available. Hotel quarantine has fallen into the ""good enough"" problem - it was good enough to solve the initial, but now we're stuck with the workaround when we should have had the proper solution buy now. The federal government should have implemented a serious quarantine solution in the last 18 months but has been happy to let the states take the hit and deal with the consequences. That's where your problem lies.",australia,t5_2qh8e,/r/australia/comments/otk5g8/coronavirus_megathread_b117_counts_leaks/h71g4r6/
124,124,0,1627525593,"&gt;""Wants a jab."" This kind of messaging really pisses me off. Everyone NEEDS a jab as soon as they can get one.  I have no issues vacine passport and those who dont want sign an equivilant to a DNR that they dont want any treatment for covid related illness or symptoms.    &amp;#x200B;  Wont happen due to doctors and their pesky hippocratic oath (sarcasm on the pesky part)",australia,t5_2qh8e,/r/australia/comments/otoe18/scott_morrison_expecting_everyone_who_wants_a/h6wqtin/
125,125,0,1627207027,"This to me is just crazy. I’m an Australian living in Portugal. Here there has been no fear campaigns against any of the vaccines. After confirming my details in an online portal I got a text message from the national healthcare system for an appointment location, date and time 10days later. I received my first vaccine in one of the many vaccination centres (almost every community sports centre) and I didn’t know what vaccine I’d get until I walked into the booth. Portugal has 4 available but I’m sure if you really wanted one particular vaccine you could ask your doctor to write a letter. I got Pfizer and an appointment for 1 month later to get the second dose. Once I have the second dose I can download my digital covid passport and enter certain countries, not required to do so many covid tests and even enter nightclubs when they are allowed to open again. The media has a lot to answer for in Australia by spreading so much fear and not showing the realities of every other country that has had to live with the virus for the last 18months. Everyone I know has had the virus and gotten over it. Everyone I know also knows someone that has died from it. We accept the seriousness and we don’t want to live with lockdowns anymore, vaccination is the only way forward. Unless you want to live with closed borders for the rest of your life whilst the rest of the world gets back to normal.",australia,t5_2qh8e,/r/australia/comments/or2l44/join_the_az_club_the_under_40s_influencing_their/h6gk1ga/
126,126,1,1627233643,"The pandemic response we have seen is ramshackle and often confusing as it doesn't seem to achieve it's stated goal of stopping the circulation of the virus and protecting the vulnerable. Until you realise that this was never the purpose. The response has, since the beginning of 2020 been designed simply to divert attention from the blame that our respective governments rightly deserve for the situation we find ourselves in. After all, had our governments been able to distribute the masks and implement the protocols that our longstanding pandemic response strategies outlined from the start, all of this could have been avoided.  As funny as the tagline here is, the government is actually trying to control the people. As an australian who has been in France throughout the pandemic, of course with an eye always towards the events unfolding back home, it has been difficult for many to understand a lot of the initiatives that have been put in place.   The french pandemic response being a more clear example of exactly what is about to unfold in Australia I would point out that everyone in France was perplexed when they told us that wearing masks wasn't useful for members of the general public. The dogs in the street here cocked their head sideways and mumbled in confusion when the government told us that children in school wouldn't spread the virus to their family members. We all rolled our eyes with exhaustion and bemusement when the government decided to implement a 6pm curfew in lieu of an actual confinement, a measure which would last for ten months when everyone knew after considering it for 10 seconds that such a measure would make peoples' lives miserable (those who worked weren't even able to buy groceries as the shops were forced to close before the average worker could get to them) and the measure clearly didn't work to stop the virus.  Why!? People exclaimed. For ten months people pulled their hair out listening to pandemic updates while crammed halfway into a stranger's armpit on the one train that EVERYONE IN THE CITY now had to climb aboard to get to and from work. We spent 10 months surrounded by people, but isolated from our friends and loved ones. The virus spread.   The answer is control. In France the government opted for a curfew that wouldn't work at all in place of a confinement which would have worked a little bit because they were concerned about popular criticism and losing their grip on power. The crisis for our governments is entirely a crisis of control. As we approach our third covid season Europe is in a state of upheaval. Protests against a health passport which will deny people access to hospital care and authorize their bosses to fire them without access to welfare, a health passport which mandates the vaccination of children as young as 3 or threatens their exclusion from kindergartens, schools and daycare centers. All of this in France is a hideous and calculated threat and an attempt to force people into being vaccinated, not to satisfy any particular health objectives  (our hospitals are increasingly filling with fully vaccinated citizens and doubts are surfacing about the ability of vaccines to prevent hospitalisation) but to force the population to comply, and to appear to have taken a strong initiative by harassing children and young people to receive a vaccine which is globally in short supply and ostensibly of limited use to them. Meanwhile 5million elderly and vulnerable french people have not yet been able to receive a vaccine and many others require a booster for the ones they received earlier this year.  We are two months away from another covid season and the government has done nothing in real terms to prepare the nation for what is to come. All they have done is cultivate fear and division in order to control people.   Yes it's true that the Australian government is incapable of organising an adequate hotel quarantine system, the Australian government is incapable of upholding their duty to citizens who have been desperately trying to return to their homes, some of whom have died waiting to be allowed back, yes the Australian government is incapable of organising a vaccine rollout, but that's because none of these things have been their main objective. It's about control, and watching how quickly everyone forgot the shame of the bushfires and lavished Morrison with high approval ratings from the start of the pandemic would seem to suggest that he has been somewhat successful in achieving some control not over the pandemic, but over the electorate, which is the only imperative.",australia,t5_2qh8e,/r/australia/comments/or8a8b/protesters_believe_government_that_cant_even/h6hqz0q/
127,127,0,1625640208,"Yep, hard to travel for the yearly family trip to the French Riverina if your grommets don’t have an updated COVID passport.",australia,t5_2qh8e,/r/australia/comments/ofb9hu/minister_fires_up_during_covid_press_conference/h4budxw/
128,128,0,1625498069,"&gt;Why can't we just get a vaccine fucking passport stamp already?  What and do something?   If you bored read this:  Today the European Commission is proposing to create a Digital Green Certificate to facilitate safe free movement inside the EU during the COVID-19 pandemic. The Digital Green Certificate will be a proof that a person has been vaccinated against COVID-19, received a negative test result or recovered from COVID-19. It will be available, free of charge, in digital or paper format. It will include a QR code to ensure security and authenticity of the certificate. The Commission will build a gateway to ensure all certificates can be verified across the EU, and support Member States in the technical implementation of certificates. Member States remain responsible to decide which public health restrictions can be waived for travellers but will have to apply such waivers in the same way to travellers holding a Digital Green Certificate.        Vice-President for Values and Transparency, Věra Jourová said: “The Digital Green Certificate offers an EU-wide solution to ensure that EU citizens benefit from a harmonised digital tool to support free movement in the EU. This is a good message in support of recovery. Our key objectives are to offer an easy to use, non-discriminatory and secure tool that fully respects data protection. And we continue working towards international convergence with other partners.”        Commissioner for Justice, Didier Reynders, said: “With the Digital Green Certificate, we are taking a European approach to ensure EU citizens and their family members can travel safely and with minimum restrictions this summer. The Digital Green Certificate will not be a pre-condition to free movement and it will not discriminate in any way. A common EU-approach will not only help us to gradually restore free movement within the EU and avoid fragmentation. It is also a chance to influence global standards and lead by example based on our European values like data protection.”        Key elements of the regulation proposed by the Commission today:        Accessible and secure certificates for all EU citizens:    The Digital Green Certificate will cover three types of certificates –vaccination certificates, test certificates (NAAT/RT-PCR test or a rapid antigen test), and certificates for persons who have recovered from COVID-19.    The certificates will be issued in a digital form or on paper. Both will have a QR code that contains necessary key information as well as a digital signature to make sure the certificate is authentic.    The Commission will build a gateway and support Member States to develop software that authorities can use to verify all certificate signatures across the EU. No personal data of the certificate holders passes through the gateway, or is retained by the verifying Member State.    The certificates will be available free of charge and in the official language or languages of the issuing Member State and English.    Non-discrimination:    All people – vaccinated and non-vaccinated – should benefit from a Digital Green Certificate when travelling in the EU. To prevent discrimination against individuals who are not vaccinated, the Commission proposes to create not only an interoperable vaccination certificate, but also COVID-19 test certificates and certificates for persons who have recovered from COVID-19.    Same right for travellers with the Digital Green Certificate –where Member States accept proof of vaccination to waive certain public health restrictions such as testing or quarantine, they would be required to accept, under the same conditions, vaccination certificates issued under the Digital Green Certificate system. This obligation would be limited to vaccines that have received EU-wide marketing authorisation, but Member States can decide to accept other vaccines in addition.    Notification of other measures – if a Member State continues to require holders of a Digital Green Certificate to quarantine or test, it must notify the Commission and all other Member States and explain the reasons for such measures.    Only essential information and secure personal data:    The certificates will include a limited set of information such as name, date of birth, date of issuance, relevant information about vaccine/test/recovery and a unique identifier of the certificate. This data can be checked only to confirm and verify the authenticity and validity of certificates.    The Digital Green Certificate will be valid in all EU Member States and open for Iceland, Liechtenstein, Norway as well as Switzerland. The Digital Green Certificate should be issued to EU citizens and their family members, regardless of their nationality. It should also be issued to non-EU nationals who reside in the EU and to visitors who have the right to travel to other Member States.        The Digital Green Certificate system is a temporary measure. It will be suspended once the World Health Organization (WHO) declares the end of the COVID-19 international health emergency.        Next Steps        To be ready before the summer, this proposal needs a swift adoption by the European Parliament and the Council.        In parallel, Member States must implement the trust framework and technical standards, agreed in the eHealth network, to ensure timely implementation of the Digital Green Certificate, their interoperability and full compliance with personal data protection. The aim is to have the technical work and the proposal completed in the coming months.        Background        To comply with the measures to limit the spread of the coronavirus, travellers in the EU have been asked to provide various documents, such as medical certificates, test results, or declarations. The absence of standardised formats has resulted in travellers experiencing problems when moving within the EU. There have also been reports of fraudulent or forged documents.        In their statement adopted following the informal video conferences on 25 and 26 February 2021, the members of the European Council called for work to continue on a common approach to vaccination certificates. The Commission has been working with the Member States in the eHealth Network, a voluntary network connecting national authorities responsible for eHealth, on preparing the interoperability of vaccination certificates. Guidelines were adopted on 27 January and updated on 12 March, and the trust framework outline was agreed on 12 March 2021.        Today the Commission adopted a legislative proposal establishing a common framework for a Digital Green Certificate. The Commission also adopted a complementary proposal to ensure that the Digital Green Certificate is also issued to non-EU nationals who reside in Member States or Schengen Associated States and to visitors who have the right to travel to other Member States. Separate proposals to cover citizens and non-EU citizens are necessary for legal reasons; there is no difference in treatment of citizens and eligible non-EU citizens for the purpose of the certificates.        The latest information on coronavirus measures as well as travel restrictions provided to us by Member States are available on the Re-open EU platform.",australia,t5_2qh8e,/r/australia/comments/ociw5u/a_mild_level_of_suffocation_australians_overseas/h44vxxb/
129,129,0,1625108585,"I can see it now , they'll use something like ""covid tracing, vaccination passport""",australia,t5_2qh8e,/r/australia/comments/obbu1w/calls_to_stop_nsw_police_trial_of_national_facial/h3n1f8s/
130,130,0,1624542895,"If the Fed gov is to introduce a COVID passport sometime in the future, I hope they have been recording all the vaccine jabs that people have been getting to date.  If we are eventually allowed to travel overseas again in the future, the other countries are going to demand it in order to obtain a Visa.    Common Sense would indicate some kind of database is needed, but common sense in not so common with Governments these days given the multitude of common sense types of HQ policy failures etc.  Also I would have though the notion of a database recording process would be fully transparent, though I have not heard about it yet.    Maybe the data can be extracted through Medibank item numbers?  The Gov Health record is not viable as a lot of people like me would have opted out of it when this was introduced some years ago.",australia,t5_2qh8e,/r/australia/comments/o56x0h/coronavirus_megathread_54_counts_leaks/h2vvkeu/
131,131,1,1624578427,"I really don't understand the outrage over the potential ""vaccine passports"". I've worked in many shit holes around the world that require a yellow fever vaccine to enter and it's just recorded in a booklet that I keep with my passport.  Why is the covid vaccine any different?",australia,t5_2qh8e,/r/australia/comments/o56x0h/coronavirus_megathread_54_counts_leaks/h2xrh68/
132,132,2,1624587564,"No. The idea that you are ""innocent until proven guilty"" is not only harmful, it's not even how our judicial system works.  To start with, it assumes that ""innocent"" or ""guilty"" are the only two options. At the least, courts don't find you innocent, they find ""not guilty"" - explicitly not absolving you of all crimes. But even before the verdict, we treat people differently.  Let's suppose two people, Alice and Bob, go out for a night on the town. While quite drunk, Alice allegedly assaults a police officer, who charges her with a crime which will now need to go to court to determine if she is guilty or not guilty. Whether the police officer's statement is fact or a fabrication based on a misunderstanding or even personal vendetta is not yet known. Bob makes it through the evening without assaulting anyone - as he is definitely innocent, we'll use him as our control to see if Alice is treated the same as an innocent person.  The police officer does not arrest Bob, but does arrest Alice and takes her to the station, despite her protests that since she hasn't been proven guilty she must be treated as innocent and allowed to go free.  Having made bail, Alice is released into the community. She packs her bags, grabs her passport, and heads to the airport to buy tickets to Morocco. Coincidentally, Bob is also at the airport, preparing to board the same flight.  Bob boards the plane with no issues (we'll assume COVID isn't a problem in this scenario) and arrives in Morocco for his holiday. Alice, however, is stopped by customs, arrested again, and subsequently remanded in custody until her trial, despite her protests that as she is ""innocent until proven guilty"" she should be allowed to have her freedom and go on a holiday.  It's clear that we aren't treating Alice the same as Bob. She's been charged with a serious crime, and the way society treats her is different from how it treats an innocent person.  It is *also* different from how it would have treated a guilty person - she was not thrown straight into imprisonment nor was she immediately fined. This is the heart of what the expression ""innocent until proven guilty"" is getting at: that you should not be subjected to the punishment for a guilty conviction before you have actually been found guilty. It does *not* suggest that you be treated as innocent.  If someone is accused of a crime, they are not legally ""innocent"" - they merely have not yet been found guilty. While legal *punishments* are not yet applicable, legal *procedures* may apply that are different from those not accused of a crime.  Investigations by the police or other authorities are *not* a legal punishment. Scrutiny by the media is *not* a legal punishment. Mockery on social platforms is *not* a legal punishment. These are all legitimate things to do legally, and the concept of ""innocent until proven guilty"" does not apply here.  Saying someone committed a crime is also *not* a legal punishment - though it may constitute a legal offence in the form of defamation if it can be proven to be false. Further, if a jury is found to have been unjustly swayed by fervent public opinion, the court may rule a mistrial. For *those* reasons, we should be careful about not getting carried away in our public forums. But the suggestion that the accused should be free to go about their life as though innocent is both unrealistic and illogical.",australia,t5_2qh8e,/r/australia/comments/o6xxal/christian_porter_rape_allegation_documents/h2y8biy/
