,Unnamed: 0,created_utc,body,subreddit,subreddit_id,permalink
68,0,1630471663,"I'll copy paste what I replied to someone above:  There's a difference between disclosing your vaccination status for international border travel. That's not what I'm talking about. Different countries have their own laws, which is fine. These declarations are usually physical forms you present to the country you intend to travel to. My examples are in reference to national measures.  Example: [""You will be given an international yellow fever vaccination certificate. You may need to show this to enter other countries after you have been in a yellow fever-infected area.""](https://www.healthdirect.gov.au/yellow-fever)  Parents disclosing immunisation status for their kids isn't new, which is okay because it was part of the National Immunisation Program. I don't have a problem with that. They have measures in place that determine this effectively. There's a [process](https://www.health.gov.au/sites/default/files/nip-vaccine-listing.pdf) to have certain vaccines added to that list.  The issue is ensuring that health information and records are managed effectively. Which can't actually be done unless it's implemented correctly, of which there is no plan. The only information they're working with is ""There'll be a vaccination passport"".  It's different for COVID because there's no Governing body, committee, or organisation ensuring any of this is above-board and maintains health privacy functions. This is important.",australia,t5_2qh8e,/r/australia/comments/p8fvab/coronavirus_megathread_b1526_counts_lockdowns/hb5g2ck/
69,1,1630479777,I had a similar circumstance where I didn’t have original docs (I was overseas) and I said during covid it’s not possible to get it... not sure you tried it but worked for me. It wasn’t a passport application but it was some filing that I needed my citizenship docs for.,australia,t5_2qh8e,/r/australia/comments/pfnp94/passport/hb5rcgj/
70,0,1630215542,"It's quite simple really. There is no need to make it up as they go, they're not the first to do it and can copy /learn from successful deployment overseas.   In France we have a vaccine passport (or the equivalent certificate if you're not vaccinated but have had a negative test in the last 48/72 hours).   The establishment quickly scans you in when you arrive or while giving you the menus, or scanning your entry ticket if it's an event, etc. If there's an issue, the person can be ignored and police can be called.   Police occasionally do spot checks at restaurants and events to keep everyone on their toes. There is a very large fine on the establishment and also a smaller fine on the individual if someone is caught in one of these places without a vax pass.   Living with covid is not about being perfect 100% of the time, some people will cheat the rules, some will hang their nose out of their masks on public transport, etc. but as long as the majority do their best, its easy to live with covid.  Also, look at the latest covid news from Denmark for the end game after 70% vaccinated.",australia,t5_2qh8e,/r/australia/comments/pdlrm6/nsw_records_1218_new_covid_cases/hart7ez/
71,1,1630216528,I am vaxed up. This does not stop me from getting Covid or giving it to you. So what is the point of a vax passport or whatever they decide to call it?,australia,t5_2qh8e,/r/australia/comments/pdnk4t/federal_opposition_signals_support_for_proof_of/harujt3/
72,2,1630227396,"People shouldn't be in favour of the government getting so much power.   What happens if they decide that the flu shot should be added to this passport, so then you'll need the booster covid and flu vaccines every year to enjoy these new found freeedoms? Or if they decide that people's criminal records are now linked and those deemed too dangerous aren't allowed in pubs/cafes anymore?  It's fucking dodgy and a slippery slope",australia,t5_2qh8e,/r/australia/comments/pdnk4t/federal_opposition_signals_support_for_proof_of/has7tuc/
73,3,1630240729,"Lol, but remember, millions of terrorists are gonna attack us every waiting minute so we need to spy on you.....forever. will be interesting to see what the tack on next to the covid passport, unpaid fines banned from entering etc",australia,t5_2qh8e,/r/australia/comments/pdnk4t/federal_opposition_signals_support_for_proof_of/hasok2l/
74,4,1630246441,"They need to make it tied to the Covid check in. If you scan a QR it should share your digital licence &amp; Covid passport, green tick means all good and seccie can let u in, anything else and it’s turn them away as if the person was drunk. That’s the only way for it to be enforced by venues without using police resources.",australia,t5_2qh8e,/r/australia/comments/pdnk4t/federal_opposition_signals_support_for_proof_of/haszmdv/
75,0,1630200144,"I got this from a relative that is a pastor at one of the fundamentalist churches in Sydney. It is legit. I have a real concern that mystical beliefs may influence our politicians at a time where we really need level heads. Scroll to the end and look at how long the list of supporting churches is. I really do not want to go the way of the Southern US states where beliefs have infiltrated politics and has lead to a really dire health situation.  Yet, here we are. The churches are putting out a subtle biblical antivax, anti-lockdown message to try and influence politics.  https://caldronpool.com/ezekieldeclaration/?fbclid=IwAR103zqXjPjpj2Qz26nW81Tq2jlj65845nz6X9M5XP4tjXGFYSG6BSm6qvg  Just to be perfectly clear, I am not anti-religion, but religion and politics should be kept separate. We need politics to be backed by science and done in the best interests of the people. Australia, and NSW in particular, wouldn't be in this situation if our leaders cared more about science. This applies to climate change too.  A vaccine passport would mean that while I may carry the virus, and I may infect others, I will not be a statistic that has an unbearable weight on our health system. Average cost of hospital care for COVID-19 in the US ranges from $51,000 to $78,000 USD, based on age.  https://www.healthcarefinancenews.com/news/average-cost-hospital-care-covid-19-ranges-51000-78000-based-age#:~:text=More%20on%20Operations-,Average%20cost%20of%20hospital%20care%20for%20COVID%2D19%20ranges%20from,to%20%2478%2C000%2C%20based%20on%20age  We don't have that problem in Aus, because we have a social safety net. If we let the unvaxinated overwhelm our hospitals our public health system could break. Once it is gone, I doubt we will get it back easily.  Florida is a great example of what is going on in the Southern States. Florida's Governor Ron DeSantis has been a critic of Covid restrictions, to the point where he has said the state can withhold salaries from school leaders who enact mask mandates. It is so bad in Florida that they have ordered portable morgues. https://www.wftv.com/news/local/orange-county/more-than-dozen-portable-morgues-coming-central-florida-after-hospital-units-reach-capacity/XRXZLVJQPRGR5FRHVEQC4J2SJU/  If churches want to influence public policy then we should have the right to fight back. Honestly, it is not that I care that the religious are shooting themselves in the foot, what I care about is the collateral damage it will do to us all.",australia,t5_2qh8e,/r/australia/comments/p8fvab/coronavirus_megathread_b1526_counts_lockdowns/har2sb7/
76,1,1630204378,"Hahahhaha.  You think people actually use that Covid check in?  My dad went to the hospital every day for 8 weeks for his cancer treatments. This is a hospital, not a shop. He never once checked in, he doesn't know how to, and **no one ever checked**.  I am not complaining, I hope compliance with any form of vaccine passport would be very low.",australia,t5_2qh8e,/r/australia/comments/pdlrm6/nsw_records_1218_new_covid_cases/haravfm/
77,0,1629974227,"The rest of the world is even less normal than the supposed horrible closed parts of Australia are.  [“We Are Beyond Capacity,” Says Texas Midland Hospital Executive](https://marfapublicradio.org/blog/we-are-beyond-capacity-says-midland-hospital-executive/) 17th August, 2021  [Alabama has no more I.C.U. beds available, the state authorities said.](https://www.nytimes.com/2021/08/19/us/alabama-icu-shortage.html) 19th August, 2021  [Kansas City hospitals turn away record numbers of patient transfers as COVID surges](https://www.kansascity.com/news/coronavirus/article253627748.html) 20th August, 2021  [Anchorage doctors sound alarm about ‘imminent’ hospital system collapse](https://www.alaskapublic.org/2021/08/20/anchorage-doctors-sound-alarm-about-imminent-hospital-system-collapse/) 20th August, 2021  [Florida logs more COVID deaths last week than ever before](https://www.palmbeachpost.com/story/news/2021/08/20/covid-florida-shattering-new-records-deaths/8214404002/) 20th August, 2021  [Orlando mayor asks residents to start conserving water immediately due to liquid oxygen shortage](https://www.wesh.com/article/orlando-mayor-to-hold-newser-on-unprecedented-event-requiring-community-assistance/37359831#) 20th August, 2021  [Full hospitals are impacting EMS operations in Mississippi](https://www.wlox.com//app/2021/08/21/full-hospitals-are-impacting-ems-operations-mississippi/) 21st August, 2021  [Florida reports 1,486 COVID deaths, more than 150,000 cases this week, topping 3 million total cases](https://www.orlandosentinel.com/coronavirus/os-ne-print-florida-coronavirus-friday-aug-20-20210820-7zv67ko4vbcrzedjnpchgjxo3i-story.html) - Florida has a smaller population than Australia. 61% have 1 vaccination dose &amp; 50% have 2 doses, and according to USAstats that is as a percent of the entire population, not only as a percent of over 16 year olds which Australia is reporting. Australia is at ~20% of the entire population having 2 doses.  [Oregon COVID-19 patient unable to get ICU bed dies](https://abcnews.go.com/US/oregon-covid-19-patient-unable-icu-bed-dies/story?id=79565124)  [North Texas runs out of pediatric ICU beds amid Covid surge](https://www.nbcnews.com/news/us-news/north-texas-runs-out-pediatric-icu-beds-amid-covid-surge-n1276783) 14th August, 2021  [No pediatric ICU beds left in Dallas amid COVID surge, county judge says]( https://www.cbsnews.com/news/dallas-hospitals-pediatric-icu-beds-covid/) 13th August, 2021  &gt; ""In Dallas, we have zero ICU beds left for children,"" Jenkins said Friday at a virtual news conference. ""That means if your child's in a car wreck, if your child has a congenital heart defect or something and needs an ICU bed, or more likely if they have COVID and need an ICU bed, we don't have one. Your child will wait for another child to die.""  From July [Nearly 120,000 children in US have lost a primary caregiver to COVID-19](https://abcnews.go.com/Health/120000-children-us-lost-primary-caregiver-covid-19/story?id=78931426)  [US is No. 4 in the world with most orphaned children by COVID deaths](https://www.miamiherald.com/news/coronavirus/article252921513.html), which links a Lancet study measuring about a million orphaned children in the world from covid.  [More than 11,000 Indonesian children are estimated to have lost one or both parents to Covid-19](https://www.abc.net.au/news/2021-08-21/orphaned-children-indonesia-coronavirus-pandemic-covid/100385666)  [Tens of thousands of children cope with ""pandemic grief"" after losing parent or caregiver](https://www.cbsnews.com/news/covid-19-pandemic-orphaned-children-grief/)  &gt; Today, the younger Quarles girls are in therapy. Asia turned 11 without her dad. ""When you look at my kids you can tell something is missing,"" Vickie said. Researchers see an increase in depression and PTSD in children who lose a parent. It can leave them traumatized, confused and angry.  Only 57% of Australians even have a passport, and 30% are immigrants so probably have a passport by default, and many who do travel overseas only do it once in their life, and the vast majority of travel is to New Zealand or other nearby countries and are probably immigrants visiting family. The vast vast majority of Australians are not flying out of the country so often that this has had any impact at all, half don't even have a passport.",australia,t5_2qh8e,/r/australia/comments/pbouit/nsw_records_1029_new_locally_acquired_cases_of/haepe2a/
78,0,1629936538,"Thanks for saying this. I've been repeating this sentiment until I've gone blue in the face, and the response has always been, at best, a shrug.   The Australian passport is not worth the paper it's printed on. If Australia won't repatriate its citizens in the middle of COVID, it won't repatriate its citizens in even worse crises either (think: global war, deadlier virus, etc).   Anyone who plans to ever travel outside of Australia should make sure they have citizenship or permanent residency in another country, because otherwise they are FUCKED if shit hits the fan.",australia,t5_2qh8e,/r/australia/comments/pb9ywo/australian_pm_scott_morrison_hits_out_nzs_covid19/had0q26/
79,0,1629774590,"I think a lot of people are overestimating how much support the liberals are gonna get in the next federal election. Im seeing countless people talk about how their not voting for the libs at all because of things revolving around covid such as the lockdowns, restrictions or mandates.  I support the vaccines and plan on getting novavax if my doctor approves of it (i have an auto immune disease) but i am heavily against mandates such as the vaccine passport. I get having it for international travel and even massive crowd events like the footy but its just fucked that you would need it for just going to the shops or a cafe. I voted for Morrison in 2019. Let me tell you im not going to vote for him again. The moment he began to support the idea of a vaccine passport for a domestic use he lost my support. And no, im not voting for labour either, they support the vax passport as well.",australia,t5_2qh8e,/r/australia/comments/paakc2/why_do_these_people_keep_winning_elections/ha495p1/
80,0,1629699218,"If the immunity from getting COVID is low and some people are just ideologically just not going go Vax no matter what, and with no way to even ethically force them to Vax or imprison until COVID stops, it would seem like COVID is going to be lingering around forever going backwards and forwards primarily among the unvaccinated.  As long as it lingers, the more the chance of a mutation.  If we open up and let it rip, the concern is that we are basically rolling the dice that a mutation of an even worse strain could form?  But if we don't let it rip, but it lingers over time, mutations could still occur?  And what is the point of the Vax Passport exactly, is it a punitive measure to 'encourage' Vax to be able to participate in events? To protect the innocent (Fully Vaxxed) of the chance of getting a mild case of COVID while enjoying their back to normal life?  I feel like there is a missing piece of the puzzle here, I can't put my finger on it.",australia,t5_2qh8e,/r/australia/comments/p91bly/vaccine_passports_to_combine_jab_records_with_qr/ha03yxg/
81,1,1629704207,Except getting vaccinated doesn't stop you from spreading covid. You still get sick and spread it. Can you comprehend any of the information from the CDC at all?  You also prove my point. As you see they don't protect you. Going to stick a smoker in a camp? Warning of the risks of drinking lol Putting people in camps for ruining their liver? Taking their cars away to make sure they don't drink and drive? Going to have a passport to make sure you have a shirt on in the sun?  Totalitarian nutjobs up in here.,australia,t5_2qh8e,/r/australia/comments/p96zka/former_730_host_kerry_obrien_alarmed_by/ha0a0kp/
82,2,1629704314,"Sure pre covid you could be traced indirectly with your gps,  with vaccine passports you are legally being tracked and god forbid anything happened it could be used against you in a court of law unlike now.   Whats next? They still wont be happy if anyone can cheese the system with loopholes in the tracking , might aswel get microchipped like a dog, I mean your already got a vaccine passport so whats the diffrence right?  When you keep giving them a piece of cake eventually they will try to take the whole thing. The only argument for wholeheartedly trusting the authorities at this point is ignorance.  I rather die a man than live like a coward.",australia,t5_2qh8e,/r/australia/comments/p91bly/vaccine_passports_to_combine_jab_records_with_qr/ha0a4we/
83,0,1629616695,"yeah i made my account (again) after a year of covid propaganda. the elderly and at risk should take the vaccines if they wish. this new vaccine mandate stuff (which was a ""conspiracy theory 14ish months ago) are insane. so that's my story. its not ""brigading"" unless its a ""brigade of one"" (me, a real human being, not being payed to bot or brigade). how is ""anti-vax passport,"" content ""dangerous?"" are vax passports ""safe?""   i've taken all prior vaccines, a flu shot once. i'm not ""anti-vaxx"" in the the 2019 sense. what a great trick that's being done, bundling up arguments against lockdowns and mandates and ""passports"" as ""dangerous anti-vax rhetoric."" fantastic PR move.",australia,t5_2qh8e,/r/australia/comments/p91bly/vaccine_passports_to_combine_jab_records_with_qr/h9vv69l/
84,1,1629621372,"How am I ""all over the shop""? I know what risk management is, I was being an arse because of your condescension to the first poster.  In a country like ours, that has focussed on using lock downs to stop it spreading, the vaccine passport idea is far worse in terms of risk management. Someone with a passport can have the virus and spread it, albeit at about half the rate of someone that is not vaccinated, so what is the point? It isn't health related. Because as you said, ""reducing the chance of spreading is risk management"", in Australia opening up, even vaccinated WILL greatly increase the chance of it spread, the only difference is less people die. The virus will spread through the population like every other country.  If people are OK with this, fine. But from what I've seen in these covid discussions is that people don't know this, and it certainly isn't being explained to them as such. The vaccines aren't a miracle fix, they are in best case, a temporary stop to people dying from it. That is it.",australia,t5_2qh8e,/r/australia/comments/p91bly/vaccine_passports_to_combine_jab_records_with_qr/h9w0qg6/
85,2,1629622195,"The probability, haha, is much higher that you are bailing on the conversation now that your bullshit has been exposed, rather than me ""not seeing it"".  First line of the fucking article.  &gt; Millions of vaccinated Australians will be able to use their mobile phones to gain exemptions to lockdown rules at cafes, restaurants and public events under a national cabinet plan to use digital records to verify vaccine status.  Your fixation on me pointing out that the vaccine making people only half effective at transmission (A point I only made to be honest about the effective immunity of the current vaccines, while explaining that none of them have a sterilising immunity) is irrelevant. The passport will allow someone with the virus to spread it, that isn't risk management reduction in any way. It is as Frydenberg alluded.  &gt; Mr Frydenberg said it was a “fallacy” to expect to eliminate COVID-19 and said the states and territories had to offer people a path toward easing restrictions.  &gt; “We have to give people the clear sense that there is light at the end of the tunnel,” he said.  Risk management isn't driving any of this, it is economic pressure.",australia,t5_2qh8e,/r/australia/comments/p91bly/vaccine_passports_to_combine_jab_records_with_qr/h9w1o1z/
86,3,1629623798,"Get over it the whole of Europe has covid passport rules in place, it has to happen so get vaxxed and stop complaining about some data freedoms when people are literally running from their homes in Afghanistan",australia,t5_2qh8e,/r/australia/comments/p91bly/vaccine_passports_to_combine_jab_records_with_qr/h9w3ga6/
87,4,1629625610,"It is a surveillance program.  If I have covid, with the passport I am allowed to  infect anyone freely is that how it works?",australia,t5_2qh8e,/r/australia/comments/p91bly/vaccine_passports_to_combine_jab_records_with_qr/h9w5gp7/
88,5,1629625993,"We’ll get used to being asked for a covid passport it’s not a big deal is what I’m saying, there’s bigger issues to complain about and if you don’t like it then don’t go out",australia,t5_2qh8e,/r/australia/comments/p91bly/vaccine_passports_to_combine_jab_records_with_qr/h9w5w39/
89,6,1629636636,"But by doing HIV tests what does it achieve? If a person tested positive then what, he’s not allowed to go inside the club?  Vaccine passport is different. People can get covid just by entering premises.",australia,t5_2qh8e,/r/australia/comments/p91bly/vaccine_passports_to_combine_jab_records_with_qr/h9wjup2/
90,7,1629644952,"This is completely different to what you said in the first post. You were literally talking about stopping it spreading and eradication.  And what you have said since, while more accurate, has zero relevance to the point of a vaccine passport. There is literally no need for it, if the vaccine roll outs are achieved. But if they aren't then the concept, as presented in the article, of allowing people with these passports to have exemptions around covid suppression measures, it actually makes things worse.  So it is either pointless or dangerous. The passport idea is purely from economic pressure, it has nothing to do with health.",australia,t5_2qh8e,/r/australia/comments/p91bly/vaccine_passports_to_combine_jab_records_with_qr/h9x0hzc/
91,8,1629671899,"My point right there. A fake passport is only useful if you’re wanting to avoid being vaxxed, and if you’re not vaxxed when Covid catches up with you you run a vastly greater risk of serious illness/death.",australia,t5_2qh8e,/r/australia/comments/p9lkki/richard_managed_to_forge_a_covid_vaccine/h9ypvgk/
92,0,1629531399,"The whole crap thing about this current situation is, I can’t travel interstate, but it’s perfectly ok for my to leave australia under my dual citizenship, then return to australia(potentially interstate) on my Australian passport and quarantine for 14 days.   Why cant I just travel interstate and quarantine for 14 days?  Why cant other states set a plan and advertise it, to what it will take to reopen borders to nsw.   Covid zero is unobtainable. This whole blame game is beyond a joke. NSW are victims in this.",australia,t5_2qh8e,/r/australia/comments/p8liyz/calls_for_gladys_berejiklian_to_resign_over/h9rkbnx/
93,1,1629542622,"On Reddit, that's why I went here immediately lol. So you need a covid passport which means an injection to come back? Damn",australia,t5_2qh8e,/r/australia/comments/p8p9xa/is_it_true_that_you_cant_leave_australia_without/h9rx1ue/
94,2,1629548989,"Joyce at Qantas (because fed politicians didnt have the guts) has declared november 15th Freedom day.   Because like fuck i will stand for vaccine passport or some other loosened restrictions for those whom can still catch and spread this disease and become the pool of covid that seeds ""the pandemic of the unvaccinated"".   Just luckily it will line up with a time when SUPPLY will have given all a chance to vax.   NOVEMBER 15TH FREEDOM DAY.   If you cancer patients haven't prepared, if you anti vaxxers haven't prepared, if you haven't encouraged your 70 year old dad to vax.   Bad fucking luck.",australia,t5_2qh8e,/r/australia/comments/p8dfl6/vaccination_rate_of_70_wont_end_lockdowns_if/h9s5u4k/
95,3,1629592777,"The business has a duty to protect its workers and customers under WHS acts. Having a covid infected person coming in and spreading a deadly disease to these people, plus the economic cost of shutting the premises down for deep cleaning, is a huge incursion. A vaccine passport is a trivial nuisance on you compared to what they risk.",australia,t5_2qh8e,/r/australia/comments/p91bly/vaccine_passports_to_combine_jab_records_with_qr/h9uppyx/
96,4,1629596622,"Firstly, I think their shitty target is not only inadequate, it's not gonna stop people from contracting Covid and whatever mutations this virus makes in the meanwhile... The NSW Government is playing catch-up! We will never know the REAL statistics/ numbers because they may manipulate them to suit their requirements.  When they open up, who will they be opening up to? The country will be divided, with interstate travel almost certainly requiring a vaccine passport/ booster shots, Covid testing regularly on entry and further quarantine and QR check-ins becoming the norm. By the way, how many of the daily Covid 19 positive numbers have already had a vaccine inoculation... I'm just curious, don't think I've seen these numbers anywhere...",australia,t5_2qh8e,/r/australia/comments/p934gn/830_new_covid19_cases_and_three_deaths_recorded/h9uxk7v/
97,5,1629597136,"What happens if you are vaxxed , have the passport and still get Covid . Makes the passport quite literally useless",australia,t5_2qh8e,/r/australia/comments/p91bly/vaccine_passports_to_combine_jab_records_with_qr/h9uym9j/
