,Unnamed: 0,created_utc,body,subreddit,subreddit_id,permalink
50,0,1631753778,"Lol. Since when did Yanks have ""a legitimate concern"" about Australia?  The bulk of them can't point to Australia on a map, [even a US newsroom can not get it right;](https://youtu.be/LnS2k3Rrw5k)   the few who can afford a passport, the republicunt voters, think of Australia as a theme park created for their amusement and as tourists are disappointed we're not like the *Yewnydid Staytz*;   there's a small but loud minority who are conspiracy theorists who *right now* are convinced [the entire nation is under house arrest ](https://www.abc.net.au/triplej/programs/hack/tiktok-exposing-young-people-to-covid-conspiracies/13492988);   the remainder (with overlap) are psalm-singing, gun-toting, book dodging, salad averse, map shy, waistless, yeehaws -- and that's just the Zoomers --  [who take to Zoomer social media platforns starting fights](https://www.dailymail.co.uk/femail/article-9959273/TikTok-video-Woolworths-trolley-disinfection-car-washes-slammed-American-viewers.html) because they are outraged to learn we use ""trolley"" instead of ""shopping cart"" and we have, implausibly, a supermarket chain called Woolworths.  There's a good handful of them who'd much rather live here *because* of our lack of ammosexuals,  our  industrial relations system and universal healthcare.",australia,t5_2qh8e,/r/australia/comments/pol4wv/the_uk_failed_with_age_verification_for_porn_now/hd0tfrm/
51,1,1631768232,"[Read Full Article Here](https://archive.md/WfvKX)  Business owners could face fines of up to $55,000 for breaching proposed public health orders which will restrict them to only serving fully vaccinated customers — as a growing number slam plans for NSW Government regulations expected to be rolled out next month.    An expansive community of business owners across the state say unvaccinated people will be welcomed despite State Government regulations which will restrict access to venues to double-vaccinated patrons.    Last month, NSW Deputy Premier John Barilaro revealed businesses will need to prove all staff and customers are vaccinated in order to open to the double-jabbed public when the state reaches 70 per cent in October.        Deputy Premier John Barilaro during the COVID-19 update in Sydney. Picture: NCA NewsWire / Dylan Coker    The Deputy Premier warned businesses and unvaccinated customers would face “significant fines” if they are caught at a venue without being vaccinated.    A Controversial jab or no jab Facebook page dedicated to the NSW Hunter Region has seen thousands of people promoting “pro-choice businesses” once the lockdowns are lifted.    ‘Newcastle, Hunter and Port Stephens businesses welcome jab or no jab’ is encouraging businesses across the region to continue to serve their customers regardless if they are vaccinated or not.    This article contains content that is only available in the web version    Open the web version    With more than four and a half thousand members, businesses are promoting their services online to support the cause.    “Jab or no Jab, you are all welcome to be pampered in our relaxed environment. I look forward to seeing everyone real soon,” the owner of **Studio 77 hair and beauty in Rutherford** commented on the page.        Businesses will be forced to check customers are vaccinated during the QR code check in. Picture: NCA NewsWire / Nikki Short    **Full Throttle at Beresfield** also chimed in, “Good BBQ never discriminates. Everyone is welcome.”    Two pubs in the Hunter Valley have also shared their intentions of “accepting everyone”.    The iconic **Ellalong Hotel** vowed to accept all walks of life into their pub.    “We don’t care if you are vaccinated or not vaccinated, if you are fat, thin, tall or vertically challenged, gay, straight, white, black, hot or down right ugly or even a dragons supporter. We welcome all,” it said on its Facebook page.    “United we stand – divided we fall. Save Australia. Some things are worth fighting for,” continued the post.        The Ellalong pub in the Hunter Valley has promoted that it will welcomed people who are unvaccinated. Credit: Facebook    It garnered more than 150 comments, with a majority congratulating the pub for their stance.    “First place I’m going for a feed,” one person said.    “What a fantastic, inclusive business,” another person commented.    While some were cautious of the statement.    “Pretty much guarantee the police will be there upon opening checking vaccine certificates, if you’re not vaccinated no entry,” they said.    Meanwhile, **The Caledonian Hotel in Singleton**, which put a giant banner out the front promoting ‘Free Australia’, has also joined the ranks of businesses wanting to invite everyone, including those without the jab.        Caledonian Hotel at Singleton will welcome those with a jab or not. Credit: Facebook    “The Caledonian Hotel under the Australian constitution 1901 will abide by all law and will never discriminate against anyone,” it said on its Facebook page after refusing to speak to “mainstream media”.    “Everyone is welcome at the Cali! Kind regards management Calendonian Hotel,” it read.    Newcastle MP Tim Crakanthorp said it was disappointing that there are people out there who would choose to put others at risk, but cited confusing information.    “Businesses making these decisions for themselves shows that there is a large information void coming from the NSW Government about how they can operate on reopening,” he said.    “There should be no room for interpretation in this Public Health Order, and businesses need to be given plenty of notice as to what their rights and responsibilities will be.        Newcastle MP Tim Crakanthorp said it is disappointing people are putting others at risk.        Charlestown MP Jodie Harrison believes the message to businesses is confusing.    Meanwhile, Member for Charlestown Jodie Harrison agreed the message to businesses are confusing.    “I’ve spoken with small businesses who are concerned about their liabilities if they enforce, or don’t enforce, vaccination,” she said.    “They are after very clear information and certainty from this government.”    The Deputy Premier said he was “not interested” in Facebook pages criticising the public health orders.    “You don’t have to open at 70 per cent, no one if forcing you,” he said. “But if you choose to reopen, it will be under the parameters of the public health order.    “Under Work Health and Safety legislation, employers have the responsibility to keep their staff safe — and in this case, safe from Covid.”        NSW Deputy Premier John Barilaro speaks to the media during a COVID-19 press conference. (Photo by Bianca De Marchi – Pool/Getty Images)    Mr Barilaro said there would be “fines for people who do the wrong thing” however, a set amount for the infringement had not been determined by the NSW Government.    “First point of clarification is what do fines look like in relation to regulating it, and what are the mechanisms we put into businesses.    “I don’t want to put any more onus on business owners — if I don’t feel comfortable that businesses have the ability to turn away customers and enforce the rules, then I don’t want to punish businesses for that.    “Most businesses owners will not have an excuse to say that they didn’t check the QR code because there is already an obligation to do so.”    The Deputy Premier also revealed businesses in regional settings could be used to trial the vaccination passport as part of the QR code check in system.    The breaching of public health orders currently imposed by the NSW Government results in a maximum penalty of $11,000, or imprisonment for six months.    While on-the-spot fines of up to $3000 can be issued to people breaching the orders.    However, NSW Government regulations say the penalty for businesses increases to $55,000 for a breach of public health orders, and a further $27,500 penalty may apply for each day the offence continues.        Premier Gladys Berejiklian during an update on COVID-19 in Sydney. Picture: NCA NewsWire / Dylan Coker    NSW Premier Gladys Berejiklian said “it will be the law” that unvaccinated people cannot attend reopening businesses under the NSW road map.    “You can’t go into a hospitality venue, you can’t go to ticketed events unless you are vaccinated,” she said.    Attempts were made to contact the administrators of the Facebook group.",australia,t5_2qh8e,/r/australia/comments/pp6qap/businesses_face_55k_fines_for_serving/hd1l7bo/
52,0,1631610990,When over 80% of the uk adult population is vaccinated and 94% have covid antibodies a vaccine passport is no longer relevant.,australia,t5_2qh8e,/r/australia/comments/pnrpew/uk_ditches_vaccine_passports_in_england_what_this/hcst3md/
53,1,1631616299,"Take your first disingenuous question. You've decided you need proof that someone isn't HIV positive before sleeping with them.  There can be lots of folks with Aids out there who are fully infectious but because you are exercising /u/debanked's ""no HIV passport, no down and dirty rule"" you are pretty much ensured you are not getting HIV.  Take a step out, now despanked has Covid and society is all like ""no covid passport no going to the tightly packed bar for Friday night drinks"" so while you can be as infectious as you'd like at home you aren't spreading it to us in easily transmissible situations, just like your first tangential rebuttal.  Now I fully expect you not to read this and instead post some inane ""follow up"" question. So I'll suggest one and save your handlers the effort. ""Well then, how did Trump survive your librle China plague?!?""  The answer to that being, either your a bot or your retarded either way have a good night.",australia,t5_2qh8e,/r/australia/comments/pnrpew/uk_ditches_vaccine_passports_in_england_what_this/hcsz8jv/
54,0,1631266913,"While you're technically correct, the COVID vaccine doesn't work towards herd immunity the way a vaccine for things like chicken pox and measles do.  Yes, it's not a magical force field that repels the disease, but your body can fight it so effectively that it's like you never even had it in the first place. The COVID vaccine isn't effective like that. There is ZERO immunity period. So in this instance, forcing vaccines and having passport programs is pointless because we will NEVER reach a herd immunity threshold.",australia,t5_2qh8e,/r/australia/comments/plguzh/mandatory_vaccinations_what_are_your_thoughts/hcajuhn/
55,0,1631232560,"This is actually a great idea. It would be plenty easy to add it to digital licences, which plenty of people in NSW have at least, no idea about other states? I'm hoping the licence app will be harder to fake than the covid passport?",australia,t5_2qh8e,/r/australia/comments/pl85k4/how_can_we_open_up_safely_when_you_can_buy_a/hc8ygqo/
56,1,1631234292,who cares if the buyer of fake vaccine passport gets covid?,australia,t5_2qh8e,/r/australia/comments/pl85k4/how_can_we_open_up_safely_when_you_can_buy_a/hc929yg/
57,2,1631234483,So hear me out here...  Does it matter? Surely there cant be that many people that do this? it wouldnt really make any real difference in the vaccination rate... Like how many of those nut jobs would spend 200$ on that... or have the 200 to spare  And if you can still catch the virus after having the vaccine... then the passport is no proof of not having covid?  Just wondering if this is all blown out of proportion a bit..   (im not saying dont get the jab.. my second one is tomorrow),australia,t5_2qh8e,/r/australia/comments/pl85k4/how_can_we_open_up_safely_when_you_can_buy_a/hc92p2m/
58,3,1631237274,"Someone should just create an ""apply for fake covid passport"", collect the personal details, and it auto submits to a police tip line or something.",australia,t5_2qh8e,/r/australia/comments/pl85k4/how_can_we_open_up_safely_when_you_can_buy_a/hc98yiy/
59,4,1631262618,"In the case of COVID it's a false narrative. We've already seen that the vaccine won't prevent you from getting COVID (or transmitting it), therefore there's no such thing as ""herd immunity"".   For normal vaccinations (which you can call an immunisation, because it makes you immune to the disease), having a certain percentage of the population immunised is a good thing because it will eradicate the disease.   This will not happen for COVID.   So, getting vaccinated is a good idea for your own protection, but it won't help anyone else.   Yes, a ""percent of the population vaccinated"" will lessen the strain on hospitals, but if you're going to force that then why not target smoking, obesity or alcoholism as well?   If the vaccine worked as other vaccines do, then yes, mandatory vaccines and a passport would be handy in this pandemic.",australia,t5_2qh8e,/r/australia/comments/plguzh/mandatory_vaccinations_what_are_your_thoughts/hcaf0jy/
60,0,1631062192,"&gt; 'show your papers'   You spout that line as if you could travel overseas before without any ID.  &amp;#x200B;  It's no different to getting a visa or showing your passport, and these days you need to provide biometrics at destinations. A slip showing you have been vaccinated hardly seems like a hill to die on compared to what we have to do pre COVID.",australia,t5_2qh8e,/r/australia/comments/pjxe4v/australia_covid_vaccine_passports_to_be_issued_in/hc030hb/
61,1,1631120637,"So let’s have a look at the article.  First of all, the tone - it’s obviously a “OMG LOOK AT THIS” sort of op-ed nonsense where they had an opinion (“the decadence of the west belies their authoritarian nature”) and then wrote 500 words to back that.  &gt; The role of ‘Big Nurse,’ Kesey’s tyrannical antagonist, who has an arsenal of medication at her disposal, would go to Australian health chief Dr. Kerry Chant. This medical authoritarian recently informed the 8.1 million locked-down subjects of New South Wales that Covid will be with us “forever” and people will have to just “get used to” rolling up their sleeves for endless booster shots.   Dr Chant is the Chief Health Officer of NSW, not the Australian health chief.  The position that covid will be with us “forever” is not an uncommon one among health chiefs.  &gt; Chant’s grim assessment of Australia’s future faced no challenges from other professionals, which should come as no surprise, since the act of expressing medical second opinions – a ‘luxury’ that doctors have enjoyed since at least the Middle Ages – has been [outlawed](https://au.news.yahoo.com/facebook-post-lockdown-protest-11000-fine-080358345.html?guccounter=1).   Nothing has been outlawed, of course, the linked article says:  &gt; As Covid-19 case numbers continue to surge in NSW, the State Opposition wants tougher, targeted public health orders to crack down on anti-lockdown rally organisers and viral social media spruikers.  &gt; The State Opposition is calling for harsher penalties to crack down on anti-lockdown rally organisers. Source: AAP  &gt; These include $11,000 fines for people sharing information on social media about illegal rallies and inciting others to illegally attend.  &gt; Under the plan, protest organisers would be slapped with whopping $20,000 fines.  &gt; Unlawful attendees would face fines of $5,500, an increase from the current $100  The opposition called for fines for protesting…that’s not a law, it’s a press release, and it’s about being a cunt, not “getting a second opinion”.  Back to your article.  &gt; While few would find fault with Chant’s wry observation that “we want diseases to be totally eliminated,” it is the total absence of democratic procedure in this wild goose chase that is alarming. After all, it was Dr. Chant who advised citizens in the heat of summer not to “start up a conversation” with others in public spaces – a wonderful excuse to keep the populace squirming under the heel of bureaucracy.   What democratic procedure is lacking?  The democratically elected government of NSW is acting in accordance with the laws of NSW.  &gt; In the next chapter of this Keseyian tragedy, Australian leaders are passionately signaling – virtuously, of course – that the only way to escape from creeping medical apartheid is for everyone to submit to the jab.   Yes, first mention of apartheid.  +1000 clicks!  &gt; “There is going to be a vaccinated economy, and you get to participate in that if you are vaccinated,” Victoria Premier Dan ‘Big Brother’ Andrews informed a roomful of puzzled and muzzled reporters. “We’re going to move to a situation where, to protect the health system, we are going to lock out people who are not vaccinated and can be.”  Ah, so vaccines will be maybe required for some things?  So like the UK’s hilariously shitty [covid passport](https://www.bbc.co.uk/news/newsbeat-58475147) scheme for nightclubs and maybe much more?  Or like Canada’s one for [international travel](https://www.reuters.com/world/canada-planning-covid-19-vaccine-passport-international-travel-2021-08-11/)?  &gt; Aside from ‘ape-shit crazy,’ there is really only one way to interpret that incredibly disturbing remark: either you agree to submit to a vaccination, or the “vaccinated economy” will be closed to you. Now, whether that lockout will only apply to the bread and circuses that make up Victoria’s vibrant cultural scene – nightclubs, concerts and sporting events, for example – or to the more indispensable venues, such as grocery stores and medical clinics, the Dear Leader would not say.   Ah, so nothing has been announced, so let’s assume the worst, and make a North Korea reference to…the democratically elected Premier of Victoria.  Right.  Anyway, it’s all like this - just nonsense with lots of strong adjectives and really weirdo references.  RT is a propaganda arm of the Russian state, so this is exactly what they do - troll the world in a really heavy handed fashion.  It really feels like part of the problem is that’s summer in the northern hemisphere and people are bored, and they’re finally looking at world news again and see Australia, where it is winter, and delta recently got lose, doing things that almost every country was doing eighteen months ago, and Australia mostly avoided by closing the borders.",australia,t5_2qh8e,/r/australia/comments/pkdvc9/australia_is_now_a_mental_ward_where_the_crazies/hc2vlq5/
62,2,1631143305,"it will only be funcitonal IF and only if our govenmetn makes arrangements.  The brits were told 'she'll be right, jsut take this British covid passport for your trip tot eh eu"", but they would uyup detained and quarantined, cause it didn't mean jack to the EU, after the UK refused to sign on to the EU protocol.  I have great faith in our excellent DFAT people, but the politicians who set the direction... probably didn't even think about it... until it impacts them, then they can just drop the ole *Diplomatic Immunity.*        If the gov screw this up too, and there is little reason to think they won't, were stuck on this bloody island.  If that sounds harsh... having actual sitting senators pushing horse drugs in an actual recorded senate inquiry... is a deal breaker for me.  SHY in relation to it ""I am confused by the Australian Governments position on treatment with horse drugs"", but if that wasn't enough of a wtf moment, this is in an inquiry about media monopolies....    this is the crap I expect in the USA...not here",australia,t5_2qh8e,/r/australia/comments/pk6qog/qantas_alan_joyce_reaffirms_airline_will_ban/hc4afgy/
63,0,1631016404,"The ""International Production Orders bill"" is the worst yet. It will give the authorities access to foreign held telco and related data. We already have crowdsourced mass surveillance by Google and Apple, if you carry a semi modern smartphone you are carrying a wifi and bluetooth beacon that's detected by all phones around you and now the Amazon sidewalk network.    (Yes, that includes if your phone is in aircraft mode)  Combine that with facial recognition and metadata and the authorities have it all and the access is easy. Police accessed Covid app data that we were promised they didn't have access to it. Of course under the AA bill they can seize access, backdoor the system and nobody is allowed to tall about it.    Accessing your communications metadata just requires a signature from a senior police officer. Police have even been busted accessing, altering and giving data to domestic violence perpetrators on their victims!   They have proven we can't trust them with the data they already have, this BS has to STOP. There's no oversight either.  The biggest risk to us all is when they lose control of the database and it's sold on the dark web. Every drivers license, passport, credit card.. it will all have to be re-issued and our identities will be sold many times over. Cops are not immune to bribery, extortion or corruption, our data will be for sale, it's just a matter of when.",australia,t5_2qh8e,/r/australia/comments/pjjkzv/extraordinarily_dangerous_backlash_to_australian/hbx76ec/
64,0,1630781212,"Approving citizenship by descent is it's own thing, separate from visa applications and whatnot. COVID might mean fewer people in or available to do whatever necessary follow up there might be. And then whomever they have to contact us probably also doing the same thing.   We did this for my daughter, outside Australia. As she was like, 2 years old when we did it, the process was reasonably quick. It's not like there was a criminal background check to do, you know? Processing times were 3-4 months when we applied, and I recall being thrilled hers was decided quicker than that.  We still have to get the full certificate thing, but the certificate they sent is ok to use to get the passport, which we did in March 2020, just as literally everything was shutting down.",australia,t5_2qh8e,/r/australia/comments/phutyy/citizenship_by_descent_process/hblk6dy/
65,0,1630577744,"Aussie expat in London here. The UK govt have fucked a lot up during the pandemic, but not the vaccinations.  If the vaccination rates have only just now hit 79%, then we should see the results of this in two weeks time when the vaccines are most effective. The death rate per million may change.   The UK is a densely populated country, and cold and dark for most of the year. I’m not an expert, but wouldn’t you compare the UK’s covid stats to similar countries in size and population (e.g. France, Germany) rather than spacious Australia?   For what it’s worth, I am 34 years old and have been double vaxxed with Pfizer since early July. I’ve been able to travel abroad and attend music festivals with the vaccine passport. Friends who were double vaxxed and unlucky to get covid only complained of cold like symptoms and recovered quickly. I am cautious, but optimistic when it comes to living with covid.",australia,t5_2qh8e,/r/australia/comments/pgehs6/uk_has_now_arrived_at_our_target_of_80_of_16_year/hbar1co/
66,1,1630579614,"Not as dumb as you, apparently.  Talk about having your head buried in the sand. What's your brilliant game plan? zero-covid forever wont do much good if it has to be maintained by constant lockdowns even after we hit 80%. Your cool to see the economy is in ruins, everyone with a foreign passport fleeing for greener pastures, suicide rates and mental health issues climbing and the rest of the developed world looks on with pity?",australia,t5_2qh8e,/r/australia/comments/pg510g/victoria_records_176_covid19_cases_as_state_races/hbatgd2/
67,2,1630589740,"So, I am an australian citizen who just arrived in Brisbane from Europe &amp; spending his first day in a hotel quarantine. I have never been to Australia before, but I am planning to stay here for years. The problem is, I just found out that one of my tooth is decayed. I have no health card, or any australian documents, other than a passport. I want to fix it as soon as quarantine's over. I also don't have a lot of money, so I don't think I can afford a private dentist in Brisbane. I read that apparently unemployed people can go to a public dentist for free, with a "" low income health card"". I think I found a hostel which I'll be staying in after quarantine is over, but I still don't have a proper adress so I don't think I can register in the medicare system or begin any other procedures? Is there something I can do online in the quarantine time to get things started even if I don't have an adress? Do public dentists still work in Brisbane regardless of  the Covid situation? Please help out a very clueless mate.",australia,t5_2qh8e,/r/australia/comments/pfu97c/coronavirus_megathread_c12_counts_lockdowns/hbbbncu/
