,Unnamed: 0,Unnamed: 0.1,created_utc,body,subreddit,subreddit_id,permalink
0,0,0,1643122872,"Fair enough. I think your home citizenship will still be the relevant one for your visa, as you’d be traveling on your South African passport, but any COVID-related restrictions would be whatever applies for people coming from Europe/Germany. I think the COVID stuff will change so much over the coming months, best to check Australian Immigration for inbound traveler rules much closer to time.",australia,t5_2qh8e,/r/australia/comments/sccs51/visitor_information/hu5r4u5/
1,1,0,1642923372,"I shaved off about four business days agreeing to pick mine up directly from the passport office than waiting for it to be mailed out. I would pay the priority if you can afford it, as likely with covid wiping out staff the processing staff could be working with reduced staff numbers. Don’t want to wait the full spectrum of the six weeks if it’s essential you get home asap. Good luck!",australia,t5_2qh8e,/r/australia/comments/sao21y/how_long_does_it_take_to_renew_a_passport/htusrrp/
2,2,0,1642821916,"The usual. Masks, covid passport, event size limits etc. They had a bunch of ads running about it until the postponement",australia,t5_2qh8e,/r/australia/comments/s9n0mw/who_wants_to_get_sick_why_the_west_will_mostly/htp0yci/
3,3,0,1642143329,"NZ Citizen living in Aus and flown here plenty.  You can just fly in on a NZ passport, you won't be given any proof that you hold the visa, but being on a NZ passport automatically grants the 444, they can see it in the system.  As someone else said, just make sure you have your vaccination passport and fill out any covid declarations/exemptions you need.",australia,t5_2qh8e,/r/australia/comments/s3h17y/travelling_to_australia_as_a_nz_from_overseas/hslky8g/
4,4,0,1641857941,"I came back into Australia after an overseas trip last week. I got pulled aside by border force because they didn't have proof of my vaccination.   I produced my international covid vaccination certificate which was issued by the Australian govt and linked to my Australian passport.   I had checked all the entry requirements and didn't see a health declaration on any of the lists. They were annoyed and said ""the airline required you to fill out this form"" but it was not handed out at the airport or on the plane. Plus I checked my emails and it was not in the pre departure requirements list.   So I filled out the form and was free to go after that. But they came out swinging about me not providing proof of vaccination. Which I didn't think would be necessary given that they were the ones that supplied the proof for other governments?   So as much as I despise Novax's entitlement, I kinda feel for him here.   TLDR: Border force are a hot mess.",australia,t5_2qh8e,/r/australia/comments/s0lfwi/extract_from_djokovics_border_security_interview/hs4tjjq/
5,5,0,1641795725,"Lol, ""sensationally overturned"". From [The Guardian](https://www.theguardian.com/sport/live/2022/jan/10/novak-djokovic-appeal-federal-circuit-court-cancellation-australian-visa-covid-vaccination-live-updates)  &gt; Judge Anthony Kelly reads out a minute agreed to by both the government and Djokovic, where he quashes the decision to cancel Novak Djokovic’s visa, orders government to pay costs, and for Djokovic to be released from detention in 30 minutes with his passport and personal effects released to him.  &gt; The minute notes Djokovic was allowed until 8.30am when he was originally detained to response to the notification to cancel his visa, but the decision was made at 7.42am.  &gt; It found if he had had more time he could have consulted more widely and responded further than he was able to.  &gt; This is why it was so delayed: they were coming to an agreement.",australia,t5_2qh8e,/r/australia/comments/s0d4c2/djokovic_visa_cancellation_quashed_the_age/hs13d5x/
6,6,0,1641649354,"Why would he do that, if he wanted to do something illegal he would get a fake covid passport. Lot of people get these in EU countries, not to mention in Serbia, it would be piece of cake, especially for him.",australia,t5_2qh8e,/r/australia/comments/ryutih/djokovic_had_exemption_on_grounds_of_recent/hrrxubz/
7,7,0,1641481547,I was rejected for an exemption a couple weeks ago to study at university in australia. You know what I was? A fully vaccinated(triple jabbed with pfizer)New zealand passport holder currently in a commonwelth country(Canada). International students from all across the world including covid hotspots like India were allowed in whereas the government completely forgot about nz citizens outside NZ. Luckily they changed the border rules now that let me in. I’m flying over tommorow(provided my covid test is negative),australia,t5_2qh8e,/r/australia/comments/rxboj1/abf_investigates_two_more_tennis_australia/hrhyjgs/
8,8,0,1641418256,"&gt;But Djokovic is unable to proceed through passport control after a member of his support team made a critical mistake in requesting a sub-class of visa that does not apply to those who have received medical exemptions from a Covid-19 vaccine. The error had been discovered by the Australian border force while Djokovic was already travelling on a 14-hour commercial flight from Dubai to Melbourne.        Djokovic’s father, Srdjan, confirmed to the Serbian  &amp;#x200B;  So most likely this will just be a temporary issue. And his new visa application will be assessed first thing in the morning. Also fuck this dickheads father for saying he will have people in the streets, when his own incompetence is landing him in this spot. And even if it hadnt been his fault. Fuck that dickhead for using an inciteful language.  Too bad we're bending over backwards for these assclowns.",australia,t5_2qh8e,/r/australia/comments/rwwpx2/novak_djokovic_denied_entry_to_australia_after/hreoeoe/
9,9,1,1641425175,"Can't blame anyone but himself and his support crew lol  ""But Djokovic is unable to proceed through passport control after a member of his support team made a critical mistake in requesting a sub-class of visa that does not apply to those who have received medical exemptions from a Covid-19 vaccine""",australia,t5_2qh8e,/r/australia/comments/rwwpx2/novak_djokovic_denied_entry_to_australia_after/hrf6cpw/
10,10,2,1641431725,"I don't know what the situation is since the advent of COVID, but every international flight I'd ever taken prior to that had only had the attendant at the check-in desk eyeball my passport is valid. With a lot of countries with reciprocal visa agreements there's not even that requirement so they're just checking your passport is not expired.    There's no way for airline staff to know if these are valid or not as the evidence is nothing but stamps and stickers issued by embassies, and done weeks if not months in advance. There's no access to the country in question's visa database or entry permit data like ESTA for the US, visa revocation, multi-entry permissions, etc.    There's always way more scrutiny on entering (and even leaving) the country you're visiting as they're the only ones with any authority. What happens on check-in is not a control that guarantees entry at all.",australia,t5_2qh8e,/r/australia/comments/rwwpx2/novak_djokovic_denied_entry_to_australia_after/hrfmpmu/
11,11,3,1641456681,COVID passport here gave us 1 year natural immunity after infection . Does Australia not recognise this? Is this why he got the exemption at the time ?,australia,t5_2qh8e,/r/australia/comments/rwwpx2/novak_djokovic_denied_entry_to_australia_after/hrgthm3/
12,12,0,1641302910,"Mate ... I live in Germany and have friends and family in Australia. My Mrs boss is from Melbourne. He never said it was worse there when he was visiting. In Germany we've been locked down for almost 2 years straight now (since this all began). No freedom days, or opening up again days, or whatever they were called At one point it was only essential services which were open, like supermarket and servo. We've been having to provide covid app and ID for months, if not more than a year. Now, even with a valid vaccination passport we are also needing to provide negative PCR tests to go anywhere. We cant go to work, we have to work from home. 100,000 cases a day ... It's just not the same",australia,t5_2qh8e,/r/australia/comments/rvrg4f/australian_open_2022_novak_djokovic_to_play_in/hr7l8ih/
13,13,0,1640626288,"Hey, the only hard bit or unknown at the moment is the borders with covid.   Otherwise, as a NZ citizen you can just get on a plane and head over (make sure you have your passport). Your visa is sorted at the airport and lets you live, work, study etc.  Applying for jobs in country would probably be easier. So if you can get over and stay with family while you settle in that would probably make it heaps easier.  &gt;I was thinking of coming over and getting a forklift license to try to find something to pay my rent while look for work in my career field.  It's not the worst plan in the world. I'm sure your family would give you some leeway on rent initially, but that's good morals on your part.",australia,t5_2qh8e,/r/australia/comments/rpix1j/looking_to_move_to_australia_from_nz_how/hq62v39/
14,14,0,1640354784,"[Nope, he's safe](https://www.theguardian.com/business/2021/dec/02/tesco-ad-featuring-santa-with-covid-vaccine-passport-cleared-by-watchdog-christmas).",australia,t5_2qh8e,/r/australia/comments/rnlnal/fears_of_super_spreader_event_after_single_man/hpt4st5/
15,15,0,1639781159,"Recruiting companies are often asking for reams of sensitive personal information before a job offer is made, and even before an interview. This puts job applicants at risk of identity theft by hackers, frauds posing as a recruiter, or the employees of the recruiter. It is common to request this info is sent by email, which is both insecure and is liable to leave copies of information around (including in the sender's sent mailbox).  It is evident that recruiting companies are failing to protect this data. They should only be requesting data as needed, and should limit the data they request. Perhaps there needs to be greater safeguards around what companies are allowed to ask for.  Here is the list of information requested by a Victorian recruiting company following a job application on seek. The applican was not given an interview: &gt;Thank you for your interest in being a part of our COVID Response Team.  &gt;If you are still interested in opportunities, we have available, could you please send us the following compliance documents?  &gt;Police check (not longer than 1 year old)  &gt;Working with Children Check (employee type)  &gt;Infection Control and Prevention certificate  &gt;PPE training certificate (evelearningex link below)  &gt;Copy of Drivers Licence / Victoria ID  &gt;Copy of Passport or Birth Certificate  &gt;Your own VEVO Check - Visa for the Right to Work in Australia (if applicable)  &gt;Contact details of 2 Referees for reference checks  &gt;Payroll documents (TFN declaration, Super choice form, employee details form)  &gt;Proof of your Covid-19 Vaccination Record &gt;Qualification / Proof of Study Transcript",australia,t5_2qh8e,/r/australia/comments/rip8uj/coles_westpac_amp_and_department_of_defence/hoz9j55/
16,16,0,1639597345,"I was talking to my partner about this, and we pretty much both agreed that we’d probably only travel to the UK if we did go anywhere because I have a British passport, thinking being that we could work and live without issue should the borders shut again,  but considering they are completely fucked with covid over there, I can’t see us going anytime soon. Makes me realise how lucky we were to travel in our 20’s.",australia,t5_2qh8e,/r/australia/comments/rgwyb8/anyone_else_afraid_to_travel_overseas_in_case_of/hoomwtn/
17,17,0,1639200188,"Do you have any sort of certification that you are vaxxed, either digital or paper? Are you sure you need the International Covid Vaccine certificate specifically? From memory you need a document stating the vaccine you got and when,your name, and either your Dob or passport number. Sounds like you don't have that, but just in case...",australia,t5_2qh8e,/r/australia/comments/r4e3az/coronavirus_megathread_b11529_counts_lockdowns/ho34jqf/
18,18,0,1639083651,"I'm a overseas travelling and am unable to return to Australia because I am unable to apply for the medicare International Covid Vaccine Certificate.  I am traveling on an NZ passport and Medicare messed up my name and they can't find my vaccine records when looking me up through my passport number.I called them up to try sort it manually and the operator said verbatim:  &gt;You have done everything right, I can see your passport and that you're vaccinated here in Australia - but the system doesn't seem to allow me to link them. I don't know what I can do about this.  The obvious question is ""why didn't you sort this before you left?"" and I am asking myself that as well. There are so many hoops to jump through when travelling it's an easy thing to miss.   I suppose I didn't expect the country I live and got my vaccines in to drop a ""new phone who dis"" on me.  So as of right now, I am chilling alone in a foreign country with no idea of how or when I'll get back home.  Sick.",australia,t5_2qh8e,/r/australia/comments/r4e3az/coronavirus_megathread_b11529_counts_lockdowns/hnwevmm/
19,19,0,1638339781,"So far we know the symptoms all go away, but down the line they could resurface, perhaps. No way to know this until time has passed.  Simple, the vaccine is not necessary. The numbers don't support it, the reaction does not support it. This entire situation is the pandemic equivalent of burning down your kitchen to kill a spider. The death rate is minimal, the people who are at risk are given the option to get the treatments or shots so they choose. So why is any of this going on? Why the mandates? Why the demands? You literally cannot eradicate covid, nor is it worth eradicating. It's such a non-factor when compared to almost any disease, especially ones that aren't just influenza. Smallpox had a death rate of over 30%, I dont know of anything like what we're seeing right now.  So why would I take a shot for a disease that isn't going anywhere, that won't stop transmission, or infection, and might screw with my body in ways that we either don't know about, or aren't being told about. Because like I said Pfizer doesn't want to release its data. I'd much rather just get the disease, be sick for a week, and get over it. It's why I don't bother with the flu shot, it's not worth getting.  And to add on to that, I dont believe the government has any right whatsoever to tell me I have to take medicine or shots, or even have a friggin passport and papers on me to live my life day to day. So by my own moral compass and principles I have to decline. If it kills me? So be it, but it was my choice, and freedom carries the price that you might make the wrong choices. But thats fine. Too many people are just fine with the nanny state babying them.",australia,t5_2qh8e,/r/australia/comments/r5adgx/new_omicron_case_found_in_nsw_has_been_active_in/hmrm1za/
20,20,0,1637555475,"The difference is that vaccine passports are a **necessary** evil that solve a *real* problem. People *are* dying from Covid. Or getting sick and even after recovery have long-term health issues e.g. lung damage.  Meanwhile voter fraud is a crime the libs love to hype up but in reality we barely charge anyone with it each election, let alone find them guilty. It's usually just old people who accidentally vote twice, and we notice because there are systems in place to check during vote count / after the election.   The rare times voter fraud *has* made a difference, comparisons between the electoral roll and the census have picked it up, voter fraud is a non-issue and ID-laws will just make it hard for *not-liberal-demographics* like poor people with no drivers license or passport to vote.",australia,t5_2qh8e,/r/australia/comments/qymkr3/voter_id_laws_will_diminish_rights_of_all/hlloijw/
21,21,0,1637340618,"&gt;I'd love us to adopt wearing face masks if you've got a cold or the flu.  Why not?  It's not going to happen, though. 2 years time and things will be back to as they were in 2019.  I doubt it, COVID isn't going away any time soon and hence the restrictions will remain.  As an example, the Netherlands has slightly higher vaccination rates than Australia, has had ""vaccine passport"" type restrictions on the unvaccinated for several months (Similar to Australia), and yet has reached new highs in new COVID cases per day in the past week. https://www.worldometers.info/coronavirus/country/netherlands/",australia,t5_2qh8e,/r/australia/comments/qxb5qv/scott_morrison_wants_to_pretend_nothing_has/hl9v27e/
22,22,0,1637121587,"That's literally what I have to do. Just paid 3 months in advance for a short term 3 month lease cause the references are bullshit, mean nothing and I have no rental history outside of roommates and I certainly don't keep their numbers. Then they require 100 points of ID which should be a passport and license at 70 points each as primary documents but no they are worth 40 apparently so I had to scan them both plus a birth certificate which I had to find and a medicare card. Like jesus christ. Then they won't bank statements from the last two years which I get normally if you're not going to pay upfront which I couldn't do as I choose not to go on the dole and haven't worked since covid began spending most of my savings and a whole other bunch of hurdles. Just want a 1br apartment for $250 a week and it's so difficult so I just paid the first person I could as I was not doing that all again. Not happy with the new place either, a hotel room with no internet but 3 months =(",australia,t5_2qh8e,/r/australia/comments/qvnzwj/whats_the_deal_with_rental_applications_these/hky38cs/
23,23,0,1636912972,"In murder or battery or negligence court cases there is a legal principle called the “but for” (this isn’t a troll, that literally is the name in Queensland&amp;WA law) test which is partially used to determine culpability for an adverse event. The test is used to determine whether or not harm was caused by or how significantly harm was exacerbated by a particular factor under the control of a party. If you could put COVID 19 on trial in most of those cases you mentioned,it would be found guilty. The fact that there were underlying co-morbidities is irrelevant. COVID is the extraordinary factor in those cases.   As it stands, and to answer your original post, I’ve been double jabbed and I don’t have to wear a mask or provide a COVID passport anywhere except for at an airport. I’m glad to be living here rather than over there with your cutthroat, mercenary healthcare system, cheaply corrupt government and hyper factionalised political climate that’s on the verge of a widespread explosion of domestic terrorism.",australia,t5_2qh8e,/r/australia/comments/qts5h3/how_does_it_feel_to_live_in_a_biomedical_security/hkm3ufh/
24,24,0,1636450494,"As of 2018 only 57% of the population had an Australian passport. While there’s obviously a bunch of permanent residents and visa holders who hold foreign passports, you’d have to imagine there’s still a pretty substantial percentage who had no intent of traveling internationally even before COVID.   That said, it’s a shame that it’s the end of things for some. My folks were avid travelers, but after their last overseas trip in 2020 was cancelled due to COVID, they’ve got to the point now that they don’t feel comfortable due to the ongoing effects of aging and the increased risk of breakthrough COVID even being double vaxed.",australia,t5_2qh8e,/r/australia/comments/qpzdym/devastating_figure_as_overseas_travel_restarts/hjx1w6i/
25,25,0,1635584728,"Oh yeah, it doesn't happen all the time but certainly a lot more often than here. There was a story of a schoolkid who was followed off a bus and was killed by someone who took his phone. I later found out he was a classmate's brother's friend. Two of my friends' friends also were killed for their money. Both stories made news. There was also a family and their housekeepers who were forced into a small bathroom with insufficient ventilation by robbers and ended up dying inside.  There are also people who would assault motorbike riders to steal their motorbikes and so on and so forth.  To be fair, this is in Jakarta, the capital city. It's probably not as bad in other cities or smaller towns.  I've only been to Thailand once, but it was on tour so I guess we don't really interact with the public much. I haven't actually visited a lot of SEA countries even though my passport allows visa-free travel there. Maybe when the covid situation gets better I'll visit there. My instructor took a month long trip to Vietnam a couple years ago and he seemed to enjoy it a lot.",australia,t5_2qh8e,/r/australia/comments/qisyls/after_leaving_australia_for_2_years_i_just_have/himfwvo/
26,26,0,1635425542,"Pretty much yes.   I'll share a story. 9 months into losing my job due to covid centerlink send me a letter. It said I have to provide a proof of age card, drivers license or passport or I'd be cut off  They had me on file back when I was previously on aus study. Also had my birth certificate, working with childrens card, forklift licenses, marine license, rental agreement, bank statements, previous investments and bills all on file  Seeing as I refused to pay for a passport and couldn't get my drivers license before the deadline the proof of age card was my only option. Guess what i.d and documents I supplied to obtain the proof of age card? All the fucking ones they already had on hand!",australia,t5_2qh8e,/r/australia/comments/qhimn2/government_introduces_law_requiring_voters_to/hidi9hu/
27,27,0,1635026845,"** It's now illegal in Victoria for unvaccinated people to play chess, practice archery or coach junior football - has the state finally gone too far? Where will it go next?**  For reference the [Open Premises Directions](https://www.dhhs.vic.gov.au/victorias-restriction-levels-covid-19) from the Victorian Acting Chief Health Officer (CHO) mandates that clubs, special interest meeting groups and sports facilities specifically exclude and prohibit unvaccinated people on behalf of the state.  Unfortunately, as many of us suspected, the Vaccine Passport did get implemented and is actively being used in Victoria to prevent unvaccinated people from participating in social activities.  The Vaccine Passport is a now a dangerous tool that only requires the Victorian CHO to add another premises or activity to the list in order to forcibly conscript an organisation into the service of the state.  In my opinion this has already gone too far. A second subclass tier of ""citizen"" has now been created and can be further excluded from society with a simple stroke of the pen.  Where it will go next is even more worrying. The Victorian AMA has *already* gone on record as saying [""Covid-deniers and anti-vaxxers should opt out of public health system and ‘let nature run its course’""](https://www.theguardian.com/australia-news/2021/oct/21/victoria-ama-says-covid-deniers-and-anti-vaxxers-should-opt-out-of-public-health-system-and-let-nature-take-its-course). These are the ""experts"" we are being socially engineered to trust unquestioningly and they proposing that people with a different opinion should be thrown onto the medical scrap heap.  Where it is very likely to go next, in my opinion, will be the large businesses and corporations that were ""permitted"" to stay open by the government and friendly politicians. Expect the supermarket chains and large stores like Bunnings to be enforcing vaccination status soon.  History shows when The State forces organisations to act on their behalf and creates a sub group of people to be singled out for hate that it never goes well.  **What do you think - has the state finally gone too far? Where will it go next?**",australia,t5_2qh8e,/r/australia/comments/q47jcq/coronavirus_megathread_r1_counts_lockdowns/hhsg65w/
28,28,1,1635066956,"To an extent, they would be used as an example of the need. It started with the attempt at a “covid tracking app”. That set people off no matter what your into belief wise.  With the check in system and linked vax passport, we are at a point where the gov should provide free phone and data to support it or…. A card with all the info in it. Your Medicare card has that info, sans a photo on it….voila, the Australia card.",australia,t5_2qh8e,/r/australia/comments/qeho89/australia_is_in_the_final_stages_of_passing_its/hhuczly/
29,29,0,1634875412,Can anyone hook me up to the covid vax passport instructions that were on here the other day?  Thank.,australia,t5_2qh8e,/r/australia/comments/q47jcq/coronavirus_megathread_r1_counts_lockdowns/hhkwnkc/
30,30,0,1634703169,"Woah, don't bring science and facts in here. Everyone is way too conservative. But seriously it is a joke. Natural immunity is 26x stronger and lasts longer. The fact you need to get vaxxed is stupid. Italy already has a passport for vaxxed or had Covid. This is how it should be.",australia,t5_2qh8e,/r/australia/comments/qbmxp1/novak_djokovic_wont_be_able_to_enter_australia/hhbnr21/
31,31,1,1634730805,Vax passport has an obvious community health benefit and is not as intrusive. The pros outweigh the cons unless you don't believe that Covid is real etc in which case I won't even engage with you.,australia,t5_2qh8e,/r/australia/comments/qb8t57/australian_government_digital_identity/hhcn5s9/
