,Unnamed: 0,Unnamed: 0.1,created_utc,body,subreddit,subreddit_id,permalink
0,0,0,1643635595,"Likely some combination of vaccine passport and forcing all guests to take an ATK test at first. Maybe they allow unvaccinated in with ATK test.  Hopefully vaccine passport is enough, but the clowns in this government pick their covid policies out of a hat so who knows",Thailand,t5_2qjw5,/r/Thailand/comments/sh0bye/will_only_vaccinated_people_be_allowed_in_bars/huznw1p/
1,1,0,1643430818,"I went to Muang Thong Thani (Bangkok) on the 24th and it was Chaos. At one point, they started turning away people who's visas expired in February, telling them to ""come back next week"" and reassuring them that it's all good even though the scheme ended on the 25th. That's when I knew that they got word that it was going to be extended.  People with visas expiring in January were told to ""come back tomorrow"".  Mine expired in Feb but I'd booked online which saved me from being kicked out.  Here's the link for that: [https://www.immigration.go.th/?page\_id=20131](https://www.immigration.go.th/?page_id=20131)  Queue online and arrive early so as to not cause issues. You should be able to bypass the queue of people, go directly to the desk, and show them the e-mail that you get after you make a booking. That'll save you a lot of time.  I've been here for 23 months extending every time and I used to write ""flights cancelled due to covid"" in my form. I was questioned on 4 occasions. One lady accused me of working here. The same one also questioned my ability to return home another time. Another (the angry one) questioned how I support myself and another time accused me of providing a false address. Asides from causing issues over nothing and being angry power trippers in general, that's about as serious as it ever got with the immigration ladies at MTT.  Here's how it all went down originally. I arrived at the start of March 2020. Before it was time to go, I went to MTT to get my extension. It was chaos, highly confusing, and it took forever. They had it in the big multi-storey car park next to the skyscraper, not in that little office building that hosts them now. The process took all day. You could get there, be sent to the 5th floor, and then they'd send row by row lower as people got processed. Eventually as the tourist numbers died down, they stopped hosting it there and moved it to the little building.   Initially it was a monthly stamp thing, then they changed it to 2 months, but they'd only give you a 2-week stamp after you'd paid and had your paperwork processed. After the 2 weeks you'd go back with just your passport and they'd stamp another 6 weeks onto it. This eventually changed to giving you the full 2 months on the first visit.  For some months, depending on the time you went, you could walk into the building and you'd be the only person there, or there'd be a few other people max. I think the fastest I've been in and out is about 10 minutes. It helped that I had a stamp that wasn't on the 1st of the month as that's when it was busiest. You may be able to push your stamp out by overstaying a day but I'm not sure any more.  It's been a wild ride of worrying that I'll be rejected of the scheme won't be renewed. I'm going to be changing to a marriage visa this time round to avoid any possible issues as it sounds like they're getting serious about it all. Strange that they want tourism to return, but don't want tourists staying in the country spending money.  I know that 23 months is extreme in my case, I'm not complaining.",Thailand,t5_2qjw5,/r/Thailand/comments/sejpil/updated_info_for_60_day_covid_extensions_anyone/huojlvw/
2,2,0,1643203714,"So much wrong and idiotic in your sour grapes response, but I think it will be educational to others if I respond point by point. I must say that I don't think I have ever seen a post in which every enumerated point was flatly wrong.  First off, I am not trading anything. I don't have to give up my US citizenship. Look up dual citizenship. India doesn't allow it, but they do allow citizens who obtain foreign citizenship to obtain a status that is pretty much the same. About the only important thing they cannot do is own agricultural land. I know, because I just spoke to an Indian who obtained Thai citizenship and he went through that process. You might want to check that out so you are more informed in the future.   a. PR is expensive, time consuming, and takes years. In any case, not necessary if you are married. Process averages 3-4 years start to finish.  b. It is not always easy to start a company under the US treaty, and many things are still prohibited. And it costs money and time. And reams of documentation.  c. Sure you have the right to stay under an O visa, which you need to apply for each year, and report every 90 days, etc. No more need for me to do that. At all. BTW, I can now enter Burma, Cambodia, Laos and some other countries visa free, which I could not do before. I can still use my US passport when overseas as that is perfectly legal and acceptable. Enter and leave Thailand with your Thai passport, and you can use whichever one you want overseas.   d. No need for me to negotiate for a higher pay package as I am mostly self employed. My part time Thai employer could care less. They pay me for the skill they need, not because I am a foreigner or Thai.  e. There is no requirement to renounce my US citizenship. The US government isn't accepting that anyway for the last several years, ostensibly because of COVID.  f. My kids are US citizens. My citizenship status doesn't affect their ability to immigrate to the US in any way whatsoever.   **Reread this until you understand this:**  Why would Thais see me as anything other than a farang? Citizenship doesn't change your ethnicity. I am a Thai citizen, with all the rights and responsibilities that entails. I am not ethnically Thai. What a nonsensical argument. I am sorry your experience here has evidently not been as pleasant a one as mine. You seem bitter than you are ethnically Indian. Why is that I wonder?  Throughout my time here, and throughout this process, I have never met a single Thai who had an issue with my living here or becoming a Thai citizenship. Not one. Every, and I mean EVERY, Thai official I dealt with during this process were extremely encouraging. And throughout the years I could not count the number of Thais who asked me why I hadn't changed my citizenship.  There are just too many benefits of my holding Thai citizenship to list here.",Thailand,t5_2qjw5,/r/Thailand/comments/sd1jjq/has_anyone_actually_succeed_at_becoming_a/huahj2e/
3,3,0,1643038507,I’ve heard rumor that “losing” your passport and applying for a new one gives you a new passport number and the potential to start  the process over with Krupsa. Don’t know from experience. Got fed up myself between tragic school management and Covid so came home  for a bit. Didn’t really enjoy the process myself. We’ll see.,Thailand,t5_2qjw5,/r/Thailand/comments/sbcsxp/eal_teacher_here_7_12_years_of_experience_a_ba_in/hu124ge/
4,4,0,1642831367,"You’ll need:  1. Photo 2. Copy of any other stamps they’ve given you, copy of visa, copy of passport page, copy of departure card. 3. 90 day receipt. They will do 90 day reporting for you when you go so you should already have this. If it’s your first visit then no need. 4. All the required documents to fill out which will be at immigration. Tell them you want a covid extension. 5. 1900 baht",Thailand,t5_2qjw5,/r/Thailand/comments/s9up5b/covid_visa_extension_documents/htpk6lm/
5,5,0,1642653927,"&gt;I always put down 'cancelled flights' which they were and the borders were closed to my country. But now they're open and there seems to be a way back. But I need more time to switch to a different visa type. Scared of being rejected this time.  They instructions given by Immigration, at Immigration literally has you fill the reason in as ""COVID-19"". No need to think of a reason yourself.  &amp;#x200B;  &gt;Every other time I go there one of the ladies makes a big deal about a non-issue. First I'm working without a permit. Then I'm lying about my actual address. They punish me by taking forever to process my passport. One time I got my dates mixed up and came in a day earlier than I'd booked. ""YOU LIE TO ME!!!"" and I had to come back the next day. Very angry ladies, the rest of the process is fine except their attitude.  They are just enjoying their power trip. Just smile, agree with everything, then be patient. Happens to everyone at some point or another.  &amp;#x200B;  &gt;ตำรวจตรวจคนเข้าเมืองพฤติกรรมหยาบคายกับต่างชาติมาก โปรดทำกับเขาให้เหมือนมนุษย์พึงปฏิบัติ ถ้าคุยกับคนไทยพวกคุณไม่กล้าขึ้นเสียงหยาบคายแน่นอน พอเห็นเขาเป็นต่างชาติเลยทำใส่เขา เขาก็เป็นมนุษย์เหมือนกับเรา มีอาชีพตำรวจตรวจคนเข้าเมืองได้เพราะต่างชาติ มีเงินเดือนใช้ทุกวันนี้เพราะต่างชาติเข้ามาในประเทศไม่ใช่หรอ??? ทำไมไม่พูดกับเขาดีดี พ่อแม่ไม่สอนหรอ เวลาคุยกับคนอื่นต้องสุภาพ หรือองค์กรสอนกันมาแบบนี้???  This Thai person must not have been to other government offices, like Transport, Labour, etc. because government front line staff love doing the power trip thing, and are equal opportunity a-holes, regardless of your race or nationality.",Thailand,t5_2qjw5,/r/Thailand/comments/s7je2h/visa/htf3me0/
6,6,0,1642312201,"Are you no longer eligible for the reason why you were given the Non-immigration O? I’m fairly sure you can extend for another year depending on your circumstances albeit someone who is on a non-immigrant O might be able to better clarify.  That being said, the requirements for a COVID extension  are fairly simple. You’ll need the following; at least one 4x6cm passport style photo, photocopies of your information page and your visa/entry stamp in your passport as well as your departure card. Photocopies can be done at immigration for pocket change but you may be stuck in a long line depending on the office and time of day.  Once you have everything you’ll go up and ask the immigration officer for the COVID extension form which is just a standard TM.7 extension package but with another page. To err on the side of caution, bring your own pen as they may not have any for you to use. Once your form is filled out and checked they’ll give you a number, then it’s fairly standard. You go up, hand over your package of documents and exactly 1900 baht in cash then you sit around for a bit while they review it.  For me, I’ve had mine granted the same day but others have reported getting an under consideration stamp where they just show up next week and get the stamp anyway.",Thailand,t5_2qjw5,/r/Thailand/comments/s535n7/covid_visa_extension_which_documents_to_bring/hsva89g/
7,7,1,1642326492,"&gt; I forgot the 30 day visa on arrival went out with Covid  At some point - you need to give up.   There was never a 30-day visa on arrival. A VOA is 15 days and applies to citizens of some countries such as China and India. It's a visa they have to apply for and pay 2,000 baht on arrival at the airport.   &gt;went out with Covid and is now a visa exempt entry,  Never was. Visa-exempt entry has always been thing going back years, and probably a lot longer again. When I first got here, I've got a passport full of visa-exempt entries. Until about 2015-2016, unless you were from certain countries, visa-exempt was 15 days when entering through a land border. Others 30 days. In 2013, I filled my passport with them.",Thailand,t5_2qjw5,/r/Thailand/comments/s548zz/60_day_covid_extension_vs_60_day_tourist_visa/hsvu368/
8,8,0,1642256686,"I don't reply to private messages.  You suggested that maybe 90 day reporting doesn't apply to Covid extensions.  I doubt that's true since 90 day reporting applies to all visas, but don't sweat this.  Just go to immigration and ask if you have to do 90 day reporting.  If they say yes, which I think is what will happen, just say you didn't know, pay the fine and get your paper put into your passport.  If they say no, no problem.  The confusion may have come about because most tourist visas are shorter than 90 days and the problem never arose.  But with the Covid extensions these short term visas suddenly got extended.  I can't find anything on government websites, but some sites, [like this one](https://www.thaiembassy.com/travel-to-thailand/covid-19-guide-for-travelers-in-thailand), say:  &gt; If you are a foreigner staying in Thailand for a period longer than 90 consecutive days holding a Non-Immigrant Visa or Extension of Stay, you are required by Thai Immigration to report your current address every 90 days. You may file for the TM47 notification in person, by mail, online, or by an agent.   which is what I expected.",Thailand,t5_2qjw5,/r/Thailand/comments/s4id21/is_a_photocopydigital_version_of_an_idp/hsrnink/
9,9,0,1641988769,"There were a lot of regulation that change over last two years. Also regulation usually came in verbal during conference before documentation.   At first foreigner had to pay for medical service. Then COVID patient definition for UCEPCOVID also include any person. I am not sure which document that state about this things. But I can confirm by asking my financial department of my hospital just today. I am working for Home Isolation, if patient has valid passport, no cost we ask for.   If you encounter any problem. You can call Department of Heath Service Support Tel 1426 [Only in Official hours] This department control all private hospital including hospitel that hospital provide services.",Thailand,t5_2qjw5,/r/Thailand/comments/s20qh7/mister_prakan_allianz_insuranceanyone_have_their/hsc6q8w/
10,10,0,1641900423,"My AXA travel pass insurance was 155 euro. OP states euro so I assume residential status in Europe. Maybe you come from a higher risk country but for me from Germany things have been cheap. AXA policy name ""Individual Inbound Travel Insurance Policy"" this for the exact max visa free time I can stay on a German passport. Thaipass application is free. Visa not needed for OP if he's Euro zone.  As I've stated I have done all 3 version of entry since covid started and never paid 2k euro. Maybe I just do better research. In the end, it's the internet you believe what you want and I enjoy my Chang.",Thailand,t5_2qjw5,/r/Thailand/comments/s0k2v8/i_fell_for_the_english_center_scam/hs70ebu/
11,11,0,1641390241,"I've had 6 covid extensions. I have to go in the next day for a ""final"" one. On an American passport. My job was supposed to get my a visa but it hasn't been processed yet. Am I safe to get one? Will I be rejected? Any experiences?",Thailand,t5_2qjw5,/r/Thailand/comments/rt72t0/covid_information_travel_tourism_and_general/hrcp6nj/
12,12,0,1641317820,"It all makes sense if you just take corruption into account. The hospitals obviously want to squeeze as much out of the covid insurances as possible. I was nearly one of those. Had a really bizarre test &amp; go experience. Where the hotel told me, they need to have me in the hotel for another day and do a new test, because something apparently went wrong with my test and they couldn’t say if I was positive or negative. First sign of scam and cash grab. I then talked to someone from the hospital directly and I asked what went wrong. They probably didn’t expect the farang to be fluent in Thai (I’m half, but traveling with my European passport). They basically couldn’t answer my question, only that they need to take a new sample and do a new analysis. I asked for my CT value, which they certainly should have after doing the test. But they couldn’t tell me. At this point I was getting really suspicious and told them, even though still in a polite way. The hospital employee hung up and wanted to call me back 5 minutes afterwards. So they called me back and told me it would take 1 hour for them to do a new analysis, but at the same time the person was certain that I’m gonna be negative. I suspect that they let me off the hook, after knowing that I’m fluent in Thai and not scared of asking questions. After talking to the hotel employee in charge I only then got to know that the hospital would do this with many other tourists, but I was the only one they skipped the second night of quarantine on. I Maybe I’ll do a whole post about it.",Thailand,t5_2qjw5,/r/Thailand/comments/rvj65e/welcome_to_2022_rant/hr8khxj/
13,13,0,1641000591,You show up to immigration near the end of your 30 day visa exempt stamp in your passport. You fill out the application form for the Covid extension (as long as it’s still currently available). Pay your 1900baht. Wait in line to get approved for your Covid extension which will give you an under consideration until (with a date approx 30 days later). You will show back up at immigration with your passport/stamp and wait again until they stamp you in for another 30 days. They will tell you that you need to go home to your country and this is the last one. You wait until that 30 days is almost over and you repeat the process if you still can’t travel and if the extension is still available.  You may also need to provide the arrival stub in your passport (TM65 I believe) and a TM30 from your hotel or wherever you’re staying.,Thailand,t5_2qjw5,/r/Thailand/comments/rsuet1/visa_extension_no_flights_back_to_home_country/hqr6fpy/
14,14,0,1640522739,"BP now reporting about the EU and Thailand agreeing to accept each other's certs. No mention of Sinovac or what exactly ""connected to the EU Digital Covid certificate system"" means in practice still though. They do mention though that it is the Vaccine Passport is accepted now and the Digital Health Pass will be accepted in January.   https://www.bangkokpost.com/thailand/general/2237571/eu-accepts-thai-covid-certificate",Thailand,t5_2qjw5,/r/Thailand/comments/r61lam/covid_information_travel_tourism_and_general/hq0qld6/
15,15,0,1640149467,"42% of 12000 is around 5000 So in 2 years, 5000 kids worldwide died WITH COVID-19. If you take into account that every kid that dies with a positive COVID test gets into this statistic, while the cause of death might be something completely different, the real amount is minuscule.  Therefore vaccinate ALL kids worldwide with a vaccine with unknown long-term side-effects, especially thinking of things that can just be known in 10-20 years like fertility, is absolute madness. The unknown side-effects of the swine flu vaccine were just discovered after several years.  Not even talking about the definite „side-effects“ of governmental control, like the implementation of a digital vaccination passport to track and trace even the youngest. No matter where you go, check in and out with your digital trace and being forced to do that.  When I look at my downvotes, it seems like many people just completely lost their mind based on fear-mongering.",Thailand,t5_2qjw5,/r/Thailand/comments/rlhpv1/kids_511_allowed_pfizer_shot/hpis46s/
16,16,1,1640172758,"He left the hotel without checkout out, and without his passport.  He knew full well he was circumventing the rules, and probably knew he was Covid positive.  Why else would he not wait for the result and check out properly?",Thailand,t5_2qjw5,/r/Thailand/comments/rly7lj/police_search_for_infected_tourist_who_left/hpjncb6/
17,17,0,1640059530,"6. ""When purchasing a personal insurance policy for coronavirus infection (2019-nCoV), the insured must reside in Thailand. (For foreigners, they should have Passport and Work permit or have resided in Thailand for more than 6 months)""  [https://www.dhipaya.co.th/en/product-detail-10-37-12.html](https://www.dhipaya.co.th/en/product-detail-10-37-12.html)  850 Baht for 1 year. Foreigners up to 99 years old. 1,000,000 baht death benefit / 100,000 baht medical treatment for Covid-19 for 1 year.",Thailand,t5_2qjw5,/r/Thailand/comments/rkmetm/covid_insurance_for_when_already_in_thailand/hpduudf/
18,18,0,1639467073,"Correct. I live in Germany. 2 weeks ago I left to the USA and came back yesterday. ( Flew into Spain ) you show your vaccine.   When you arrive in EU, take your vaccine and passport for a pharmacy and they will get you a qr to download the COVID app",Thailand,t5_2qjw5,/r/Thailand/comments/rg1jdv/does_a_thai_citizen_require_a_vaccine_passport_to/hohi4g1/
19,19,0,1638555488,"Ouch, we're pretty worried as we have needed to resubmit with only 6 days - and 5 full days - remaining. I have had both thai passes come through within hours but my partner still doesn't have her first.     We both have EU COVID certs, naturally the same hotel too - however, I'm European and she has a SE Asian passport. Anecdotal, but we're wondering if the passport/nationality makes a difference on speed.",Thailand,t5_2qjw5,/r/Thailand/comments/r7c51t/sha_extra_plus_differentiation_needed/hn3hdu9/
20,20,0,1638400214,"I arrived BKK last night. Flights were from SEA to ICN to BKK. At SEA, the only thing checked was Covid test. At ICN, Korean Air has a separate transfer desk devoted to Thailand travel. They checked vaccine card, passport, insurance, hotel, and Thai pass QR code. The process took about ten minutes. At BKK you exit the plane, walk a bit and sit in a chair. A attendant checks your documents and pulls the one you need going forward - Covid test, Thai pass qr code, boarding pass, and TM6. Then you carry those documents to the Thai pass checkpoint where they scan the qr and stamp the TM 6. After that, hike to immigration. Immigration is pretty much the same as ever except they have added a face photo. After exiting customs, you will see a large number of tables with an even larger number of hotel placards. There are attendants there who will help you find the hotel. 5 minutes wait for the driver and I was on the way to the hotel. My flight landed at 2320 and I was in the car within thirty minutes. One stop in the way to the hotel for Covid test.  Compared to the process for travel approval, the actual travel process is quite efficient (at least it was yesterday).",Thailand,t5_2qjw5,/r/Thailand/comments/r6rtex/travel_process/hmuyx1d/
21,21,1,1638468354,"I booked my hotel from the Agoda site. I chose the Siri Sathorn Bangkok which is listed as Sha plus+.  I payed 120 usd.  I got an email from the hotel themselves asking for my passport and itinerary. They sent me a letter (attached in email response) which confirmed I had a pickup from the airport, food, and a covid test included in their package.",Thailand,t5_2qjw5,/r/Thailand/comments/r7c51t/sha_extra_plus_differentiation_needed/hmyk4ob/
22,22,0,1638339417,"As others have said, it has to be in person as they take a picture. For both my previous two year and five year licenses, they took digital photos of me at the DLT.  I'm in the process of renewing my five year now. On November 23rd, I went to the DLT to make the appointment. I believe it is all done by appointment because of Covid. The earliest appointment I could get was Dec 3.   That gave me time to get the required documents together. Three passport photos (150 baht for a set of four) for my residence certificate (300x2=600 baht). Medical certificate 100 baht. The fees for motorcycle and car licenses are 355 and 605 baht. So a total cost is 1810 for me.  Before going, I asked an agent how much and they wanted to charge 3500 for one license + 500 for the second + 1000 for the residence certificate = 5000 baht. I'm not convinced the service they provide is worth the additional 3190 baht, though 1000 for the residence certificates would be worth not having to go to immigration.",Thailand,t5_2qjw5,/r/Thailand/comments/r665ai/thai_drivers_license_renewalin_person_requirement/hmrlh5u/
23,23,0,1638280211,"I can confirm this for you. Myself and 2 other tourists were all denied a Covid extension at a Bangkok immigration office and told to show proof we had departing flights. This was about 1.5 weeks ago.   I didn't know the other people, just overheard their situation, and then the same thing happened to me. The immigration office gave me two options.   1. Return with a ticket showing I was leaving Thailand on or before 29/01/2022. 2. Leave Thailand on or before 28/11/2021 and just come back in after a day or two.  I chose the 3rd option, which was to pay a visa agent to get me the extension. They returned my passport in 3.5 days.  While neither here nor there, I am planning to leave Thailand on or before the 29th when my next visa extension is due to be renewed. Due to Covid I've been held up here longer than planned and need to continue my travels. If Thailand doesn't bring back the volunteer visa, I will leave permanently when my condo lease is up.  My country (Dutch), nor America (I am a Permanent Resident Alien) treats foreigners or nationals this way if they have paid or gone through the legal process to stay in the country long-term.",Thailand,t5_2qjw5,/r/Thailand/comments/r5j4oc/covid_extension_question/hmnu1cj/
