,Unnamed: 0,Unnamed: 0.1,created_utc,body,subreddit,subreddit_id,permalink
172,83,0,1628159105,I recently moved from Bangkok to Chiang Rai and encountered 7 roadblocks along the way. All of them asked for my final destination and waved me through. At the last checkpoint in Chiang Rai I had to show my QR travel info and vaccine certificate.,Thailand,t5_2qjw5,/r/Thailand/comments/oy88vv/how_serious_are_the_checkpoints/h7sf1v8/
173,84,0,1628001657,"Yellow vaccine passport, don’t travel only with a EU digital certificate",Thailand,t5_2qjw5,/r/Thailand/comments/owyidh/got_denied_on_my_flight_to_phuket_because_i_did/h7k2vu4/
174,85,1,1628050938,"I don't know if I agree. The vaccine certificate for the UK is currently just a printed out PDF with a barcode. Anyone could forge the printed out paper, the bar code is the only thing which really verifies that it's legit. And FYI, the airline nor immigration scanned bar code for me",Thailand,t5_2qjw5,/r/Thailand/comments/owyidh/got_denied_on_my_flight_to_phuket_because_i_did/h7n2rps/
175,86,0,1626519202,"Well, I know I'm in the minority, but I'm not impressed with how ""organized "" it is. (Sorry for the typing, I'm on the phone).  The first time i was out in around 45 minutes or so.  Second shot, i was there for 2 hours.  To get to the 9th floor you wait for really slow elevators as people gather all around you. Then everyone crams into the elevator up to the 9th floor.  The entire process is indoors in a narrow L shaped corridor.  There were 9 stops.  9. No reason it couldn't have been 2 or 3. Besides the around 150 or so numbers I heard called while i was there, there were dozens of workers (no wonder all these health workers keep testing positive).  Most of them were unnecessary and shouldn't have been there.  There were no accommodations for covid, it was just the usual snap the ""system"" into place and it hopefully fits what you're trying to do.  The number of people up there and the time spent there should have been limited at every chance.  Nothing was cut out and it could have just as easily been a pre-covid event.  And I don't think the spacing between chairs was sufficient at all.  But it doesn't even matter as much when you are in an enclosed space like that, worsened by the crowds.  The 30 mns waiting time should have been cut out for safety concerns. If someone feels unwell, they can return.  People should have been let go and allowed to remain in the area or not far away.  I've never had more than a cup of orange juice and sent away when vaccinated in the past.   Then i get handed a pathetic little piece if paper that says ""Thailand certificate "" for covid vaccine.  It's useless.  Then i was told I had to go to one of only three places to get a vaccine ""passport"". So i had to travel to nonthaburi arrived at 6AM and spent another 3 hours indoors with more people not really respecting social distancing.  One lady checks the papers, then you hand them to a lady at a window at 6.30. At 8 am she calls your name and hands them back to you, telling you to go upstairs where you start again.    So total I spent 5 hours indoors, not including two round trips traveling, in two days.  Probably there will be many posts following telling me I'm a shit head, been it's caused great anxiety.  I stayed in or traveled thru more than a dozen countries on 4 continent's since end of 2019, I've been safe so far, but so totally vulnerable the past two days.  Villa was a madhouse just now too, it's ridiculous.",Thailand,t5_2qjw5,/r/Thailand/comments/ob9tve/covid_information_travel_tourism_and_general/h5i5frf/
176,87,0,1615797001,"I keep seeing comments like yours in r/worldnews, but vaccination certificates/""passports"" already exist. They're little yellow booklets, (originally) issued by the WHO. To enter certain countries, certain vaccinations (like ones against yellow fever) may be required, and that's how these booklets came about. They're actually quite convenient to carry around when travelling. If you injure yourself or get bitten by a stray dog, you'll know whether or not you'll need to get a booster jab.   The first page is for compulsory vaccinations (yellow fever), and there's a couple more pages for other vaccines. Either way, it's recognised internationally, and it's an easy way to know if a COVID vaccine was administered/which type/when etc.   Here's what they look like:  https://www.thaitravelclinic.com/Knowledge/who-international-certificate-of-vaccination.html  With that said, I find the fact that certain governments are trying to come up with vaccination certificates of their own, a bit ludicrous. Have they made sure that over 190 sovereign states will validate these certificates? Why not use the already-existing, internationally-recognised ones?",Thailand,t5_2qjw5,/r/Thailand/comments/m5d373/routes_to_recovery/gqzs7gu/
177,88,1,1615799307,"I don't believe vaccination entries are that easy to fake, though.  &gt;Anyone can simply write in that they had whichever vaccine needed  Doctors and nurses who recognise this risk, all put the sticker that was on the vaccine vial. These stickers confirm the batch number, the manufacturer, the production/expiry date of the vaccine etc. The hospital/doc/nurse that administered the vaccine also need to stamp and sign off on the certificate.   The issue is making sure that immigration officers request for the vaccine stickers to be in the booklet, and are made aware of what the different vaccines' stickers should look like. Forging a hospital stamp and a sticker for a vaccine vial, sounds like a lot more pain than getting a jab. Technically, you're right, it's possible for very determined people to pretend they got vaccinated when they haven't...but you could say the same about any paper certificate. Ultimately, unless the data is digitized, anything could be recreated or tempered with.   Having the vaccine-vial sticker on the certificate is common practice. If immigration officers are told and trained about them, for the time being, I think it's a decent solution.",Thailand,t5_2qjw5,/r/Thailand/comments/m5d373/routes_to_recovery/gqzucvz/
178,89,0,1615370203,Its this 3 month vaccine certificate rule that is puzzling me.,Thailand,t5_2qjw5,/r/Thailand/comments/m1lt1t/buying_vaccines_privately/gqfilnk/
179,90,0,1615249998,Card or certificate?  All the vaccine cards I've seen so far have been the kind of thing you could fake in about 5 minutes with a printer and a pen. I'm not sure those are going to be enough...,Thailand,t5_2qjw5,/r/Thailand/comments/m0cyt4/thailand_to_cut_quarantine_for_vaccinated/gq9wlag/
180,0,0,1643635595,"Likely some combination of vaccine passport and forcing all guests to take an ATK test at first. Maybe they allow unvaccinated in with ATK test.  Hopefully vaccine passport is enough, but the clowns in this government pick their covid policies out of a hat so who knows",Thailand,t5_2qjw5,/r/Thailand/comments/sh0bye/will_only_vaccinated_people_be_allowed_in_bars/huznw1p/
181,1,0,1641715763,I’ll match your anecdote with an anecdote.    I got Pfizer when getting Pfizer was difficult to get in Thailand.    When I went to the location they said the Pfizer vaccine was for foreigners only.  My wife (Thai) asked if she could get the shot and they told her “No”.    She showed them her US passport and they welcomed her right in to get a shot.,Thailand,t5_2qjw5,/r/Thailand/comments/rzix46/phuket_covid_19_phuket_opinion_what_are_they_doing/hrw2l33/
182,2,0,1640522739,"BP now reporting about the EU and Thailand agreeing to accept each other's certs. No mention of Sinovac or what exactly ""connected to the EU Digital Covid certificate system"" means in practice still though. They do mention though that it is the Vaccine Passport is accepted now and the Digital Health Pass will be accepted in January.   https://www.bangkokpost.com/thailand/general/2237571/eu-accepts-thai-covid-certificate",Thailand,t5_2qjw5,/r/Thailand/comments/r61lam/covid_information_travel_tourism_and_general/hq0qld6/
183,3,0,1640380082,"The problem is Moh Prompt app is a bit messy. There’s a bunch of different QRs in the same app.    I think for using in EU, it has to be the “Digital Health Pass” one (also the same one in the certificate) and not the one you get in e-Vaccine Passport (that one linked to a different website but shows vaccination status also)",Thailand,t5_2qjw5,/r/Thailand/comments/rnu84j/eu_to_recognise_thai_vaccine_certificate_as_equal/hpulkc6/
184,4,0,1640149467,"42% of 12000 is around 5000 So in 2 years, 5000 kids worldwide died WITH COVID-19. If you take into account that every kid that dies with a positive COVID test gets into this statistic, while the cause of death might be something completely different, the real amount is minuscule.  Therefore vaccinate ALL kids worldwide with a vaccine with unknown long-term side-effects, especially thinking of things that can just be known in 10-20 years like fertility, is absolute madness. The unknown side-effects of the swine flu vaccine were just discovered after several years.  Not even talking about the definite „side-effects“ of governmental control, like the implementation of a digital vaccination passport to track and trace even the youngest. No matter where you go, check in and out with your digital trace and being forced to do that.  When I look at my downvotes, it seems like many people just completely lost their mind based on fear-mongering.",Thailand,t5_2qjw5,/r/Thailand/comments/rlhpv1/kids_511_allowed_pfizer_shot/hpis46s/
185,5,1,1640176289,"Go to app Moh Prompt  Last row, middle column: “International Certificate”  Click on it, on the delivery option click “e-Vaccine Passport”  This is free until 31 Dec 2021",Thailand,t5_2qjw5,/r/Thailand/comments/rm32y1/urgent_question_on_international_covid19/hpjsi3g/
186,6,0,1639923615,I’m flying to Chiang Mai soon and I know you either need to test or show a vaccine passport.,Thailand,t5_2qjw5,/r/Thailand/comments/rjvarg/do_i_need_pcr_test_to_fly_domestic_from_phuket_to/hp64crk/
187,7,0,1639543814,Definitely not a requirement. My (Thai) gf recently flew out of Bangkok on an international flight without the vaccine passport and there was no problem... Seriously though what does it do anyway?,Thailand,t5_2qjw5,/r/Thailand/comments/rg1jdv/does_a_thai_citizen_require_a_vaccine_passport_to/holvpta/
188,8,0,1639465896,"Interesting.  Does the Vaccine Passport have a QR code in it?  If so, then great.  If not, then The QR code in the upper right of the vaccination record issued when people get vaccinated in Thailand is probably 1000% better.",Thailand,t5_2qjw5,/r/Thailand/comments/rg1jdv/does_a_thai_citizen_require_a_vaccine_passport_to/hohgj30/
189,9,1,1639465983,Absolutely not. The only QR code is the hospital certificate. For some reason Thailand decided not to include the QR code on the vaccine passport,Thailand,t5_2qjw5,/r/Thailand/comments/rg1jdv/does_a_thai_citizen_require_a_vaccine_passport_to/hohgnel/
190,10,2,1639466123,"Wow.  Yeah it sounds like people are better off using the document they already have, rather than this vaccine passport.",Thailand,t5_2qjw5,/r/Thailand/comments/rg1jdv/does_a_thai_citizen_require_a_vaccine_passport_to/hohgu9s/
191,11,3,1639466349,"No.  But you need to check the country to are going to and their entry requirement.   When you are coming back to Thailand, as of now, you need to get ThailandPass QR code.  I would assume that if you are thai, you can upload your vaccination from Mor Phrom app information.    However, you can apply for international vaccination certification from Mor Phrom app to travel overseas now - not sure if it’s the same as this yellow vaccine passport book.",Thailand,t5_2qjw5,/r/Thailand/comments/rg1jdv/does_a_thai_citizen_require_a_vaccine_passport_to/hohh5bb/
192,12,4,1639467073,"Correct. I live in Germany. 2 weeks ago I left to the USA and came back yesterday. ( Flew into Spain ) you show your vaccine.   When you arrive in EU, take your vaccine and passport for a pharmacy and they will get you a qr to download the COVID app",Thailand,t5_2qjw5,/r/Thailand/comments/rg1jdv/does_a_thai_citizen_require_a_vaccine_passport_to/hohi4g1/
193,13,0,1638556127,US passport and Pfizer CDC vaccine  card,Thailand,t5_2qjw5,/r/Thailand/comments/r81fgt/thailand_pass/hn3izy8/
194,14,1,1638565066,Does your paper vaccine have your nationality and passport number?,Thailand,t5_2qjw5,/r/Thailand/comments/r73wrv/can_you_use_your_paper_vaccination_certificate_to/hn453ab/
195,15,0,1638400214,"I arrived BKK last night. Flights were from SEA to ICN to BKK. At SEA, the only thing checked was Covid test. At ICN, Korean Air has a separate transfer desk devoted to Thailand travel. They checked vaccine card, passport, insurance, hotel, and Thai pass QR code. The process took about ten minutes. At BKK you exit the plane, walk a bit and sit in a chair. A attendant checks your documents and pulls the one you need going forward - Covid test, Thai pass qr code, boarding pass, and TM6. Then you carry those documents to the Thai pass checkpoint where they scan the qr and stamp the TM 6. After that, hike to immigration. Immigration is pretty much the same as ever except they have added a face photo. After exiting customs, you will see a large number of tables with an even larger number of hotel placards. There are attendants there who will help you find the hotel. 5 minutes wait for the driver and I was on the way to the hotel. My flight landed at 2320 and I was in the car within thirty minutes. One stop in the way to the hotel for Covid test.  Compared to the process for travel approval, the actual travel process is quite efficient (at least it was yesterday).",Thailand,t5_2qjw5,/r/Thailand/comments/r6rtex/travel_process/hmuyx1d/
196,16,0,1637813330,"I am replying to my own post because I just received the Thailand Pass today.  I am from California, USA.  I submitted a jpg image of my paper vaccine card for both doses.  It doesn't have a QR code or a passport number on it.  I got my Digital COVID-19 Vaccine Record from:   https://myvaccinerecord.cdph.ca.gov/  I used Microsoft Paint to crop the QR code from the Digital COVID-19 Vaccine Record.  I submitted the QR code jpg image for the QR code for both doses.  My Thailand Pass was automatically approved in less than one minute.  Here is an article about how to get a digital vaccination certificate from the states in the USA that provide them:   https://www.afar.com/magazine/how-can-i-get-a-vaccine-passport",Thailand,t5_2qjw5,/r/Thailand/comments/ql8xab/my_thailand_pass_was_rejected_due_to_vaccine_type/hlzslm8/
197,17,0,1637643317,"I flew from BKK to CNX today on VietJet. Only thing required was my passport. No test, vaccine or AQ paperwork required u/Boring_Spread4820",Thailand,t5_2qjw5,/r/Thailand/comments/qwxf8b/domestic_travel/hlqedtp/
198,18,0,1637214691,"&gt; He said visitors to blue zone provinces must present a vaccine passport before entering, despite having already had to present it at Suvarnabhumi airport.  As the USA does not offer a ""vaccine passport"" (there's a paper CDC card with handwritten info--some states have a QR code scheme as well), then I guess USA passport-holders won't be entering any blue zones?  • Thailand 2022: We Don't Know Either!",Thailand,t5_2qjw5,/r/Thailand/comments/qwfnrd/new_2022_tourism_campaign_gets_nod/hl37e69/
199,19,1,1637214946,https://www.bumrungrad.com/en/blog-news/covid-19-vaccine-passport,Thailand,t5_2qjw5,/r/Thailand/comments/qwiyfw/does_anybody_know_where_can_i_apply_for_covid/hl37ru3/
200,20,2,1637220113,Can you clarify what's 1500b? As I understand you can only get the vaccine passport for 50b from the listed government venues? And it appears as though all appointments are fully booked.,Thailand,t5_2qjw5,/r/Thailand/comments/qwiyfw/does_anybody_know_where_can_i_apply_for_covid/hl3f6ut/
201,21,3,1637223712,Something no one has mentioned is that there is currently no scenario where this passport is required to travel. Your vaccine certificate is equally valid.,Thailand,t5_2qjw5,/r/Thailand/comments/qwiyfw/does_anybody_know_where_can_i_apply_for_covid/hl3jtls/
202,22,4,1637227103,"There is currently no internationally recognized Covid Vaccine certificate.   Whether you have this passport or not, you need to validate with authorities for your transit and destination if the vaccination documentation is acceptable. This passport, created by the Thai authorities has, as far as I know, never been the subject of an agreement of validity with other countries.  There are, to date, no reports of people being denied the use of the vaccine certificate delivered by the Thai hospitals.  For now this passport only gives the illusion of being ""more official"" but doesn't give any extra value internationally.",Thailand,t5_2qjw5,/r/Thailand/comments/qwiyfw/does_anybody_know_where_can_i_apply_for_covid/hl3nuyd/
203,23,5,1637229538,"I went in person to the building in Bamrasnaradura Infectious Diseases Institute  https://goo.gl/maps/Bn7d5bAj4kkfoprt9  They need to check  a bunch of paper for you, especially if you're a foreigner (passport, visa, vaccine confirmation from the app) etc  edit: as someone mentioned they have now moved the vaccine passport service to Sathorn",Thailand,t5_2qjw5,/r/Thailand/comments/qwiyfw/does_anybody_know_where_can_i_apply_for_covid/hl3qowg/
204,24,6,1637232086,"Nope, I’ve used a yellow vaccine passport from country a in country b.",Thailand,t5_2qjw5,/r/Thailand/comments/qwiyfw/does_anybody_know_where_can_i_apply_for_covid/hl3tpxu/
205,25,7,1637233151,You can do it through the Mor Phrom application and either choose to pick it up in person or have it mailed to you. You need two documents which you can upload straight from the app: 1. Passport page with your photo (the main page) and 2. Vaccine certificate.  Thailand 4.0 at its finest.,Thailand,t5_2qjw5,/r/Thailand/comments/qwiyfw/does_anybody_know_where_can_i_apply_for_covid/hl3v1r4/
206,26,8,1637253690,"It’s actually a health passport with vaccination history details within the passport, it isn’t a COVID vaccination passport, I have had one of these yellow booklets for years, I obtained it in Bangkok for travel to certain countries that required yellow fever vaccination, there are spaces within the booklet for other vaccine history entries",Thailand,t5_2qjw5,/r/Thailand/comments/qwiyfw/does_anybody_know_where_can_i_apply_for_covid/hl4zwz1/
207,27,0,1637138563,"Thanks for sharing the info. I plan on getting my vaccine passport soon and want to make sure I have the right details.  I already made an appointment on the Mor Phrom app and got my QR code confirming both vaccinations. I have an appointment for December 3 but I’d like it sooner and am willing to do a walk-in and wait in person. How long did you wait?  The Ministry of Communicable Diseases at the Ministry of Public Health you mentioned is the location in Nonthaburi listed as - Division of Communicable Diseases, Building 5th, 6th Floor, Department of Disease Control, Nonthaburi Province. Is that correct? There are several buildings with similar names.  I’ll need to show the QR code certificate of vaccination from the app and the other documents they mentioned I should bring - a photocopy of my passport and a photocopy of my vaccine certificate that was issued to me at my second vaccination. I’ll bring the originals too but can this be photocopied there? I don’t have easy access to a copy machine but I’ll make copies before I go if I have to.  Another (older?) version of the requirements said I needed to show an e-ticket for a plane travel within the next three months. Did they ask for this? I don’t have this info because I was planning to buy my ticket after I’ve successfully gotten my vaccine passport.  Thanks so much. Again I just wanted to double check everything before I went so there are no surprises.",Thailand,t5_2qjw5,/r/Thailand/comments/qp4mtm/how_do_i_obtain_a_vaccine_passport/hkyt80n/
208,28,1,1637206522,"Two key paragraphs:  He said visitors to blue zone provinces must present a vaccine passport before entering, despite having already had to present it at Suvarnabhumi airport.  -sounds omnious, throw up more barriers and non sense bureaucracy  Mr Yuthasak added that with all the measures in place, the tourism sector is expected to rebound and meet a target of recovering to 50% of its 2019 level in terms of revenue by next year.  -50% next year ...totally realistic.",Thailand,t5_2qjw5,/r/Thailand/comments/qwfnrd/new_2022_tourism_campaign_gets_nod/hl2sd6y/
209,29,0,1636800269,"It would also be helpful to know places where a vaccine passport is NOT enough, places that also require an ATK or PCR test in addition to the vaccine passport. I believe someone had said Phi Phi islands requires an ATK test. Any others?",Thailand,t5_2qjw5,/r/Thailand/comments/qsxzqw/vaccine_passport_requested_inside_thailand/hkg0kle/
210,30,1,1636803753,But what’s wrong with supporting places that require a vaccine passport? Isn’t it pretty fair that they don’t want to serve you unless they’re sure that you’re vaccinated?  Obviously you could of entered Thailand prior to the test and go system.,Thailand,t5_2qjw5,/r/Thailand/comments/qsxzqw/vaccine_passport_requested_inside_thailand/hkg4odd/
211,31,2,1636806214,"It is easy to have a digital version using Mo Prom. Also, you could just take a picture of your vaccine passport and most if not all would accept it. If you did not have your phone you could print out a copy.",Thailand,t5_2qjw5,/r/Thailand/comments/qsxzqw/vaccine_passport_requested_inside_thailand/hkg7ubi/
212,32,3,1636814645,"I had to show all of them throughout my travel. They don't only check it at arrival, but the airlines want to check all the documents before even letting you get on the plane. The only thing that they didn't ask for was my accomodation, which was required for the QR code. But I decided to list it since its a step you have to take before starting to fill in for the QR code. In my case, they also checked EU vaccine, PCR test, insurance, etc both at airplane booth and at checkpoint on arrival, checking it with my passport.     **Tl:dr : YES, and have them printed out to hand them over when checked**! Even if they allow it by phone, as it was with my group, it heavily delayed the process and caused some to be declined.",Thailand,t5_2qjw5,/r/Thailand/comments/qqnebd/documents_required_for_test_go_program/hkglx5i/
213,33,4,1636828454,"Not true, I got asked in two occasions now. And both times when I said „I do not have a vaccine passport“ they looked at me like I would be the reaperman itself 🙃",Thailand,t5_2qjw5,/r/Thailand/comments/qsxzqw/vaccine_passport_requested_inside_thailand/hkhh3e2/
214,34,5,1636858891,"Was never asked for "" vaccine passport "" for entire year there 2020-2021 . Although was asked for a driver's license after crashing a moped drunk which 2000 baht solved the issue including a ride to the resort on a police moped",Thailand,t5_2qjw5,/r/Thailand/comments/qsxzqw/vaccine_passport_requested_inside_thailand/hkjez4x/
215,35,6,1636860871,"That's right That's why everyone got covid in 2021 ;) 🍸I got there last December came back this October.  There was  no checking on any "" vaccine passport """,Thailand,t5_2qjw5,/r/Thailand/comments/qsxzqw/vaccine_passport_requested_inside_thailand/hkjj1e9/
216,36,7,1636862234,"vaccine passport is an actual thing in Thailand now, hospitals are issuing them, mainly to people in Thailand who need to travel overseas.  vaccine certificates or proof of being vaccinated is a separate thing.  in many countries it is just a paper card.  in thailand it is a digital QR code on an app.",Thailand,t5_2qjw5,/r/Thailand/comments/qsxzqw/vaccine_passport_requested_inside_thailand/hkjlvc2/
217,37,8,1636862669,So the Thailand pass as they called now which replaced coe now it's considered vaccine passport? I am confused.  Because I just got my Thailand pass for flying out next March 2022 back to Thailand. Am I missing something???,Thailand,t5_2qjw5,/r/Thailand/comments/qsxzqw/vaccine_passport_requested_inside_thailand/hkjmra5/
218,38,0,1636638138,"Thai Pass approval for traveler from US:  I applied on Nov 4th and was just approved today (Nov 11). I submitted the SHA page from my hotel in Bangkok, CDC card from US with my nationality and passport number handwritten on the front (no QR code), AXA Swasadee certificate page, and screengrab from my airline's booking page to confirm return flights.  No additional requests or questions were asked. I received the automated reply when I initially submitted my application, too.  Edit: Just scanned my own QR to see what comes up, and it's only my name, approval date, DOB, which vaccine I received, and the dates on which I received my 2 covid vaccines.",Thailand,t5_2qjw5,/r/Thailand/comments/qk40mp/covid_information_travel_tourism_and_general/hk78uf9/
219,39,0,1636379312,"I just go my yellow vaccine passport done last week. I used it to get into Australia.  You need to register on Moprom app, apply for an international vaccine passport, upload ur documentation and wait for verification. Should only take 2 days to verify and then u should be able to see that Moprom has recorded that you have done 2 vaccines and have a QR code.   This QR code certificate of vaccination on the Moprom app is very important. You need to show this at the Ministry of Communicable Diseases when u go pick up ur yellow vaccine passport.  After verification, you can pick up ur yellow passport as walk-in (takes some hours) or book in advance via app (currently 1 month in advance). The ministry of communicable diseases is at the ministry of public health   Hope this helps….",Thailand,t5_2qjw5,/r/Thailand/comments/qp4mtm/how_do_i_obtain_a_vaccine_passport/hjswt72/
