,Unnamed: 0,Unnamed: 0.1,created_utc,body,subreddit,subreddit_id,permalink
53,53,0,1632962594,Halfway down this article they say Walgreens went with CLEAR  https://www.macworld.com/article/353620/iphone-covid-vaccine-passport-app.html,Thailand,t5_2qjw5,/r/Thailand/comments/pxkzo2/us_cdc_vaccination_cards/heskci7/
54,54,0,1632116271,"&gt; I thought the offenses could have been related to overstay given the similar.  There's no need for overstay right now because of Covid, you just have to go to the immigration department every 2 months to extend your visa, they approve everyone. Many people have been living here on just tourist stamps in their passport for about 1.5 years now.",Thailand,t5_2qjw5,/r/Thailand/comments/prn5bm/thai_police_helped_arrest_a_malaysian_transgender/hdk50op/
55,55,0,1630853155,"In regards to Insurance I deal with Pacific Cross . A lot of expats use them. They are very good to deal with . My contact is Jamie Edwards . He works directly for the Company. His email is (jamie.e@th.pacificcrosshealth.com).  You can always drop him a line if you wish and ask a few questions.  Basically I just went on the website and got the info and sent my Passport up to Ottawa by mail from Nova Scotia. Now I realize things are different with Insurance COE documents, Hotel booking etc.  I would advise you to come into Phuket via the Sandbox program. You don’t have to do quarantine, just check into one of the approved Hotels . They will do a Covid Check and then you are free to explore the island. After 2 weeks you can go to other parts of the Country. As a Canadian you don’t have to bring money over. Immigration will accept letter from the Canadian Embassy. Your best bet is to go to the CRA website log into your account and print off a Proof of Income letter.  That’s one reason I like Chiang Mai because of the Canadian Consulate. They are super helpful there.  Assist Thai Visa is the Agent I use in Chiang Mai . They are very professional and have close Thais with the Expat Club .   I am in Phuket at the moment, but hope to get back to CM soon.  Actually Jamie Edwards used to work in Bangkok at Pacific Cross head office , but he is based in Phuket now. Hope this was some help. Cheers",Thailand,t5_2qjw5,/r/Thailand/comments/phbtlu/non_immigrant_oa/hbox3dx/
56,56,0,1630556079,"Yeah, it's probably a good indication of what they will accept as inbound proof, if that is what the user above is asking. As the article states:  &gt;Several vaccine passport solutions have begun to roll out in different countries across the world with the most recent one being in Thailand. The idea is simple and a vaccine passport aims to give travelers a physical or digital record to verify that a citizen has been fully vaccinated and authorized for entry.A vaccine passport will most likely be part of the mandatory travel documents people need to present to travel in the near future and according to a recent article published by local media The Thaiger, Thailand has introduced their version of an international vaccine passport certifying Covid-19 immunization.  I was just looking at entry [requirements for Spain](http://www.exteriores.gob.es/Embajadas/BANGKOK/en/Noticias/Pages/Articulos/How-to-enter-Spain-from-Thailand,-Cambodia,-Laos-and-Myanmar---Traveling-in-times-of-covid-19.aspx):  &gt;• To have had the last recommended dose of the vaccine at least 14 days before entering Spain.• Only vaccines authorized by WHO or by the European Medicines Agency (Pfizer, Moderna, Astra Zeneca, Janssen, Sinopharma and Sinovac) are accepted. Astra Zeneca shots made in Europe, India and South Korea are also accepted, **but not those made in Thailand by Siam Bioscience, as it has not yet been approved by either WHO or EMA**.• The vaccination certificate is accepted in Spanish, English, French or German.• The vaccination certificate must include the name and surname of the applicant, date of vaccination and doses, type of vaccine and number of doses administered, issuing country and identification of the issuing body of the vaccination certificate.  They talk about a certificate and not a passport but sure they will accept the Thai passport, so long as it has the details which I think will be standard on these types of docs.",Thailand,t5_2qjw5,/r/Thailand/comments/pfi2to/covid_information_travel_tourism_and_general/hb9yywa/
57,57,0,1630375305,"I got an email through from Samitivej Sukhumvit Hospital. They offered me Pfizer for September 4th. It was in my spam folder so make sure you check yours if you registered on the expatvac website.   &gt;The appointment for your COVID-19 shot (Pfizer) is September 4, 2021, 1:30PM - 3PM at Samitivej Sukhumvit Hospital. People with any of seven underlying diseases or at least 12 weeks pregnant must present evidence and personal identification at the vaccination site. The evidence can be a picture of medical records containing information about the specific disease or pregnancy, or prescriptions in the patient’s name. Evidence of underlying disease should be no more than one year old. If the hospital finds that any information provided is incorrect or does not match the information on your passport, Samitivej Sukhumvit Hospital reserves the right to refuse your vaccination.",Thailand,t5_2qjw5,/r/Thailand/comments/ovhvw2/covid_information_travel_tourism_and_general/hb092lm/
58,58,0,1630036985,They haven't permanently suspended the visa exemption program. This is more like a COVID preventive measure than anything else.  &gt; The OP can now visit Japan for 2 weeks with a Thai passport vs 90 days on his American one.  Wow that's something to be very proud of.,Thailand,t5_2qjw5,/r/Thailand/comments/pbg4lh/obtaining_citizenship/haikdrg/
59,59,0,1629990698,"While you can't get in ""trouble"" they can rescind or change your dates. Personal experience - husband and I both did extensions on the same day. The office had his expiry date 10 days before mine. We questioned it, they changed the date in his passport, didn't change it online. Our next covid extension was completed for the same dates,two weeks later we received a call from immigration telling us we had to return to the office and that dates would be changed.  Friends on an STV, already had the 2 extensions, tried to change to the 60 day covid in Satun and were denied. That was in June.",Thailand,t5_2qjw5,/r/Thailand/comments/pb6tw8/any_chance_of_changing_stv_visa_to_something_else/haflk8o/
60,60,0,1629871598,"Yeah there are quite a few documents that need to be submitted. I can see why some people will find this annoying. But i think if you inform yourself in time and know what you have to do it's okay. You mostly have to pay for things and then upload receipt. All document have to be uploaded at the COE (Certificate of Entry) website where an embassy staff will approve it or let you know what's missing. In the end they isue you the COE.  Those are the required documents:  \- your passport and visa copy   \- visa supporting documents i.e. marriage cert and wife's id    \- proof of vaccination   \- covid specific insurance   \- flight booking   \- hotel booking   \- PCR test bookings   \- something called a SHABA certificate that the hotel will send you after your booking  You have to plan a bit with the timing of what you need when, i.e. if you just got vaccinated you gotta wait 2 weeks before flight and things like that.",Thailand,t5_2qjw5,/r/Thailand/comments/pb23p0/im_on_day_5_of_the_phuket_sandbox_if_you_have_any/ha9f4q9/
61,61,0,1629776034,"There's no vaccine/travel passport set up yet, I don't think they've even agreed on how that system'll work - we only have a name for now ([Thai Covid Pass](https://www.bangkokpost.com/thailand/general/2169923/thailand-to-shift-strategy-to-learning-to-live-with-covid-19)). Need to wait and see how that one plays out and whether it'll be the same thing for travel and venues, or two (or more) separate systems.  You should receive a paper record of some sort after the second shot though.  You should also be able to enter the details from that paper into the Mor Prom app, which should show your vaccination status (Thai language only, of course).",Thailand,t5_2qjw5,/r/Thailand/comments/pafcqs/to_those_who_received_both_your_covid_shots/ha4bwsi/
62,62,1,1629779166,"There is a travel passport - its the yellow book.  Can't be bothered to upload a photo, but you can google it.  I got mine yesterday.     I did make a post on thethaiger with details.  Here -    https://thethaiger.com/talk/topic/2775-thailand-covid-19-certificate-of-vaccination-vaccine-passport/?do=findComment&amp;comment=41584",Thailand,t5_2qjw5,/r/Thailand/comments/pafcqs/to_those_who_received_both_your_covid_shots/ha4hf4f/
63,63,2,1629782862,"It's literally what they call it in all the media.  It's a document for travel.   I'm just answering the op's question with details.  Pretty much everyone is calling it the vaccine passport, so whether you accept it or not is up to you...  To repost the Bangkok Post link where they call it the Vaccine Passport   https://www.bangkokpost.com/thailand/general/2102771/thailand-adopts-use-of-jab-passports   ""The government has announced it will adopt the so-called **vaccine passpor**t, a certificate of vaccination, for use with Covid-19 vaccination in Thailand as an official travel document for those already vaccinated against Covid-19 and travelling to other countries.""",Thailand,t5_2qjw5,/r/Thailand/comments/pafcqs/to_those_who_received_both_your_covid_shots/ha4n1us/
64,64,3,1629782936,"But it's not the Thai Covid Pass mentioned in my first link, which will allow access to restaurants, etc.   That's what most people consider a ""vaccine passport"" to be, IMHO.",Thailand,t5_2qjw5,/r/Thailand/comments/pafcqs/to_those_who_received_both_your_covid_shots/ha4n5k7/
65,65,0,1629380242,"Because ""AztraZeneca"" is technically not a vaccine, it's the company. And that company has licensed several different versions of the vaccine.   The UK is vaccinating people with Vaxzevria (formerly known as Oxford AstraZeneca). Vaxzevria obviously has full EU approval.  India (for example) is vaccinating people with AstraZeneca's Covishield and Covaxin. These vaccines haven't gotten full EU approval yet so theoretically you can't get the vaccine passport or whatever. It's pretty dumb but surely will get sorted out soon.  https://qz.com/2026656/the-eu-digital-covid-certificate-excludes-the-covishield-vaccine/  This article is already out of date, but does explain the initial situation.",Thailand,t5_2qjw5,/r/Thailand/comments/p7dmck/will_europe_recognise_my_covid_jab_as_a_thai/h9j4y0v/
66,66,0,1629106884,"Pleasant:  Civil marriage, in and out very quickly.  Wife renewal of passport. Done in less than an hour, a similar process takes weeks back home.  DLT: First driving licenses made very quickly with translation of my original license. Renewal at a DLT during covid, I didn't know you had to take appointments beforehand and they were all filled up for the next 2 months. After a quick 2 minutes pleading, the lady in charged added me to the list. Came back a week later and did my 5 years renewal pretty quickly.  Immigration: usually no problem at all, unless... you get the vicious asshole from Phuket immigration who sadistically enjoy rebutting applicants with a new daily document requirement.",Thailand,t5_2qjw5,/r/Thailand/comments/p5av6j/whats_your_most_pleasant_and_unpleasant/h94yvpk/
67,67,0,1628264146,"Reality: Only 37% of US citizens have a valid passport and many of those people will hesitate to travel to a country where an American has either died in an accident or been killed at a crime scene that was subsequently trampled by gawking locals. They'll even warn their friends about the place.  Fantasyland: 30% of adult US citizens refuse to get a free and widely available Covid vaccine or even wear a mask because reasons while 650,000 US citizens have died due to the Coronavirus Pandemic in the past 18 months alone and not many people in the US of A will hesitate to gather with the locals or hop on a plane and go party with the locals in another part of the country, completely fearless and unworried about catching the virus and having their grave trampled by a bunch of gawking locals.  tl;dr: don't trust Americans do behave in a rational manner.",Thailand,t5_2qjw5,/r/Thailand/comments/oyz91p/how_burmese_workers_in_phuket_feel_right_now/h7y2kkp/
68,68,0,1627918955,"This is about their internal digital Covid passport, it's not that Thai AstraZeneca is not valid for travel for people coming from outside the EU. It was misreported.  &gt;However, the digital passport isn’t a mandatory document to travel to the EU, but it is a practical tool, which eases travelling within the member states, the statement also noted.  &gt;Fully vaccinated people, including those vaccinated with vaccines that haven’t yet been approved by the European Medicines Agency (EMA), are allowed into the EU, which have passed WHO’s Emergency Use Listing process.  &gt;“There is no obstacle or hurdle. Therefore, some recent reporting concerning the AstraZeneca vaccines’ origins is inaccurate,” the statement reads.  https://www.schengenvisainfo.com/news/eu-delegation-to-malaysia-says-all-who-approved-vaccines-are-valid-for-travel-to-eu-including-covishield/",Thailand,t5_2qjw5,/r/Thailand/comments/ow7ef6/yesterday_i_registered_for_vaccine_from_expatvac/h7fum1o/
69,69,1,1627985080,"&gt;	Things happen even if you think you are fully prepared.  Forgetting evidence of your Covid vaccination before you board a flight these days is like forgetting your passport, or going to a concert and leaving the ticket at home.  Sure, bad things happen to forgetful and careless people as you yourself acknowledge, but OP is making it seem like it’s not fully his fault.",Thailand,t5_2qjw5,/r/Thailand/comments/owyidh/got_denied_on_my_flight_to_phuket_because_i_did/h7jb1nm/
70,70,0,1627855549,There are big protests going on all over the world against covid lockdown and vaccination passport policies.  Just because the corporate media isn't covering them doesn't mean they're not happening.,Thailand,t5_2qjw5,/r/Thailand/comments/ovrgho/protesting_on_dindaeng_road/h7d0lyr/
71,71,0,1627613152,"Well, there was a French expat retiree pissing and moaning on Facebook about how he won’t go back to France and be forced to get the vaccine and how Thailand can’t make him get vaccinated either.    Then someone asked what if they require vaccination for all long-term visa extensions.    Two days, no answer.    LOL.    Another guy, who I don’t think is American, posted that the only two things he needs to travel are his middle finger and a passport.    LOL.    It’s not just Americans that are raging assholes about this Covid stuff.  Lots of idiots everywhere.    Probably worse in the expat communities because expats are sort of independently minded people.    Many of them left their home country because they were unhappy or fed up there.     And a large percentage of those people are just unhappy people to begin with.  Turns out it had nothing to do with their home country.  ;-)",Thailand,t5_2qjw5,/r/Thailand/comments/otv9g7/import_used_cars_to_thailand/h71d7c6/
72,72,0,1627552251,"Excuse me, It was the British Chamber of Commerce. Here is what we received at work earlier this month:  Thank you for your patience. We are planning to send our list for vaccination to the Department of Disease Control at the Ministry of Public Health this Friday 9th July.  Therefore this list will close at midnight on Thursday 8th July.  We are focusing on the AstraZeneca vaccine.  Some have asked about vaccinations for their non-British spouses or carers. We will do our best to support these. Soonest please email the following details to – greg@bccthai.com.  Name: Gender: Date of birth: Thai ID card number or passport number (if non-Thai): Address: Mobile number: Email (if applicable):  Best regards  Greg Watkins  To contact us by email:   General Enquiries: greg@bccthai.com Technical Enquiries: david@bccthai.com   To UnSubscribe from the ""Covid-19 Vaccination Group"" Mailing List, please click here. หอการค้าอังกฤษ - ไทย British Chamber of Commerce Thailand 23rd Floor, M Thai Tower, All Seasons Place, 87 Wireless Road, Lumpini, Pathumwan, Bangkok 10330 Tel: +66 (0) 2651-5350-1 Email: contact@bccthai.com Location Map: Thai/English Copyright © 1998-2020 British Chamber of Commerce Thailand, All Rights Reserved. Disclaimer/Terms of Use | Privacy Statement",Thailand,t5_2qjw5,/r/Thailand/comments/ots79t/another_vaccine_rollout_program_designed_to/h6xsfpx/
73,73,0,1627286455,"Looking at flying too Thailand Phuket sandbox   Currently in Australia with U.K. passport    Correct me if I’m wrong this is what I need   proof of vaccination RT-PCR test before arrival and during your stay in Phuket  COVID-19 Insurance  SHA+ Hotel in Phuket  2 weeks but can change after 1 week    Certificate of Entry (COE)   The coe what I’m not sure about   When I go to apply it gives you options As why you’re applying   The only option I fit In is   Tourist visa    When I click on this link is says   “Application not currently available”  I read this is what I need online    Copy of the tourist visa, non-immigrant visa, or extension of stay with a re-entry permit or “no visa for some countries”   Coe says I need a visa   Internet saying there is 60+ countries that don’t need visa   Any info or advice would be great   Thanks",Thailand,t5_2qjw5,/r/Thailand/comments/ob9tve/covid_information_travel_tourism_and_general/h6kc0a5/
74,74,0,1627166449,"Native Thai, need to pay 2 years worth of taxes on my vacation rentals as well as visit family.  The first name on my Thai passport is spelled differently than on the COVID Vaccine card, I am wondering if I should enter the country with that or use my US Passport.",Thailand,t5_2qjw5,/r/Thailand/comments/oqnbdx/foreigners_that_are_planning_on_coming_to/h6ewqu7/
75,75,0,1626480785,"Is it ok to come to thailand in September? I just want to rent a place, eat or drink in restaurants, go to yoga, go to co-working. I work online and want to stay. I have a Canadian passport. Will it be safe? Will it be enjoyable? Will the covid restrictions be manageable?",Thailand,t5_2qjw5,/r/Thailand/comments/ob9tve/covid_information_travel_tourism_and_general/h5gm9hb/
76,76,1,1626519202,"Well, I know I'm in the minority, but I'm not impressed with how ""organized "" it is. (Sorry for the typing, I'm on the phone).  The first time i was out in around 45 minutes or so.  Second shot, i was there for 2 hours.  To get to the 9th floor you wait for really slow elevators as people gather all around you. Then everyone crams into the elevator up to the 9th floor.  The entire process is indoors in a narrow L shaped corridor.  There were 9 stops.  9. No reason it couldn't have been 2 or 3. Besides the around 150 or so numbers I heard called while i was there, there were dozens of workers (no wonder all these health workers keep testing positive).  Most of them were unnecessary and shouldn't have been there.  There were no accommodations for covid, it was just the usual snap the ""system"" into place and it hopefully fits what you're trying to do.  The number of people up there and the time spent there should have been limited at every chance.  Nothing was cut out and it could have just as easily been a pre-covid event.  And I don't think the spacing between chairs was sufficient at all.  But it doesn't even matter as much when you are in an enclosed space like that, worsened by the crowds.  The 30 mns waiting time should have been cut out for safety concerns. If someone feels unwell, they can return.  People should have been let go and allowed to remain in the area or not far away.  I've never had more than a cup of orange juice and sent away when vaccinated in the past.   Then i get handed a pathetic little piece if paper that says ""Thailand certificate "" for covid vaccine.  It's useless.  Then i was told I had to go to one of only three places to get a vaccine ""passport"". So i had to travel to nonthaburi arrived at 6AM and spent another 3 hours indoors with more people not really respecting social distancing.  One lady checks the papers, then you hand them to a lady at a window at 6.30. At 8 am she calls your name and hands them back to you, telling you to go upstairs where you start again.    So total I spent 5 hours indoors, not including two round trips traveling, in two days.  Probably there will be many posts following telling me I'm a shit head, been it's caused great anxiety.  I stayed in or traveled thru more than a dozen countries on 4 continent's since end of 2019, I've been safe so far, but so totally vulnerable the past two days.  Villa was a madhouse just now too, it's ridiculous.",Thailand,t5_2qjw5,/r/Thailand/comments/ob9tve/covid_information_travel_tourism_and_general/h5i5frf/
77,77,0,1626251939,"As far as I am aware, no one has been denied the Covid visa extensions yet. I've also been staying on this since March last year and most of the people I see at the immigration center at MTT are all obviously working here. I even saw a Laos passport holder in work uniform as she came to extend her tourist visa.",Thailand,t5_2qjw5,/r/Thailand/comments/ojzgtj/is_immigration_allowing_people_to_stay_in/h54u33u/
78,78,0,1624438193,"Maybe they need him there but I would assume not. I'm never usually required to be there for that kind of thing. Often, as long as my wife has a signed copy of my passport she is fine. Just make sure the signature is in blue ink! She was refused once when I used a black pen because it could have been a photocopy of my signature.  Just be aware that the country isn't very open right now and will require you to have vaccination papers for covid-19 and to quarantine for 14-days on arrival. I think that's changing in a few months though. Do check though. I haven't entered the country in ages because covid etc so I'm going on what I can remember hearing.",Thailand,t5_2qjw5,/r/Thailand/comments/o68egz/how_long_does_it_take_to_get_id_in_bangkok/h2qynhy/
79,79,0,1623969118,"Hey everyone!     I am moving to Thailand and my flight is on July 6th. I will be teaching there and have received all of the documents from my school. As soon as I received the documents, I followed the pre-covid directions and sent all of my materials in. Through perusing the internet, I found that I should have applied for the visa online prior to sending my passport and such to them. It was a careless mistake but when I called and listened to the recording about a visa, it was never once mentioned. Oh well.   I applied online, printed the barcode sheet, typed up a letter, and mailed that in separately from my other documents (passport and flight info). I've called several times and have done all that they have asked me to do, although the gentleman has been hard to understand. I think he was on a speakerphone.    I am just freaking out and nervous that I won't have it back in time. I know that there is still time but can someone tell me how long it has taken for them to get their visa back from the Chicago consulate once they received their documents? I know that there isn't much I can do and I don't blame them as I know they are trying their best; however, my anxiety heightens every time I see ""post your passport and e-visa appointment"" on the status page.    Thanks in advance! :)",Thailand,t5_2qjw5,/r/Thailand/comments/npgv93/covid_information_travel_tourism_and_general/h2580cy/
80,80,0,1623701329,"You normally swap over mid flight, enter/exit UK on UK passport and enter/exit Thailand on Thai passport. This is actually how country's want you to do it, if citizen of a country always enter on that ID.  Do not mix them up, ie enter country on one, exit on the other, as it could cause to be on overstay or classified as an illegal entry on your foreign ID.  Covid and Thai COE system has made this a bit more difficult when going to Thailand though, as your flight check in is tied to your COE, not sure how people getting around that",Thailand,t5_2qjw5,/r/Thailand/comments/nzrubw/is_dual_citizenship_with_thai_being_one_half_of/h1ror83/
81,81,0,1621852665,"&gt;If so, you can ask your local motosai or a trusty person to do it for you for a few hundred baht. He/she would need a signed copy of your passport and most likely a power of attorney form.If there's no amount indicated on the receipt, they probably want you to be there while they inspect the package and assess the duty  There is an amount on the receipt given, 259thb with a chop of 20thb, probably not worth paying someone else to pick it up for me  I was hoping there was some way to just pay the fees online and have it delivered the last 4km since I want to avoid going out with so many covid cases recently  Its a small package, I don't get why they can't just bring the package here and have me pay the duties on collection.. entirely defeats the purpose of giving my exact address for shipping lol",Thailand,t5_2qjw5,/r/Thailand/comments/njr62l/thailand_post_customs/gz9c4az/
82,82,0,1620694516,"&gt; Can I come to Thailand next month as an American?   Yes, if you're willing to quarantine.  &gt; How long can I stay?   I think the tourist visas are 60 days, but there's probably ways to extend that or switch to a different visa. I'm not too sure about this in the COVID era though.  &gt; How do I know if my passport needs to be renewed, and if so, how do I go about that?   Uhh, look at the expiry date then subtract 6 months (as most places won't give you visas in the last 6 months anyway)? I don't know who to contact in the US to do it, probably state department or something, if overseas your embassy.",Thailand,t5_2qjw5,/r/Thailand/comments/n26q29/covid_information_travel_tourism_and_general/gxod4jq/
