,Unnamed: 0,Unnamed: 0.1,created_utc,body,subreddit,subreddit_id,permalink
125,36,0,1636379312,"I just go my yellow vaccine passport done last week. I used it to get into Australia.  You need to register on Moprom app, apply for an international vaccine passport, upload ur documentation and wait for verification. Should only take 2 days to verify and then u should be able to see that Moprom has recorded that you have done 2 vaccines and have a QR code.   This QR code certificate of vaccination on the Moprom app is very important. You need to show this at the Ministry of Communicable Diseases when u go pick up ur yellow vaccine passport.  After verification, you can pick up ur yellow passport as walk-in (takes some hours) or book in advance via app (currently 1 month in advance). The ministry of communicable diseases is at the ministry of public health   Hope this helps….",Thailand,t5_2qjw5,/r/Thailand/comments/qp4mtm/how_do_i_obtain_a_vaccine_passport/hjswt72/
126,37,0,1636365938,"Richard Barrow picked one up recently and took it to the UK with him. He didn't need it at all.  You already need a vaccine certificate to get the yellow booklet, and I think most (all?) countries will prefer to see the former.",Thailand,t5_2qjw5,/r/Thailand/comments/qp8v94/is_the_yellow_thailand_vaccine_passport_book/hjsd0f6/
127,38,1,1636366290,in australia you apply for an international vaccine certificate which has your passport number and a QR code linked with your passport,Thailand,t5_2qjw5,/r/Thailand/comments/qlofu5/has_any_american_received_thailand_pass_approval/hjsdeew/
128,39,0,1636104445,"Yep, I think you’re correct, this is from the Thai Airways page and is UK departure specific:  VACCINATION AND TESTING REQUIREMENTS   - All travellers entering Thailand under this scheme must be fully vaccinated against COVID-19 for more than 14 days, with a vaccine approved by the MoPH or the WHO.   For travellers from the UK, the NHS COVID Pass or vaccination record is accepted as proof of COVID-19 vaccination. Travellers from Ireland can obtain and present the EU Digital COVID-19 Certificate.    - A COVID-19 test with a laboratory result indicating that COVID -19 is not detected (COVID test must be by RT-PCR method), issued within 72 hours before departure is required. Please note that this is required for all travellers, irrespective of nationality and age.   - A COVID-19 RT-PCR must be undertaken upon arrival in Thailand.",Thailand,t5_2qjw5,/r/Thailand/comments/qmnl89/do_i_need_to_book_a_sha_hotel_as_a_thai_resident/hje8c59/
129,40,0,1635964295,"I have an EU QR code on my vaccine certificate, but still waiting 13 hours and haven't gotten any mail from them, not even confirmation mail. I used my hotmail though. Anyway I'm going to try again with gmail if no response after 48h because i booked my flight for next week -_-",Thailand,t5_2qjw5,/r/Thailand/comments/qlx4w4/useful_information_about_thailand_pass/hj6jbao/
130,41,1,1635967337,"Booked an AQ hotel from Agoda and chose ""other"" in the form since they ask which website i booked via.  I have applied for two Thailand passes with the working method, each for different persons and on mine i added quarantine certificates from dose 1/2 and dose 2/2 plus cropped the QR code from each certificate and added in the QR upload section.  However the other person only has his vaccine certificate for the second dose 2/2   so i just added same certificate on both sections, also same QR code on both since there was only one to be had.   Oh and i almost forgot, the application asks for passport number in the vaccine certificate and as you might know it does not have it so i added that myself in [paint.net](https://paint.net) program. However i don't think this would have mattered because i dont think a computer can read that detail so fast.  Both was approved immediately.",Thailand,t5_2qjw5,/r/Thailand/comments/qlx4w4/useful_information_about_thailand_pass/hj6r9cz/
131,42,0,1635929803,Singapore has passport number on the vaccine certificate.,Thailand,t5_2qjw5,/r/Thailand/comments/qlofu5/has_any_american_received_thailand_pass_approval/hj4js6f/
132,43,0,1635859120,"Too soon to say. Check their websites in January.   Currently I'm not sure what you need for Chiang Mai or Samui. No requirements for Bangkok.   I do know that for Phuket you need to pre-register with GoPhuget and show either a vaccine certificate or a negative test, your destinations are likely similar.   But requirements for all of those destinations could very easily change by January, things are moving pretty quickly.",Thailand,t5_2qjw5,/r/Thailand/comments/qk40mp/covid_information_travel_tourism_and_general/hj0albs/
133,44,0,1635778357,"For me I had two doses of pfizer, on my certificate there are two  QR codes, one for each dose.  The vax data section asks you for two files for each dose   1) vaccination status   2) QR code   For the vaccination status just put in a jpeg version of vaccine status letter/certificate. In the UK you can access this through NHS inform.   If your vaccine certificate or card has both doses on it, just upload it twice (once for each dose)   In the QR code section they want a cropped version of each QR code for each dose.  So if you have a vaccine status letter with QR codes on it, you need to crop those (leave a wee border around them). And submit the QR code to its relative dose.",Thailand,t5_2qjw5,/r/Thailand/comments/qkel6z/anyone_getting_this_error_when_trying_to_submit/hiw1fhn/
134,45,0,1635754750,"Nope, just showed them our passport and they confirmed our name matched the vaccine certificate.",Thailand,t5_2qjw5,/r/Thailand/comments/qk40mp/covid_information_travel_tourism_and_general/hiv28bi/
135,46,0,1635689708,"As long as you're vaccinated and coming from one of the approved countries (without being in an *unapproved* country in the previous 21 days), then yes - that should be the case.  The airline flying you to Phuket on day 2 will want to see your vaccine certificate though, and I think you still need to register on GoPhuget before you fly.",Thailand,t5_2qjw5,/r/Thailand/comments/pyxe5y/covid_information_travel_tourism_and_general/hirkxb1/
136,47,0,1635656334,If you get 2 jabs you get given a vaccination certificate. You can convert this to a vaccine passport. Friend of my wife had to do this to go to Australia.,Thailand,t5_2qjw5,/r/Thailand/comments/qjh0k8/vaccination_in_thailand/hiqc4bg/
137,48,0,1635519612,"Yes in Greece they give booster shots to people between 50 and 59 years old, and they have to have an underlying condition to get it. Thailand will let in everyone with a vaccine certificate even if antibodies is not present in the body anymore. Thats my point.",Thailand,t5_2qjw5,/r/Thailand/comments/qhhgh5/thailand_pass_details_confirmed/hiiqgee/
138,49,0,1635464854,"Okay, yeah, I forgot that months later I got a QR code that links to a record in the California database (I guess). I suppose that is more ""official"" than the paper CDC card, which can be so easily counterfeited. However, I would still like a specific answer to the question of what exactly the Thais are referring to when they say ""vaccine certificate."" I'm sure I'm not alone in this.",Thailand,t5_2qjw5,/r/Thailand/comments/qhxhc0/where_to_get_vaccine_certificate_usa_for_coe/hig4o13/
139,50,0,1635225789,"to add to what /u/IBeAPOENewb said (which I agree with)  Thailand does have an official vaccine passport (got it recently in case I needed to travel abroad urgently), but currently it doesn't have much use, there are plans in the future for it to be useful but not right now (and as with many Thai government plans, it may not come to fruition).  When you get to Sweden I don't think they'll care whether you have the official Thailand vaccine passport (as they won't recognize it anyway) or just the vaccine certificate, and will probably just accept either.  Best to check with relevant embassys/immigration departments/flight carriers.",Thailand,t5_2qjw5,/r/Thailand/comments/qfz1lw/is_vaccine_passport_different_than_vaccine/hi2x0ho/
140,51,1,1635227244,"Like an actual digital certificate that is issued by the country? Australia provide a vaccination certificate (the same as any other vaccine), it’s on the immunisation history and they provide an internationally accepted vaccination certificate.   The US doesn’t seem to have anything similar that is issued by the federal government.",Thailand,t5_2qjw5,/r/Thailand/comments/qfgpgx/simplified_guidelines_for_entry_from_approved/hi2z070/
141,52,2,1635255049,"There is no common definition of what a ""vaccine passport"" is. Confusingly, it's usually not required for travel, but rather for access to places (e.g. stores, gov't offices) within the country.   Some countries accept a domestic vaccine certificate as a ""vaccine passport"" but I would be surprised if they accepted a foreign one.   You need to find out what Sweden requires as a ""vaccine passport"", and how to obtain it based on your Thai vaccine certificate. Could be an app, could be a document with a QR code, not sure.",Thailand,t5_2qjw5,/r/Thailand/comments/qfz1lw/is_vaccine_passport_different_than_vaccine/hi41l83/
142,53,0,1634840900,Think its a more of a mix of economic choices (for example USA) mixed with those who implimented WHOs Public Key Infrastructure (PKI) vaccine certificate (that makes it easy for app to recognise foriegn certs),Thailand,t5_2qjw5,/r/Thailand/comments/qcwdyr/list_of_countries_approved_for_nov_1_2021/hhisd5q/
143,54,0,1634622558,"My sister in law flew in on the 6th and said when arriving at CNX the official asked for vaccine certificate and for those that didnt have one, they needed to do a covid test (at your own expense i presume). Not sure if things have changed since then.",Thailand,t5_2qjw5,/r/Thailand/comments/qb4wf9/anyone_domestically_go_to_chang_mai_lately/hh7ab4z/
144,55,1,1634624412,"I think what they mean is that instead of MorChana only being a digital vaccine certificate, it will be expanded to provide a pass for those who recovered from COVID-19 or have a recent negative test result. Just like it's done in much of Europe.",Thailand,t5_2qjw5,/r/Thailand/comments/pyxe5y/covid_information_travel_tourism_and_general/hh7cnoo/
145,56,2,1634644312,"Mor Prom has the ""vaccine certificate"" which shows the date of your jabs, as well as the ""digital heath pass"" which does not.",Thailand,t5_2qjw5,/r/Thailand/comments/qb3y9a/vaccine_question/hh80cfv/
146,57,0,1634478922,"Moderna was barely approved back then ([13 May](https://www.bangkokpost.com/thailand/general/2115195/thai-fda-approves-moderna-vaccine)).  There also weren't any embassies offering that vaccine back then, I'm fairly sure of that. That leaves two options, either an under-the-counter vaccination (wouldn't that be hard with the logistics involved? And would her other employers foot the steep cost?) or, perhaps more likely, it could be a fake certificate.",Thailand,t5_2qjw5,/r/Thailand/comments/pyxe5y/covid_information_travel_tourism_and_general/hgzgbb9/
147,58,0,1633789938,"Hello,  I’m an American expat living in Mueang Nakhon Nayok, Thailand.  In June/July I received 2 doses Sinovac COVID-19 vaccine.  I walked into a Lak Si vaccination clinic in early June as a high priority candidate (age and comorbidity heart and liver cirrhosis diseases) for COVID-19 vaccinations.    My cardiologist has ordered (documented on Medical Certificate) an immediate COVID-19 mRNA booster vaccination.  There are no plans for the Lak Si vaccination center to offer booster mRNA vaccines, as ordered by my cardiologist.    I’m not registered on Mor Prom or https://expatvac.consular.go.th/ (my high priority status bypassed my having to register in early June).  I have questions as to how, as a high priority candidate for booster Pfizer mRNA vaccine I can quickly receive a Pfizer mRNA COVID-19 booster vaccine?",Thailand,t5_2qjw5,/r/Thailand/comments/q4mh9e/american_expat_seeks_thai_covid_mrna_booster/hfzhd4c/
148,59,0,1633755599,"Hi!   I did it last week by car.   You need   - Vaccine  - Rapid Test within 72 hrs. - This one was the most important, you have to have this, they actually didn’t check my vaccine certificate at all that day and only asked for my rapid test result.   The QR code they will provide and show you how to do, you just fill out your information it takes 2 minutes.  The reporting to local clinic is just a Line ID account you are supposed to send messages to, and I didn’t use it. Good luck",Thailand,t5_2qjw5,/r/Thailand/comments/q3l81n/koh_samui_domestic_entry_requirements_arriving/hfy37kt/
149,60,0,1633678828,Now if they'd just recognize the local vaccine / certificate,Thailand,t5_2qjw5,/r/Thailand/comments/pyxe5y/covid_information_travel_tourism_and_general/hftvt3h/
150,61,1,1633681180,Wasn't J&amp;J only for those vaccinated by the French Embassy? Those got an EU vaccine certificate anyway.,Thailand,t5_2qjw5,/r/Thailand/comments/pyxe5y/covid_information_travel_tourism_and_general/hftyddv/
151,62,0,1631930823,Can you remind everyone which is which? Correct me if I’m wrong:  หมอชนะ mochana tracking up (trust prayut to know where you go and live)  ไทยชนะ Thai Chana (is this the เราชนะ one that gave Thai people discounts at markets/restaurants ) Edit: walking through the mall thai chana QRs are everywhere. A tracking app apparently   หมอพร้อม Mo Prom (vaccine registration and certificate for Thai people and foreigners that have a 13 digit number),Thailand,t5_2qjw5,/r/Thailand/comments/pqca8v/does_people_still_have_หมอชนะ_on_their_phone/hda7vjf/
152,63,0,1631667844,"Haha they tried this when I turned up for an appointment for a Pfizer jab - they said my 'medical certificate' was out of date -  actually I took documents showing I had 4 stents implanted after a heart attack just 3 years ago. They said I could take another vaccine instead, but I refused and got the Pfizer thankfully.  They're struggling.",Thailand,t5_2qjw5,/r/Thailand/comments/pnv8jv/thai_government_playing_bait_switch_with_covid/hcw75fq/
153,64,0,1631405692,"Once you get your vaccine you can easily register on Mor Phrom for the vaccine certificate as a foreigner though, you just need the ID number on the paper certificate they give you and your phone number.",Thailand,t5_2qjw5,/r/Thailand/comments/pfi2to/covid_information_travel_tourism_and_general/hci1o6b/
154,65,0,1631250545,It works. Even shows my second dose now that I received a few minutes ago. Just the app vaccine certificate isn't loading yet.,Thailand,t5_2qjw5,/r/Thailand/comments/plecyx/หมอพรอม_app_usable_by_foreigners/hc9zk6g/
155,66,0,1631216919,"Hey, I recently travelled from Bangkok having one dose of AZ and I think it's approved here.   I reported my vaccination to my Region's Public Health Unit with the lot number and a scan of the certificate translated to English. A few days later they emailed me stating my vaccination status is one dose.  If you're planning to be exempt from quarantine when you arrive get two doses of AZ or get heterologous doses of AZ and mRNA (Moderna or Pfizer). In both cases you will need to wait 2 weeks after the doses to be qualified as fully vaccinated.  If you're planning to get your second dose in Canada you're most likely going to mix with an mRNA vaccine because AZ stock here is quite low (at least in Ontario).   Hope this helps!",Thailand,t5_2qjw5,/r/Thailand/comments/pkv5ap/astrazeneca_from_thailand_approved_yet_for_travel/hc7y72k/
156,67,0,1630556079,"Yeah, it's probably a good indication of what they will accept as inbound proof, if that is what the user above is asking. As the article states:  &gt;Several vaccine passport solutions have begun to roll out in different countries across the world with the most recent one being in Thailand. The idea is simple and a vaccine passport aims to give travelers a physical or digital record to verify that a citizen has been fully vaccinated and authorized for entry.A vaccine passport will most likely be part of the mandatory travel documents people need to present to travel in the near future and according to a recent article published by local media The Thaiger, Thailand has introduced their version of an international vaccine passport certifying Covid-19 immunization.  I was just looking at entry [requirements for Spain](http://www.exteriores.gob.es/Embajadas/BANGKOK/en/Noticias/Pages/Articulos/How-to-enter-Spain-from-Thailand,-Cambodia,-Laos-and-Myanmar---Traveling-in-times-of-covid-19.aspx):  &gt;• To have had the last recommended dose of the vaccine at least 14 days before entering Spain.• Only vaccines authorized by WHO or by the European Medicines Agency (Pfizer, Moderna, Astra Zeneca, Janssen, Sinopharma and Sinovac) are accepted. Astra Zeneca shots made in Europe, India and South Korea are also accepted, **but not those made in Thailand by Siam Bioscience, as it has not yet been approved by either WHO or EMA**.• The vaccination certificate is accepted in Spanish, English, French or German.• The vaccination certificate must include the name and surname of the applicant, date of vaccination and doses, type of vaccine and number of doses administered, issuing country and identification of the issuing body of the vaccination certificate.  They talk about a certificate and not a passport but sure they will accept the Thai passport, so long as it has the details which I think will be standard on these types of docs.",Thailand,t5_2qjw5,/r/Thailand/comments/pfi2to/covid_information_travel_tourism_and_general/hb9yywa/
157,68,0,1630133465,"I got Pfizer this morning over there.  Richard was wrong as they don't accept walk ins but rather let people with an appointment come a bit whenever they want (which resulted in a pretty big queue today). It seems they had some issues with the system because it went from giving appointments within a 30mins slot, to appointments anytime within a day.  Despite the line it was pretty well organized.  You get to pick your vaccine when you book, and that's the one you actually get.  Then they give you the proper paper certificate with the 13 digit number and the date for the next appointment (mine is scheduled on 18 Sept.)",Thailand,t5_2qjw5,/r/Thailand/comments/ovhvw2/covid_information_travel_tourism_and_general/hanlyzj/
158,69,0,1630060674,Have to assume the green card is the vaccine certificate from mo prom,Thailand,t5_2qjw5,/r/Thailand/comments/ovhvw2/covid_information_travel_tourism_and_general/hajgaqk/
159,70,0,1629825505,"Its a scannable QR code link on the form you get for the 2nd vaccination proof.  I can't give you the exact link, as its unique to me.  The url contains -[https://co19cert.moph.go.th/moph-immu/#/vaccine/certificate](https://co19cert.moph.go.th/moph-immu/#/vaccine/certificate) \+ the unique url parameter bits for your own details.  &amp;#x200B;  This is what a ""real"" link looks like - https://imgur.com/gallery/OUt7PYt",Thailand,t5_2qjw5,/r/Thailand/comments/pahgei/thailand_covid_vaccination_proof_types/ha6najt/
160,71,0,1629779166,"There is a travel passport - its the yellow book.  Can't be bothered to upload a photo, but you can google it.  I got mine yesterday.     I did make a post on thethaiger with details.  Here -    https://thethaiger.com/talk/topic/2775-thailand-covid-19-certificate-of-vaccination-vaccine-passport/?do=findComment&amp;comment=41584",Thailand,t5_2qjw5,/r/Thailand/comments/pafcqs/to_those_who_received_both_your_covid_shots/ha4hf4f/
161,72,1,1629779871,"Question: Is it easy to have a certificate that you are vaccinated without having a vaccine in Thai vaccination centers?  When there are vaccination days in the local state hospital, you have hundreds of people who go for vaccination. After registration for the vaccination, it's a little bit chaotic between receiving the vaccine and leaving the hospital.  If an anti-vax person doesn't wish to have a vaccination but needs the registration, can he easily abuse the chaos?  People who are vaccinated in Thailand, what is your opinion? Is it easy to have the paperwork without a vaccine?",Thailand,t5_2qjw5,/r/Thailand/comments/ovhvw2/covid_information_travel_tourism_and_general/ha4ikrk/
162,73,2,1629781618,"Yes, it has details of the Dose, Name of Vaccine, Date of Vaccination, Manufacturer and Batch No of Vaccine, Certificate issued Date, Signature , Stamp of issuing center.  &amp;#x200B;  I'll upload an example to the imgur link once I've neutered any person info on there.  &amp;#x200B;  https://imgur.com/a/YPx6M1I",Thailand,t5_2qjw5,/r/Thailand/comments/pafcqs/to_those_who_received_both_your_covid_shots/ha4l9gs/
163,74,3,1629781860,"Right, that's what I said - ""Certificate of Vaccination"".  Calling it a ""vaccine passport"" is a bit over the top, I don't think you can use it to skip quarantine or anything yet in any country.",Thailand,t5_2qjw5,/r/Thailand/comments/pafcqs/to_those_who_received_both_your_covid_shots/ha4lm09/
164,75,4,1629782275,I just received my second shot of AZ today in Phuket. They gave me a Certificate of Vaccination with the name of a Hospital. If I want the Vaccine Passport they said just go to the Hospital and they issue it. Cost 50 Baht,Thailand,t5_2qjw5,/r/Thailand/comments/pafcqs/to_those_who_received_both_your_covid_shots/ha4m7k7/
165,76,5,1629782862,"It's literally what they call it in all the media.  It's a document for travel.   I'm just answering the op's question with details.  Pretty much everyone is calling it the vaccine passport, so whether you accept it or not is up to you...  To repost the Bangkok Post link where they call it the Vaccine Passport   https://www.bangkokpost.com/thailand/general/2102771/thailand-adopts-use-of-jab-passports   ""The government has announced it will adopt the so-called **vaccine passpor**t, a certificate of vaccination, for use with Covid-19 vaccination in Thailand as an official travel document for those already vaccinated against Covid-19 and travelling to other countries.""",Thailand,t5_2qjw5,/r/Thailand/comments/pafcqs/to_those_who_received_both_your_covid_shots/ha4n1us/
166,77,6,1629783254,I expect that the Thai Covid Pass mentioned will be either linking  the MorPhrom or ThailandPlus app to the green MOPH record page or asking people to show the green MOPH page in order to enter a restaurant.     i.e. show the Vaccine and Test Result Certificate Page.,Thailand,t5_2qjw5,/r/Thailand/comments/pafcqs/to_those_who_received_both_your_covid_shots/ha4nlo5/
167,78,7,1629786932,"There are several checks throughout the process - I've only had a first dose, but it went something like:  1. Enter waiting area, show ID/passport 2. Proceed to check-in area, get vaccination paperwork, confirm personal details 3. Proceed to medical check area, paperwork is checked/updated with your blood pressure, height and weight etc 4. Proceed to vaccination area, where you actually get vaccinated - your paperwork is then stamped/updated again once the needle has actually gone into your arm 5. Recovery room, paperwork checked/updated again, then you either get the appointment card for your second dose, or the certificate to say you've now had both.  Now could you pay an unscrupulous member staff to stamp your paperwork without actually vaccinating you? Or to inject saline solution instead of the vaccine? Probably, with enough patience and budget.  But you're never alone out of sight with only one person - there are observers inside the booths watching the actual vaccinations, and so you'd need to pay those guys off too, without anyone else noticing.  I don't think a casual anti-vaxer would be able to beat the system without having pre-arranged help on the inside.",Thailand,t5_2qjw5,/r/Thailand/comments/ovhvw2/covid_information_travel_tourism_and_general/ha4sg1q/
168,79,8,1629800585,"Hi everyone,   It is now possible for you to register for your ""digital vaccine certificate"" if you've received at least your first dose of a vaccine in Thailand.   I explained it, step by step, here: https://twitter.com/WritingByMatt/status/1430089278340562945   Cheers!",Thailand,t5_2qjw5,/r/Thailand/comments/ovhvw2/covid_information_travel_tourism_and_general/ha58bh9/
169,80,0,1629380242,"Because ""AztraZeneca"" is technically not a vaccine, it's the company. And that company has licensed several different versions of the vaccine.   The UK is vaccinating people with Vaxzevria (formerly known as Oxford AstraZeneca). Vaxzevria obviously has full EU approval.  India (for example) is vaccinating people with AstraZeneca's Covishield and Covaxin. These vaccines haven't gotten full EU approval yet so theoretically you can't get the vaccine passport or whatever. It's pretty dumb but surely will get sorted out soon.  https://qz.com/2026656/the-eu-digital-covid-certificate-excludes-the-covishield-vaccine/  This article is already out of date, but does explain the initial situation.",Thailand,t5_2qjw5,/r/Thailand/comments/p7dmck/will_europe_recognise_my_covid_jab_as_a_thai/h9j4y0v/
170,81,0,1628613754,What does it list on the vaccine as on the Thai certificate when you get an AZ jab?,Thailand,t5_2qjw5,/r/Thailand/comments/p1mv7q/travel_after_vaccination_in_thailand/h8ffgyo/
171,82,0,1628404555,From what I understand the Thai embassy in your home country is the one that does the vaccine status verification before your COE is issued. They don't check anything other than looking at the certificate after you land and making sure the printed details on there match your submitted details.,Thailand,t5_2qjw5,/r/Thailand/comments/ozzfgu/proving_vaccination/h856gh4/
