,Unnamed: 0,created_utc,body,subreddit,subreddit_id,permalink
67,1,1631209740,"&gt; A competent leader would get more then one campaign promise met in 6 years in office.   [Is that right?](https://www.polimeter.org/en/trudeau)  &gt; Hell if you think about he didn’t actually do anything about COVID beside CERB and that was bipartisan for the most part.  Vaccine manufacturing, securing millions of doses despite having no domestic production facility, organizing a national airport shutdown, billions into securing ventilators and PPE for future COVID and other pandemic preparedness, stemming food supply issues while factories were forced to close, millions in loans for businesses under the LEEFF program, negotiating as much as possible (often compromising) with provincial governments in relation to delivering healthcare and creating vaccine certificate programs (not to mention spending federal money researching the legal consequences, so provinces didn't have to), acting quickly to close the US border, conducting *daily* publicized briefings to help people stay informed, and so much more. You clearly have *no* idea what you're saying or else your memory is defective.   &gt; EU shut down flight to Canada then he does it, US shuts down the boarder then he does it and on and on always reacting to other people’s policies.   Because he wasn't first, he ought to be criticized? Seriously, that's a weak argument.   &gt; Then becomes the only g7 country to take funds away from a foundation set up to get COVID vaccines to 3rd world countries.  If that's how you choose to frame it, fine, but I prefer the unbiased version: he chose to protect Canadians sooner rather than later, and in exchange promised future doses for 3rd world countries. Particularly useful since we will have our own production facilities, have a stockpile of our own thanks to early contracts securing from major suppliers, and thanks to our healthcare delivery services a good portion of the population are vaccinated. Almost as if he and the government knew we'd be able to use the vaccines sooner than others, and that we'd be in a position to help once we're out of the woods. Crazy, eh?   &gt; Plus to confirmed ethics violations.  Nothing to with COVID at all. Like...nothing.",canada,t5_2qh68,/r/canada/comments/pklb29/debate_discussion_2_frenchlanguage_debate/hc7gq7z/
68,0,1631123451,"Manitoba is accepting a Government certificate of exemption instead of a vaccine passport where required. However, no one really knows how to get this Government certificate and it seems to be able to override a doctor.",canada,t5_2qh68,/r/canada/comments/pkccj8/legal_questions_around_rights_linger_as_some/hc32hfv/
69,0,1631042754,"We definitely do, both through credit cards and debit cards.  Even with that being the case I think we should still be wary of new systems that capture the same type of data, especially those built in haste during a pandemic.  Credit card companies and cell phone companies have had many years to refine their security, they’re reasonably secure (although breaches do still occur). Vaccine passports with QR code logging create an entirely new attack surface which is virtually guaranteed to be breached or leaked.  Another criticism I have, that I didn’t even mention, is that in practice they’re quite easy to defeat. Theoretically any time you have your QR code verified you should produce photo ID along with it, but in my experience I’ve not been asked once for ID over the several weeks I’ve been using my certificate. I could be unvaccinated and using someone else’s QR code.",canada,t5_2qh68,/r/canada/comments/pi6bsr/vaccine_passports_are_a_huge_ethical_minefield/hbyuwbv/
70,0,1630957016,"Ontario &gt;During the briefing, officials said the enhanced certificate system is meant to be temporary. https://www.cbc.ca/news/canada/toronto/ontario-covid-vaccine-passport-certificate-proof-1.6160728  B.C. &gt;“This is a temporary measure that’s getting us through a risky period where we know that people who are unvaccinated are a greater risk of both contracting and spreading this virus,” B.C.’s Provincial Health Officer Dr. Bonnie Henry said. https://www.citynews1130.com/2021/08/23/b-c-covid-19-vaccine-passport/  Quebec &gt;Directeur national de santé publique du Québec, Dr Horacio Arruda a pour sa part rappelé que le passeport vaccinal s’avère «une mesure temporaire» https://www.lesoleil.com/actualite/covid-19/passeport-vaccinal-en-vigueur-le-1er-septembre-hausse-des-cas-a-prevoir-video-3ce4c2d8800ac57c35a6e74a9ce2ef76  You  &gt;The fact theyve said it’s not temporary  Are you capable of saying things that are actually true?",canada,t5_2qh68,/r/canada/comments/pixwrb/singh_pushes_for_national_covid19_passport/hbuep79/
71,0,1630870673,"The amount of people in the clinical trials compared to the total population of Canada is small. Many places are now requiring proof of vaccination (like restaurants, universities, etc.), it's not just a few places. There are other reasons unvaccinated people could be present in an area where the certificate is required (like people with legitimate medical exemptions, children under 12, even a few people illegally sneaking through without being checked; also there are random people who got the vaccine but failed to seroconvert), a few random people in a given location in the clinical trial who got placebo is unlikely to make a difference.  However the benefit of the trials (more and potentially better vaccines being approved) is huge. Based on this it's very important to encourage such trials and not put severe roadblocks to people entering such clinical trials.",canada,t5_2qh68,/r/canada/comments/pieomr/they_rolled_up_their_sleeves_for_science_now/hbq0ipy/
72,1,1630935118,"Ah, so an identification or certificate of sorts to determine if the customer has previously been exposed to Covid and potentially carries the antibodies? That’s actually pretty smart.. I like that idea!  What could we call that though? I can’t think of anything immediately, but I’ll give it some thought. I don’t want to derail this conversation about vaccine passports.",canada,t5_2qh68,/r/canada/comments/pixwrb/singh_pushes_for_national_covid19_passport/hbt1ljq/
73,2,1630953416,"I don’t know who has any patience for these slippery slope theoreticals when we’re still in the midst of an actual real crisis. It’s [abundantly clear](https://montreal.ctvnews.ca/most-canadians-in-favour-of-vaccine-passports-for-non-essential-activities-poll-1.5556167) that some form of vaccination certificate is going to be required as we move beyond the immediate threat of COVID and the vast majority of Canadians support the idea. A national one will simplify a provincial patchwork of differing systems and will make interprovincial travel less burdensome. Any conflation between this and authoritarianism and a lack of freedom is completely ridiculous. But again, the vast majority of clear minded citizens in this country already know this.",canada,t5_2qh68,/r/canada/comments/pixwrb/singh_pushes_for_national_covid19_passport/hbu6k1a/
74,0,1630832318,"&gt;The final determination of whether you qualify for the vaccine exemption is up to the border agent, and if you don't get it, you have to spend 14 days in quarantine and do more testing.  This might not be a big deal to a Canadian returning home, but I can't see many tourists taking the risk of visiting Canada for leisure and being sent into quarantine for 14 days.  its extremely rare for the vaccine certificate to not be accepted. if that happens, they can leave Canada. [https://travel.gc.ca/travel-covid/travel-restrictions/isolation](https://travel.gc.ca/travel-covid/travel-restrictions/isolation)  individuals in 14 day isolation can leave Canada.",canada,t5_2qh68,/r/canada/comments/pi046x/fully_vaccinated_international_travellers_allowed/hbo214z/
75,1,1630840408,"This article doesn't even touch on the privacy concerns for those who do have vaccine certificates.  Before I get started I might as well add this disclaimer, I am fully vaccinated and as I'm currently living in the EU I already have a vaccine certificate on my phone, QR code and all that.  I've been using it to enter bars and restaurants for several weeks now, however it isn't required here at most other places.  It's important to make a distinction between old-fashioned vaccine cards and a machine-readable document like what we're looking at here.  In the past someone looking to participate in some public activities would just show their card, the person looking at would nod, and we'd be on our way.  The system we have now uses an app to (at a minimum) verify the digital signature of the QR code, ensuring it isn't a fake.  So far, so good - nothing too nefarious here.  However, will these systems be storing your identity and location for contact tracing?  If so, how long will the data be stored?  Who will have access to this data?  This is important, since overlaps in proximity and time between people can be used to determine relationships between people, in the same way that phone and email metadata have been used in the past - imagine an auto-generated list of Facebook friends.  Presuming this data is stored, there's always the risk of a data breach, but beyond that, which government agencies will have access to it?  Would law enforcement be able to access it to aid in investigations?  How about immigration enforcement?  The weakest link in the whole system may be the phones that are used out in the wild to scan these things.  Let's assume the most secure scenario - that no contact tracing is done (unlikely), the identity of scanned codes are not sent over the internet, all the app does is verify the digital signature.  From what I've seen here, the devices used to scan this info aren't dedicated devices, they're the personal phones of whichever employee is working the door.  If their phone is compromised, your personal information could also be compromised.  *Edit -* I should also mention that in practice, a lot of establishments here don't bother to scan my certificate, they just glance at it.  Also, in places where they know me, they just wave me in and don't even look at the phone.",canada,t5_2qh68,/r/canada/comments/pi6bsr/vaccine_passports_are_a_huge_ethical_minefield/hbob6ol/
76,2,1630859633,"&gt;For its trial to proceed properly, Medicago is using a “double blind” experiment, meaning some participants are given the Medicago vaccine candidate, while others are given a placebo. &gt; &gt;Neither people administering the vaccine nor those receiving it know whether they got the placebo or the real thing, and they won’t until researchers have a chance to compare the rates of COVID-19 in both groups. &gt; &gt;Only participants leaving the trial can find out which dose they’ve received. &gt; &gt;That’s Lacasse’s main concern right now — that other Medicago trial participants will leave the trial in order to receive an already-approved vaccine, slowing down the experiment.  An experiment should not supersede public health measures. Having unvaccinated people going into high transmission risk areas that requires vaccination, all because they don't know whether they're vaccinated or not, would not be responsible. The reason we are closing these areas to the unvaccinated is because of the potential for outbreaks.  &gt;“Clinical trial participants are essential to advancing vaccine technology in Canada, and should not be penalized for their choice to contribute to science for the benefit of society.”  Other people's health should not be put at risk by anyone else's choice. Participants chose to join knowing they may receive a placebo instead of the vaccine. They can choose to leave if they are concerned about not being able to get the vaccine certificate.",canada,t5_2qh68,/r/canada/comments/pieomr/they_rolled_up_their_sleeves_for_science_now/hbpbotf/
77,3,1630862020,"If we're comparing restaurants to people, the restaurant equivalent of a vaccine passport is a food and safety certificate or whatever you call that it.  Restaurants that don't pass their health inspections get closed down until they can make the appropriate changes.  If the restauranteur chooses not to make the changes, they can't re-open.",canada,t5_2qh68,/r/canada/comments/pidwsr/howard_levitt_why_vaccination_discrimination_is/hbph2u0/
78,0,1630689763,"One problem is that you're basically looking for a hail Mary in the form of a vaccine that offers *sterilizing* immunity. Most vaccines aren't like that (the one for HPV is an exception) including the ones for polio and measles. Breakthrough infections will always be a thing when all we have are vaccines that offer *protective* immunity. You could be in for a long wait before that kind of COVID vaccine would be available (if ever).  Another problem is that Canada is an outlier by still insisting on pre-departure  testing of all *fully* vaccinated people planning to enter Canada in defiance of Hajdu's own advisory panel [which did not recommend such testing of fully-vaccinated travellers before trying to cross a Canadian border checkpoint](https://www.canada.ca/en/health-canada/services/drugs-health-products/covid19-industry/medical-devices/testing-screening-advisory-panel/reports-summaries/priority-strategies-quarantine-borders.html#a6). From ""Table 1: Key air and land border measure recommendations for persons entering Canada"" for travellers who are not (medically-)exempt from vaccination but fully vaccinated anyway.  &amp;#x200B;  &gt;Fully vaccinated non-exempt travellers   &gt;   &gt;Eliminate pre-departure test for travellers entering Canada and day 10 testing  &amp;#x200B;  Europe does not impose two barriers like Canada currently does with mass vaccination having gained ground. It's either you get tested or your get fully vaccinated. Satisfying just one of these conditions precludes you from needing to shell out for a negative PCR test before boarding your flight and/or automatic quarantine upon arrival. There are some countries like Czech Republic and Portugal which allow incoming Canadians only if they show a negative PCR test result. This is because Canada still lacks a *federally*\-backed vaccine certificate like the EU, Israel and Serbia, and so prospective Canadian incomers must provide a negative test result. The .pdfs issued by the home province/territory mean jack shit to Czech and Portuguese border guards.  In practice, this means that I'm currently free to go to Germany or Poland without a pre-takeoff test since they recognize fully vaccinated Canadians like me as ""safe"", not needing automatic quarantine or post-arrival testing. However, when I'd line up for the return flight at Frankfurt or Warsaw airport, I have to show a negative PCR test result at the gate in order to get on the plane. If I end up with a positive PCR test before that return flight, then I'm screwed out of my return flight and stranded there for another 10-14 days. The full vaccination status has been totally undermined by a test result requirement imposed by my own government.",canada,t5_2qh68,/r/canada/comments/ph1g1u/canada_set_to_welcome_fully_vaccinated_foreign/hbgxhlj/
79,0,1630610234,"Creating a new protocol takes a lot of time and money. The government is extremely slow and has a lot of bureaucracy. If they can pump out a new system and roll it out Canada wide in 9 months, my faith in them would be restored. There's already a system that works and meets all their requirements, and they even have the infrastructure for it. Quebec would also kick up a shit show if they were forced to move to a inferior and insecure system.  The smart health cards protocol for example has been in the works for many years already, and is based off other similar technology.  It would be impossible for them to do anything else and expensive for them to attempt. It would also be easily hacked and bypassed.  See what's happening in Ontario, they are also moving to this technology: https://www.cbc.ca/news/canada/toronto/ontario-covid-vaccine-passport-certificate-proof-1.6160728",canada,t5_2qh68,/r/canada/comments/pghnnk/the_liberal_election_platform_government_picks/hbcpxvm/
80,0,1630528113,"&gt;Ontario Premier Doug Ford defended the delayed rollout of a vaccine certification program by blaming Liberal Leader Justin Trudeau for calling an “unnecessary election” during the fourth wave of the COVID-19 pandemic, effectively ending his three-week silence in the federal campaign.  &gt;The comments were made by the premier during a news conference on Wednesday afternoon where he announced a province-wide vaccine certificate program that will require customers to show proof of a double dose prior to entering some indoor establishments such as gyms, restaurants and banquet halls.  &gt;“All the premiers, every premier, wanted a vaccine passport and unfortunately, the federal government decided to go into an unnecessary election, which I'm still shaking my head over, in the middle of a fourth wave in a pandemic, then telling us just three weeks ago that they wouldn't be able to get it done till the 24th,” Ford said.",canada,t5_2qh68,/r/canada/comments/pg2c8f/ford_defends_delayed_ontario_vaccine_certificate/hb8cxz8/
81,1,1630532516,"Ford defends delaying a vaccine certificate because it took him time to convince his anti-vax daughter that daddy will lose votes if he does not, and he can blame Trudeau. There fixed the headline.",canada,t5_2qh68,/r/canada/comments/pg2c8f/ford_defends_delayed_ontario_vaccine_certificate/hb8n2og/
82,0,1630500997,"Premier Doug Ford will hold a news conference at 1pm today to announce a vaccine certificate system will be implemented as of Sept 22nd.         At first you’ll have to show vaccine receipt + gov’t ID, followed by an app that will combine both.",canada,t5_2qh68,/r/canada/comments/pftbvj/ford_to_announce_a_vaccine_certificate_system/hb6jypc/
83,1,1630510501,&gt;a vaccine certificate will be needed to visit indoor food and drink establishments  Good. Now I can blame the government that vaccines will be required at my wedding (:,canada,t5_2qh68,/r/canada/comments/pft9em/proof_of_vaccination_will_be_needed_at_movie/hb75nvy/
84,2,1630519605,https://s3.documentcloud.org/documents/21053251/ontario-release-vaccine-certificate-program.pdf  Page 7 bullet 3,canada,t5_2qh68,/r/canada/comments/pfyp6k/ontario_government_to_require_covid19_vaccine/hb7s1hn/
85,3,1630519622,https://s3.documentcloud.org/documents/21053251/ontario-release-vaccine-certificate-program.pdf  Page 7 bullet 3,canada,t5_2qh68,/r/canada/comments/pfyp6k/ontario_government_to_require_covid19_vaccine/hb7s319/
86,4,1630520928,"We just don't want the hospitals to collapse. Once the unvaxxed are naturally immune or dead, we can relax.  Vaccine certificates are not the beginning of a fascist dystopia. If a totalitarian wants power they will take it with or without a... lol....vaccine certificate.",canada,t5_2qh68,/r/canada/comments/pfyp6k/ontario_government_to_require_covid19_vaccine/hb7v97y/
87,0,1630257088,"Exactly.  Yeah, it takes time, but the Canadian authorities are ridiculous so far. It is similar with the vaccines passports, with a total lack of provincial and federal coordination.  I would say more, a total lack of international coordination. Canada does not accept EU digital certificate (which you cannot fake it and its accepted in all Europe and can be validated with the code) because it does not disclose the date of the first vaccine (it says you had 2 vaccines, and the date of the last one). However it does accept a paper written by your doctor...which can easily be faked and Canada cannot check its authenticity.  But the EU digital certificate is not valid..yeah right. LOL",canada,t5_2qh68,/r/canada/comments/pdr29h/canada_bans_direct_flights_from_morroco_and_stops/hatoub3/
88,0,1630236329,Ontario announced a vaccine certificate that will release next week.,canada,t5_2qh68,/r/canada/comments/pdt0vk/do_you_want_covid19_vaccine_cards_bc_applauded/hasi3fn/
89,0,1630082242,"&gt;Having 10+ different versions is just unnecessary.  It boils down to Canadian healthcare ***not*** being a national responsibility per Federal legislation (i.e. [Canada Health Act](https://en.wikipedia.org/wiki/Canada_Health_Act)) in contrast to the rest of the civilized world (i.e. not the USA and not Canada).  This is why Canadians (and Americans) make do with such a mickey-mouse hodgepodge of ""proof"" for COVID-19 vaccination that's backed only by a province or territory (or state for some Americans) compared to Europeans and Israelis. The latter's certificates are nationally or supra-nationally backed. The idea that Germans, for example, get a vaccine ""certificate"" backed by their home *Bundesland* (e.g. Bavaria, Hesse, Thuringia) instead of the German government or EU does not compute. This is also related to why the Czech Republic does **not** consider any Canadian to be fully vaccinated [because it recognizes only nationally-backed vaccination certificates rather than sub-national ones](https://www.mzv.cz/ottawa/en/news_and_events/the_conditions_for_entry_of_persons_to.html). Provincial and territorial documents typically mean sweet fuck all to the rest of world.  The same logic guides the use of domestic vaccine passports. Canada's idiosyncratic division of powers/responsibilities puts domestic vaccine passports on the same level as health cards and licenses for driving, gun ownership, fishing and hunting. This is arguably very absurd but all in accordance with Canadian legislation and regulation.",canada,t5_2qh68,/r/canada/comments/pcofik/trudeau_promises_1b_to_help_provinces_pay_for/hakpz8i/
90,1,1630108841,8 hour course that you can access whenever you want?  Edit: if it's this easy why are you panicked? I'm sure you can find a reason to not get an adult vaccine certificate as well,canada,t5_2qh68,/r/canada/comments/pcvf5g/ontario_to_institute_vaccine_passport_system/hamftd1/
91,0,1629920548,"While it is SAFE for people with autoimmune conditions to get the vaccine, it may not be very EFFECTIVE in some of those cases.  So they still need everyone else to get vaccinated.    But if they want to do leisure activities and need that vaccine certificate, they are able to get the jab safely.",canada,t5_2qh68,/r/canada/comments/pbbh64/no_medical_or_religious_exemptions_for_bcs/habz6m0/
92,1,1629983729,Right.... except the provincial government owns the CovaxON database that holds the vaccine records. The regional officers don't have the right or permission to access the data for this vaccine certificate purpose.   The province has only agreed to share it with the federal government for explicitly using for a vaccine passport.,canada,t5_2qh68,/r/canada/comments/pbz79v/ontario_health_units_prepared_to_create_their_own/haf5f4x/
93,2,1629990217,The VaxiCode app is completely optional. It's just provided as a convenient storage medium for the QR code.  The QR code is the actual covid vaccine certificate. Ontario doesn't have anything like it.,canada,t5_2qh68,/r/canada/comments/pbz79v/ontario_health_units_prepared_to_create_their_own/hafkecg/
94,0,1629751072,"A simple Google search shows that you’re wrong: https://time.com/5952532/vaccine-passport-history/  &gt; During a series of smallpox outbreaks across the United States from 1898 through 1903, many states authorized compulsory vaccination, while other leaders sought to use the power of public and private institutions to pressure reluctant Americans to accept the vaccine. A Chicago physician wrote in 1901 that “Vaccination should be the seal on the passport of entrance to the public schools, to the voters’ booth, to the box of the juryman, and to every position of duty, privilege, profit or honor in the gift of either the State or the Nation.”  &gt; Employers across the country acted to make smallpox immunity a condition of employment. Factories, mines, railroads and other industrial workplaces with tight quarters were particularly forceful in demanding proof of vaccination. In 1903, Maine’s government decreed that “no person be allowed to enter the employ of, or work in, a lumber camp who can not show a good vaccination scar. Though workers sometimes resisted, corporations and governments usually ensured that they took the vaccine in the end.  &gt; Social gatherings and clubs, too, sometimes required proof of vaccination in order to attend. When smallpox swept through Kansas City in 1921, one newspaper reported that “‘Show a scar’ has been officially adopted as the passwords to lodges and other meetings.” Public school leaders across the country also required students to present a “plain scar, the records of a school or a certificate by a reputable physician” in order to enter their institutions. Among others, the superintendent of the Savannah, Ga., school system in 1897 arranged for students to be provided with “admission cards” to their school once they provided proof of vaccination.",canada,t5_2qh68,/r/canada/comments/pa7s0k/bc_becomes_second_province_to_require_proof_of/ha2spfl/
95,1,1629775136,Oh *present proof* you say?? Almost sounds like a vaccine certificate.,canada,t5_2qh68,/r/canada/comments/pa7s0k/bc_becomes_second_province_to_require_proof_of/ha4a7po/
