,Unnamed: 0,created_utc,body,subreddit,subreddit_id,permalink
47,0,1632586343,"&gt; It’s a kind of medicine to drift on four wheels around even a bit of this splendid province, without a mask and identification beyond the traditional licence and insurance.  … and a seatbelt, and airbags, and lines on the roads, and on-ramps, and speed limits, and, maybe most importantly, the prevention of normal people from using the road for anything traditional, like walking, hanging out, commerce, wrangling livestock…  My little pleasure costs little more than a few thousand well enforced laws on the production and sale of private vehicles, roads, fuel, etc; tens of billions of dollars a year; the idolatry of the private vehicle; the sullying of settlements; the cutting up of the undeveloped nature; and the destruction of a few l ecological systems necessary for human flourishing and a few others necessary for our survival.   Barely anything else!  And now you want me to wear A MASK when I buy A DONUT!!!???,?!?????!!!!! Do you not know that I’m god-king!?  &gt; The recent vain monstrosity — they called it an election, but it would be better described as a carnival exercise to see if the Liberals could grab a majority during a confused and universally anxious time — suggested the need for some rural relief.  Personally I don’t think Trudeau is doing great and I’m glad that I had the opportunity to say so. If you think the election was a waste of time, don’t vote anymore. If you want to vote, get vaxxed and wear a mask.   &gt; At the counter, I learned Ontario was under a “vaccine mandate” and was told that in order to “stay inside,” I would need to show proof of vaccination: I must have a “certificate,” and produce a copy of my ID to back up the certificate.  &gt; Remember, I was not buying napalm. I was at a Tim Hortons negotiating the purchase and consumption of a Boston cream.  Normally I only hafta show the ID of the Queen. Or my Tim’s card that’s tied to my identity. Or my credit/debit card that’s tied to my ID.   (Imagine thinking that unvaxxed people are entitled to donuts and coffee but that poor people aren’t, lol)  &gt; The staff at each place insisting on it were embarrassed to do so.   … because they have to share a country with people older than 12 who aren’t vaccinated. And also because they’re dramatically underpaid. And the mandated dorky outfits don’t help.    &gt; people offended by the stupidity and insolence of the new decree did not, in my experience, take their frustration out on the workers who are tasked with enforcing the idiotic rules.   … They were too busy threatening healthcare workers or taking up hospital beds.   &gt; The threatened fines for “eating without a license” rival those that previously went to billionaire fraudsters operating pyramid schemes.  …  &gt; … the rickety, always changing, sometimes completely reversing and awesomely inexplicable policies they have been bringing in defy any consistent rationality whatsoever. Whatever COVID is, or whatever variation it mutates into, when it comes to Ontario’s response to it, there seems to be no design, no consistency of approach, gravely unequal treatment of various sectors of the economy, one rule for the lower class and another for those insulated by their vocation or wealth.  …  &gt; … many COVID policies have no virtue beyond protecting the authorities that are supposedly managing the crisis, no appreciation for those they are harming in ways other than medical and usually come with wonderful exemptions for those who can skate above ordinary reality.  [Actually me and Rex see pretty much eye to eye on this. Doug Ford’s bungling has not been amazing. Better than Moe’s or Kenney’s. But follows the typical ‘conservative’-branded pattern of incoherence.]",canada,t5_2qh68,/r/canada/comments/pv8vzl/rex_murphy_you_want_to_eat_that_doughnut_here/he8hucn/
48,0,1632507232,"Of course it forces businesses to comply, it wouldn't work very well or be fair if compliance was not mandatory.  When I said the thing about background checks, I wasn't talking about leaving your kid with uncle Earl I meant volunteering to supervise a school activity or some such thing.  Are deaths dramatically increasing?  Not dramatically, no.  Are we opening everything up and increasing capacities for indoor businesses and taking away mask mandates?  No.  Are we finishing up a nice warm summer that tends to lower viral spread as evidenced in 2020's summer months, and now heading into winter months which generally increase viral spread?  Yes.  Are we discriminating against one specific, named group of people in this vaccine certificate system?  No.",canada,t5_2qh68,/r/canada/comments/pty4ej/were_being_forced_local_business_push_back/he4c3b5/
49,1,1632513675,"&gt;Of course it forces businesses to comply, it wouldn't work very well or be fair if compliance was not mandatory.  Don't you see a problem with the government turning civilians into an investigation and enforcement arm of the government?      &gt;Are we discriminating against one specific, named group of people in this vaccine certificate system? No.  Just try to keep in mind that they are fellow humans as the hate starts to build.",canada,t5_2qh68,/r/canada/comments/pty4ej/were_being_forced_local_business_push_back/he4rj2k/
50,2,1632513895,"Ok, but **you said**  &gt;Vax rates for 1st and 2nd doses have gone up considerably **since the passport was announced.**    That's just not true.  The passport was announced [24 days ago](https://www.cbc.ca/news/canada/toronto/ontario-covid-vaccine-passport-certificate-proof-1.6160728).  You could have said doses have gone up for the last 3-4 days, but that's about it.     (and I also wonder out of Thursday's rate, how much of that is boosters which have now begun?  The author of that tweet does not indicate it, but that would involve actual thought and consideration rather than just tweeting a graph to get people excited).",canada,t5_2qh68,/r/canada/comments/puq3fw/randall_denley_ontarios_vaccine_passport_is/he4s2fx/
51,0,1632436195,"Article Highlights:  &gt;Just two days into the vaccine certificate system, the battle over the new passports to enter “higher risk” settings might become a legal tussle.   &gt;   &gt;The Justice Centre for Constitutional Freedoms says it has sent a legal warning letter to the Ontario government on behalf of four clients demanding the vaccine passport mandate be revoked immediately.   &gt;   &gt;“Mandating a system that denies Canadian’s access to certain services that are arbitrarily defined as nonessential by the government creates a slippery slope and sets a dangerous descent into a medical dictatorship,” said Henna Parmar, a lawyer with the centre.   &gt;   &gt;The centre wrote to the Ontario government saying that it will file legal action if the province fails to halt what the centre considers “its unconstitutional discrimination” against those who have not yet chosen to receive what the centre calls “experimental vaccines.”",canada,t5_2qh68,/r/canada/comments/pu6b42/potential_legal_challenge_looms_for_vaccine/he0qfaf/
52,1,1632446729,"I see you've never had to work in the service industry.  Any extra step you add to the process is multiplied by many times for a business. For you it's just a few extra seconds, but for a business it's something they have to do for every customer, including those that will take a lot more than a few seconds.  Your mistake is assuming every customer is calm, reasonable, moderately intelligent, and decently understanding. When you go to a restaurant it takes the hostess several seconds to look at *your* card. However, in any given day that hostess is going to deal with multiple people that will have circumstances and stories that you can barely imagine. Someone might come in without a phone and an obviously fake certificate, another person might come in with an ancient phone that doesn't even run this app, a third person might not even know there's a vaccine mandate, another might verbally berate you for doing your job, yet another might pull out a pack of 30 papers and spend 10 minutes finding the right one, another might be hard of hearing and a non-native speaker. It's just an endless fire-hose of the unexpected.  That said it's not that a business necessarily needs a staff increase to deal with things like this. It's just that things like this mean a business is having staff doing things that aren't useful to the actual operation of the business. So while nobody would actually hire extra staff for this, it could still be a difference between seating 40 and 50 people in a night, just because your staff might need to spend extra time arguing with someone reducing the time they are available, and prompting people passing by to visit a place with less arguments happening in front of it.  As I've said before, this entire mandate idea is poorly researched, poorly planned, poorly implemented, poorly targeted, poorly incentiveized, and just generally poorly handled. It's just a complete and total passing of the buck by the government to the citizens. One that is using some of the most vulnerable populations to enforces an impossible requirement, which is not likely to have a the type of effect we need on vaccinations rates. Worse, after this all goes wrong the government is probably going to try to absolve themselves of any responsibility. It's not going to be their fault that their expensive attempt to foster responsibility on someone else won't work, because they just gave the public what people said they wanted. It'll be the fault of everyone else for just asking for an obvious sounding solution, instead of asking for an actual proper implementation that would likely take months of dedicated effort to design.",canada,t5_2qh68,/r/canada/comments/pty4ej/were_being_forced_local_business_push_back/he1cub2/
53,2,1632499630,"&gt;Businesses that do not comply with the vaccine certificate program face $1,000 fines or a penalty of up to $10 million, according to the Ontario government. However, Premier Doug Ford has said the initial focus will be on enforcement through education.  Will be informative to see how the province deals with flat out defiance.",canada,t5_2qh68,/r/canada/comments/pumkxp/we_accept_everyone_wellknown_oakville_restaurant/he3twuc/
54,0,1632402983,"*With a month still to go before Ontario launches its vaccination verification app, concerns are being raised about how easy it is to modify the province’s existing vaccination certificates — potentially letting unvaccinated people gain access to restaurants, bars, gyms and even flights.*        *According to forensic document examiner Shabnam Preet Kaur, the existing vaccination certificates, which are in the form of Portable Document Format (PDF) files, can be quickly edited to change the name, birthdate and other personal information using a number of easily accessible programs.*        *For instance, Microsoft Word allows a user to open the watermarked vaccine certificate and change the name and other identifying information to that of an unvaccinated person, then re-save the file as a PDF. The Star verified that this can be done quickly and easily using the existing software found on most home computers.*        *Kris Klein, a lawyer with nNovation LLP and an expert on privacy, access to information and information security, said the editability of the certificate makes him worry about fraudulent activities that could jeopardize someone’s health or life.*        *“In the haste to move quickly, it seems like some pretty basic steps weren’t taken,” he said in an email. “The government will need to find a solution very quickly or risk having to suspend the proof of vaccination campaign.”*        *If done properly, a QR code would be much more effective at fighting fraud, Klein said.*        *In an email, Ministry of Health spokesperson Alexandra Hilkene said using the PDF certificates as proof is an interim measure until the QR code certificates are available on Oct. 22, when the province’s verification app will also be launched.*        *“When it comes to the health and safety of our communities, we are confident the overwhelming majority of Ontarians will do the right thing,” said Hilkene, noting that the majority of Ontarians over 12 have received both their doses and therefore will have a certificate ready to use.*",canada,t5_2qh68,/r/canada/comments/ptuz54/almost_anyone_can_fake_an_ontario_vaccine/hdyl3wh/
55,0,1632161599,"IF the individual provides the ""proof"" then the system is not secure, and we'll be laughed away from every other country.   The only way a federal vaccine certificate works and is accepted as real is if the proof is provided government to government.",canada,t5_2qh68,/r/canada/comments/prwqdz/con_33_lib_29ndp_16_ppc_10_bq_7_grn_3/hdmbgax/
56,1,1632174008,"Yea as an Albertan if you can postpone the trip a couple months do so. It’s complete shambles at the moment, but atleast the announcement of the ‘totally not a vaccine passport, restrictions exemption certificate-vaccine passport’ has seen a pretty considerable uptick in vaccination rates. Likely will see things back under control in a month or so.",canada,t5_2qh68,/r/canada/comments/pruxve/trudeau_says_alberta_saskatchewan_made_wrong/hdn5eea/
57,0,1632097900,"Just going to leave this here  *EU Digital COVID Certificate*        *EU Digital COVID Certificate (issuing country: Czech Republic)*        *The EU Digital COVID Certificate (EUDCC), also called the Green Pass,\[35\] came into force on 1 July 2021 and eases travel across all 27 member states, and additionally Switzerland, Iceland, Norway, and Liechtenstein.\[36\]*        *More than 200 million EU Digital COVID Certificates have been generated.\[37\]*        *Greece's prime minister, Kyriakos Mitsotakis, had proposed the creation of such a certificate to revive freedom of movement and facilitate free travel for the vaccinated European Union's citizens in the EU and Schengen Area.\[38\]\[39\]\[40\]\[41\]*        *A certificate can be issued to a person who has been vaccinated, has recently recovered from COVID-19, or has recently had a negative PCR test.\[36\] Vaccination certificates are issued to a vaccinated person for any COVID-19 vaccine. Member States have to accept vaccination certificates for vaccines approved by EMA and may decide to extend this also to EU travellers that received vaccine approved by national authority or WHO.\[42\] According to the EU, children under the age of 6 ""should also be exempted from travel-related testing*        *Denmark*        *Denmark introduced a coronapas on 21 April 2021 which replaced the older MinSundhed (My Health) app, or a paper printout.*        *Coronapass was a digitally verified immunity passport for all those that had been vaccinated, or with a recent negative test not more than 72 hours old or who had recovered from a previous infection of COVID-19 within the past 180 days. Due to its resident population's high uptake of vaccines, Denmark lifted all its remaining COVID-19 restrictions on 10 September 202*        *Switzerland's COVID Certificate*        *The Swiss COVID certificate is not provided automatically, it must be explicitly requested to comply with data protection laws.*        *The certificate is available for people who have recovered, tested negative, or been vaccinated with a vaccine authorized in Switzerland. People under the age of 16 do not need a COVID certificate in Switzerland.*        *The certificate expires 72 hours after sampling in the case of a negative PCR test. This is reduced to 48 hours in the case of a negative antigen test.*        *https://en.wikipedia.org/wiki/Immunity\_passport*        *France*        *In order to obtain the pass, people must have proof they are fully vaccinated, recently tested negative or recently recovered from the virus.*        *Israel*        *Israel introduced a vaccine pass earlier this year. It required people to show proof of either vaccination or having recently had the virus. The pass helped increase uptake of the vaccine, especially among younger people.*        *After infection rates declined, authorities decided to end the scheme.*        *But the government has now announced plans to reinstate the system amid a recent surge in cases.*        *The green pass system will only allow those over the age of 12 who are vaccinated, recovered from Covid-19 or who present a negative test result to attend large events and enter certain public spaces, the Times of Israel reports. The new pass will come into effect from 29 July.*        *https://www.bbc.com/news/world-europe-56522408*        Not sure how many more because it would portably mean searching by each country",canada,t5_2qh68,/r/canada/comments/priiy9/alberta_exploring_whether_covid19_infection_could/hdj6rzb/
58,1,1632098868,So far health experts this side of the pond [are not recommending prior infection be used as substitute for vaccination](https://www.npr.org/sections/health-shots/2021/08/28/1031287076/antibody-tests-should-not-be-your-go-to-for-checking-covid-immunity) because there isn't enough research to draw concrete conclusions on how to implement it. [But it seems people with prior infection might be okay with one shot](https://www.washingtonpost.com/opinions/2021/08/31/covid-19-recovery-vaccination-natural-immunity/). The research is ongoing.  The issue is how long you can use this for a pass. EU has a Vaccine Pass that accepts prior infection as one of the eligible criteria but it's only good for up [to 6 months after infection](https://www.gov.ie/en/publication/3a698-eu-digital-covid-certificate/). So I guess you'd need to get vaccinated within 6 months of infection anyway.,canada,t5_2qh68,/r/canada/comments/priiy9/alberta_exploring_whether_covid19_infection_could/hdj8s46/
59,0,1631782455,"Coming home for a visit next month, expect my European Union vaccine certificate will be basically useless beyond the airport.",canada,t5_2qh68,/r/canada/comments/pp4v5k/blue_jays_fan_from_manitoba_says_he_was_denied/hd22o2j/
60,1,1631793040,"&gt; Wouldn't your passport and vaccine card suffice? If not than I agree that is an issue.  If this story is anything to go by, apparently not.  This guy was from the next province over and couldn't get into a Jays game with his paperwork.  &gt; Also, passports for vaccines have been a thing in Canada for decades. I required one for school and I required one for work. Inconvenient sometimes? Sure, reasonable? 100%  I think there were religious exemptions available in Ontario when I went to school there, and none of the jobs I ever had in Canada required them.  Even if you've required them for school and work, the scope of the currently proposed laws vastly exceeds what we've seen in the past; I don't think you've ever needed any kind of vaccine certificate to get on a plane, or go to a restaurant or bar or gym etc.",canada,t5_2qh68,/r/canada/comments/pp4v5k/blue_jays_fan_from_manitoba_says_he_was_denied/hd2g3qc/
61,2,1631794427,Most of it's just a Google search away.  https://www.thestar.com/opinion/star-columnists/2020/05/28/its-a-mutiny-wow-ontarios-public-health-units-are-acting-to-protect-their-regions-and-the-province-has-to-listen.html   https://ottawa.ctvnews.ca/mobile/ontario-health-units-prepared-to-create-their-own-vaccine-certificate-eastern-ontario-top-doctor-1.5562012  https://ottawacitizen.com/news/local-news/ottawa-public-health-would-support-school-boards-that-adopt-mandatory-staff-vaccinations-trustees-told   Doug Ford did the bare minimum very late every time we had a crisis. It's just that Kenney did worse.,canada,t5_2qh68,/r/canada/comments/pp2s45/proof_of_vaccination_program_announced_in_alberta/hd2igok/
62,3,1631824609,"If you’re still reeling from recent anti-vaxxer protests outside downtown hospitals maybe this will lift your spirits: On Monday, the day that dozens of anti-vaxxers spewed their bile on hospital row, roughly 4,500 Torontonians were vaccinated at clinics all over the city. And of those Torontonians, it’s likely that 40-50 per cent received their first dose of COVID-19 vaccine, according to Joe Cressy, chair of Toronto’s Board of Health.  Dozens of jerks vs. 4,500 vaccinated Torontonians.  Anti-vaxxers may appear in outraged headline after outraged headline, and don’t get me wrong, they deserve the derision. But we shouldn’t let their reckless racket distract us from the quiet vaccination victories being won consistently at mobile clinics across Toronto, outside transit stations, apartment complexes and shopping centres.  “The city push is going really well,” says Phil Anthony, the manager of vaccination strategy at Michael Garron Hospital in Toronto’s east end. “We’re seeing an increase in first doses on a daily basis and it is driven by hyperlocal clinics.”  This week, the city will push further. Ever fond of embarrassing catch phrases, Mayor John Tory on Wednesday announced the launch of “#DaysofVaxtion,” a four-day pop-up clinic campaign (Thursday-Sunday) aimed at getting shots into the arms of the roughly 314,000 eligible Torontonians who aren’t fully vaccinated (of which, according to Tory, 158,000 have not received a first dose).  Toronto Public Health and hospital staff will set up shop outside various high-density locations, such as TTC stations, schools, parks and malls: a “mega-event” composed of “micro-clinics” according to Tory. “Gone are the days of the world record-breaking clinic at Scotiabank arena,” says Cressy. “Now we’re moving to dozens of hyperlocal clinics.”  Clinics — if you can believe it — where people actually change their minds. It may be utterly pointless trying to convince an anti-vaxxer steeped in conspiracy theory to get immunized. But the success of Toronto’s mobile clinics proves that non-ideologues (a.k.a. people of good faith) can see reason where they once saw fear. Or convenience where they once saw a hassle.  “Last week I was at a clinic in East York outside a series of apartment buildings,” says Cressy. “The first three people in line were all getting their first dose. The first person was a guy about 50 years old and he wanted a vaccine for a couple of months but just didn’t know where to get one. We brought the clinic to him.  “The second person was a woman who was 32 weeks pregnant. She had questions about taking the vaccine while pregnant. She spoke to her OB to a point where she felt comfortable. She came out of her apartment and got the shot while her parents took care of her older kid.”  And the third person in line, Cressy says, was a guy in his thirties who wasn’t staunchly opposed to the vaccine, but who had no plans to be vaccinated until news of the province’s proof of immunization certificate was announced. He “wanted to go to bars,” Cressy says.  The city councillor described the encounters as “a fascinating case study. Three different people all getting their first dose, all with three very different reasons.”  Good for them. Good for us.  If you’re fully vaccinated and you’re frustrated with those who aren’t, it’s easy to forget that the world isn’t divided cleanly into two camps: the fully vaxxed and the never-gonna-get-vaxxed. There are still thousands of people in this city who are on the fence about the shot, leaning toward yes. And helping to nudge them over that fence into the land of protection-from-COVID-19 are health-care workers patiently answering questions and refusing to judge. Their work is invaluable and unending.  “The real story is how well we’ve come together to do this,” adds Michael Garron’s Anthony. “How rewarding it to see so many different sectors come together to vaccinate Toronto: hospitals, Toronto Public Health, community health centres.”  Despite what the anti-vaxxers want you to believe, and what the breathless coverage of their lost cause may suggest, it’s not all doom and gloom in the city. People change their minds every day to protect themselves and us. They won’t stop.",canada,t5_2qh68,/r/canada/comments/pplhwb/forget_the_antivaxxers_the_real_story_is_the/hd4i1ba/
63,0,1631660221,"True, only about 80% of vaccinated people want a vaccine certificate.",canada,t5_2qh68,/r/canada/comments/pod79c/heres_the_full_list_of_exemptions_for_ontarios/hcvqmpv/
64,0,1631496708,"u/Xatsman u/TheRC135 he/she said 90% of the people are against it is just the people within his/her social circle, and not representing the whole Canadian population. Obviously, he/she has not look at the poll that say the vast majority of Canadians support Vaccine certificate pass.",canada,t5_2qh68,/r/canada/comments/pmjhgu/ekos_lpc_304_cpc_309_ndp_199_greens_43_ppc_91_bq/hcn0ar7/
65,0,1631299380,"You're right, we will eventually get one. It'll be months too late and they'll call it something different like an immunization certificate or something, and Kenny and Shandro will swear up down left and right to the press that it it absolutely **not** a vaccine passport...but we'll get them.",canada,t5_2qh68,/r/canada/comments/pln4bk/commentary_trudeaus_tone_on_the_pandemic_shifts/hcceomo/
66,0,1631200492,"Machine-readability, whether it's through QR codes, RFID chips, or even old-fashioned bar codes, mean that each time you have your certificate validated there's a risk of your identity, location and date/time being stored, either by design or surreptitiously.  If a vaccine certificate was created like a drivers license - with a photo, anti-counterfeiting measures like holograms, elements that show up under UV lights, etc. - it could be verified upon entry to public spaces without similar privacy implications.",canada,t5_2qh68,/r/canada/comments/pkycti/vaccine_passport_or_immunization_record_why/hc6uh5w/
