,Unnamed: 0,created_utc,body,subreddit,subreddit_id,permalink
96,2,1629806035,"&gt;This will not apply to indoor religious gatherings, retail, grocery stores or the health care system.  &gt;But there will not be any exemptions for those who are not able to take the vaccine for medical reasons or those who do not want to take it for religious reasons.  &gt;The plan is to reassess the vaccine certificate program in January.  &gt;“This is a temporary measure that is getting us through a risky period, where we know that people who are unvaccinated are at greater risk of both contracting and spreading this virus,” Henry said.  &gt;“They will not be able to attend those events through this period of time of high risk. There are no exemptions for other reasons as well.”",canada,t5_2qh68,/r/canada/comments/pa7s0k/bc_becomes_second_province_to_require_proof_of/ha5g4s0/
97,0,1629357654,Who wants to show a vaccine certificate just to travel or go out. Ridiculous.,canada,t5_2qh68,/r/canada/comments/p70hva/trudeau_doubles_down_on_mandatory_covid19/h9i8wpy/
98,0,1629154543,"&gt; This is a lie, you needed to every year to remain a student. Students with lapses in vaccination are given notice, then suspended if vaccinations are not done. It has been this way for 40 years at least. I kept my vaccination record in my wallet all through high school and university because I needed to show it at least once a year, and when I got vaccines. How is this hard for people?  er...yeah this isn't a lie. Went to School in rural Southern Ontario, also in a major urban center in Alberta. Nobody I know had to carry a vaccine certificate around in their wallet. I've never owned a vaccine certificate. What are you rambling on about?  &gt; Having a centralized, digital ID card that links your citizenship, Driving Record, Criminal Record, Health Card, and SIN is the pinnacle of progress.  Once we have that, why would any business not request that information at every door? And if there are any red flags, that person doesn't get to come inside my building. They get service at the door.  Man - you have to be trolling me here - you had be in the first half not gonna lie.",canada,t5_2qh68,/r/canada/comments/p5c7na/otoole_comes_out_against_mandatory_vaccinations/h97whp6/
99,0,1628914616,"That's largely correct for the immigration stuff (and Canada largely accomplished that by being really restrictive with acceptable documentation). For vaccinations, there's nothing digital. Clerk needs to check your vaccine certificate, whether the vaccines are accepted by Canada. And they also accept certificates of covid infection if the time range is right (and that recently changed a bit).",canada,t5_2qh68,/r/canada/comments/p3oods/federal_government_to_require_vaccinations_for/h8vgos6/
100,0,1628876352,"That’s not what is happening here.  All they are saying is that a provincial vaccine passport that uses the federal certificate as proof won’t be implemented. You’ll still be able to get the federal one to use in a province that has put a passport system in place or for international travel.   Is an Alberta business wants to require it to come in, they don’t need the provincial government to implement the policy, they can do it themselves.",canada,t5_2qh68,/r/canada/comments/p3olt8/alberta_rejects_idea_of_federal_vaccine_passport/h8t3g8h/
101,1,1628886080,"The EU has already implemented an integrated vaccine certificate, paper or electronic, that over 30 countries have implemented. You cannot travel between EU countries without quarantining unless you can prove your vaccination status using this system.  In fact Italy is using the system to restrict access to restaurants, museums, sporting events concerts etc.  Scan your phone when you walk in, just like you scan your ticket.  [https://ec.europa.eu/info/live-work-travel-eu/coronavirus-response/safe-covid-19-vaccines-europeans/eu-digital-covid-certificate\_en](https://ec.europa.eu/info/live-work-travel-eu/coronavirus-response/safe-covid-19-vaccines-europeans/eu-digital-covid-certificate_en)",canada,t5_2qh68,/r/canada/comments/p3oods/federal_government_to_require_vaccinations_for/h8trtqo/
102,0,1628812578,"&gt; 80% of the population is already vaccinated - now you need to recall them, check insure they are actually vaccinated, and hand out a card. What do you do when there needs to be a booster shot?   Why should that matter? Once a person is vaccinated they no longer pose as high a risk of hospitalization, even if a booster is due. Their immune system isn't 'naive' to the virus any more.  &gt; Covid will still be around but the public health crisis and all the emergency powers around it will be gone next year. I also didn't say it would be DIFFICULT to decommission them I said it would be a waste of money to go through the effort of deploying it and then turning around to decommission them in under a year.   Do you think ordering the number of vaccines the govt. did was a waste of money as well?  &gt; I strongly disagree that any of those items are solved issues and maybe the question you should be asking is WHY are people focusing on digital methods to roll this out... if the solution is obvious and you aren't hearing that as the main method being pitched maybe it's you that's missing something.  If we're going by that argument, then why do you have an opinion on this matter either? Surely the experts have all got it figured out and have reasoned that the vaccine certificate is worth the effort.",canada,t5_2qh68,/r/canada/comments/p2c1wb/quebec_to_bar_unvaccinated_people_from/h8pyh0r/
103,0,1628678643,"I wish they'd stop calling it an inevitable 4th wave and call it what it is - a first wave of unvaccinated people. Also, the word passport is unfortunate and while I realize that cat is out of the bag, a vaccine credential, vaccine proof, vaccine certificate might have had a better chance at being successful. Too late now tho.",canada,t5_2qh68,/r/canada/comments/p1uepw/quebec_to_implement_covid19_vaccine_passport_on/h8ipr1y/
104,1,1628712081,TLDR  &gt; announced Wednesday that they are actively working with provinces and territories on proof-of-vaccination credentials to make it safe for international travel.  &gt; vaccine documents will be made available to permanent and temporary Canadian residents that are fully protected against the virus.  &gt; Health experts and business groups across the country have stressed that a vaccine certificate system would be a way to avoid another lockdown and accelerate an economic reopening.,canada,t5_2qh68,/r/canada/comments/p2ksqb/canada_working_on_vaccine_credentials_for/h8koy9z/
105,2,1628712794,"This press release is an announcement of an announcement and a verbose variation of the [leak from the Treasury Board in June that we can't expect a vaccine passport for travel until December at best](https://www.politico.com/news/2021/07/23/canadas-vaccine-passport-wont-come-until-december-at-the-earliest-500656). Excerpted the press release in the dog days of summer:  &amp;#x200B;  &gt;Canadians are looking for a more reliable and secure way to demonstrate their COVID-19 vaccination history to foreign and Canadian border officials. To that end, the Government of Canada is collaborating with the provinces and territories to develop a proof of vaccination that will facilitate cross-border travel, while reducing the risk of spread and importation of COVID-19. We are also continuing to engage with Indigenous partners across the country to ensure that a proof of vaccination credential responds to the needs and rights of Indigenous peoples.   &gt;   &gt;The Government of Canada is working with provinces and territories to develop a secure pan-Canadian approach. This plan is based on advice from our public health officials with priority placed on the safety and security of all Canadians.   &gt;   &gt;For Canadians who decide to travel, using a proof of vaccination will provide foreign border officials with the vaccination history needed to assess whether a traveller meets their public health requirements and provide a trusted and verifiable credential for when they return home.   &gt;   &gt;Travellers will be able to submit their proof of vaccination in ArriveCAN (mobile app or Canada.ca/ArriveCAN) when coming back to Canada. While the focus is on a digital proof of vaccination, we will also make sure that these documents are accessible for all Canadians who may need to use them.  All of the above to say that ""We're still working on it and in the meantime don't forget to use ArriveCAN when coming to Canada.""  Nary a mention of an actually usable federally-backed certificate for Canadians to use when trying to enter other countries. Totally unlike the EU's travel app which has been running since last month and has allowed fully vaccinated EU citizens to cross European borders without the need to take PCR tests every time like what we Canadians are still forced to do if we have the nerve to want to bring back our fully-vaccinated selves.",canada,t5_2qh68,/r/canada/comments/p2kvlx/canada_moving_forward_with_a_proof_of_vaccination/h8kqm1k/
106,3,1628726109,It was in another article I think be the cbc.  But for it to work the province had to adopt it and use a vaccine certificate.,canada,t5_2qh68,/r/canada/comments/p2nhsv/canada_moving_forward_with_a_proof_of_vaccination/h8llcp6/
107,0,1628516636,"""Three days later, Gauthier says the client returned and told him, ""that made a lot of sense to me,"" and presented her first vaccine certificate. ""  I'm calling BS on this. You can't get a vaccine certificate for a single vaccine. The certificate is issued two weeks after your second dose.",canada,t5_2qh68,/r/canada/comments/p05m38/eastern_townships_gym_owner_targeted_online_over/h8aa1s4/
108,0,1628459146,Wait so an app that tracks and warns about a health issue (covid) isn't health related?  And the vaccine certificate would be the same way.  If businesses and people want to participate they can or they can opt out as it was for the app.  You could even go a step further and make it part of the covid app,canada,t5_2qh68,/r/canada/comments/p0m7yy/covid19_vaccine_passport_system_largely_supported/h87rwny/
109,0,1628222916,Assuming the bugs could possibly outweigh the huge benefits of this system...  What bugs are there? The EU vaccine certificate has only been out for a month. What is it’s worst current bug?,canada,t5_2qh68,/r/canada/comments/oylkv3/legault_announces_quebec_will_move_ahead_with/h7waqtx/
110,1,1628272419,"&gt; But for day to day use like restaurants and gatherings is very against. That’s a tool of authoritarianism.  No it is not  Authoritarianism would be the government mandating that all businesses must 100% enforce vaccinations.  That is not what is being discussed. What is being discussed is the vaccine ""certificate"" so that if a business wishes to make it's own FREE CHOICE on allowing unvaccinated people in, they have the means to doing so easily.  I would be against the government mandating what the businesses do. That would be an authoritarian over-reach. Just providing the certificate and leaving the people the choice how to enforce it on their own private residence or business is NOT authoritarian government over-reach.  People need to stop throwing around this idea that the Canadian government is some authoritarian nightmare communist hell hole.",canada,t5_2qh68,/r/canada/comments/oz83yo/turned_around_at_the_us_border_forced_to/h7ym9wk/
111,2,1628273453,"The only mandate the federal government can pass regarding mandatory vaccinations is what Trudeau alluded to the other day.  Federal employment can mandate vaccinations. But they cannot actually mandate universal vaccinations like that amongst the private sector, or Provincial regulated industries.  The decision would only impact those working directly for the federal government or a federally regulated industry (like health care practitioners who are part of a regulated professional organization)  Thy can also mandate them for international travel. But that's about the extent of the power. Unless they declare a state of national emergency and enact emergency powers again (which I don't think they will, there's zero apetite for that)  Which means, that most of the hand ringing about ""rights"" over carrying a vaccine certificate is mostly coming directly from those who are refusing to get the shot and do not wish to lose access to privileges that they also equate to as ""rights""  For example: It's a privilege and a benefit of living in our society that we can go in peace to a movie theatre. This is not a right. We have no rights to watch movies. A business can and absolutely have the freedom to limit who can enter their establishment already. This has legal precedent and we see it constantly with ""no shirt, no shoes no service"" messaging.   The constant screeching by the anti-vaxxdrs that this is ssome authoritarian over reach into denying them their right to a haircut, or hang out at a movie theatre is just them showing their pure ignorance and repeating talking points that are purposely being spread to sew division and keep these people ignorant.  As for immigration: that's a reall real tough one. there are pros and cons to it. And there's definitely massive abuse of immigration/refugees by big business who use them to get away with driving down the cost of labour for their own corporate avarice. But at the same time, Immigration is what Canada is basically founded on. And we have been a welcoming country. it's how pretty much all our families got here. So hearing 1st or 2nd generation immigrants turn around and screech that they should stop letting immigrants in... is troubling.  (end rant)",canada,t5_2qh68,/r/canada/comments/oz83yo/turned_around_at_the_us_border_forced_to/h7yoo8y/
112,0,1628183575,When was the last time you were asked to show your smallpox vaccine certificate?,canada,t5_2qh68,/r/canada/comments/oylkv3/legault_announces_quebec_will_move_ahead_with/h7tvxmg/
113,1,1628184973,That's the best part. The smallpox vaccine works. That's why nobody cares about your certificate.,canada,t5_2qh68,/r/canada/comments/oylkv3/legault_announces_quebec_will_move_ahead_with/h7tzc7m/
114,2,1628186457,"Vaccine certificates for the smallpox vaccine were absolutely a thing that people cared very much about. You should read up more on them.  From Wikipedia:  The first International Certificate of Vaccination against Smallpox was developed by the 1944 International Sanitary Convention[1] (itself an amendment of the 1926 International Sanitary Convention on Maritime Navigation and the 1933 International Sanitary Convention for Aerial Navigation).[2] The initial certificate was valid for a maximum of three years.[1]  […]  After smallpox was successfully eradicated in 1980, the International Certificate of Vaccination against Smallpox was cancelled in 1981, and the new 1983 form lacked any provision for smallpox vaccination.[1]  Source: https://en.m.wikipedia.org/wiki/Vaccination_requirements_for_international_travel",canada,t5_2qh68,/r/canada/comments/oylkv3/legault_announces_quebec_will_move_ahead_with/h7u30hg/
115,3,1628186631,"If you don't see a difference between a certificate for international travel and a certificate to go to go out in public, I'm not sure what I can tell you.   It was also for a vaccine that worked.   These are two incredibly huge differences.",canada,t5_2qh68,/r/canada/comments/oylkv3/legault_announces_quebec_will_move_ahead_with/h7u3g3m/
116,4,1628195432,"The purpose of providing your driver's license is to prove you are above the legal age to drink/gamble etc. and there is no record of what locations I presented my drivers license/passport/birth certificate at.   It is not a license for entering a store, simply a method of proving you are a certain age or that you can drive your vehicle legally.    The vaccine passport is literally proposed as a license to enter public spaces and shops, arguably some of the more core and basic freedoms that make up a liberal democracy like Canada.",canada,t5_2qh68,/r/canada/comments/oyksrf/quebec_to_implement_vaccine_passport_system_as/h7up1nk/
117,0,1628133691,Probably will want it to be a different card than. Maybe a vaccine certificate.,canada,t5_2qh68,/r/canada/comments/oy5sm7/poll_shows_majority_of_canadians_support_barring/h7rg4n1/
118,0,1627999673,Some people are just too dumb. Just look at no new normal. Bring a very big stick please and we indeed need secure vaccine certificate.,canada,t5_2qh68,/r/canada/comments/ox3vtl/vaccinations_no_more_carrotbring_out_the_stick/h7jyohj/
119,1,1628022084,"You do not have the 'freedom' to enter stores, hotels, or events. You have permission as per the rules and guidelines set by the owners of those establishments which can include the requirement to provide ""immunization record"" o/a ""vaccine passport/certificate"" upon request if you wish to enter/partake.  It is simply upon the government to issue such documentation to businesses can effectively make that choice.",canada,t5_2qh68,/r/canada/comments/oxa6a4/tasha_kheiriddin_bring_on_the_vaccine_passports/h7lf5t8/
120,2,1628028135,"Had a mix, don't care. It was the right thing to do.  It's actually insane that 200 countries are supposed to keep tabs on the vaccine standards of 200 other countries with a dozen vaccines and dozens of vaccine regiments across many internal jurisdictions.   &amp;#x200B;  Ultimately, the government will produce a certificate saying you're vaccinated or not, without disclosing details like when and by what mode. And if other places don't accept that, fuck em.",canada,t5_2qh68,/r/canada/comments/oxdp09/decision_to_mix_vaccines_could_cause_travel/h7lt96e/
121,0,1627960756,"been down this rabbit hole before .. I refuse to post all the links where the WHO, MERCK, and all these studies say it's safe. I refuse to post proof that Tylenol (which is prescribed to covid patients)  has more adverse reactions .. than the drug mentioned in that link.  All I'm going to say is, when patients were dying and vaccines weren't an option .. that drug mentioned above became a godsend to many doctors and patients.   &amp;#x200B;  I'm not going to say anything bad about the FDA, all I know is .. it's been reported that on some certificate given ( before or after the vaccine jab) in the States .. it reads ..   &amp;#x200B;  THIS VACCINE HAS NOT BEEN FDA APPROVED.  &amp;#x200B;  sneaky language move, vaccines got Emergency Use Authorization... so I guess that's what is meant.   I am VH, they got me.   &amp;#x200B;  Send me a private msg if ya wanna get really freaked out... or have the persuasive abilities to flip a VH person.",canada,t5_2qh68,/r/canada/comments/owrjk3/immunocompromised_albertans_concerned_with/h7iecww/
122,0,1627848750,"Have a national immunization certificate (that can be recognized internationally) but allow the provinces to decide whether to implement local vaccine requirements or not. For international travel, countries have had vaccination requirements for years, so one more ""vaccine passport"" shouldn't be a problem.",canada,t5_2qh68,/r/canada/comments/ovynkf/vaccine_resisters_are_lazy_and_irresponsible_we/h7cmixq/
123,0,1627753049,"In the UK, the fine is [500 pounds](https://www.theguardian.com/world/2021/may/16/fake-covid-vaccine-and-test-certificate-market-is-growing-researchers-say). That's a more reasonable fine. They just need to hire a lawyer.",canada,t5_2qh68,/r/canada/comments/outnpx/pair_of_travellers_from_us_fined_20k_each_for/h7822eu/
124,0,1627586198,"&gt;No one raised a fuss about vaccine certificates until we called them ""passports""  Perhaps because nobody ever suggested that you should need a ""vaccine certificate"" in order to go to the grocery store?",canada,t5_2qh68,/r/canada/comments/otzwus/adam_no_one_raised_a_fuss_about_vaccine/h6zppnb/
125,1,1627617483,"Not in to Canada, out of Canada you dumb ass. If a Canadian wants a visa to another country they require their vaccine records or a stamped certificate from the dr who administers them.",canada,t5_2qh68,/r/canada/comments/otzwus/adam_no_one_raised_a_fuss_about_vaccine/h71lbml/
126,0,1627573853,This article is awful. When was the last time you had to show a yellow fever vaccine certificate to eat out with friends? And what purpose does the vaccine passport even serve? We know now infected people can easily spread covid regardless of vaccination status. I got my vaccines as a kid. Not once did I have to show it unless I’m entering an at risk country with poor medical facilities. These are not the same as what is being proposed now.,canada,t5_2qh68,/r/canada/comments/otzwus/adam_no_one_raised_a_fuss_about_vaccine/h6yvnq7/
127,0,1627148339,"IRCC &amp; Canadian authorities have always had to go through massive amounts of documents formated in all sorts of ways when dealing with PR applications and the like. I hope that authorities actually utilize the fact that travellers have to upload vaccine certification before travel so authorities can verify it.    That being said, I genuinely wish they start some kind of vaccine passport thing for international travel as soon as possible. No, the vaccination certification used in the past pre COVID (aka Yellow Card) won't cut it (https://en.m.wikipedia.org/wiki/File:International_Certificate_of_Vaccination_or_Prophylaxis_(Netherlands)_-_proof_of_vaccination_against_DTP_and_MMR.jpg). Those are literally stickers pasted on to a sheet of paper which can easily be tampered with.   Having a proper vaccine passport would bring peace of mind. I wouldn't have to worry if border patrol would be like ""hmm.... the certificate does not have xyz information... sorry you can't enter""",canada,t5_2qh68,/r/canada/comments/oqhlkm/yvr_arrivals_terminal_splits_passengers_by/h6dx23y/
128,0,1627063122,"I've got a yellow fever vaccine certificate from Health Canada (I think? Can't be bothered to dig it out), it's theoretically required for a handful of countries but I've never actually been asked for it.",canada,t5_2qh68,/r/canada/comments/oq6xrk/canadas_vaccine_passport_wont_come_until_december/h69wk87/
129,0,1626917344,"The table notes, however, that vaccine certificates differ from passports.  “A vaccine passport provides proof of vaccination status for the purpose of travel across international borders,” reads the brief, whereas a vaccine certificate is “a verifiable attestation by an issuing body, for example, the Province of Ontario, that a person received an approved and complete series of COVID-19 vaccines.”  So its not different?  They really think people are that stupid?  ""If we change the word from passport to certificate, they will definitely fall for it!""   I'm vaccinated, so either way i'll be fine, but this is such a joke. We.Are.Done.Here  Let's move on.",canada,t5_2qh68,/r/canada/comments/op0uwj/ontario_science_table_says_vaccine_certificates/h62qna0/
130,0,1626800175,&gt; I can go all over Europe with my Ontario vaccine certificate and no testing; but cannot return to Canada without the hassle of finding and paying for a covid test.  [(link)](https://www.reddit.com/r/canada/comments/onj1po/fully_vaccinated_us_travellers_allowed_to_enter/h5sih5x/),canada,t5_2qh68,/r/canada/comments/onj1po/fully_vaccinated_us_travellers_allowed_to_enter/h5w7z5c/
131,0,1626719435,"&gt; All travellers will be required to upload proof of vaccination to the ArriveCAN app or website before they board their flight to Canada and carry their vaccine certificate with them to present to border officials.  &gt; Fully vaccinated travellers will also be able to forgo the mandatory post-arrival test unless randomly selected.   So I see no mention of needing a Pre-Arrival test, did CTV forget that part or is that quietly being dropped?",canada,t5_2qh68,/r/canada/comments/onjfke/canada_to_allow_fully_vaccinated_american/h5s5mim/
132,1,1626724958,I can go all over Europe with my Ontario vaccine certificate and no testing; but cannot return to Canada without the hassle of finding and paying for a covid test. That's ridiculous! Also lets just that I was extremely unlucky enough to pick up covid anyways.  With a positive test you cannot come home. So the government is prohibiting sick Canadians from returning to their own country. Shouldn't this be a big deal? I though we all had a right to return to Canada. There is not one other disease that the government will refuse you entry for.,canada,t5_2qh68,/r/canada/comments/onj1po/fully_vaccinated_us_travellers_allowed_to_enter/h5sih5x/
133,0,1626404610,"My guess.  Like most things in the pandemic, the govt was slow to react and didn't work on a national vaccine certificate (for international travel purposes) until too late and they don't expect it to be ready (i.e. communicate with provincial databases) before August/September.  And until Canadians don't have a ""vaccine passport"", can't ask foreigners to show one when entering Canada.",canada,t5_2qh68,/r/canada/comments/ol77zz/fully_vaccinated_americans_can_enter_canada_as_of/h5crdw0/
134,1,1626436238,"That's what is said about the new EU Vaccine Passport  ""The European COVID-19 travel certificate has been created by the European Union in a bid to restore the freedom of travel,""  https://www.schengenvisainfo.com/news/all-details-on-eu-covid-19-passport-revealed-heres-what-you-need-to-know/  If they decide that is a requirement to visit Europe in the second half of 2021, then we have a problem.  As usual we are following the USA ""freedom"" model but that's not necessarily what is best for Canadians or the world. In the USA they have to do it because imposing it is political suicide.",canada,t5_2qh68,/r/canada/comments/okzvdg/were_not_gonna_have_a_split_society_ontario/h5dy2ga/
