,Unnamed: 0,created_utc,body,subreddit,subreddit_id,permalink
0,0,1643995478,"&gt; Vaccinated people outnumber the unvaccinated in both the hospital and the ICU  This is commonly cited by the anti-vax rhetoric, which is correct. However, from the [same site](https://covid-19.ontario.ca/data), 84% of the population is vaccinated and 11% are not. Why are 44% of those in the ICU unvaccinated, while making up 11% of the population?  I would advocate for limiting hospital saturation to a proportion of the population, but using vaccine status as a factor in this decision is currently unethical, it's a [hot subject](https://globalnews.ca/news/8286334/covid-19-can-doctors-deny-medical-care-to-unvaccinateded-patients/) in the medical field because of how blown out of proportion the cost of dealing with such a small number of unvaccinated are.   &gt; If you look at the number of available ICU beds, it's basically been flat for the past 90 days, with only a slight uptick from Omicron.  Are we looking at [the same data](https://i.imgur.com/jLEouhu.png)? I see a quadrupling in number of adults in the ICU between 90 days ago and today, peaking at almost quintupling a week ago. That surge came among the post-Christmas lockdown, as a variant 2x more contagious than Omicron, which itself was the most contagious variant yet, ripped through the continent.  &gt; I have no idea why you think this. There are no restrictions on movement or gatherings, except for certain commercial events.  I mean, what you've said is technically correct, but grotesquely misleading, as ""certain commercial events"" [includes](https://covid-19.ontario.ca/proof-covid-19-vaccination):  **Where proof of vaccination is required**  Have your vaccine certificate and your ID ready when entering a business or organization.  Businesses and organizations are required to check that your name and date of birth on your proof of vaccination matches your ID.  Indoor  You must show your proof of vaccination (enhanced vaccine certificate with QR code) and ID to enter indoor areas of:  * restaurants, bars, and other food and drink establishments without dance facilities (with limited exemptions, including for take out and delivery) * food or drink establishments with dance facilities, including nightclubs and restaurants, clubs and other similar establishments (with limited exemptions, including for take out and delivery) - note: indoor areas only permitted to open if they are operating solely as an indoor food or drink establishment without dance facilities meeting and event spaces, with limited exemptions * facilities used for sports and recreational fitness activities, including waterparks, and facilities where personal physical fitness trainers provide instruction (with limited exemptions) * gyms, fitness/sporting/recreational facilities, pools, leagues, sporting events and indoor areas of facilities where spectators watch events * casinos, bingo halls, and other gaming establishments * concert venues, theatres, and cinemas * strip clubs * horse racing tracks, car racing tracks and other similar venues * locations where commercial film and TV productions take place with studio audiences  Outdoor  You must show your proof of vaccination (enhanced vaccine certificate with QR code) and ID to enter any of the following outdoor areas:  * outdoor areas of food or drink establishments with dance facilities, including nightclubs and restoclubs * outdoor meeting and event spaces including conference centres or convention centres that have a usual capacity of 20,000 or more people (with limited exemptions) * outdoor facilities used for sports and recreational fitness activities that have a usual capacity of 20,000 or more people, including waterparks and personal physical fitness training (with limited exemptions) * outdoor concert venues, theatres and cinemas that have a usual capacity of 20,000 or more people * outdoor horse racing tracks, car racing tracks and other similar venues that have a usual capacity of 20,000 or more people",canada,t5_2qh68,/r/canada/comments/sjvf35/ontarios_top_health_official_says_it_may_be_time/hvl3e7s/
1,1,1644031053,Take the jab take the jab …. Why is this being pushed so hard is the real question now ??? do you think anyone actually cares that much that your vaccinated so we can all return back to normal that’s just a controlling statement to begin with and it just goes to show they don’t care about your health they care about theirs and they complain that we are getting them sick when I’m reality they  are making us sick… people saying stuff like fuck the convoy clearly belong to the middle class political tier of Canadians cause not a single person I’ve actually met that can hold a conversation and or actually talk to one another believes that shit these truckers work day in and day out to deliver goods aside from the trucks that deliver for stores these truck drivers are just fed up like everyone else to wake up to a new set of rules if it isn’t clear we don’t want it anymore I’d rather die stupid and happy then stressed out and forced into things i think that goes for the mass majority enough people have suffered and enough people are saying I don’t care any longer… the far left can shuv their vaccines right up their ass just like abortion was passed a personal choice so is taking a vaccine I have never been forced to take a vaccine not through swine flu not through anything and btw you can pay a person on the dark net to escrow you a vaccination certificate so how secure is your system ???? How many people that have vaccines are actually vaccinated in starting to see a few issues here on a really big scale ….. and if Trudeau got covid as the truckers came down and his kids then that means the shots efficiency isn’t as good as they are saying ! Very confused lately I used to be a supporter of Trudeau he made a lot of things better when he first came into office but has progressed to unhealthy abuse of power in my opinion.,canada,t5_2qh68,/r/canada/comments/sktrn4/trump_calls_trudeau_far_left_lunatic_as_siege/hvniw2x/
2,0,1643827213,"Boosters do show real reduction in transmission, at least for a couple months. But Moe was referring to vaccination in general required for the vaccine certificate, not the recently boosted.  Does it make sense to restrict access to places in Saskatchewan based on two-dose vaccine status? The effects seen are pretty small so it is a judgement call.   Alternatively he could require recent boosters, but that isn’t logistically feasible as some people have been boosted more than 10 weeks ago, and aren’t eligible, and others received their second shot too recently to be boosted so it is a non-starter.",canada,t5_2qh68,/r/canada/comments/siqj9m/experts_explain_why_premier_scott_moes_claims_on/hvb6cgf/
3,0,1643229754,"Odd stance when you can buy a cheap used phone and use pay as you go plans to have just as an emergency device.   But regardless, then just... print it out...  Also passionately against printers?  Then call your provincial health care provider and they will mail you your vaccine certificate. (1-833-943-3900 for Ontario)",canada,t5_2qh68,/r/canada/comments/sd4iv4/walmart_costco_and_other_big_box_stores_in_canada/hucez1v/
4,0,1643113643,"https://www.medrxiv.org/content/10.1101/2021.08.24.21262415v1  &gt; **Methods:**  &gt; We conducted a retrospective observational study comparing three groups: (1)SARS-CoV-2-naïve individuals who received a two-dose regimen of the BioNTech/Pfizer mRNA BNT162b2 vaccine, (2)previously infected individuals who have not been vaccinated, and (3)previously infected and single dose vaccinated individuals. Three multivariate logistic regression models were applied. In all models we evaluated four outcomes: SARS-CoV-2 infection, symptomatic disease, COVID-19-related hospitalization and death. The follow-up period of June 1 to August 14, 2021, when the Delta variant was dominant in Israel.  &gt; **Results:**  &gt; SARS-CoV-2-naïve vaccinees had a 13.06-fold (95% CI, 8.08 to 21.11) increased risk for breakthrough infection with the Delta variant compared to those previously infected, when the first event (infection or vaccination) occurred during January and February of 2021. The increased risk was significant (P&lt;0.001) for symptomatic disease as well. When allowing the infection to occur at any time before vaccination (from March 2020 to February 2021), evidence of waning natural immunity was demonstrated, though SARS-CoV-2 naïve vaccinees had a 5.96-fold (95% CI, 4.85 to 7.33) increased risk for breakthrough infection and a 7.13-fold (95% CI, 5.51 to 9.21) increased risk for symptomatic disease. SARS-CoV-2-naïve vaccinees were also at a greater risk for COVID-19-related-hospitalizations compared to those that were previously infected.  &gt; **Conclusions:**  &gt; This study demonstrated that natural immunity confers longer lasting and stronger protection against infection, symptomatic disease and hospitalization caused by the Delta variant of SARS-CoV-2, compared to the BNT162b2 two-dose vaccine-induced immunity. Individuals who were both previously infected with SARS-CoV-2 and given a single dose of the vaccine gained additional protection against the Delta variant.  I'd also point out that the EU [recognizes prior infection in their Covid passport system](https://ec.europa.eu/info/policies/justice-and-fundamental-rights/eu-citizenship/movement-and-residence/eu-digital-covid-certificate-vaccinations-and-travel-restrictions_en), and the EU isn't a bunch of science denying nutjobs.",canada,t5_2qh68,/r/canada/comments/sbtzfq/trudeau_slams_fear_mongering_over_covid_vaccine/hu587rw/
5,0,1642883565,"As a Chinese-Canadian (I hold a Canadian passport and have been banned from entering China indefinitely due to COVID-19), I have heard of news pieces where Chinese government officials threaten and coerce immigrants to return. This is generally not a good strategy though. If I am in Canada and I know I am a wanted person in China to the point that the Chinese police are harassing me by phone or in person, I would never return. It is better for me to get murdered by Chinese police in Canada, let the local police and RCMP investigate the murder, than for me to return to China and be disappeared forever, even though the murderer will never be brought to justice.  I have been joking with my mother about the opposite problem that she may face: being banned from entering China due to COVID-19. Full disclosure: my mother has 3 doses of the Pfizer-BioNTech vaccine and has a QR code to prove it.  You see, my mother entered Canada on a ""parent and grandparent super visa"" (introduced way back in 2012 to allow parents and grandparents of Canadian citizens and permanent residents to visit Canada long term). At the time, she was approved for a 2 year stay (she needed to buy her own health insurance but that is it). At the time, she already had an immigration application pending.  Shortly after she landed under the super visa scheme, her immigration application was approved and she ""soft crossed"" the US-Canada border with just her Chinese passport with a newly issued immigration visa on foot (by soft crossing, I mean you leave the Canadian side but never try to enter the US and since she did not have a US visa, she would not have been allowed to go to the US anyway). Once she did that, she became a permanent resident and has had this status ever since. Her passport expired in 2021 though, and something weird is happening. Let me explain.  Back in July of 2021, right around the time that her passport expired, the National Immigration Administration of China issued an order to severely limit who is allowed to apply for Chinese passports. Only those with an Offer of Admission to a foreign school or a job offer from a foreign employer is allowed. Since this order, very ridiculous stories have surfaced:  1. Middle-aged woman in China tries to apply for a passport to go to America because her daughter gave birth to a baby there and she wants to visit. The Chinese authorities refused her passport application citing COVID-19 restrictions. 2. Chinese man who frequently flew between Shanghai and Los Angeles pre-pandemic because his wife and son both live in America got stopped by Chinese Customs officials despite having a valid passport and US Visa. They make him show his wife's ID and even his child's birth certificate, and was questioned extensively on why he needed to go. Once he landed at LAX, he (a foreign national by definition) was not scrutinized by American officials at all, in sharp contrast to when he was exiting China (a country where he is a citizen). 3. Chinese person immigrated to Singapore and has permanent residence status there. Due to the pandemic, the person's passport cannot be renewed at the embassy and as a result, they risked losing permanent residence status and face deportation to China (granted, that in Canada, if you are a permanent resident, it is not mandatory for you to have a passport from your country of origin, nor is it mandatory to possess a permanent resident card, as long as you remain in Canada, so this story applies to only certain countries). The person in question owns a condo in Singapore and may be forced to sell it if permanent residence status is lost.  So, going back to my mother, her passport expired 6 months ago. Since she is not a Canadian citizen, she is not able to get a Canadian passport. But when I went onto the app (Chinese Consulate) that is used to apply for Chinese passports, I realized the required documents are ridiculous. Not only do you need your expired passport and photos for the new passport, you also need to go through facial recognition, submit a document (like a health card, driver's license or bank statement) to prove which province in Canada you live in). In addition, there is a requirement for a photo of the applicant holding up a copy of a recent mainstream newspaper (by recent, they mean within 3 days of taking the photo). They also have this warning: due to COVID-19, in person applications for passports are not accepted, and as a result, your passport will not contain your fingerprint and therefore, you will not be able to use the self serve kiosk when entering China.  Given how hard it is to get a passport these days, I have doubts on whether my mother will even be allowed to get a passport. If she cannot get one, she becomes *de facto* stateless and will have no choice but to apply for Canadian citizenship.  I know this story seems to be irrelevant to this discussion, but it serves to show that in China, citizens can be treated in extreme ways (some are coerced to return or outright kidnapped from other places and transported to China, while others are refused passports or permits). Hong Kong politician Leung Kwok-Hung (the man with really long hair) was one of the most famous Chinese citizens who are banned from entering China due to his anti-CCP views.",canada,t5_2qh68,/r/canada/comments/sa8av1/chinas_efforts_to_force_return_of_citizens_whove/htscry8/
6,0,1642788109,"\&gt; There’s the selfish reasoning again  You want to strip people of their right to bodily autonomy or shame them into compliance to get a vaccine that they DO NOT NEED. There is a great deal of irony in your statement. If they are not at risk of hospitalization, then they are not someone who will overrun our hospitals. So the need for personal protection isn't there. If the vaccines do not reduce transmission as they currently aren't, there is no argument for forcing people to get it for communal protection either.  Nada, zip, no reason. I can not in good conscience force a 20 year old athlete to get the jab.  \&gt; It’s not mild at all   Well the WHO disagrees with you as well.  https://www.reuters.com/business/healthcare-pharmaceuticals/who-sees-more-evidence-that-omicron-affects-upper-respiratory-tract-2022-01-04/  For the overwhelming majority, it is.      https://www.youtube.com/watch?v=9UHvwWWcjYw  Here's a great video I encourage everyone to watch that came out yesterday. It covers a Freedom of Information Act request published in the UK by the Office for National Statistics. It lists the total number of fatalities from COVID with no other underlying causes.  ""Deaths with COVID-19 on the death certificate"" - 174,233    ""Deals from COVID-19 with no other underlying causes"" - 17,371     The average age of death of those of the 17,000 is 81.5. We can already do basic math based on case numbers and fatalities based on age group, but this just solidifies the notion that COVID is only dangerous for the exceptionally ill or the very old. For everyone else, it's not a risk. Yes, protect them, get them vaccinated and safe, but the shots don't reduce transmission in their current iteration and we need to stop locking down 99% of the populace over this.  \&gt; We can’t live the rest of our lives with hospitals filled to the top     Well good thing we're not right now, either.  [https://covid-19.ontario.ca/data/hospitalizations](https://covid-19.ontario.ca/data/hospitalizations)  We have 500 beds currently free with nobody occupying them. We have 2300 beds and non-COVID related cases are occupying 1300 of them. Plus, this chart doesn't even distinguish between hospitalizations FROM COVID vs WITH COVID, so the real number of COVID-exclusive ICU cases is even lower.  My point is, you need to take a step back. The numbers are looking better and better every day and you have an opportunity breathe a sigh of relief.  Those countries are opening up, even the U.S. is to a degree, and many other countries like Sweden moved on a long time ago because of this.  I was pretty pro-lockdown early into this before we knew anything about it, but I've re-evaluated as things went on.",canada,t5_2qh68,/r/canada/comments/s9dgn6/why_would_the_unvaccinated_reject_a_covid19/htmliug/
7,0,1642708352,"*Premier Doug Ford says the current requirements for the COVID-19 vaccine certificate will remain as is.*     *When asked by a reporter if the premier would update the vaccine certificate requirement to include three doses instead of two, Ford said “not right at this point.”*        *Ford made the short comment at a press conference on Thursday where he revealed a reopening plan for the province that included lifting closures on restaurant indoor dining and gyms, among easing of other capacity restrictions starting Jan. 31.*  &amp;#x200B;  *The proof of vaccination system will continue to apply to certain indoor public settings such as restaurants, gyms and theatres for at least the next two months as outlined in the reopening plan.*        *The government also recently mandated that Ontarians use a vaccine certificate that includes a scannable QR code to gain entry into those settings, as the older versions were susceptible to fraud.*        *As of Thursday, of the aged 12 and older population, 88.8 per cent are fully vaccinated. Meanwhile, third-dose immunization is at 44.8 per cent — more than 5.7 million Ontarians have received a booster shot.*        *Ontario Liberal Party Leader Steven Del Duca slammed Ford for not updating the vaccine passport requirements to three shots.*        *“It’s time Ontario required booster shots for vaccine certificates,* u/fordnation*. This is a measure that will increase booster uptake, make the reopening safer, and get us back to doing the things we love sooner,” Del Duca wrote on Twitter.*        *Meanwhile, Ontario NDP Leader Andrea Horwath said the vaccine passports should be further expanded into more non-essential businesses, LCBOs, and cannabis retail stores.*        *“Those places should require certificates as well,” Horwath said.*        *“It’s also curious that this issue of the third dose was just out of hand dismissed by the premier,” Horwath continued. “That the idea of the third dose being a requirement for the fully vaccinated passport was completely ignored.”*",canada,t5_2qh68,/r/canada/comments/s8re3y/ontario_covid19_vaccine_passports_will_remain_at/hti25u1/
8,0,1642012804,"The problem is that only select peer reviewed articles are turned into mainstream media. Others are either completely disregarded or dismissed with ""but..."".   Here are some summary points from a very fresh review of peer reviewed articles:  - Encouragingly, authors of a study conducted among recovered individuals who had experienced mild SARS-CoV-2 infection reported that mild infection induced a robust antigen-specific, long-lived humoral immune memory in humans. - It is known that SARS-CoV-2 infection induces specific and durable T-cell immunity, which has multiple SARS-CoV-2 spike protein targets (or epitopes) as well as other SARS-CoV-2 protein targets. The broad diversity of T-cell viral recognition serves to enhance protection to SARS-CoV-2 variants,15 with recognition of at least the alpha (B.1.1.7), beta (B.1.351), and gamma (P.1) variants of SARS-CoV-2. - Some people who have recovered from COVID-19 might not benefit from COVID-19 vaccination.6 ,  19 In fact, one study found that previous COVID-19 was associated with increased adverse events following vaccination with the Comirnaty BNT162b2 mRNA vaccine (Pfizer–BioNTech) - Although longer follow-up studies are needed, clinicians should remain optimistic regarding the protective effect of recovery from previous infection.    [source](https://www.thelancet.com/journals/laninf/article/PIIS1473-3099(21)00676-9/fulltext)   And yet in Canada, previous infections are not considered at all in the immunization record of previously infected people. However, it is recognized by the EU health authorities.   [An EU Digital COVID Certificate is a digital proof that a person has either](https://ec.europa.eu/info/live-work-travel-eu/coronavirus-response/safe-covid-19-vaccines-europeans/eu-digital-covid-certificate_en)  - been vaccinated against COVID-19 - received a negative test result or  - recovered from COVID-19   The EU also says this:   Booster shots: As of yet, **there are no studies expressly addressing the effectiveness of boosters on the transmission of COVID-19** and therefore it is not possible to determine an acceptance period for boosters. However, given the emerging data, it can be expected that protection from booster vaccinations may last longer than that resulting from the primary vaccination series. **On the basis of new scientific evidence on this issue, the Commission may, if needed**, propose an appropriate acceptance period also for vaccination certificates issued following a booster.   In Canada we already know EU is wrong?   So, is this the peer reviewed stuff you are talking about.",canada,t5_2qh68,/r/canada/comments/s29cp9/majority_of_canadians_support_healthcare_fines/hsdqpph/
9,0,1640020156,"Starting January 4th Ontario will be requiring people to use the enhanced vaccine certificate with QR code and businesses will be required to use the Verify Ontario app to scan the QR code in settings where proof of vaccination is required. The app does the work of figuring out whether someone is the correct length of time past their last dose - big green checkmark for yes, big red x for no.",canada,t5_2qh68,/r/canada/comments/rkra2p/definition_of_fully_vaccinated_not_changing_to/hpbc9q4/
10,1,1640023186,"You don’t need a smart phone to use the enhanced vaccine certificate with the QR code, it’s just a pdf document same as the previous versions, and you can print it out on paper. Only the businesses need to have a phone/tablet/etc in order to scan the QR code.  Obviously some people don’t have a printer (or any friends/family/neighbours who have a printer), but you can go to a public library for help in a pinch.",canada,t5_2qh68,/r/canada/comments/rkra2p/definition_of_fully_vaccinated_not_changing_to/hpbjqyr/
11,0,1639261506,"Flu shots wane in efficiency, yet you don’t need a flu shot certificate to go to the gym. The “vaccine” has failed so far in ending the pandemic which is the exact rhetoric the “experts” claimed. Why should we bother with a vaccine that wanes after 6 months which isn’t nearly long enough for it to be worth it since there is a risk that can be taken. More athletes and healthy people have dropped and died from heart conditions in the past 4 months than the past 4 years combined. When monocholonal antibodies have worked wonderfully against covid and have no risk at all why should we not turn our attention towards them? The answer is because it would be too damming politically for politicians to say they were wrong with these vaccines and more importantly it would be more damming to pharmaceutical companies profits.",canada,t5_2qh68,/r/canada/comments/rdznam/fully_vaccinated_how_many_doses_will_it_take_and/ho6a1g5/
12,0,1639203592,"Instructions for getting your proof of vaccination with the QR code are here: [Proof of COVID-19 vaccination](https://covid-19.ontario.ca/proof-covid-19-vaccination)  It’s still just a PDF document. You can print it out on paper, or save the PDF to your smart phone, or if you have an iPhone with iOS 15.1 you can scan the QR code with the camera to [add the proof of vaccination to your Apple Wallet.  ](https://news.ontario.ca/en/release/1001080/apple-wallet-update-now-compatible-with-ontario-vaccine-certificate)",canada,t5_2qh68,/r/canada/comments/rdiohw/ontario_announces_changes_to_proof_of_vaccination/ho3a8jp/
