,Unnamed: 0,Unnamed: 0.1,Unnamed: 0.1.1,created_utc,body,subreddit,subreddit_id,permalink
359,4,4,0,1634420198,"Well, Turkey is where every Pakistani loves to go - takes about a couple of weeks to get the visa. Spain, Netherlands, Germany and Switzerland have started serving visas for Pakistanis recently (without Schengen due to Covid). Albania is also a great option. Kenya another one. Egypt. Uzbekistan has also been seeing quite a few Pakistani tourists recently. Maldives and Seychelles for your island vacation.    If you are a travel enthusiast, I'd suggest to join a Facebook group called The Travel Diary. It's a Pakistan focused group so you will get all the opinions from the perspective of a Pakistani passport holder, unless mentioned otherwise. You can make your complete travel itenary there, while getting feedback from recently travelled Pakistanis.",pakistan,t5_2qh89,/r/pakistan/comments/q9ffej/travel_as_a_pakistani_passport_holder/hgwps1t/
360,5,5,0,1634208181,"Hi! I'm an American who lives and works in Pakistan and just recently flew back into Pakistan.   For the most part, Pakistani immigration is very easy to navigate. Due to Covid-19, however, you will need a negative PCR test 72 hours from your initial departure and the Pass Track App downloaded with your information filled.   Upon disembarking the plane, they'll first check your Pass Track app. Then you'll head to the immigration counter, hand the agent your passport and NICOP/Visa, who in turn will check your documents and take your picture with a Webcam.   Before baggage claim, you may also under go another rapid antigen test (similar to PCR nasal swab). Have your NICOP/Visa, passport, and passtrack app on hand when you disembark the plane.   Hope this helps. If you have a NICOP and don't look like a foreigner, the immigration agents don't ask too many questions.",pakistan,t5_2qh89,/r/pakistan/comments/q7oknf/traveling_alone_as_a_female_to_pakistan_any_tips/hglgutz/
361,6,6,0,1631366612,"I understand your frustration but not everything is a conspiracy theory against Pakistan. Yes, there’s practically no travel between India and Pakistan but I was in Dubai back at end of April when things were getting out of hand in India, When I was flying back to Pakistan via the Fly Dubai terminal, hundreds of Indians and Pakistanis were seated together awaiting their respective flights and interacting with each other. If people aren’t taking our COVID numbers seriously, it’s because our government lacks credibility around the world not because it’s some ploy to ostracize us.   Ukraine is notorious for treating Pakistanis with a lot of contempt upon arrival because several Pakistanis who travel there only do so they can flee in to one of the bordering countries.   I was supposed to visit Russia this summer to attend a Euro cup game. Had my ticket and everything lined up. Was super excited. Guess what ? I didn’t end up going because a lot of people flying in from Pakistan ended up getting detained and being sent back. Among these were 18 or 19 year olds who had shown up with a mere hundred dollars on them not thinking they’d be vetted by immigration. What was their real purpose of travel ? The airline I was traveling with announce they weren’t to going to fly people to Russia traveling on the basis of Fan ID.   I know how it feels to be in your shoes having traveled frequently on a Pakistani passport. But it’s just the card we were dealt. We have to rise above it rather than blame others.",pakistan,t5_2qh89,/r/pakistan/comments/pltdwt/im_depressed_that_the_random_bs_in_neighboring/hcfkrs0/
362,7,7,1,1631388408,"1) I'm so confused about the prestige of an Estonian medical degree, aren't their universities not even in the top 100? I know multiple Pakistani lecturers (with degrees from Pakistan) teaching at top 100 institutions, I personally studied from one. Don't stress about ""prestige,"" it's not Oxbridge or Ivy (which aren't special anyway, I have multiple colleagues from there and it didn't help them any more than me!)  2) Research point is fairly valid, however, you can always apply to do research after undergrad (and research degrees generally pay you to do them). I can personally confirm that I've seen multiple researchers from no-name universities, everywhere.  3) I don't have ADHD but I've lived in Europe and the medical care is quite good, albeit, most countries are similar (Australia, New Zealand, Canada, etc.) This is important when making a decision on where to study because all these places offer those benefits too.  4) True, you can provide a comfortable living for them doing just about anything abroad though. Medicine is expensive and takes quite a long time (you'll need to fund yourself until the $$$ rolls in).  5) A Pakistani passport isn't a burden, I've actively tried to keep mine because this passport is a part of my identity. You bite the hand that feeds you?  6) While it's good to be ambitious, Pakistan doesn't particularly need doctors more than, let's say, water security or agriculture workers.  My point being, you weren't born in South Sudan, we have fantastic universities in Pakistan that offer a wide range of degrees (many of which, lead people abroad anyway). While it's unfortunate Covid has delayed your education, you have many options (delay for a year, alternative location, alternative degree, etc.) and Estonia isn't going anywhere.  Take a breather and look at the wider picture.",pakistan,t5_2qh89,/r/pakistan/comments/pltdwt/im_depressed_that_the_random_bs_in_neighboring/hcgxhlt/
363,8,8,0,1629181322,"No, get your covid test on your passport number",pakistan,t5_2qh89,/r/pakistan/comments/p5xx8b/use_booking_reference_for_covid_test_ba/h99c2pj/
364,9,9,0,1625611206,"Have you got a British Passport, if the answer is yes then you can as someone I know stayed in Spain for 2 weeks and came to the UK yesterday.   Go there and stay for a 12 days to be on the safe side as someone I know got caught out with the timings via Turkey and that was an expensive mistake.  Make sure you get a covid Test done in PK and you will need to fill the entry form for Spain online and print it (will provide link if required)  Once your there inshAllah and before you return get a PCR test done in Spain and fill in the passenger locator form and purchase the day 2 and day 8 kit which is required as Spain is is Amber.  Next announcement is on the 15th July, Maybe wait till then?  Good luck as ticket prices to Spain are expensive as there are limited flights to PK.  If you need any help with anything give me a shout.",pakistan,t5_2qh89,/r/pakistan/comments/oetmv6/british_pakistanis_what_advice_do_you_have_in/h4agu90/
365,10,10,0,1622317327,Applied and got one (pre-COVID). I can answer any specific questions you might have.   The basic process is that you get all the documents required by UK Govt and apply online. Then proceed with your documents and passport for submission at your nearest Gerry's office.   They usually take around 3-4 weeks to process it (non-urgent) and you'll get an email and maybe a phone call when your passport is ready for collection from the office.,pakistan,t5_2qh89,/r/pakistan/comments/nnsqea/what_is_the_process_for_getting_a_tourist_visa_to/gzwhk7t/
366,11,11,0,1615528524,"As far as government level goes an ally (that won’t drone strike you) is better than no ally.   As far as people go liberal Turks are more likely to dislike us while right wing Turks are more likely to like us. Reddit is more left leaning so on subs like r/TurkeyJerky you’ll see them shitting on us. When I went in person they were really nice to the point that it was suffocating. A couple things I remember are the TSA agent hugging us (pre-covid) after seeing my dad’s Pakistani passport, free tea at a local restaurant, and a couple people tried to greet us in Urdu. Really wholesome",pakistan,t5_2qh89,/r/pakistan/comments/m2n2t9/discussion/gqnvj94/
367,12,12,0,1613700071,"This has also been discussed extensively on the Indiamike forums.  If you are an Indian citizen (not OCI), then your wife can get a long term X visa to stay in India.    If you are a non-Indian citizen, then your wife will need to do one of two things: apply on her Pakistani passport, or renounce her Pakistani Citizenship and then apply on her US passport.  I have heard of both situations being successful (yes they ask about your parents and grandparents, but some people have still been successful).   However, using a Pakistani passport will likely be more trouble, and the visa will have more restrictions (list cities where you can go, etc)  Due to covid, I am not sure if any non-essential visas are being issued so you may not have any options right now.",pakistan,t5_2qh89,/r/pakistan/comments/lm5gio/dear_neighbors_has_anyone_here_applied_for_a/gnyk9g0/
368,13,13,0,1612009555,"You go to the British Council website and fill out a form. At the end click submit via physical bank. You will then get a document which you have to print out. Sign the doc, attach two photocopies of your Pakistani ID card, (or passport if you are a foreign citizen). Then go to the nearest standard charted bank and submit fees. Take screenshots and photos along the way for proof. You will get an email of confirmation a week or so later. Then you will get an email with your provisional Statement of Entry (SoE), Venue Letter and Covid Precautions Document. Two weeks before your exam you will get your physical SoE and Venue Letter. Visit the venue a day or two before the exam to familiarize yourself with the area. On your exam day you should be there with stationary, mask, sanitizer and SoE ONLY. Be there at the REPORTING TIME not the EXAM START TIME. Before the result day you will get an email with a website link and your logins. Login to the website to view the results.",pakistan,t5_2qh89,/r/pakistan/comments/l735v6/how_to_apply_privately_for_cies_in_islamabad/gld1361/
369,14,0,0,1643463464,Maybe bcoz karachi is the metropolis and also bcoz 25% capacity is allowed and on top of that many ppl are returned bcoz they fail to show a vaccine certificate.,pakistan,t5_2qh89,/r/pakistan/comments/sfh9a9/psl_2022_why_is_the_stadium_nsk_empty/hupulrq/
370,15,1,0,1637956053,Cansino is not approved for people under 18 so there's no way you can get a vaccine certificate within a week.,pakistan,t5_2qh89,/r/pakistan/comments/r24vie/i_need_vaccine_certificate_urgently_within_a_week/hm6tpi9/
371,16,2,0,1630494549,"Actually quite a lot of pumps do this in Karachi atleast. The volume makes it sensible for them to hold, the dip in sales is a not a problem because they would cut down on the losses in the longer run.  &amp;#x200B;  As for the vaccine certificate, well this is a new plan by the gov to try and get people vaccinated, without actually thinking of the implications or the logistics. Just like public transport is allowed to operate only at 50% capacity but they failed to mentioned that which capacity they are talking about, i.e the one recommended by the manufacturer which would deem all the buses in sindh as unusable or the recommended when it was fit to operated i.e 20-30 people or the capacity at which they are operated at i.e 100-120 people.... The ruling has only helped traffic police see a boost in there revenue",pakistan,t5_2qh89,/r/pakistan/comments/pfok70/today_i_went_to_shell_petrol_pump_in_lahore_had/hb68z9m/
372,17,3,0,1628180267,"I'm not sure if that is what they were told.  All I know is that is what my mamu told my mother, which is why I started to look into all of this since they said he only needed one dose of the Pfizer vaccine.  Maybe they didn't read the vaccination certificate properly.  No idea.",pakistan,t5_2qh89,/r/pakistan/comments/oxzh71/covid19_vaccine_question/h7tnvuv/
373,18,4,0,1628098376,"And on the side note , make sure ka jo vaccine abba na lagwai ha tumhara, wohi khud bhi lagwana . Kuch Universities certificate mangti aur mobile par message check karti ajkal vaccine wala(looking at you NUST) , taka koi problem na ho.",pakistan,t5_2qh89,/r/pakistan/comments/oxtewv/how_to_get_vaccinated_privately/h7p9uov/
374,19,5,1,1628105818,You can only get the certificate after you are fully vaccinated. There is nothing as partial vaccine certificate.,pakistan,t5_2qh89,/r/pakistan/comments/oy0a4t/nimsnadragovpk_not_updated/h7pros6/
375,20,6,2,1628140979,"This is incorrect. After the first dose (of a 2-dose vaccine) you get a certificate that says ""Partially Vaccinated"" and once you get the second dose, the same certificate is updated.",pakistan,t5_2qh89,/r/pakistan/comments/oy0a4t/nimsnadragovpk_not_updated/h7rsh08/
376,21,7,0,1627055161,"&gt;Secondly it’s Pakistan, anyone who doesn’t want the vaccine can pay and get a certificate.  There's always that.",pakistan,t5_2qh89,/r/pakistan/comments/oq3loh/government_of_pakistan_is_overstepping_its/h69dxbm/
377,22,8,0,1626742072,"* ""First phase has been implemented. Chinese experts provided extensive training of formulation and quality control testing to scientists/engineers of BPD, NIH. As a result, BPD NIH has started shared production from concentrate bulk and so far has successfully produced one million doses by the name of PakVac, which are available for vaccination through EPI after getting lot release certificate from the DRAP"", the Minister for Health added. * The next target was to prepare three million doses per month, which are under manufacturing process. * The vaccine costs $13 per dose, and the BDP has the capacity to deliver three million doses a month, adding the efficiency rate/immune response is 74.7 percent  Source: [Business Recorder](https://www.brecorder.com/news/40108226/na-informed-nih-started-manufacturing-pakvac-from-concentrate-bulk-in-may-with-cansinobio-china)",pakistan,t5_2qh89,/r/pakistan/comments/onr8ao/national_institute_of_health_nih_in_collaboration/h5tjc8m/
378,23,9,1,1626767297,"As per usual our newspapers don't give their sources.  From the[national assembly Question session of 19th July.](http://www.na.gov.pk/uploads/documents/questions/1626674932_421.pdf)  &gt;37. \*Sheikh Fayyaz Ud Din:   Will the Minister for National Health Services, Regulations and   Coordination be pleased to state:   (a) the quantity of Covid-19 vaccine available in the country at   present;   &gt;   &gt;(**ANS)**   &gt;   &gt;(a) As of July 12, 2021, there are approximately 9 million   doses of COVID-19 vaccines available in the country.   (b) As of July 12, 2021, a total of 19.8 million doses of   COVID-19 vaccines have been administered.   16   (c) Pakistan airs to vaccinate all the eligible population who is 18   years and above (119 million). In this regard, to fully vaccinate all eligible   population, Pakistan needs 238 million doses based on a two-dose   regimen. As of July 12, 2021, Pakistan has received a total of 28.7 million   doses. However, Pakistan will be receiving 23 million and 24 million   doses in July and August respectively. Moreover, the Government is   effectively mobilizing resources and engaging all possible forums to   acquire the required number of COVID-19 doses in 2021-22.  {{BREAK}}  &gt;52. \*Ms. Shams Un Nisa:   Will the Minister for National Health Services, Regulations and   Coordination be pleased to state:   (a) when Pak Vac vaccine is expected to be available for masses;   and   33   (b) the details of the vaccine regarding its type, storage   temperature, efficacy rate/immune response, estimated cost   (per dose), approval and trials and estimated capacity?   &gt;   &gt;**ANS**   Minister for National Health Services, Regulations and   Coordination: (a) National Institute of Health (NIH), Islamabad   collaboration with CanSino Bio China has started the manufacturing of   Covid-19 vaccine PakVac at Biological Production Division (BPD) from   concentrate bulk in the month May, 2021.   After having extensive training of forrnulation and quality control   testing from Chinese vaccine experts, BPD has so far prepared more than   one million doses and supplied to Expended Programme Immunization   (EPI) for vaccination of the general public free of cost.   (b) Type: Recombinant Adenovirus vector 5   (single shot)   Storage temperature: 2°C to 8°C   Efficacy rate/immune   response:   74.7%   Cost (per dose): 13 USD/dose   Capacity 2-3 million doses/month  {{BREAK}}  &gt;56. \*Mr. Sikandar Ali Rahoupoto:   Will the Minister for National Health Services, Regulations and   Coordination be pleased to state whether the Government has   taken steps in respect of preparation of corona vaccine in the   country; if so, the details thereof?   &gt;   &gt;**ANS**   Minister for National Health Services, Regulations and   Coordination: Government of Pakistan has made extensive efforts to   arrange the Corona Vaccine and initiated agreements with different   vaccine manufacturers such as Sinopharm, Sinovac, Astrazenica, CanSino   and Pfizer. Free of cost vaccination is being extended to all citizens.   National Institute of Health (NIH) has signed an agreement with   CanSinoBio China a developer of Covid-19 Vaccine (Covidecia) for   Transfer of Technology (TOT) to co-manufacture corona vaccine at   Biological Production Division (BPD), NIH to be implemented in two   phases.   37   First Phase has been implemented Chinese experts provided   extensive training of formulation &amp; quality control testing to   scientists/engineers of BPD, NIH.   As a result BPD NIH has started shared production from   concentrate bulk and so far has successfully produced one million doses   by the name of PakVac which are available for vaccination through   Expended Programme Immunization (EPI) after getting lot release   certificate from DRAP.   The next target is to prepare three million doses per month which   are under manufacturing process.  {{BREAK}}  &gt;58. \*Syed Agha Rafiullah:   Will the Minister for National Health Services, Regulations and   Coordination be pleased to state:   (a) whether it is a fact that Pakistan neither produces a single   vaccine of any kind nor the country has a single FDAapproved lab of international gold standard; if so, the reasons   thereof;.............   &gt;   &gt;**ANS**   Minister for National Health Services, Regulations and   Coordination: (A) No. it is not a fact that Pakistan neither produces a   single vaccine of any kind. The fact of the matter is that at present three   pharmaceutical units are manufacturing vaccines locally. About fifteen   vaccines are being manufactured.   Pakistan at present has three WHO approved Labs. Whereas one   more lab is under process of accreditation.",pakistan,t5_2qh89,/r/pakistan/comments/onr8ao/national_institute_of_health_nih_in_collaboration/h5unuup/
379,24,10,0,1626085039,"How will foreign tourists enter then. For example, many USA states by policy had banned issuance of any vaccine certificate only doctor's note or CDC card is used which isn't a proper stamped or qr-coded certificate, in UK there is no national certificate and no plans to introduce one only NHS app is used, and in Canada it is similar (doctor note or vax cards are used by these countries, not certificates).",pakistan,t5_2qh89,/r/pakistan/comments/oikgre/sops_tightened_for_tourists_amid_virus_surge/h4wlfpt/
380,25,11,0,1622842698,So far so good. It's opening up now with vaccine certificate condition so waiting for summer vacations.,pakistan,t5_2qh89,/r/pakistan/comments/nscn0z/daily_discussion_thread_june_05_2021/h0m7xk8/
381,26,0,0,1641322399,"That's literally him with a slight grown beard, besides why would a soldier on secret cross border mission take his vaccine card, passport and id card with him?",pakistan,t5_2qh89,/r/pakistan/comments/rvpa3s/indian_media_claimed_that_a_pakistani_soldier/hr8weo2/
382,27,1,0,1637297562,"Sikh community should be supported, but we need to be careful of Indians bringing in the Indian variant. Make every visitor produce an authentic vaccine passport.",pakistan,t5_2qh89,/r/pakistan/comments/qwikkl/kartarpur_corridor_reopens_after_a_gap_of_20/hl7uhp3/
383,28,2,0,1632121397,"No, it's the other way around. You need a CNIC/passport to get a vaccine.",pakistan,t5_2qh89,/r/pakistan/comments/prd4tz/do_you_need_to_get_the_covid_vaccines_in_order_to/hdkbphm/
384,29,3,0,1628052275,"Your numbers don't make sense.   The UK was one of the worst hit. There were 5.9 million cases and 130k deaths.   Pakistan's population is at least three times higher than the UK, yet the confirmed cases were 1million and 23k confirmed deaths. The infection rate is 7 people per 100k.  Pakistan was able to control the spread due to sensible precautions taken. So much so, that it's ranked the third best in terms of control only after new Zealand - in the world. This was all achieved without a vaccine.  Enforced vaccinations, coupled with a passport to confirm you are vaccinated is unreasonable. So people who had other vaccinations such as polio or malaria have to carry a passport?   If you support the right for someone else to determine what is put into your body - and for it to determine if you're able to participate in society, what else are you in favour of? What else would you force upon the populace? What else would exclude them from?  We don't have to talk about my mother or anyone else's. Every person who died would likely have had someone who cared for them, it's beside the point.",pakistan,t5_2qh89,/r/pakistan/comments/owtwif/oh_no_the_tyranny/h7n4xdi/
385,30,4,0,1626875742,"Hey so I was in the exact same place as you 3 weeks ago scrambling for the pfizer vaccine. I too called gerrys to ask for the pfizer vaccine but the thing is that they have a I must say a weird policy to only vaccinate those outsiders who are travelling to either the UK or US as students. Finally the moderna vaccine reached the expo center which is basically same as the pfizer vaccine(m-RNA based). There they just asked me for the copies of my visa, passport and the CNIC after which I was vaccinated by the moderna one. So yeah id say leave the pfizer vaccine and do try to get vaccinated by the moderna one.",pakistan,t5_2qh89,/r/pakistan/comments/oo7fxp/pzifer/h604kd3/
386,31,5,0,1626808186,"I am going to go to Canada during the spring for university, so do you think that would count as a valid reason? However, I don't have my acceptance yet since the schools that I'm interested in have yet to open their application portal for the spring intake. I have my passport ready would that be enough to show proof to be elgible for Moderna?   I am a bit skeptical about sinovac because its literally been banned everywhere. Even the middle east and EU are not allowing people who have gotten sinvoc into their countries. And since WHO has advised against getting two different vaccines, I think it would be much better to just get a vaccine thats accepted internationally.",pakistan,t5_2qh89,/r/pakistan/comments/oo7fxp/pzifer/h5wr1c6/
387,32,6,0,1621712395,"Many western countries will have Vaccine Passport requirement, so yes, Vaccination would be crucial (US seems ok for now though).  Irony is I'd be more concerned with him getting Food Poisoning, reminding him to stick to only SEALED bottled water/Soda/Tea. I was down for 5 days during my cousins wedding, the Nestle bottles in my Army Mess Hotel were refilled using the local filter plant.",pakistan,t5_2qh89,/r/pakistan/comments/nimigq/what_is_real_covid_picture_in_islamabad_my_ex/gz34tp9/
388,0,0,0,1642004097,"&gt;My parents? What IDs? I have my Passport birth Certificate And my COVID Vaccination Card  The basic identity kit is the birth certificate. You will also need your school records.   &gt;Am I missing anything?  You need employment and money.  &gt;How much money would I need for atleast 6 months? I know how much rent, electricity and Water would cost. I do Not Accurately know how much food would cost per month. For me It seems like 10-15k, is this close to yours?  Consider your rent for a room, depends on the location (safety of the place). If you are planning for 6 months, you will need roughly  80k for a quite comfortable life.  &gt;Is there anyway to fake my age or identity?  There is a way but that is jail time. **You definitely would not like jail time.**  If you just need some time out of your household, find a friend or a relative to stay at for the moment to change your environment. If you plan to go fully independent, then make sure to at least have people to fall back to when things go sour. Be careful of predators too.  I am neither condoning or tolerating your decision, but be mindful of your considerations.",Philippines,t5_2qjov,/r/Philippines/comments/s1ydg8/need_to_leave_toxic_household/hsd3cof/
