,Unnamed: 0,Unnamed: 0.1,Unnamed: 0.1.1,created_utc,body,subreddit,subreddit_id,permalink
501,113,58,0,1618751905,"Not to be pessimistic, but I don't see Japan opening their borders anytime soon, not even in August. It's already April, and they're not even sure if the Olympics will push through. My suggestion is to wait for their announcements. Also, they might have new requirements because of the pandemic (such as Covid tests, vaccine passports).  &gt; hingiin ko po ba sa kanya yung required documents and ako ang magpapasa dito kapag nag apply na ako ng visa?  Yes, you will need to ask for these documents from your guarantor, and you will be the one to present. Also remember that the Japanese Embassy **doesn't accept** applications directly from applicants. You will need to find a travel agency that is approved by the Japanese Embassy and can submit the application on your behalf. Here are some of them: https://www.ph.emb-japan.go.jp/itpr_ja/00_000256.html. They will help you gather and check your requirements. You will have to pay a fee.   &gt; Kailangan ko pa rin po ba mag present ng bank certificate ko? He mentioned that since he's gonna be the one who will cover my expenses during my time of stay their then I don't need to present my bank or pay anything.  Technically, you don't need to present anything if you have a sponsor. But I highly recommend presenting your own documents help because it helps prove that you do have some sort of money in your account and your ties to the Philippines.   Also, you need the latest birth certificate from PSA (issued within 1 year). You can order this online: https://psahelpline.ph/  You can check this blog about the Japan tourist visa requirements -- it's very detailed: https://www.thepinaysolobackpacker.com/japan-visa-requirements/",Philippines,t5_2qjov,/r/Philippines/comments/mtb2qv/traveling_to_japan_and_tourist_visa_questions/guys2xr/
502,114,59,1,1618751942,*presents covid vaccine certificate*,Philippines,t5_2qjov,/r/Philippines/comments/mt9x9f/evening_random_discussion_apr_18_2021/guys54w/
503,115,60,0,1617087054,Im sure na isip na nila lagyan ng onsite registration ng Philhealth at NSO birth certificate printing sa vaccine centers   /s,Philippines,t5_2qjov,/r/Philippines/comments/mg94ko/philhealth_is_now_asking_us_to_know_our/gsry9ko/
504,116,61,0,1614870100,You have to confirm with the airline if they allow the transport of cat. Some planes do not have ventilation that they sometimes decline animal transport.   You also need to secure a transport permit for the cat. You need to present the vaccination record with valid rabies vaccine and a veterinary health certificate.,Philippines,t5_2qjov,/r/Philippines/comments/lxgvxl/how_do_i_book_a_flight_from_bacolod_to_manila/gpnq48l/
505,117,62,0,1614737371,We get a vaccine monitoring form with a vaccination certificate.,Philippines,t5_2qjov,/r/Philippines/comments/lw0grz/ama_i_am_an_hcw_who_received_their_first_dose_of/gphkpv5/
506,118,0,0,1642036885,"&gt;What someone like me need to be able to live away from. My parents? What IDs? I have my Passport birth Certificate And my COVID Vaccination Card  You're gonna need more than just IDs to live away from your parents. You're going to need a job.  &gt;How much money would I need for atleast 6 months? I know how much rent, electricity and Water would cost. I do Not Accurately know how much food would cost per month. For me It seems like 10-15k, is this close to yours?  The money you would need depends on what kind of lodging and lifestyle you'll have. 10 - 15K for six months is too low. If you're used to having comfortable lodgings, it's going to be 10k a month. If you bed-space instead, you can save money, but you'll potentially be spending 7 to 8k a month anyway.   &gt;Also I may decide to leave as soon as 18 but COVID may ramp up again and they may decide only 21+ can go buy groceries. Is there anyway to fake my age or identity?  They don't check the age in both the vaccine and quarantine passes, so I don't think you should go making fake documents or identities which is a crime. If ever they do restrict people below 21, you can always reason that you're living alone.",Philippines,t5_2qjov,/r/Philippines/comments/s1ydg8/need_to_leave_toxic_household/hsfes0z/
507,119,1,0,1641547905,"This is going to be a problem, especially if we are going to have booster shots every 3 months like what the UK wants.  https://twitter.com/BBCPolitics/status/1465346793793802253  the govt makes it so hard for people to get vaccinated/boostered up when you have to wake up very early in the morning just to line up, (and the line is very long). And now the mayors want the unvaccinated banned from going to restaurants, malls, groceries. I'm pretty sure those who did not get the boosters will be considered ""unvaccinated"" in the future. Fck Isko moreno and all these mayors.  I didnt get the vaccination because i already had covid back in March of 2021. There's this thing called ""natural immunity"". It was unneccessary for me to get the jab, and i never had the virus again after getting sick with it. But I finally decided to get the vaccine after they announced a ""lockdown for the unvaccinated"".   But this vaccine mandate/passport that the govt officials are forcing upon us is too much. This will backfire bigly for those (isko moreno) who favored this and this will wreck our economy for sure. Booster shots 3 to 4 times a year for new variants, long lines at the crack of dawn, businesses having only half the customers it usually gets because of the mandates, good luck with that.  Btw, going against the vaccine mandates and its unintended consequences may be the only chance Leni robredo has of gaining the lead vs Marcos and Isko.",Philippines,t5_2qjov,/r/Philippines/comments/ry371q/duterte_is_concerned_new_ihu_covid19_variant_will/hrm7zno/
508,120,2,1,1641558321,"Uhmm making a unified QR card for better contact tracing and a unified vaccine passport with a verifiable QR code to avoid counterfeit vaccine cards? Mass testing, home service swab testing, subsidize paid swab tests (goddamn please fix philhealth issues). Just increase testing and contact tracing efforts. I mean these are just some initiatives on top of my head. I’m sure with the resources na meron siya, marami siyang pwedeng gawin. Hindi pwedeng what else can he do kasi president siya ng bansa eh.",Philippines,t5_2qjov,/r/Philippines/comments/ry2gru/more_than_20000_new_covid19_cases_breaking_the/hrmmc1t/
509,121,3,0,1641350668,"If I know the person IRL and if his ideology leans to the right, I just tell them that it's a Communist conspiracy to destabilize their country, the beacon of freedom. COVID attacks their freedom because it forces the government to implement quarantine measures and vaccine passport. Giving up vaccines is like giving up their guns. Hence, they're giving up their freedom.  This logic often works. Try it.  ps, This is not a sarcastic post. The goal is to save lives. :)",Philippines,t5_2qjov,/r/Philippines/comments/rwbio7/di_ko_maintindihan_bakit_ang_daming_ayaw/hravktw/
510,122,4,0,1640199241,Tanong ko lang: payag ba kayo sa universal vaccine passport?,Philippines,t5_2qjov,/r/Philippines/comments/rm82tu/nightly_random_discussion_dec_22_2021/hpl7gys/
511,123,5,1,1640213144,"Regarding my question about vaccine passport, I get both sides why some agrees with it while some don't, but it's interesting to see that a lot of Europeans and Latinos disagree with vaccine passport. The Europeans I've asked about it mostly skew on the nay side, and everyone who agrees gets fed with downvotes.",Philippines,t5_2qjov,/r/Philippines/comments/rmft6a/daily_random_discussion_dec_23_2021/hpm59v4/
512,124,6,0,1637482475,Kamaganak at barkada ng isa sa magulang ko. Nakakairita nga eh... ayuda ng ayuda kaso anak ng anak din  Sana po sana pinayuhan ng mga magulang ko na hangang 1 anak lang sila para di kami mabigatan sa pagkakantot nila.  Pagkatapos ng kalahating siglo nakaka irita na kasi. Kukunin ka lang ng ninang di dahil sa mabuti kang Katoliko ka kung hundi kasi me $$$ ka.  Buti marunong ako mag dahilan na di ako nag sisimba at pinagbabawal ng Simbahan ang mga tao katulad ko.  Kagaya itong pademya... kinukulit ako ng mga kamaganak ko makipag kita dahil miss daw nila ako. Ako naman sinabi ko na pag wala ng vaccine passport  na ako magpapakita. Mahirap na magka-COVID. Di naman ako matutulungan.  Sila nga yung na-COVID at kami nag bayad.,Philippines,t5_2qjov,/r/Philippines/comments/qyocjv/a_year_after_lockdown_186_million_poor_and/hlhk5ku/
513,125,7,0,1637317693,Not sure if specifically anti-vaxxers. The common theme I see here is that people are anti-vaccine mandate anti-vaccine card for passport and other shit. Many of this theme na nakikita mo is sa Europe at Amerika galit talga sila bakit daw kailangan ng vaccine card para lng maka access ka ng service which in there perception it undermine there freedom. What is the point of no vaccine mandate if you can't even enter an establishment it should be equal as long as they wear masks. If bussiness can do that before the vaccine roll out why not this time. Besides that IMO covid is exaggerated by the media sila den nag bibgay ng takot sa tao because fear sells. Covid survivability is so high for teens kids and young adult. Ang mga nasa ICU lang namanay mga matatanda at matataba at may comorbidity.,Philippines,t5_2qjov,/r/Philippines/comments/qx3b2f/sm_city_fairview_no_vaccine_no_entry/hl8mfjg/
514,126,8,1,1637371881,"News this week:  1. COVID restrictions tightened in Europe due to fourth wave 2. Quiboloy faces charges of sex trafficking in US 3. Duterte's ""blind item"" on a presidential candidate allegedly taking cocaine 4. Bong Go to run for president, Duterte for senator, Parlade for president 5. The breakup of Wilodia ^((Sino kaya ang third party? Barbie? Christine? Willie Revillame?)) 6. MOA globe ""stolen"", then it was ""returned"" - Netflix 7. [Vir Das' ""Two Indias"" monologue sparks outrage in India](https://www.bbc.com/news/world-asia-india-59323282) 8. Tesco [got red-tagged](https://www.independent.co.uk/news/uk/home-news/tesco-christmas-advert-boycott-santa-vaccine-b1957399.html) in the UK over [fully vaccinated Santa commercial](https://www.theguardian.com/business/2021/nov/15/tesco-christmas-ad-complaints-santa-covid-vaccine-passport)",Philippines,t5_2qjov,/r/Philippines/comments/qxqjf4/daily_random_discussion_nov_20_2021/hlc0th6/
515,127,9,0,1637303669,Anong punto ng no vaccine mandate kung di pede papasukin ang tao na walang vaccine parang ang ginawa 2nd class citizen. Kung kaya ng establishment na mag provide ng service nong wala pang vaccine rollout bakit ngayon di pede? Kaya ang daming nag proprotesta sa europe at america sa vaccine card sa passport establishment kase ginawa kang 2nd class. Dapat dito mapavaccineated unvaccinated pede pumasok basta may facemask. I wonder kung anong mangyayare sa mga unvaccinated na tao in the future maabutan kaya nila yung time na dina need ng vaccine card or mapipilitan na magpa vaccine para maka trabaho at ma access ang services.,Philippines,t5_2qjov,/r/Philippines/comments/qx3b2f/sm_city_fairview_no_vaccine_no_entry/hl84jy0/
516,128,10,0,1637102437,"Hi there. Work and places to visit have generally opened up for vaccinated people. Alert level in the Metro is level 2 right now, which means more places can operate at 70 to 100 percent capacity.  Masks are still required and best if you bring your vaccine passport or card.  Travel is more viable now as some provinces have also reduced need for quarantine if you're vaccinated.  Do still practice caution though as provinces are where vaccination rates are still low.  Though admittedly, I personally feel we opened up the economy a little too fast in preparation for Christmas.  I and my family are still reluctant to travel.",Philippines,t5_2qjov,/r/Philippines/comments/qvj7k0/daily_random_discussion_nov_17_2021/hkww0t3/
517,129,11,0,1636842112,"kung yan naka UPO na presidente ngayun sa tingin mo taas basahod ng teacher? sundalo? cnu nag pa extend  ng expiration date ng Drivers license mo ?1-2 years to 5-10 yrs?  nagawa na ba yan ng mga ini Idulo mong POLITIKO? sinu nag pa vaccine ng libre sa mga brgy ngayun? at sino ang di gumastos ng million para sa sariling ADvertisement tulad neto? sinu kumatay sa mga drug LOrd na sini sira ang mga pamilya, tahanan at kumunidad? sino nag extend ng Passport? nagawa na ba nila yan? mag paplano palang ng KALAYAAN SA COVID?  basura ginagawa na nga nyan ngayun at naghihirap pah ang ngayung administrasyun tapos sya may pera pah para sa Advertisement nato na dapat inu una ang taong bayan sa Vaccination.pweee",Philippines,t5_2qjov,/r/Philippines/comments/qsue23/i_was_going_to_watch_an_abba_video_when_i_got_a/hkid0vk/
518,130,12,0,1636599670,"Yeah, that's what we intend to do. As i mentioned in another comment, earlier today a friend told me that recently in Canada (and even right here in Montréal!) there were many cases of human trafficking/abuse of ppl especially nannies from Philippines, so it does make sense they would implement something against this.  However their ""implementation"" at least in our case just adds yet another layer of shit on top of:    - all the requirements we needed just to have ""permission"" to get married   - getting fucked over for 3 entire years by immigration canada   - and the québec government   - nearly staying stuck there (or worse - in hong kong airport) without my very necessary medications in jan. 2020 because of a new ""corona virus"" appearing in china   - the resulting worldwide pandemic   - her being required to re-take a (rather expensive) medical exam because it was expired after 2 years - with 1 month maximum delay allowed by ircc   - despite all borders being closed between provinces there due to said pandemic (3rd wedding anniversary occurred during a very fun month)   - having to pay hundreds of $ (and hours of waiting in clinics) for covid tests to be allowed to travel between provinces to undergo this medical exam   - the clinic where she took said exam postponing it, AND having the balls to demand extra fees for it   - more fuckups with her passport thanks to immigration canada and/or the canadian embassy/vfo there   - her needing to get a covid vaccine that is recognized by both the canadian and philippines govt.   - her employer taking advantage of her and of the entire situation in several ways knowing she will be leaving soon anyway  ...and now this.",Philippines,t5_2qjov,/r/Philippines/comments/qqycqs/my_wife_is_stuck_in_philippines_unless_she_goes/hk5mstq/
519,131,13,0,1633850331,"I want to and plan to, but my sister wants it for me harder than I do want it for myself, like she's pushing me to look for scholarships to Canada already that will promise that I can leave in 3 months, pero wala pa akong enough show money 'tsaka passport! Pero hindi sa abandoning that personal plan to move; I just really need to save up and plan it well, especially pandemic pa rin ngayon. Lucky us naka-tiyempo kami ng Pfizer for walk-in sa city namin (may mga countries kasi na maselan sa vaccine brands ng papasok sa bansa nila, like kung Chinese vaccine ang tinake mo, you'll still be treated as unvaccinated and must undergo 14-day quarantine).",Philippines,t5_2qjov,/r/Philippines/comments/q50lrw/afternoon_random_discussion_oct_10_2021/hg2txr4/
520,132,14,0,1633144160,I don’t get the rude and sarcastic comments I said I already have a passport in the post I’m asking if the visa is also required - I’m not the only American who’s wise enough not be a government Guinea pig and get the vaccine. That has nothing to do with my question - if you don’t have an answer to it kindly move along I’m just asking 1 question I’m not looking for drama debates or anything like that jeez,Philippines,t5_2qjov,/r/Philippines/comments/pzi2t5/is_the_philippines_closed/hf1z5z5/
521,133,15,0,1632962390,Got harrased by an antivaxxer. He's 6ft tall and im merely 5ft. Stood my ground then he left the building. Bawal kasi wala vaccine passport dito,Philippines,t5_2qjov,/r/Philippines/comments/py5o4z/daily_random_discussion_sep_30_2021/hesjwq2/
522,134,16,0,1632273851,"I am a US/PH dual citizen who has lived in the Philippines for over 20 years (I'm currently 24), with plans of permanently migrating to the US next year. To that end, I have a few questions:  1. Which passport should I present when leaving the Philippines (US or PH), and what documents should I prepare in preparation for my migration? 2. I heard that travel tax is a thing so how do I account for that? 3. What are common shakedowns that someone in my position (dual citizen leaving the PH) can encounter at the airport and how would I handle them? 4. It is my understanding that the US is now requiring individuals entering the country to present proof of  vaccination, and that many US states require it to enter establishments. I have indeed been fully vaccinated in the Philippines with the AstraZeneca vaccine, with a certificate issued by the Quezon City government as proof, and it's also stated on my EZConsult account that I'm fully-vaxxed. Would this certificate be sufficient for entry into the US, and what procedures may I follow in order to obtain a local equivalent for everyday use? (As a side note, I plan on migrating to Chicago, IL)",Philippines,t5_2qjov,/r/Philippines/comments/prhih2/weekly_help_thread_sep_20_2021/hdsip1x/
523,135,17,0,1632023922,"Unpopular, but I understand this take, and it is a complicated issue, given the politics of US. It's a question between giving up a certain degree of autonomy and self governance vs. Public health safety. It is up to assessors to determine the pros and cons.  I personally dont agree with a blanket vaccine passport/ vaccination mandate but I guess can be balanced by applying incentives. Such as making it a requirement for participation in COVID hotspot activities. I also think that asking for higher insurance premiums for unvaccinated individuals is better, albeit more complicated than a federal wide vaccine mandate. Talking about US btw.",Philippines,t5_2qjov,/r/Philippines/comments/pqvpjv/while_my_village_is_currently_rising_in_cases/hdf7tr6/
524,136,18,0,1631856128,"So it’s a vaccine passport, not a corona passport?",Philippines,t5_2qjov,/r/Philippines/comments/ppslge/travel_to_philippines_with_corona_passport/hd6abwk/
525,137,19,1,1631860981,"I’m saying that football and soccer is apples to oranges being compared to vaccine passport vs corona passport. I thought that was obvious enough, that it’s not differentiating football and soccer exactly which isn’t even the topic.",Philippines,t5_2qjov,/r/Philippines/comments/ppslge/travel_to_philippines_with_corona_passport/hd6gvqm/
526,138,20,2,1631861324,"Great.  Now, what are your thoughts about my second part of reply to you? Have you not thought that the term covid/corona passport is a local european term for vaccine/vaccination passport?",Philippines,t5_2qjov,/r/Philippines/comments/ppslge/travel_to_philippines_with_corona_passport/hd6hazu/
527,139,21,3,1631863814,"I have no qualms or protest about the implementation, but I highly doubt that the Philippines has it implemented when it literally doesn’t even have a concrete vaccine program - and that lots of countries and territories won’t even accept vaccination certificates from the Philippines because it is not issued by a central agency.  My issue is the possible confusion arising from calling it like that, when it clearly isn’t. Wth is a corona passport even? A passport for what?",Philippines,t5_2qjov,/r/Philippines/comments/ppslge/travel_to_philippines_with_corona_passport/hd6k8h5/
528,140,22,0,1629869553,"Hindi yata tatanggapin ng immigration dyan yung vaccine card/passport ko hahaha    but deym, kung kaya ko lang, papatusin ko yata talaga yan para hindi na hanggang imagination ko lang ang authentic na ramen 🤤 lalo kung libre pa hahaha",Philippines,t5_2qjov,/r/Philippines/comments/pb3fl9/afternoon_random_discussion_aug_25_2021/ha9cbid/
529,141,23,0,1628982212,I have a passport appointment soon(SM North). I dont have my vaccine yet. (still waiting) Will I be able to travel? I work from home as a freelancer so I cant show any IDs. I paid almost 1500 for the passport sayang naman.,Philippines,t5_2qjov,/r/Philippines/comments/p4gyx5/daily_random_discussion_aug_15_2021/h8yt6oc/
530,142,24,0,1628233864,"I live in Israel, yknow, vaccine world leader and all that.   Borders are closed-ish right now, but citizens go in and out anyway. We got rid of the vaccine passport for almost two months, we had two mask-free-*anywhere* days, life was starting to get back to normal (everyone including kids can go anywhere, movie theaters, packed trains, malls, no limits on indoor events), but then cases started going up again.  I'm hearing rumors of another lockdown during the Jewish holidays in September.",Philippines,t5_2qjov,/r/Philippines/comments/oywp0w/ang_ganda_mo_pilipinas/h7wq83g/
531,143,25,0,1628153558,"Last year, marami na nagsabi na mauuso ang vaccine card at passport. Deny deny pa noon kesyo unscontitutional daw yan. Pero ngayon, pag hindi ka bakunado, tingin sa yo may nakakahawa kang sakit, at pag minalas-malas ka pa tanggal ka sa trabaho.",Philippines,t5_2qjov,/r/Philippines/comments/oy9lmd/afternoon_random_discussion_aug_05_2021/h7s8hd3/
532,144,26,0,1628132566,"There should be a better and more efficient system to avoid this. Like, vaccine appointment, similar to passport appointment, that is, having to be registered to a website first. Then a text will come to you if it is now your turn.   Walk ins should be at least banned for the duration of the ECQ or pre-ECQ.   If they cannot hire a developer to build them a vaccine appointment app, maybe Google Forms will do, at least.   The scenario similar to this post will defeat the purpose of having a vaccination program. This is a potential superspreader event especially with Delta variant, which recent studies say is now as contagious as chickenpox (bulutong).   Some Redditors here are saying that there is already an appointment system, but scheduling is too slow. The LGUs handling these appointment system should look unto this, find bottlenecks, and devise improvements.   And to those who received a text saying it's their turn, please come. Even if it is Sinovac.   And maybe they should devise ways to let the users confirm through text if they can come or not to their vaccination schedule. The tiny town of Los Baños, Laguna, has such system.",Philippines,t5_2qjov,/r/Philippines/comments/oy3t6p/chaotic_situation_at_the_sm_san_lazaro/h7re0ri/
533,145,27,0,1627615754,"True. Singapore, Malaysia and Thailand are/will be doing the same. It's not very far off that the Philippines follows suit with a booster of Pfizer/Moderna or a third shot of Sinovac.   As for me, I'm scheduled for a second dose of Pfizer in September. It's going to be difficult for me to move around the EU if I don't have a vaccine passport or stuck with Sinovac.",Philippines,t5_2qjov,/r/Philippines/comments/ou79zz/daily_random_discussion_jul_30_2021/h71i5fp/
534,146,28,0,1626819005,"DICT pala ang mag iissue ng vaccine certificate/passport, consolidating na daw ng data from LGU, at by early August ang start.",Philippines,t5_2qjov,/r/Philippines/comments/ooc2la/daily_random_discussion_jul_21_2021/h5xg427/
535,147,29,0,1626187546,"Right, but how long will it take to start here--when you've already clearly pointed out the vaccine passport issue that is looming. Front-liners etc took what was available, and shouldn't be penalized for that.",Philippines,t5_2qjov,/r/Philippines/comments/oild0f/san_juan_solon_received_two_pfizer_booster_shots/h51ii1h/
