,Unnamed: 0,Unnamed: 0.1,Unnamed: 0.1.1,created_utc,body,subreddit,subreddit_id,permalink
0,0,0,0,1642806183,"* You'll have to go to the FRRO office in whatever city you're visiting when you're healthy enough to leave.   * Present them with medical documents and receipts for treatment / medication (start keeping a paper trail now), even if it's just Covid tests.   * You'll have to pay a fine, everyone does, even if you got Covid or you got ran over by a car. The fine is calculated based on how long you overstayed, the people who work there are the biggest dicks on the planet to literally everyone, even if you're PM Modi-ji.  * You'll be given an a special exit permit which is stamped red in your passport and told to leave within 48 hours.  ---  Don't bother booking any flights before you've spoken to the FRRO as you'll be rejected at the check-in desk or dragged off the flight before it takes off, it's really embarrassing.  Make sure to print out and take photocopies of all receipts for medical treatment - like three copies, it's insane but they will ask for it... Also print out your hotel receipt as they will want evidence of where you stayed whilst you overstayed. I don't know why, it's stupid, but it's something they ask for.  Be prepared to wait anywhere from 2 weeks to 3 months to get the red exit visa stamp... Again, I don't know why - the timing is just really random for appointments with the FRRO.   ---  There is an e-FRRO service and this can all be done online via the Indian government's e-FRRO website, but they will charge you anywhere from ₹8k to ₹50k depending how long you are sick and overstay.",india,t5_2qh1q,/r/india/comments/s9hw4d/my_tourist_visa_expires_today_for_india_and_just/htnytil/
1,1,1,0,1641760743,True. I didn't think too much about these things before coming here.. and as someone with no dependents all of still was tolerable. But covid has really made it pretty shitty with all kinds of hoops to jump through to get a stupid stamp on your passport even though the work visa is basically approved.  This had made me consider Canada as well but again it'll be a big move going to another country and almost starting from scratch. And I think now even express entry is tricky in these times. At what age did you do this?,india,t5_2qh1q,/r/india/comments/rznha8/nearly_5000_indian_millionaires_2_of_its/hrynrsd/
2,2,2,0,1640320054,"I traveled from NY to Delhi few days ago, you need to have one negative covid test and self declaration from on which you'll upload your negative test, vaccine certificate and passport. From US they're checking 2% of passengers at random.",india,t5_2qh1q,/r/india/comments/r6zmeo/foreign_travel_guidelines_megathread/hprsg8w/
3,3,3,1,1640348383,"Im from vizag too bro, had my passport done before covid. It all went smooth even though I missed a few docs. Probably one of those days that just dont go right. Shrug it off is all I can say.",india,t5_2qh1q,/r/india/comments/rncmkb/why_are_the_officials_at_the_passport_offices/hpsurv4/
4,4,4,0,1640158275,"The whole idea of the electronic visa is that it's via email only, nobody sees your passport physically until you get to the airport. It has always been like that, nothing to do with covid.",india,t5_2qh1q,/r/india/comments/r6zmeo/foreign_travel_guidelines_megathread/hpj5itd/
5,5,5,0,1639719356,"There is nothing to avoid if you are vigilant, and carry passport and covid vaccination record.",india,t5_2qh1q,/r/india/comments/ri6x7n/what_are_the_best_states_a_foreigner_should_visit/hovs9dj/
6,6,6,0,1639163824,Does the e-visas get sent back via email for printing and does not need passport physically (due to covid and all).?   Asking as my Family is travelling to India mid April and prior to that some will come from US and Thailand (Feb-April) so the passport holders will not be in US.,india,t5_2qh1q,/r/india/comments/r6zmeo/foreign_travel_guidelines_megathread/ho0tz3i/
7,7,7,0,1638196366,"Yes, apply for US tourist Visa. They don't ask if you are pregnant. They will most likely give you Visa for 5 or 10 years with maximum 180 days allowed in US on each trip.   You land in US, do tourism and give birth and get US passport for new born, get OCI card for kid to return back  to India and you are all set.  This is very popular with rich Chinese/Korean people.  However, Covid travel restrictions may put some issues on you for example travelling back with your kid to India.  It's definitely possible. Talk to right people and this is all legal.",india,t5_2qh1q,/r/india/comments/r41vhs/i_am_indian_citizen_and_pregnant_can_i_have_my/hmj8y2d/
8,8,8,0,1635347053,"Where did I ignore the natural immunity, I have mentioned it in a  comment that our natural immunity does not protect us for long. It exists but its not the solution. Not only that what about the fact only 30% of the population is doubly vaccinated to reach a certain  level of herd immunity ? These are not complete protection, \*if\* a new variant strikes , which again can be a possibility there is a good chance the country will again suffer, not as much as the second wave but even then there could be serious problems and we could be forced into a lockdown if shit hits the fan.  70% of our population has taken the vaccine but a recent survey by India today showed 7% of the population still hesitant to take the vaccine. 7 % is 7 crore people (check source) . That number is big enough to create problems. Do I guarantee there will be problems ? NO. Do I fear there will be problems ? YES, as should you. [Source](https://www.indiatoday.in/coronavirus-outbreak/story/covid-vaccine-hesitancy-in-india-at-lowest-level-only-7-adults-now-hesitant-survey-1861733-2021-10-07) . Vaccines dont work if some people take it and some dont.  The geographical distribution and climatic conditions of those who are unvaccinated could create new variants with localized outbreaks, which can snowball into something else. You should read a little more news before asking people what the fuck they are on about, reflects poorly on you.  Plan B was published officially on September 27. The leaked documents were about the cost it would be and their line of thinking. [Source](https://www.theguardian.com/business/2021/oct/26/covid-plan-b-uk-economy-cost-leaked-documents).  They are thinking about it, its not a hypothetical. Last time around he tried to do the same deny a lockdown etc and then went on to impose it anyway , how sure are you things will be  different this time ? They might not jump up to a proper lockdown but a mask mandate, vaccine passport and  booster dose is still a real possibility , unless you have a solid argument to deny that they wont ever do it. Israel itself started with the vaccine passport again, what makes you think India is in a better position with 30% fully vaccinated, no booster shots, no kids vaccination in sight. The third wave is here, the cases will rise and the government(s) with its tail tucked between its legs will again impose 8pm curfew and compulsory mask in public.  Capabilities have improved, only because we have vaccinated the population.  I am not wearing a tin foil hat screaming 400k cases a day here, I am still looking towards a significant damage if we are all not too prepared. Which I feel we are not there. Since I am not an expert I will not throw out a random number ,but going by trends I am observing in other countries we might be looking at 100k cases in the third wave and that could be devastating.  Finally, I can very freely criticize the governments chest thumping whenever I want. The person on the chair has been hired to do a job and I am not that person. The chest thumping comment was an observation to what is happening, people have already started being complacent, removing masks and everything since ' capabilities have improved.' I was simply trying to put forward my assessment that the country is getting complacent and I stand by my words. Coming to solutions we can start being strict with the rules again, imposing fines for masks , tiered entry into public spaces or lockdown for unvaccinated like Australia is planning on doing.",india,t5_2qh1q,/r/india/comments/qgf10v/we_do_not_seem_prepared_for_wave_3_god_forbid/hi96o24/
9,9,9,0,1635312488,"It's not comparison with any country, it's just how things are progressing in other countries that will ultimately lead to a domino effect on ours. The incoming of a ""wave"" of sorts is inevitable. Israel has been managing covid exceptionally well had a third peak as equivalent to their first and second, even with a booster dose. They even managed to impose a vaccine passport. India hasnt been able to impose mask laws. There are new talks of booster doses. We have a huge task at hand even though what we have achieved is a good thing.",india,t5_2qh1q,/r/india/comments/qgf10v/we_do_not_seem_prepared_for_wave_3_god_forbid/hi7pa4c/
10,10,10,0,1634482643,"Individuals must provide some basic information about themselves, including the following:  Name Nationality Age Passport number Contact details They must also provide some details about their trip, including the following:  Date of arrival in India Flight number Seat number Port of origin Port of entry Contact address while in India  (src: https://www.evisasindia.org/covid-19-self-declaration-form/)",india,t5_2qh1q,/r/india/comments/qa00k9/traveling_to_india_and_air_suvida/hgzo9fy/
11,11,11,0,1634430415,"Just as a counterpoint - I’ve been living in sg for 15 years (or in context practically all of my adult life). This post is one persons viewpoint, and with selective/recent media attention on some prompts that were politically motivated.      There are few people that are racist. The Govt isn’t, and the people that I interact with (work, housing, hospitals, restaurants, malls, vegetable Mandi, bus/train/cabs) aren’t racist.      The racist overtones are from the opposition MPs (presumably looking for leverage in the voting masses). The rest is from online trolls &amp; ill-informed random people posting messages (for all you know could be non-state actors like China).         There is discrimination against foreigners in general, in jobs/housing/school admissions - but there is a clear rationale to prioritise locals (even if discriminatory in end results). It’s not like there is a board saying, “Indians and dogs not allowed”.  The other factor is that India and China form the largest block of qualified persons applying for mid level jobs and there is ratio/quota of locals vs foreigners. For applications for permanent residency or citizenship, Indians specifically lose out to China mainland applicants, as there is a policy to maintain racial percentages and Chinese are at 70% while Indians are 10% approx - so there is some background to why a Chinese colleague.          some Indians here have felt the weight of the rulebook thrown at them for minor infractions such as loud music at late hours, which in India might have been brushed aside with, “tere baap ka colony hai kya?”. Typical shit like trying to cut queues, bypass rules, treat service staff like “servants” - which obviously gets some people riled up as that’s not the local culture - contributes to a bad impression (though I’ll clarify that the locals I interact with have the sense to not club all Indians in one category, much as back home you’ll not club all Bengali’s as “yeh tho communist hoga”).        All that said, yes it’s difficult now to retain work passes, retain jobs and it’s a tough life. But that’s more covid related than racism. (Meaning you’ll face discrimination because you have an Indian passport, not Indian race - please don’t conflate the two).",india,t5_2qh1q,/r/india/comments/q94atk/singapore_racism/hgxbw4e/
12,12,12,1,1634437032,I’m an ep holder. There is absolutely racism because of the colour of my skin. And it seems most Singaporeans have parochial views on India and Indians.   Many became openly hostile upon any discussion of the indo China conflict and clearly believe India should “obey” China  Local Indian friends have been complaining too. And special discrimination because of my passport is simply racism. Why are only Indians banned from entry to singapore? Our covid situation is a lot better then singapore at the moment. This is pure racism from the highest echelons of singapore govt and sadly the Indian govt couldn’t care less,india,t5_2qh1q,/r/india/comments/q94atk/singapore_racism/hgxpi7q/
13,13,13,0,1633762054,"What for? I left India more than 20 years back, used to visit my parents every 1-2 years pre-Covid. Didn’t have any issue, but then again all I did was shopping using my foreign card or cash. For travelling passport and oci card is sufficient.",india,t5_2qh1q,/r/india/comments/q4dmhc/am_i_gonna_have_issues_if_i_never_get_an_aadhar/hfycm7h/
14,14,14,0,1632602076,"Thank you :) I'm French and I know how fortunate I am to hold such a passport when it comes to travelling. I've had 2 India visas before and I didn't plant a bomb in India so hopefully that will make things easier to get another one? :D  But that won't solve everything. Crossing Pakistan is gonna be a challenge in many aspects: there's Baluchistan, there's the border with India. I believe that cycling from Karachi (or wherever a military escort would send me after Baluchistan) to Lahore would be alright, but that's a bit off-topic for this sub :)  And of course there's covid.",india,t5_2qh1q,/r/india/comments/pv4thz/crossing_border_from_pakistan_to_india/he9hd4y/
15,15,15,0,1630661003,"As somebody who lived in multiple western countries and Singapore for short while, and with quite a few close friends who are PR/EP pass holders (both indian and non-indian) I can say your standards regarding Singapore are low.  It is just like some sanghi's say India is not as bad as Pakistan or Afghanistan. You are saying at least Singapore does not have caste system. Well my friend, raise your standards. The fact that Singapore government did not allow non-citizens to be vaccinated (like covid cares which passport one carries) tells all you want to know without requiring media's help.",india,t5_2qh1q,/r/india/comments/pgfgzq/a_question_for_those_who_left_india_in_hope_for_a/hbfcziu/
16,16,16,0,1628088397,"You dont need a vaccine passport for travelling to Russia, only a negative covid report not older than 48hrs.",india,t5_2qh1q,/r/india/comments/oxjru6/my_friend_got_stopped_by_sibrean_immigration_at/h7oln4p/
17,17,17,0,1627904244,"&gt;P,S. I study abroad and need the passport for travel. Currently, because of Covid, all classes are online and hence I traveled back and applied for a passport renewal. Now my original is marked as returned and the new one hasn't arrived yet.  Thanks, got it after visiting the police station multiple times. Realized that the police official was not filling up the details correctly which is why it was being sent back again and again.",india,t5_2qh1q,/r/india/comments/m4jpky/issue_with_passport_application/h7f2jfx/
18,18,18,0,1627047937,"I got an opportunity, so I left. I am in the middle East, so no option for PR or passport ( golden visa etc is for doctors/big businessmen etc)  So for now it is a temporary move which I want to make permanent.  But, I do not have option right now. Checked canada express entry but my score is low as I am above 30/single and don't have relatives in canada. Cannot get 8.5 in IELTS.  Another option is higher study in canada which is damn costly for me.  I would prefer western countries, ibhave visited a few. They are nice. I prefer UAE it is an awesome place, it feels like India except absence of the negative aspects of India. But, the visa is tied up with job contract. Job security is not great here and due to Covid it's worse. Industry size is also smaller than India. So, I am undecided right now.",india,t5_2qh1q,/r/india/comments/oph41k/if_you_had_the_opportunity_would_you_leave_india/h68xof1/
19,19,19,0,1626992230,"After Covid people are trying harder to get a canada or Australia PR. NDTV had a show recently on this.  People do not go to canada to save more. This savings mentalily is deep rooted in indian culture. Because indi as ns need to buy oxygen cylinder from black market. Petrol is 100 rs/litre. Medical bills has no capping. (Iam not being political here. Just telling the truth).   If earning money is the pure motive. Go toiddle east. Saudi, qatar, uae. You will make 4 lakhs a month tax free. You will never make that much money in germany unless you are a really gifted talented guy. Middle East has huge infian community. Feels like extended india. You can get cook, maid, carpenter, plumber just like india. Eat all indian food easily and speak Hindi or malayalam on the road.. Even ipl is being played there. So why germany? If the end goal is to make money n retire in India.   If the end goal is low salary but top notch quality of work, freedom of life LGBTQ support, great options for vacation, getting experience of learning new language, &amp; doing all house work on your own, pay 40% tax, get a very strong passport, then go to germany.",india,t5_2qh1q,/r/india/comments/nszvkv/is_studying_in_europegermany_worth_it/h66i1tj/
20,20,20,0,1625724565,"&gt;ntment is for July 27th and my program start date is Sept 1st. Do you think that is a good enough amount of time for processi  I think I got an exemption because of covid (the embassy wanted to process as many applications in the shortest time so they let me off because I had interviewed before) .  July 27th to Sept 1st is a little over a month. If they accept your passport on the 27th, then it only takes them 2 weeks to process it and send it to you. I think you should be good.",india,t5_2qh1q,/r/india/comments/kwb41i/us_visa_appointment_cancelled_in_2021/h4g1s09/
21,21,21,0,1625132902,"&gt; I hate that the vocal majority of this sub-reddit would rather kiss the ass cheeks of the EU, who want to make profit from their own vaccine manufacturers and subdue competition, acting like their decision is mature.  what are you even talking about. Covishield is not included in the EU green pass because Serum Institute never applied to EMA for approval. Once they apply it'll be approved since it is Indian version of AstraZenca. There is no grand conspiracy or malice.  https://science.thewire.in/health/eus-vaccine-passport-programme-includes-az-shot-but-not-covishield/  https://qz.com/2026656/the-eu-digital-covid-certificate-excludes-the-covishield-vaccine/  https://www.ema.europa.eu/en/human-regulatory/overview/public-health-threats/coronavirus-disease-covid-19/treatments-vaccines/covid-19-vaccines",india,t5_2qh1q,/r/india/comments/oazfji/india_tells_european_union_accept_covishield_and/h3nypyo/
22,22,22,0,1625086918,https://www.schengenvisainfo.com/news/hungary-to-introduce-eu-covid-passport-on-june-30/  &gt; the EU authorities have confirmed that persons vaccinated with Sinopharm or Sputnik V vaccines may not enjoy the same privileges as those who have been vaccinated with one of the vaccines approved by the European Medicines Agency (EMA),india,t5_2qh1q,/r/india/comments/oazfji/india_tells_european_union_accept_covishield_and/h3ltsb2/
23,23,23,1,1625117800,"Petty realpolitik works!  &gt;Today Austria, Germany, Slovenia, Greece, Iceland, Ireland and Spain have included Serum Institute’s Covishield in Green Passport. Switzerland also accepts Covishield. (ET Bureau)   https://timesofindia.indiatimes.com/india/coronavirus-india-live-updates-covid-delta-plus-cases-news-1-july-2021/liveblog/84006672.cms",india,t5_2qh1q,/r/india/comments/oazfji/india_tells_european_union_accept_covishield_and/h3nh14p/
24,24,24,0,1624852822,"This is the best tl;dr I could make, [original](https://www.hindustantimes.com/world-news/covishield-excluded-from-new-eu-covid-green-pass-even-after-who-approval-101624803271741.html) reduced by 69%. (I'm a bot) ***** &gt; Many EU member states have started issuing the digital &amp;quot;Vaccine passport&amp;quot; that will enable Europeans to move freely for work or tourism.  &gt; The EU green pass will only recognise the Vaxzervria version of the AstraZeneca vaccine that is manufactured in the UK or other sites around Europe.  &gt; Member states have the option to accept other vaccination certificates in case the travellers have received Covid-19 vaccines not approved by the EMA. According to the website schengenvisainfo.com, Iceland will allow restriction-free entry to those who have been vaccinated with one of the vaccines authorised by the EMA or the WHO. Apart from the EMA-approved vaccines, the UN health agency has included Covishield, CoronaVac, and Sinopharm under its Emergency Use List.   ***** [**Extended Summary**](http://np.reddit.com/r/autotldr/comments/o9chy7/covishield_excluded_from_new_eu_covid_green_pass/) | [FAQ](http://np.reddit.com/r/autotldr/comments/31b9fm/faq_autotldr_bot/ ""Version 2.02, ~585014 tl;drs so far."") | [Feedback](http://np.reddit.com/message/compose?to=%23autotldr ""PM's and comments are monitored, constructive feedback is welcome."") | *Top* *keywords*: **Vaccine**^#1 **European**^#2 **vaccinated**^#3 **certificate**^#4 **states**^#5",india,t5_2qh1q,/r/india/comments/o91owk/covishield_excluded_from_new_eu_covid_green_pass/h3aajuk/
25,25,25,0,1624771057,"Covid shield and Aster-Zenecca vaccine are technically different before law, ie they have different trade names. So they have to prove they are the same for approval. Its like proving you are the same person before an authority if you have different names in your passport and driver's license. There will also be some enquiry into the manufacturing process to ascertain if its upto european standards. Its just rade tape and routine for all drugs and serum products.",india,t5_2qh1q,/r/india/comments/o8ppvm/no_european_union_green_pass_for_indiamade/h36lxk4/
26,26,26,0,1624177841,My sister registered on CoWin with passport number. Was asked for Aadhar Number at the PHC. She even saw on portal that PHC staff has to do entry that Aadhar was a mandatory field and so had to give that. No the identity doc mentioned on Cowin changed from passport to aadhar automatically. No Aadhar? Go die from Covid.,india,t5_2qh1q,/r/india/comments/o3e0ji/something_seriously_sinister_is_afoot_in/h2eror2/
