,Unnamed: 0,Unnamed: 0.1,Unnamed: 0.1.1,created_utc,body,subreddit,subreddit_id,permalink
200,200,166,1,1625386930,"Some states take vaccination as a proof, eg: Chandigarh asks for PCR -ve within 72 hours of travel or atleast 1 dose of vaccine atleast 14 days ago.  You can check for others here : https://www.goindigo.in/information/state-regulations.html  Chandigarh  &gt; Carry a negative RT-PCR report not earlier than 72 hours from an ICMR approved laboratory or be in possession of vaccination certificate (at least one dose) over 2 weeks old  Punjab  &gt; It is mandatory for passengers arriving in the state of Punjab from other states/UT to carry a negative RT-PCR report not earlier than 72 hours from an ICMR approved laboratory or be in possession of vaccination certificate (at least one dose) over 2 weeks old. RT-PCR timeline starts from the swab collection time.",india,t5_2qh1q,/r/india/comments/n1plmu/coronavirus_covid19_discussion_megathread_9/h406c41/
201,201,167,2,1625424527,"Show Modi's Photo on Vaccine certificates, ration bags, gas stations, Aadhaar Card, your face, your birth certificate, gift card, Passport, Death certificate, Marriage Certificate, Condoms, get a tatoo of Modi on your pen1s too..... what else does his need his face on ? such a narcistic individual",india,t5_2qh1q,/r/india/comments/odmfza/show_pm_modis_image_lotus_symbol_on_ration_bags/h41tsz8/
202,202,168,0,1625323298,"This is being repeated on TV studios, in newspapers by BJP shills.   Personally, I was infuriated to see this parasite's face on my vaccine certificate. I'm below 45 so this parasite who has no inhibitions on taxing me, was at that time refusing to buy any vaccines for people in my age group. So I paid market rates at a private hospital for getting myself vaccinated. This parasite played no role in either administering or paying for the vaccine.   Which isn't to say that this parasite is now doing any of the above. People of India are paying for it, in fact at the very fuel pump which was made to put up this poster by this parasite's lackey Dharmendra Pradhan. So it's not like he's done a big favor by giving vaccines for free.",india,t5_2qh1q,/r/india/comments/ocvvkh/thank_you_modiji_for_free_vaccines_is_written_on/h3xa9pk/
203,203,169,1,1625335108,If got both vaccine shots  nothing much is needed..just the Vaccine certificate.   For 1 dose I think they will allow you to enter with Rtpcr test with 24 hrs validity..   Check Google  entry to karnataka  n see the latest news.,india,t5_2qh1q,/r/india/comments/od0v1s/gokarna/h3xwwpu/
204,204,170,0,1625218066,"Don't want to stay...Can't get out...Sala sahi Mai atmanirbhar hi kar dala Gobi ne, aur koi Chara hi nahi.  If you are middle class and face a problem, you know you are alone, no government no institution no nothing will come to help you. Had to run around and grease hands to fucking get a death certificate here. A process that should have been smooth ,was used to exploit.  Can't get a vaccine in the first place, even when you get it Can't rest knowing whether you got the real one. ...  Third world country didn't start out as a phrase to describe countries which were shitholes, but we are ensuring that the definition sticks for generations generations come.",india,t5_2qh1q,/r/india/comments/oc2uca/thousands_jabbed_with_unknown_substances_at_fake/h3sb1ae/
205,205,171,0,1625132902,"&gt; I hate that the vocal majority of this sub-reddit would rather kiss the ass cheeks of the EU, who want to make profit from their own vaccine manufacturers and subdue competition, acting like their decision is mature.  what are you even talking about. Covishield is not included in the EU green pass because Serum Institute never applied to EMA for approval. Once they apply it'll be approved since it is Indian version of AstraZenca. There is no grand conspiracy or malice.  https://science.thewire.in/health/eus-vaccine-passport-programme-includes-az-shot-but-not-covishield/  https://qz.com/2026656/the-eu-digital-covid-certificate-excludes-the-covishield-vaccine/  https://www.ema.europa.eu/en/human-regulatory/overview/public-health-threats/coronavirus-disease-covid-19/treatments-vaccines/covid-19-vaccines",india,t5_2qh1q,/r/india/comments/oazfji/india_tells_european_union_accept_covishield_and/h3nypyo/
206,206,172,1,1625141494,"I take offence to the tone of the language used by the foreign ministry to strongarm EU to green light the Indian vaccine.  For a nation's representatives on a global stage, this is shameful.  &gt;“We have also conveyed to EU member-states that India will institute a reciprocal policy for recognition of the EU Digital Covid Certificate,” the source said. “Upon notification of Covishield and Covaxin for inclusion in EU Digital Covid Certificate and recognition of Indian CoWIN vaccination certificates, Indian health authorities would reciprocally exempt the EU member-state concerned for exemption from mandatory quarantine of all those carrying EU Digital Covid Certificate.”",india,t5_2qh1q,/r/india/comments/obemxh/austria_germany_slovenia_greece_iceland_ireland/h3oa141/
207,207,173,2,1625144510,"This is the best tl;dr I could make, [original](https://www.bbc.com/news/world-asia-india-57628123) reduced by 67%. (I'm a bot) ***** &gt; Earlier, sources told the BBC that India would not recognise a EU vaccine pass for travellers unless the bloc does the same for India&amp;#039;s own vaccine certificate.  &gt; A source in India&amp;#039;s external affairs ministry earlier said India had requested EU states to individually consider extending the exemption to people who had taken Covid-19 vaccines in India - Covishield and Covaxin - and &amp;quot;Accept the vaccination certificate&amp;quot; issued by the government.  &gt; &amp;quot;Right now, our understanding is that this certificate is meant for travel within the EU. But it could become the norm for all international travel. Nothing changes currently because most international travel is suspended. These certificates will become important when all travel resumes. We are saying, we will accept each other&amp;#039;s certificates reciprocally. Why are you discriminating against our certification?,&amp;quot; one of the sources said.   ***** [**Extended Summary**](http://np.reddit.com/r/autotldr/comments/obld69/covishield_seven_eu_countries_approve_indias/) | [FAQ](http://np.reddit.com/r/autotldr/comments/31b9fm/faq_autotldr_bot/ ""Version 2.02, ~585738 tl;drs so far."") | [Feedback](http://np.reddit.com/message/compose?to=%23autotldr ""PM's and comments are monitored, constructive feedback is welcome."") | *Top* *keywords*: **India**^#1 **certificate**^#2 **source**^#3 **travel**^#4 **vaccine**^#5",india,t5_2qh1q,/r/india/comments/obkmif/covishield_seven_eu_countries_approve_indias/h3of8c1/
208,208,174,0,1625061181,"It happened,in which world are you living in.And I am not some IT cell minion to just make up  illogical statements.I am a medical researcher and closely involved in preventative research and know a thing or two about the vaccines .  https://science.thewire.in/health/brazil-bharat-biotech-covaxin-anvisa-manufacturing-standards-certificate/  https://www.thequint.com/amp/story/coronavirus/explained-why-is-cdsco-silent-on-brazils-report-on-bharat-biotech-plant  Reuters has also publsihed articles about the same,you may Google for it.  As I said, covaxin is made on a time tested platform and is supposed to be effective and safe, but it was pushed hurriedly just for the sake of vaccine nationalism before even the vaccine was tweaked properly .This has greatly affected theanufacturing quality as well. If the gov stop pushing it's stupid nationalism and give our scientist some time to work,this would have been a very good vaccine,but the catch was this could have only been released later.But the GOV just wanted to release the vaccine early for publicity stunt. I still hope this vaccine is manufactured properly as the time goes by.",india,t5_2qh1q,/r/india/comments/oajtqw/brazils_health_minister_announces_that_the/h3k6k2t/
209,209,175,1,1625079648,"This is the best tl;dr I could make, [original](https://www.ndtv.com/india-news/india-tells-european-union-accept-covishield-and-covaxin-or-face-mandatory-quarantine-upon-arrival-in-india-sources-2476318) reduced by 80%. (I'm a bot) ***** &gt; This would mean that unless the European Union accepts Covishield and Covaxin certificates, their certificates will not be accepted in the country and people from EU will face mandatory quarantine upon arrival in India.  &gt; European Union has been told that Covishield and Covaxin must be notified in its digital Covid certificate, sources said.  &gt; The EU countries accept only the vaccines approved by the European Medicines Agency, which are Pfizer, Moderna, AstraZeneca, and Janssen.   ***** [**Extended Summary**](http://np.reddit.com/r/autotldr/comments/ob40y5/the_european_unions_reluctance_in_accepting/) | [FAQ](http://np.reddit.com/r/autotldr/comments/31b9fm/faq_autotldr_bot/ ""Version 2.02, ~585572 tl;drs so far."") | [Feedback](http://np.reddit.com/message/compose?to=%23autotldr ""PM's and comments are monitored, constructive feedback is welcome."") | *Top* *keywords*: **Covishield**^#1 **European**^#2 **vaccine**^#3 **accept**^#4 **Union**^#5",india,t5_2qh1q,/r/india/comments/ob02a0/accept_covishield_covaxin_or_face_mandatory/h3lczg2/
210,210,176,0,1624975673,"Why would it be harder to fake a ‘vaccine passport’ which is just a piece of paper or a picture on an app? I heard that people are already faking them, it’s dead easy. The only reliable thing is the QR code which can be attached to a test result as a well as a vaccine certificate, there is no real difference.",india,t5_2qh1q,/r/india/comments/o91owk/covishield_excluded_from_new_eu_covid_green_pass/h3fvfil/
211,211,177,1,1624976375,The open source license will have a clause stating that every vaccine certificate generated irrespective must and will include Modi's photo. 🙃,india,t5_2qh1q,/r/india/comments/oa67yw/made_in_india_cowin_to_go_global_over_50/h3fwvvq/
212,212,178,2,1624984622,"Ask hr whose phone number was used to get the vaccine. Sometimes these people use other phone numbers, and you will have to log in with that number to get the certificate.",india,t5_2qh1q,/r/india/comments/oa4toz/i_got_vaccinated_via_an_office_drive_but_the/h3gfg7b/
213,213,179,0,1624957303,"This is the best tl;dr I could make, [original](https://www.bbc.com/news/world-asia-india-57633980) reduced by 70%. (I'm a bot) ***** &gt; India&amp;#039;s Serum Institute is seeking emergency authorisation in the European Union for its Covishield jab, sources told the BBC.The move comes amid reports that Covishield is not yet eligible for the digital green certificate, an EU-wide travel pass, set to launch on 1 July.The certificate is currently for EU citizens only.  &gt; Sputnik V, which is the third vaccine approved for use in India and by the WHO, is on the EMA&amp;#039;s list of vaccines currently under review.  &gt; At a recent meeting of G7 countries to which India was invited, India&amp;#039;s health minister Dr Harsh Vardhan said that India was &amp;quot;Strongly opposed to a &amp;#039;vaccine passport&amp;#039; at this juncture&amp;quot;.   ***** [**Extended Summary**](http://np.reddit.com/r/autotldr/comments/oa4hfz/indias_serum_institute_is_seeking_emergency/) | [FAQ](http://np.reddit.com/r/autotldr/comments/31b9fm/faq_autotldr_bot/ ""Version 2.02, ~585299 tl;drs so far."") | [Feedback](http://np.reddit.com/message/compose?to=%23autotldr ""PM's and comments are monitored, constructive feedback is welcome."") | *Top* *keywords*: **India**^#1 **vaccine**^#2 **Covishield**^#3 **yet**^#4 **Serum**^#5",india,t5_2qh1q,/r/india/comments/o9lgmo/india_covid_covishield_not_eligible_for_eu_travel/h3f5jq3/
214,214,180,1,1624959470,Also heard of people getting a fake vaccine certificate to travel because they don’t want to take the vaccine. The sheer magnitude of stupidity makes me sick sometimes.,india,t5_2qh1q,/r/india/comments/oa41ji/what_is_being_done_against_fake_vaccinated/h3f7qxv/
215,215,181,0,1624888448,Vaccine records can be faked too. Nowadays most places ask you to have a QR code on your test / certificate so they can verify it.,india,t5_2qh1q,/r/india/comments/o91owk/covishield_excluded_from_new_eu_covid_green_pass/h3bjvgl/
216,216,182,0,1624835342,My name on my vaccine certificate is wrong. I emailed. Reckon I'll get a response and it'll be resolved?,india,t5_2qh1q,/r/india/comments/o8rrpx/the_bizarre_story_of_how_i_replied_to_those/h39gbwx/
217,217,183,1,1624852822,"This is the best tl;dr I could make, [original](https://www.hindustantimes.com/world-news/covishield-excluded-from-new-eu-covid-green-pass-even-after-who-approval-101624803271741.html) reduced by 69%. (I'm a bot) ***** &gt; Many EU member states have started issuing the digital &amp;quot;Vaccine passport&amp;quot; that will enable Europeans to move freely for work or tourism.  &gt; The EU green pass will only recognise the Vaxzervria version of the AstraZeneca vaccine that is manufactured in the UK or other sites around Europe.  &gt; Member states have the option to accept other vaccination certificates in case the travellers have received Covid-19 vaccines not approved by the EMA. According to the website schengenvisainfo.com, Iceland will allow restriction-free entry to those who have been vaccinated with one of the vaccines authorised by the EMA or the WHO. Apart from the EMA-approved vaccines, the UN health agency has included Covishield, CoronaVac, and Sinopharm under its Emergency Use List.   ***** [**Extended Summary**](http://np.reddit.com/r/autotldr/comments/o9chy7/covishield_excluded_from_new_eu_covid_green_pass/) | [FAQ](http://np.reddit.com/r/autotldr/comments/31b9fm/faq_autotldr_bot/ ""Version 2.02, ~585014 tl;drs so far."") | [Feedback](http://np.reddit.com/message/compose?to=%23autotldr ""PM's and comments are monitored, constructive feedback is welcome."") | *Top* *keywords*: **Vaccine**^#1 **European**^#2 **vaccinated**^#3 **certificate**^#4 **states**^#5",india,t5_2qh1q,/r/india/comments/o91owk/covishield_excluded_from_new_eu_covid_green_pass/h3aajuk/
218,218,184,2,1624867055,I got my first dose on 13th May. My Vaccine certificate shows next due date between 24 June and 8th July. Can I get the 2nd dose or do I have to wait till 12 weeks are completed?,india,t5_2qh1q,/r/india/comments/n1plmu/coronavirus_covid19_discussion_megathread_9/h3as96e/
219,219,185,0,1624780877,They are indirectly forcing the populace to take vaccine. May come a time when Vaccine certificate will have to be produced like PAN or Aaadhar card to travel to other parts of the country.,india,t5_2qh1q,/r/india/comments/o8ql92/assam_government_frontline_employees_to_receive/h36xeim/
220,220,186,0,1624702760,"Not sure why people are not worried about the certificate. Please get it rectified quickly. Very soon, lot will depend on it.  Best chance would be if you can check with the place you got the vaccine.",india,t5_2qh1q,/r/india/comments/o7tu9f/vaccine_related_help/h33dbox/
221,221,187,0,1624472780,"For the money I paid for the vaccine, they should even allow me to put a pic of my favourite porn star on the certificate.",india,t5_2qh1q,/r/india/comments/o6dua2/vaccination_certificate_satish_acharya/h2so7kl/
222,222,188,1,1624472981,What?You guys have pictures on your vaccine certificate?😅,india,t5_2qh1q,/r/india/comments/o6dua2/vaccination_certificate_satish_acharya/h2sonwr/
223,223,189,0,1624131798,Check on cowin if you can get on there. For most once they get the vaccine it immediately sends a text to the phone and you can download the certificate.   If not you should​ reach out to the center maybe they put in the wrong number.,india,t5_2qh1q,/r/india/comments/o3j8xb/didnt_receive_my_vaccination_certificate/h2cs2wx/
224,224,190,0,1623978151,My brother got his vaccine on wednesday . he received his certificate with female gender . he changed it to male in less than 10 mins . me in the other hand didnt even recive any sms or my certificate .,india,t5_2qh1q,/r/india/comments/o1tzbs/has_anyone_got_their_nameagegender_corrected_in/h25p7ol/
225,225,191,0,1623782817,My vaccine slot is showing timeline more than 84 days even.  It has Given range on the certificate after 1st dose. Starting at 84 days and going up till 115 or 120 days.  Agar us smai hadbadi machti h to 120 din bhi rukna pd skta h....it means.  Really really hope vaccine speed reaches said 1cr by July. Hoping some improvement post 21st.,india,t5_2qh1q,/r/india/comments/o0iudu/indian_scientists_we_didnt_back_doubling_of/h1vnsey/
226,226,192,0,1623358907,"You can register one beneficiary on multiple phones - but, the vaccine certificate will be issued only against one phone. If you do the first dose against one phone, and, try to do second dose with another phone, it won't recognize you already have taken the first dose - and you will be scheduling a first dose again (as far as i can tell).",india,t5_2qh1q,/r/india/comments/nwsfdf/i_registered_my_household_help_and_her_husband_on/h1bsaz1/
227,227,193,1,1623434850,"&gt; Inactivated virus vaccines could be at worst, ineffective.  Assuming it is properly ""inactivated"".  * [Methods used for “sterilising, disinfecting, removing or inactivating viruses” also came under the scanner, UOL reported.](https://science.thewire.in/health/brazil-bharat-biotech-covaxin-anvisa-manufacturing-standards-certificate/)  * [But if the company wasn’t inactivating the virus properly, it would mean that the vaccine itself could give patients COVID-19.](https://www.thequint.com/coronavirus/explained-why-is-cdsco-silent-on-brazils-report-on-bharat-biotech-plant)",india,t5_2qh1q,/r/india/comments/nx6bvn/fda_rejects_emergency_use_authorization_for/h1fhbqg/
228,228,194,0,1623228400,"Age on Vaccine Certificate is Based on Year of Birth, not the date of birth.  You can report any certificate issues you have on coWIN website. This feature was added yesterday.",india,t5_2qh1q,/r/india/comments/n4g4sp/i_got_my_vaccine_certificate_but_im_not_vaccinated/h14qh4f/
229,229,195,0,1622980148,I'm gonna print this out and draw over his face with markers. That's what I am gonna use everywhere when the vaccine certificate is asked.,india,t5_2qh1q,/r/india/comments/ntj6gm/why_do_we_need_his_photograph_it_disgusts_me_how/h0savl3/
230,230,196,1,1622980312,Modi is a coward. He wants to take credit for everything good happening in this country but don't want to say any bad things. Like  If he is having his photo on vaccine certificate then his photo should also be on the death certificate of all the people who had died due to covid. But he's never gonna do this because he is a coward.,india,t5_2qh1q,/r/india/comments/ntj6gm/why_do_we_need_his_photograph_it_disgusts_me_how/h0sb33q/
231,231,197,2,1622984348,Dude i paid for my vaccine dose and this fucktard appears in my certificate. WTF !!!!,india,t5_2qh1q,/r/india/comments/ntj6gm/why_do_we_need_his_photograph_it_disgusts_me_how/h0sgsg7/
232,232,198,0,1622898262,"Mamata Banerjee so far  - Crushed BJP in Election - Protested against CBI - Made Modi wait for 30 mins - Cancelled transfer of Secretary - Appointed him Advisor - Replaced his pic with her on Vaccine Certificate  She is definitely ""A Handbook on how to deal with BJP"".",india,t5_2qh1q,/r/india/comments/nsu6r9/mamata_replaces_pm_modi_on_vaccine_certificate_in/h0okf37/
233,233,199,0,1622779986,"Because AEFI reporting system is broken.  Try calling the 4 digit number at the bottom of your Vaccine certificate and see if anyone picks it up.      &gt;20 million + have been vaccinated till now. Not a single adverse reaction has been reported.  That's not how vaccines works. Phase 3 is when you get to know about adverse effects of the vaccine on a large population, and post marketing surveillance should be actively done to catch even the rarer side effects.    Infact icmr has just recently begun a real world study of vaccine efficacy, despite having a 20 million cohort.   You clearly don't understand how clinical trials works, how vaccines are assessed for safety and efficacy. You can be happy with the government forcing companies to skip crucial steps, but I as a healthcare provider can't, since it comprises the safety of patients.",india,t5_2qh1q,/r/india/comments/nr8czx/india_and_the_others_vaccine_procurement/h0j14qq/
234,234,200,0,1622485857,Isn't that like happening already to some people. One person had posted in this very sub about vaccine certificate being generated without it being administered.,india,t5_2qh1q,/r/india/comments/np2q9z/india_considers_dropping_second_dose_of/h03w1b5/
235,235,201,0,1622230431,"Selective bashing sab karte hai. But irrelevant bashing karna is being pointed out here. Why does mumbai and Delhi have the most cases? They are the financial hubs of the country ,they were also the first point if contact with international cases. Kerjriwal blame bohit karta hai, but what about the fact that delhi doesn't have statehood, cm docontrol half the state mechanisms in Delhi? How about when you bring criticism about kwjriwal you fail to account for this?  Also the maharashtra and Delhi have been reporting cases. Up declared victory with underreportimg ,Gujarat declared success with undereporting local newspapers are bringing these facts to light. Selective criticism kaha rehe gaya tab. Bangalore is a financial centre too for India how are they faring? Selective criticism phir se bhul gaye?  And modi ghar Jake sabke pichware me vaccine de rahe hai khud?  Uska photo toh phirbhi vaccine certificate me hai...did personally khana nahi de raha yeh dekh ke tumhe problem ho raha hai?? State machinery isliye bana hai Taki CM khud rickshaw me baith ke khana de?  Selective criticism pe baat karni hai toh batao phir  agar Pfizer aur Moderna bas centre se deal karna chahte hai, and vaccination stocks ka dealing 2020 se ho sakta tha..toh woh kiya kyu nahi? Vaccinating all Indians would have cost less than 2% of indias gdp.  A big figure but these are extraordinary times. We had the best vaccine supply chain in the world and still we failed. Phir bhi defense aa raha hai ki India is a poor country population yeh woh..Selective criticism kaha hai?",india,t5_2qh1q,/r/india/comments/nmtm4h/the_prime_ministers_nautanki_is_the_reason_behind/gzsmidv/
236,236,202,1,1622275714,"I think there are more covaxin vaccinations happening. Not sure why, but people taking covaxin shots aren't given certificates.  I booked vaccination slot a couple of days back and when I reach the hospital, I was told that they'd give me vaccine but won't give official certificate. They said all the covaxin shots in that hospital these days aren't recorded officially.",india,t5_2qh1q,/r/india/comments/nmnjn8/covaxin_puzzle_6_crore_shots_ready_2_crore_given/gzup1tm/
237,237,203,0,1622174427,Technically all of them need to be entered into Cowin system to generate your vaccination certificate.  And yes it is pretty obvious at this point vaccine providers are selling way more doses to private hospitals for corporate drives than to state government because they get higher price per dose. Look at daily vaccine numbers by centres in any big city it is all workplace events.,india,t5_2qh1q,/r/india/comments/nmnjn8/covaxin_puzzle_6_crore_shots_ready_2_crore_given/gzpy8pp/
238,238,204,1,1622176410,"Just got my jab a few minutes ago, in the waiting room right now, thinking of ways to edit the vaccine certificate which I'm going to get.",india,t5_2qh1q,/r/india/comments/nmozky/most_people_say_that_beejaypee_follows_mein_kampf/gzq1m0i/
239,239,205,2,1622210415,"1. Pan, voter card, driving licence are being accepted already.  2. Health Id is not being created for everyone. My parents were not given a health id. Only a beneficiary no. So health id is not mandatory to track vaccinations and neither it is being used to track vaccinations.  3. Govt is already using a separate database. See point above. Health id is not being used to track vaccinations. Even still, health id was conceived during this pandemic itself. It's not an already proven system. Health id is predominantly being pushed in union territories.  4. As I said, neither was I informed about health id generation, nor did I receive any otp. My vaccine certificate already had the health id allotted. I did not need to login to NDHM portal to authenticate. You need to login to cowin portal only if you provided an id other than aadhar during health id generation.",india,t5_2qh1q,/r/india/comments/nmo80x/took_covid_vaccine_using_aadhaar_your_national/gzrctbu/
240,240,206,0,1622112546,Health is a state subject but Modiji's pic will be on every vaccine certificate,india,t5_2qh1q,/r/india/comments/nm4pgq/health_is_a_state_subject_centre_defends_vaccine/gzmeg9h/
241,241,207,1,1622115962,"Hey, sorry to hear this, by any chance are you from Bangalore? i know another acquaintance who has a similar issue...  Anyways here are probably 2 ways you can get the certificate, hope this helps... else you can also contact the helpline number  Toll free 1075 or helpline number +91 11 23978046  [VACCINE Cert.](https://www.cowin.gov.in/faq)  Hope this helps.",india,t5_2qh1q,/r/india/comments/nm52ev/request_help_regarding_dose_1_not_showing_up_in/gzmj8ep/
242,242,208,0,1622029478,"Off topic, but is the certificate a necessity in anyway? Are there situations, where the certificate might be required, in the future? My dad ended up getting both the doses of the vaccine. However, because of an administrative screw-up, there is no certificate. The official app shows that he hasn't even been scheduled for his 1st vaccine.",india,t5_2qh1q,/r/india/comments/nldhfy/i_wrote_a_script_that_removes_modijis_photo_from/gzi3vjt/
